category,datetime,headline,id,image,related,source,summary,url
company,1617813300,AFLAC Inc. stock underperforms Wednesday when compared to competitors despite daily gains,66112429,https://images.mktw.net/im-220105/social,AFL,MarketWatch,"Shares of AFLAC Inc. inched 0.21% higher to $51.72 Wednesday, on what proved to be an all-around favorable trading session for the stock market, with the S&P...",https://finnhub.io/api/news?id=f921f05bb459d43ddf019fecdcaa1224e526dc7e4d54f45af320f064f4ea9216
company,1617726900,AFLAC Inc. stock outperforms market on strong trading day,66112430,https://images.mktw.net/im-220105/social,AFL,MarketWatch,"Shares of AFLAC Inc. inched 0.31% higher to $51.61 Tuesday, on what proved to be an all-around grim trading session for the stock market, with the S&P 500...",https://finnhub.io/api/news?id=0cf4b33f6deaf5cc03e251a7babf4a8bc0576f7e68b041c0708d2fe907ea44f6
company,1617708219,Dividend Champions On Sale - The April 2021 Heat Map,66083705,https://static.seekingalpha.com/uploads/2021/4/6/saupload_jccag1MbuEj4DnnShpqNTxyMBqotEcyTaGDSuCbJViQIFmQ7vS4pfBRXNwFjQErU5RzGFbhPb5KoLeykBBNsG6Dx2lFWwkiTDL1pbR1UKgxUxQUdr990bc3goYneknAa85BpyP5d.png,AFL,SeekingAlpha,"Dividend Champions can form the cornerstone of any income-oriented portfolio, but most of us don’t have enough time to analyze all 141 stocks thoroughly.",https://finnhub.io/api/news?id=38c822e597973e8d68dcb12f97ce5599c0e78f3e62d57b94f6bc8db7dba2bd52
company,1617640500,"AFLAC Inc. stock rises Monday, still underperforms market",66075468,https://images.mktw.net/im-220105/social,AFL,MarketWatch,"Shares of AFLAC Inc. inched 0.06% higher to $51.45 Monday, on what proved to be an all-around favorable trading session for the stock market, with the S&P...",https://finnhub.io/api/news?id=7071d2a94a086aa1525bdf045730eb25cb1ee75f208087266ad7dd0c1e4a0319
company,1617603060,Aflac price target raised to $55 from $51 at JPMorgan,66349352,,AFL,Thefly.com,Aflac price target raised to $55 from $51 at JPMorgan JPMorgan AFL,https://finnhub.io/api/news?id=dad8c942afc2051cfbc00de1c1749f7480e7d9776658868b355d05974d3229f8
company,1617542100,Where Can A Dividend Growth Investor Find Value In April?,66054464,https://static.seekingalpha.com/uploads/2021/4/2/44023936-16173776508848174_origin.png,AFL,SeekingAlpha,"For the dividend growth investor, there are no companies that are hand over fist deals. However, plenty of fairly valued to slight bargains do exist.",https://finnhub.io/api/news?id=2b753322c45bdfa26fe80f4d2a2d5acc206f91c00a239150fbbb011d6554021c
company,1617446528,My Dividend Growth Portfolio - Q1 2021 Summary,66048563,https://static.seekingalpha.com/cdn/s3/uploads/getty_images/153591382/medium_image_153591382.jpg,AFL,SeekingAlpha,"Read to know about my portfolio, changes in the past three months and stocks that are currently on my wish list.",https://finnhub.io/api/news?id=7a090bbc1e55100186507ca71940f84c71d56ce5f97521b3e6517e206320742e
company,1617440700,5 Safe And Cheap Dividend Stocks To Invest In (April 2021),66048240,https://static.seekingalpha.com/uploads/2021/4/1/saupload_9bcf1d046a8b8f63da24227897266905.png,AFL,SeekingAlpha,"This article is part of our monthly series where we highlight five companies that are large cap, relatively safe, dividend-paying, and are offering large discounts to their historical norms.",https://finnhub.io/api/news?id=a680a6c682e5a6505a1b0a8b7b24c6a96ffed45c34b3aeb3fcc0ab6ee921675b
company,1617294900,"AFLAC Inc. stock rises Thursday, still underperforms market",66029160,https://images.mktw.net/im-220105/social,AFL,MarketWatch,"Shares of AFLAC Inc. inched 0.47% higher to $51.42 Thursday, on what proved to be an all-around great trading session for the stock market, with the S&P 500...",https://finnhub.io/api/news?id=09e482fb26355e16fe72ac310e2135d3f0be5671915b6f1053efa2e08d226736
company,1617292804,Aflac (AFL) Upgraded to Buy: What Does It Mean for the Stock?,66476314,https://s.yimg.com/uu/api/res/1.2/132juehTNIyEUn7pK7.GPA--~B/aD01MDY7dz05MDA7YXBwaWQ9eXRhY2h5b24-/https://media.zenfs.com/en/zacks.com/3d7c5b2146ac04ffd51752e17ff2a619,AFL,Yahoo,"Aflac (AFL) might move higher on growing optimism about its earnings prospects, which is reflected by its upgrade to a Zacks Rank #2 (Buy).",https://finnhub.io/api/news?id=93a0af53e1b65fd32c3ea974df7df7872f2d0372c7cd7ae913bd6de0df050526
company,1617260400,The Retiree's Dividend Portfolio - John's February Update: Finding Value In Defensive Stocks,66020526,https://media.gettyimages.com/vectors/businessman-uses-the-umbrella-to-resist-the-falling-arrow-vector-id1294740363?b=1&k=6&m=1294740363&s=170667a&w=0&h=G-Wxoi1JW2S1b3m3fFYFqp8o7SsVL6IhaDuQyi7ZNy4=,AFL,SeekingAlpha,John's retirement accounts generated a total of $1006.80 of dividend income for February 2021. We are continuing to look for good opportunities.,https://finnhub.io/api/news?id=1ee6e5abcc956f68167e180c6238d9cac6ced7ea1d150bebe977fe9f7ddb3d8a
company,1617216941,Black leaders fight wave of restrictive voting bills,66476317,https://s.yimg.com/ny/api/res/1.2/_XusgsTRNcVTOrHxPT5cXA--/YXBwaWQ9aGlnaGxhbmRlcjt3PTIwMDA7aD0xMTI0/https://s.yimg.com/uu/api/res/1.2/BUNZe0LOFiMQvL_zHZujEw--~B/aD0zMzgyO3c9NjAxOTthcHBpZD15dGFjaHlvbg--/https://img.vidible.tv/prod/2021-03/31/6064c5af60b4aa1428b6bb3e/6064c5af60b4aa1428b6bb3f_o_U_v2.jpg,AFL,Yahoo,"David Clunie, Executive Director of Black Economic Alliance, joins Yahoo Finance’s Alexis Christoforous and Kristin Myers to discuss Black executives calling on corporations to fight restrictive voting laws.",https://finnhub.io/api/news?id=6f41ca00092f63aafa092946f6b4e42e7c74b656cd8303a0cbfbcf97359c6cf2
company,1617208500,AFLAC Inc. stock underperforms Wednesday when compared to competitors,66008765,https://images.mktw.net/im-220105/social,AFL,MarketWatch,"Shares of AFLAC Inc. slid 1.25% to $51.18 Wednesday, on what proved to be an all-around mixed trading session for the stock market, with the S&P 500 Index...",https://finnhub.io/api/news?id=0b0958fb0206f64e170d376b1b8de55a885c10d1c850633349702b10fba7c3c6
company,1617221532,Georgia Gov. Brian Kemp dismisses corporate backlash over election law,66011756,https://image.cnbcfm.com/api/v1/image/106862263-1617208948736-gettyimages-1231365066-VIRUS_VACCINE_US.jpeg?v=1617208985,AFL,CNBC,Kemp signed a sweeping GOP-backed election bill into law last week that civil rights advocates say disproportionately hurts voters of color in Georgia.,https://finnhub.io/api/news?id=b38f76b10ecc47c886ea9f438fabac7df8892ac6a9084516ea4fa67cf80ddb40
company,1617170040,Aflac price target raised to $46 from $40 at Citi,66349356,,AFL,Thefly.com,Aflac price target raised to $46 from $40 at Citi Citi AFL,https://finnhub.io/api/news?id=4a0e5e72416ea85537e5559d6ce0c2f0543567f7c6c098f346d1e1aa2e428a61
company,1617153180,Aflac Stock Shows Every Sign Of Being Fairly Valued,66349359,https://static.gurufocus.com/photos/gurus/guru_logo_square.jpg,AFL,GuruFocus,"Aflac Stock Shows Every Sign Of Being Fairly Valued, Stocks: AFL, release date:Mar 31, 2021",https://finnhub.io/api/news?id=0ff038c14b49f2d63dd1d1be76309e0c9df03274a3a7ba3b4504af2153e550ea
company,1617122100,"AFLAC Inc. stock rises Tuesday, outperforms market",65994207,https://images.mktw.net/im-220105/social,AFL,MarketWatch,"Shares of AFLAC Inc. inched 0.95% higher to $51.83 Tuesday, on what proved to be an all-around poor trading session for the stock market, with the S&P 500...",https://finnhub.io/api/news?id=e87d30b325169ed4ca7350343f71a29902d5e176f3b57617a28cf290d84bce1b
company,1617035700,AFLAC Inc. stock outperforms competitors despite losses on the day,65565067,https://images.mktw.net/im-220105/social,AFL,MarketWatch,"Shares of AFLAC Inc. slumped 0.43% to $51.34 Monday, on what proved to be an all-around mixed trading session for the stock market, with the Dow Jones...",https://finnhub.io/api/news?id=42d149e6c45a91162bb5369f170bf1c6a0e48d8c24cba78593dc50af53987f23
company,1617014848,"Lemonade Makes A Sour Offering For Investors, Go With Prudential Instead",65298731,https://static.seekingalpha.com/cdn/s3/uploads/getty_images/1278745342/medium_image_1278745342.jpg,AFL,SeekingAlpha,Prudential is expected to deliver $11.5 in EPS in 2021 and return $25 to shareholders in the next 3 years. Lemonade is expected to generate $115m in revenues in 2021 and is valued at $5.4bn.,https://finnhub.io/api/news?id=4919608fff2a78682776f85acf283bdb28039c5bbc0d1828efdb57d1a229c8e6
company,1616776500,"AFLAC Inc. stock rises Friday, still underperforms market",65120998,https://images.mktw.net/im-220105/social,AFL,MarketWatch,"Shares of AFLAC Inc. inched 0.82% higher to $51.56 Friday, on what proved to be an all-around positive trading session for the stock market, with the S&P 500...",https://finnhub.io/api/news?id=1cc0bd2920ff37373b12d53ea88dbe8bb2a94de485de1f4319f2c5130b40ef4d
company,1616750100,"Aflac Inc (AFL) EVP, CFO Aflac Japan James Todd Daniels Sold $1.5 million of Shares",66349361,https://static.gurufocus.com/photos/gurus/guru_logo_square.jpg,AFL,GuruFocus,"Aflac Inc (AFL) EVP, CFO Aflac Japan James Todd Daniels Sold $1.5 million of Shares, Stocks: AFL, release date:Mar 26, 2021",https://finnhub.io/api/news?id=d9d544d8a238f22c679a9e7d3c94ec5b5e55910a0d4b4ddeb43925bac51dfb2f
company,1616748720,AFLAC Reaches Analyst Target Price,66349364,,AFL,ETF Channel,"Staff article entitled AFLAC Reaches Analyst Target Price, about ETFs, from ETF Channel.",https://finnhub.io/api/news?id=78ad0b36d87b615d316be6c66cfc8ca18458958337084ef82d74f56e568e1c65
company,1616690100,AFLAC Inc. stock outperforms market on strong trading day,65120999,https://images.mktw.net/im-220105/social,AFL,MarketWatch,"Shares of AFLAC Inc. rose 2.48% to $51.14 Thursday, on what proved to be an all-around great trading session for the stock market, with the S&P 500 Index...",https://finnhub.io/api/news?id=2cf9d60b5a8a150a24da8d4125ae9f72e83189afdb9e28b3eb75de9e58a8833b
company,1616681555,Sell Alert: 10 Insanely Overvalued Dividend Aristocrats,64854928,https://static.seekingalpha.com/cdn/s3/uploads/getty_images/184769358/medium_image_184769358.jpg,AFL,SeekingAlpha,"In a world full of uncertainty, dividend aristocrats feel safe and trustworthy. But even they are subject to wild variations in price.",https://finnhub.io/api/news?id=948a17437cd8bcbc54e680638a2ed030471166e38d318d0df40922ae60d43d48
company,1616670360,3 Cheap Stocks to Add for the Post-Pandemic World,66476320,https://s.yimg.com/uu/api/res/1.2/OG7r9qFsxHH3kXvIfDp0SQ--~B/aD05NjI7dz0xNDAwO2FwcGlkPXl0YWNoeW9u/https://media.zenfs.com/en/motleyfool.com/d59109260ce79df36f940da6a140d861,AFL,Yahoo,The coronavirus pandemic hit some industries harder than others. The result? Great companies at cheap prices.,https://finnhub.io/api/news?id=67b54860235f60eeaa28d40eff22126d1e27a79ba33983cf69652538ac0bf912
company,1616603700,AFLAC Inc. stock outperforms market on strong trading day,64835050,https://images.mktw.net/im-220105/social,AFL,MarketWatch,"Shares of AFLAC Inc. inched 0.81% higher to $49.90 Wednesday, on what proved to be an all-around rough trading session for the stock market, with the S&P 500...",https://finnhub.io/api/news?id=3122a5b4cfdc00b2a1983202a297981816c6a6c3ef5f5888b5377382a17bc947
company,1616517300,"AFLAC Inc. stock falls Tuesday, underperforms market",64815905,https://images.mktw.net/im-220105/social,AFL,MarketWatch,"Shares of AFLAC Inc. shed 2.08% to $49.50 Tuesday, on what proved to be an all-around grim trading session for the stock market, with the S&P 500 Index...",https://finnhub.io/api/news?id=eb3df36344f7cb1f4f9ad7cac6d12dbfca1a2717603eddc6d77eb45083d285b9
company,1616497800,CellMax Life and Sebela Pharmaceuticals Enter Strategic Development and Commercialization Partnership for FirstSight™ Blood Test for Detection of Colorectal Cancer and Pre-Cancer,66476322,https://s.yimg.com/uu/api/res/1.2/wM4HLIPexzsuTjpR_RGqQA--~B/aD03OTt3PTQwMDthcHBpZD15dGFjaHlvbg--/https://media.zenfs.com/en/prnewswire.com/24a629af952bcdb0cb98650558e18a68,AFL,Yahoo,"CellMax Life, a molecular diagnostics company with proprietary technology for pre-cancer and cancer detection blood tests, and Sebela Pharmaceuticals, a market leader in gastroenterology, announce the closing of a strategic development and commercial collaboration agreement, as well as CellMax's Series C financing. Participation in the financing also includes a strategic investment from new investor, Aflac Ventures, the corporate venture arm of Aflac Incorporated (NYSE: AFL), and existing investor, ArtimanVentures.",https://finnhub.io/api/news?id=6a494cfd0f6b65bcfc7297a803ada88ce557adb0c35f361152f2c3a68d2b3f60
company,1616430900,"AFLAC Inc. stock falls Monday, underperforms market",64795595,https://images.mktw.net/im-220105/social,AFL,MarketWatch,"Shares of AFLAC Inc. shed 1.19% to $50.55 Monday, on what proved to be an all-around great trading session for the stock market, with the S&P 500 Index...",https://finnhub.io/api/news?id=50c88dabfc255c89ee425f1d1e2f9c3b8c87d3b08deee8ef6bc9323476520237
company,1616406291,Careful With Aflac At Full Valuation,64783427,https://static.seekingalpha.com/cdn/s3/uploads/getty_images/1265108955/medium_image_1265108955.jpg,AFL,SeekingAlpha,"Aflac is a great company, and part of my core portfolio of conservative investment stocks. However, the upside for the company doesn't meet my investment requirements.",https://finnhub.io/api/news?id=52a9ccf3c0eb97a29b5e03fb05567e83dfd4295af3bc789c2d99fbd950227ccd
company,1616360656,Dividend Champions: 3 To Consider For March 2021,64778611,https://static.seekingalpha.com/cdn/s3/uploads/getty_images/1182378270/medium_image_1182378270.jpg,AFL,SeekingAlpha,"These three dividend champions, Aflac, General Dynamics and 3M, have exceeded the S&P return year-to-date and may have more room to run.",https://finnhub.io/api/news?id=7b2bef8a30120c3508e24be4c1322c62e478fa0f1790ffae5f7dd90c92497222
company,1616171700,"AFLAC Inc. stock falls Friday, underperforms market",64762915,https://images.mktw.net/im-220105/social,AFL,MarketWatch,"Shares of AFLAC Inc. shed 1.18% to $51.16 Friday, on what proved to be an all-around dismal trading session for the stock market, with the S&P 500 Index...",https://finnhub.io/api/news?id=d5d943277760cdbca5e89432a3f11e4290b59b6f4d9c2cd2b6c7f71b63a61345
company,1616103000,Statement from Aflac Incorporated on Georgia Voting Rights:,66476325,https://s.yimg.com/uu/api/res/1.2/MsH_.YyEvtFdAjJTegHAZA--~B/aD0xMzk7dz00MDA7YXBwaWQ9eXRhY2h5b24-/https://media.zenfs.com/en/prnewswire.com/97d79ed3c66baca2699cb8a44d310561,AFL,Yahoo,"""Aflac will only support solutions that make voting easy and accessible for every eligible voter while maintaining the security and transparency of the voting process. As legislators in Georgia continue to debate these issues, we will remain actively involved in the process to influence positive results that are aligned with Aflac's long history of supporting fairness and justice. Aflac will not support legislation that fails to accomplish these goals.""",https://finnhub.io/api/news?id=bdaef1e587ddd80dc0d97290696452536df68c2ced0eecfabd827ea0fd9f16ce
company,1616085300,"AFLAC Inc. stock rises Thursday, outperforms market",64741083,https://images.mktw.net/im-220105/social,AFL,MarketWatch,"Shares of AFLAC Inc. inched 0.19% higher to $51.77 Thursday, on what proved to be an all-around dismal trading session for the stock market, with the S&P 500...",https://finnhub.io/api/news?id=4127540095cc39d7b4a97c46daa9ddb7a5f864e1ab25f06da6fc3817155e1e98
company,1615998900,"AFLAC Inc. stock rises Wednesday, outperforms market",64718353,https://images.mktw.net/im-220105/social,AFL,MarketWatch,"Shares of AFLAC Inc. rose 1.12% to $51.67 Wednesday, on what proved to be an all-around favorable trading session for the stock market, with the S&P 500...",https://finnhub.io/api/news?id=b8ee4edc27f6f17311862ec2d2832749daacbacb84b935ce83cb63c3aedd7050
company,1615912500,AFLAC Inc. stock outperforms competitors despite losses on the day,64693100,https://images.mktw.net/im-220105/social,AFL,MarketWatch,"Shares of AFLAC Inc. slipped 1.99% to $51.10 Tuesday, on what proved to be an all-around dismal trading session for the stock market, with the S&P 500 Index...",https://finnhub.io/api/news?id=7f307949024e6b83b6244657240efbf1078670bbfe2e9a84b2fd9b70d01432f8
company,1615569900,"AFLAC Inc. stock rises Friday, outperforms market",64641923,https://images.mktw.net/im-220105/social,AFL,MarketWatch,"Shares of AFLAC Inc. rallied 1.63% to $51.84 Friday, on what proved to be an all-around great trading session for the stock market, with the S&P 500 Index...",https://finnhub.io/api/news?id=12a207fcd38c61c1a68de1bb8ddf95764ae26af4360e2cb6d84ef7524dd209b7
company,1615560782,Here's Why You Should Hold Aflac (AFL) in Your Portfolio Now,66476328,https://s.yimg.com/uu/api/res/1.2/VtYTFfWT4YT_UTgBwAREiQ--~B/aD00MDA7dz02MzU7YXBwaWQ9eXRhY2h5b24-/https://media.zenfs.com/en/zacks.com/aac9cf811d947ca04e386fc3eb384f65,AFL,Yahoo,"Aflac (AFL) continues to gain from its well-diversified insurance product offerings across the United States and Japan, and digital transition efforts.",https://finnhub.io/api/news?id=d274fbbad1b1781bce4f4332997837e9acca78b4b9a046c6f18cc5c16036e52b
company,1615543200,Dividend Aristocrats: 5 To Buy And 5 You Should Avoid,64627236,https://static.seekingalpha.com/uploads/2021/3/11/saupload_photo-1554768804-50c1e2b50a6e.jpeg,AFL,SeekingAlpha,Dividend Aristocrats can be great choices for income-oriented investors. See the 5 dividend stocks to buy and 5 you should avoid.,https://finnhub.io/api/news?id=9a0509707a545aaa60b87c4425b83820f50b03f1bb39ba9eb44b3ba1ad023623
company,1615483500,"AFLAC Inc. stock rises Thursday, still underperforms market",64617428,https://images.mktw.net/im-220105/social,AFL,MarketWatch,"Shares of AFLAC Inc. inched 0.39% higher to $51.01 Thursday, on what proved to be an all-around great trading session for the stock market, with the S&P 500...",https://finnhub.io/api/news?id=9755e40ac753bf6d321024b4da8b8d6d2b4a32bb563ddd22c5e8e210289be760
company,1615469520,Aflac Brings Laughs to Help Ease Pain During March Madness®,66476331,https://s.yimg.com/uu/api/res/1.2/HAd1Ak.BJk4vxyoXxARigA--~B/aD0yNDI7dz00MDA7YXBwaWQ9eXRhY2h5b24-/https://media.zenfs.com/en/prnewswire.com/abf0a9778d8a8308d6da32e96af3fede,AFL,Yahoo,"Aflac, a leading provider of supplemental insurance products in the U.S., is preparing for The Big Dance® with a bracket-busting campaign to connect with over 150 million passionate basketball fans who are missing the traditional March Madness experience. Developed in partnership with DDB New York, the campaign, which marks Aflac's first season as an Official Corporate Partner of the NCAA®, starts with a full-court press on Selection Sunday® and continues throughout the tournament.",https://finnhub.io/api/news?id=e70004839f13730c5cfee079d8fada3d3bd77c874464f3c29a0f71d5db77ed86
company,1615397100,AFLAC Inc. stock underperforms Wednesday when compared to competitors despite daily gains,64587999,https://images.mktw.net/im-220105/social,AFL,MarketWatch,"Shares of AFLAC Inc. advanced 1.22% to $50.81 Wednesday, on what proved to be an all-around positive trading session for the stock market, with the S&P 500...",https://finnhub.io/api/news?id=4d84b252ada800b2a1b1c5de51196b4399861e79d3abd00a427e678b69fa996b
company,1615386850,Aflac's (AFL) Management on 2021 RBC Capital Markets Global Financials Conference,64577725,https://static3.seekingalpha.com/assets/og_image_192-59bfd51c9fe6af025b2f9f96c807e46f8e2f06c5ae787b15bf1423e6c676d4db.png,AFL,SeekingAlpha,"Aflac Incorporated. (NYSE:AFL) 2021 RBC Capital Markets Global Financials Conference March 10, 2021 8:00 AM ET Company Participants Fred Crawford – President and Chief Operating Officer...",https://finnhub.io/api/news?id=f66ef3c6ada8dddace9f23255c14aad581617065d45568f749d0d210a0e83685
company,1615321138,Dividend Champions On Sale - The March 2021 Heat Map,64557885,https://static.seekingalpha.com/uploads/2021/3/9/saupload_uERBLt7cFfJWrwroDJO4pZFvV5GO2R9T6iq3hAg85PKEPMyP1Yv_VdCfhrWpUCM_8b5PGFJJnIgicB0oY3IpU3rsqEwZyzQNwfG0Qv5SigPJRdSCGFn6hJ3OaeEwC6uI38oYzbJm.png,AFL,SeekingAlpha,"Dividend Champions can form the cornerstone of any income-oriented portfolio, but most of us don’t have enough time to analyze all 142 stocks thoroughly.",https://finnhub.io/api/news?id=5e5a832c8d275bb6f65fe1651165a10b2c0259fa952f684da943123efc069002
company,1615310760,AFLAC Inc. stock underperforms Tuesday when compared to competitors,64556586,https://images.mktw.net/im-220105/social,AFL,MarketWatch,"Shares of AFLAC Inc. slid 1.14% to $50.20 Tuesday, on what proved to be an all-around favorable trading session for the stock market, with the S&P 500 Index...",https://finnhub.io/api/news?id=8184139a8eb3bf260f24b3dee3f51975c8ba23af585e7807a75baa44e7703e8d
company,1615224360,AFLAC Inc. stock underperforms Monday when compared to competitors despite daily gains,64537180,https://images.mktw.net/im-220105/social,AFL,MarketWatch,"Shares of AFLAC Inc. advanced 1.66% to $50.78 Monday, on what proved to be an all-around mixed trading session for the stock market, with the Dow Jones...",https://finnhub.io/api/news?id=e3b833a2fc45563918769677c98ec378e6edd07f4ea6bfdfe3d3927710b53847
company,1615224060,Don’t put off dental care!,64555849,https://bloximages.newyork1.vip.townnews.com/standard.net/content/tncms/assets/v3/editorial/d/6f/d6fa1962-2659-5bf6-bf21-534a35901804/6047406579088.image.jpg?resize=1120%2C630,AFL,https://www.standard.net,"(BPT) - Many Americans may be risking their health by neglecting regular health appointments, including dental care. In a normal year, an estimated 100 million Americans fail to see a",https://finnhub.io/api/news?id=a4e026a5a356884d1607a5966254ca3e1543a39f721af591418e327fb28c6fa1
company,1615217160,Aflac Incorporated Announces Inaugural Sustainability Bond Issuance,66476334,https://s.yimg.com/uu/api/res/1.2/fodKJvuTNQMbPNGBEa.HGA--~B/aD0xODY7dz00MDA7YXBwaWQ9eXRhY2h5b24-/https://media.zenfs.com/en/prnewswire.com/b5b240ed1bee1ecacd6e7f053248a21c,AFL,Yahoo,"Aflac Incorporated announced today that it has closed its first sustainability bond, further reinforcing the company's longstanding commitment to uphold the core values of our ""people-first"" business approach that balances purpose and profit. The company's core values include reinforcing and operating with the utmost respect for our environment and the communities we serve.",https://finnhub.io/api/news?id=c855f3682e0bedc062a94e6b9ecec74071c439f9afce4524d8d14ffae54c9ebf
company,1615211692,Dividend Income Summary: Bert's February 2021 Summary,64533103,https://static.seekingalpha.com/uploads/2021/3/8/saupload_Screenshot-2021-03-06-at-1.54.12-PM.png,AFL,SeekingAlpha,"Building a large dividend income stream takes time, consistency, hard work, saving, and most importantly, investing.",https://finnhub.io/api/news?id=5cefd854ee4076a9ac38680ed3896d515f9dba3e1ffe47b62ff116508b26b366
company,1615107881,Annapolis Financial Services LLC Purchases Shares of 700 Aflac Incorporated (NYSE:AFL),64519057,https://www.marketbeat.com/logos/aflac-logo.jpg,AFL,https://www.thelincolnianonline.com,"Annapolis Financial Services LLC purchased a new stake in Aflac Incorporated (NYSE:AFL) during the 4th quarter, according to the company in its most recent disclosure with the Securities and Exchange Commission. The firm purchased 700 shares of the financial services provider’s stock, valued at approximately $31,000. Several other large investors have also added to or […]",https://finnhub.io/api/news?id=0b2ad46ab9670cc5cbf04be3ebcfc805c43177de259ef19b1888931a2768e662
company,1615022280,5 Safe And Cheap Dividend Stocks To Invest In (March 2021),64505352,https://static.seekingalpha.com/uploads/2021/3/3/saupload_c9d7283731b666dc78edec7bce19358f.png,AFL,SeekingAlpha,"This article is part of our monthly series where we highlight five companies that are large cap, relatively safe, dividend paying, and are offering large discounts to their historical norms.",https://finnhub.io/api/news?id=ec332cdff707b9e2ffa892a131d29b6bb359eca7e7a6424a20c2135967d03b88
company,1614985688,UPDATE 1-Civil rights groups urge companies to join fight against Georgia voting restrictions,66476336,https://s.yimg.com/cv/apiv2/social/images/yahoo_default_logo-1200x1200.png,AFL,Yahoo,"Voting rights groups are calling on companies such as Coca-Cola Co and Delta Air Lines Inc to oppose efforts by Republican lawmakers in Georgia to enact sweeping new restrictions on voting access in the battleground state.  The organizations, including the Black Voters Matter Fund, the New Georgia Project Action Fund and the Georgia NAACP, launched a campaign on social media and in local news outlets this week asking the corporations to take a stand against legislation they said aims to curb turnout from Democratic-leaning Black voters.",https://finnhub.io/api/news?id=0035c34aecf796ed169303a6a5d5e11dd1f17b70bda15f1e19d87c7209e19976
company,1614965100,AFLAC Inc. stock outperforms market on strong trading day,64492243,https://images.mktw.net/im-220105/social,AFL,MarketWatch,"Shares of AFLAC Inc. rose 3.20% to $49.95 Friday, on what proved to be an all-around positive trading session for the stock market, with the S&P 500 Index...",https://finnhub.io/api/news?id=75110283e02063f544ff7bcabf72d47c535bf7b5290af299d01da9fe6cb5ee2c
company,1614878760,AFLAC Inc. stock outperforms market despite losses on the day,64471593,https://images.mktw.net/im-220105/social,AFL,MarketWatch,"Shares of AFLAC Inc. slipped 1.10% to $48.40 Thursday, on what proved to be an all-around dismal trading session for the stock market, with the S&P 500 Index...",https://finnhub.io/api/news?id=122daae691bf2d151fc08cdc1443ae4317e11ddbfc5e925a1625868839fc3c02
