category,datetime,headline,id,image,related,source,summary,url
company,1626194640,CME Group Inc. Cl A stock outperforms market on strong trading day,69319478,https://images.mktw.net/im-220105/social,CME,MarketWatch,"Shares of CME Group Inc. Cl A inched 0.09% higher to $210.43 Tuesday, on what proved to be an all-around grim trading session for the stock market, with the...",https://finnhub.io/api/news?id=2069259a98ada62b331cc2c03541b96f391c34fcadd8b0c6d585da68672b63ed
company,1626172988,U.S. natgas futures drop on forecasts for less heat,68843372,https://www.nasdaq.com/sites/acquia.prod/files/2021-07-13T144632Z_1_IT3_RTRLXPP_2_LYNXPACKAGER.JPG?869463594,CME,Nasdaq,"U.S. natural gas futures dipped over 1% on Tuesday on forecasts for less hot temperatures that would reduce gas usage for air conditioning, although losses were capped by lower production estimates.",https://finnhub.io/api/news?id=c9adc746beb2bb3a87047134f80cc16e937d28312469481d854ffb3ee10cf4ef
company,1626151140,"Oak Harvest Investment Services Buys Advanced Micro Devices Inc, Amazon.com Inc, Square Inc, Sells Akamai Technologies Inc, Bristol-Myers Squibb Company, Qualcomm Inc",68736360,,CME,GuruFocus,,https://finnhub.io/api/news?id=10a45ddbc88d844879b6291165f4f76c00eb026d849190bead0b1b9cd18c32f8
company,1626140340,Asian shares mostly track Wall St drop on inflation worries,68751290,,CME,"Associated Press, The",Looking for stock market analysis and research with proves results? Zacks.com offers in-depth financial research with over 30years of proven results.,https://finnhub.io/api/news?id=e7d71515bf8834d68682b34800aa6c9879785331c68f6622b02ef35e43f08a49
company,1626084000,EBS Goes Live with Next Generation EBS Direct Platform,68691292,https://s.yimg.com/uu/api/res/1.2/r2GDjQI36uWBec8HY9n5zw--~B/aD0xNjt3PTE2O2FwcGlkPXl0YWNoeW9u/https://media.zenfs.com/en/prnewswire.com/277a39d66f9632b1c65741c5bde9fae7,CME,Yahoo,"EBS, a leading provider of electronic trading platforms and technology services in foreign exchange markets, has launched its next-generation EBS Direct platform.",https://finnhub.io/api/news?id=633edba17c69265fa56294b9415e0b3df0292c9619ec334f5edd43ca06e81773
company,1626081490,"Financial Sector Update for 07/12/2021: HSBC, CME, VINP, XLF, FAS, FAZ",68843373,https://www.nasdaq.com/sites/acquia.prod/files/2019-05/0902-Q19%20Total%20Markets%20photos%20and%20gif_CC8.jpg?2041236016,CME,Nasdaq,Financial stocks were trading lower premarket Monday with the Select Financial Sector SPDR (XLF) recently declining by 0.63%. The Direxion Daily Financial Bull 3X shares (FAS) were more than 1% lower and its bearish counterpart Direxion Daily Financial Bear 3X shares (FAZ) were,https://finnhub.io/api/news?id=595a575e33718410b62c31ad877994570724e2094d856b0f3b040d933aaec0ba
company,1626076800,"CME Group International Average Daily Volume Reached 5.1 Million Contracts in Q2 2021, Up 6% from Q2 2020",68691293,https://s.yimg.com/uu/api/res/1.2/egDliqXk9D.uJhVZ5tpSsQ--~B/aD0xNjt3PTE2O2FwcGlkPXl0YWNoeW9u/https://media.zenfs.com/en/prnewswire.com/70ee13c65cfb2dfb7458108915788328,CME,Yahoo,"CME Group, the world's leading and most diverse derivatives marketplace, today announced that its international average daily volume (ADV) reached 5.1 million contracts in Q2 2021, up 6% year on year.",https://finnhub.io/api/news?id=6fa4bbbfbdc397ff71f0bb6c8ff52ef5aabad18d2891c9ed158aeba0ddf16434
company,1626069600,EBS Goes Live with Next Generation EBS Direct Platform,68974119,,CME,PR Newswire,Looking for stock market analysis and research with proves results? Zacks.com offers in-depth financial research with over 30years of proven results.,https://finnhub.io/api/news?id=8e8d88342d022c09d9e8b3de817372a8293871f2e7c75c5fb8880c31c47a39a7
company,1626066120,"CME Group reports Q2 international ADV of 5.1M contracts, up 6%",68974120,,CME,Thefly.com,"CME Group reports Q2 international ADV of 5.1M contracts, up 6% CME",https://finnhub.io/api/news?id=44402246580114707097ce7cd7259855d3712b3c40019a942a5263f869a88376
company,1626062400,"CME Group International Average Daily Volume Reached 5.1 Million Contracts in Q2 2021, Up 6% from Q2 2020",68974121,,CME,PR Newswire,Looking for stock market analysis and research with proves results? Zacks.com offers in-depth financial research with over 30years of proven results.,https://finnhub.io/api/news?id=7369258ef60376812098edd4c626ea22a2f815f67f18b29a0884353d7c3e0b97
company,1626047520,Asian stocks advance after Wall Street hits new record,68974122,,CME,"Associated Press, The",Looking for stock market analysis and research with proves results? Zacks.com offers in-depth financial research with over 30years of proven results.,https://finnhub.io/api/news?id=015823dec52a1d93c764e33855028dc85c264c117c6a0056133c5e50f445984b
company,1625976060,CME Group Stock Is Believed To Be Fairly Valued,68974123,https://static.gurufocus.com/logos/0C000007BL.png,CME,GuruFocus,,https://finnhub.io/api/news?id=de4e76d14e1f50543599b89aae6a811c9d45ac5ae8da0d7f1922cbc882ddd492
company,1625845756,"Notable Friday Option Activity: BANC, CME, MS",68843374,https://www.nasdaq.com/sites/acquia.prod/files/2019-05/0902-Q19%20Total%20Markets%20photos%20and%20gif_CC8.jpg?798756139,CME,Nasdaq,"Looking at options trading activity among components of the Russell 3000 index, there is noteworthy activity today in Banc Of California Inc (Symbol: BANC), where a total volume of 1,600 contracts has been traded thus far today, a contract volume which is representative of appr",https://finnhub.io/api/news?id=60edae13eefbc6b8290f78db398582fddd2484c61b420259f7e1e65080a2733f
company,1625712180,Tech companies help pull stocks broadly lower on Wall Street,68974124,,CME,"Associated Press, The",Looking for stock market analysis and research with proves results? Zacks.com offers in-depth financial research with over 30years of proven results.,https://finnhub.io/api/news?id=27b62bdd86e9e86d194f60a90cf0456165ad84bafe73967a3b711f3d7db05d79
company,1625676240,CME Group Inc. Cl A stock underperforms Wednesday when compared to competitors,68645916,https://images.mktw.net/im-220105/social,CME,MarketWatch,"Shares of CME Group Inc. Cl A slipped 0.52% to $206.95 Wednesday, on what proved to be an all-around favorable trading session for the stock market, with the...",https://finnhub.io/api/news?id=d85004e196f84035684ccaff091545a424ea07189e3c2af65f590ea7aaf1fe28
company,1625589840,CME Group Inc. Cl A stock underperforms Tuesday when compared to competitors,68645917,https://images.mktw.net/im-220105/social,CME,MarketWatch,"Shares of CME Group Inc. Cl A slipped 2.57% to $208.04 Tuesday, on what proved to be an all-around poor trading session for the stock market, with the S&P...",https://finnhub.io/api/news?id=ff957522b89447ed328ab89b08032b2253ffbd8393199cfd9a99a24cc6d2028e
company,1625578200,Ag Economy Barometer falls for second month; rising input costs causing concern for farmers,68611234,https://s.yimg.com/uu/api/res/1.2/dEm2ZWtBEMrmEzXsJr8cJg--~B/aD0xNjt3PTE2O2FwcGlkPXl0YWNoeW9u/https://media.zenfs.com/en/prnewswire.com/6706f55f8ca3854352a57a9b38a64fb9,CME,Yahoo,"The Purdue University/CME Group Ag Economy Barometer marks a second month of sharp declines, down 21 points to a reading of 137 in June. Producers were less optimistic about both current conditions on their farming operations as well as their expectations for the future. The Index of Current Conditions dropped 29 points to a reading of 149 and the Index of Future Expectations fell 17 points to a reading of 132. The Ag Economy Barometer is calculated each month from 400 U.S. agricultural producer",https://finnhub.io/api/news?id=ad28360a0f1872ec9a43816f545983258534d266cda25ba03dc93dad8c982bd8
company,1625563800,Ag Economy Barometer falls for second month; rising input costs causing concern for farmers,68974125,,CME,PR Newswire,Looking for stock market analysis and research with proves results? Zacks.com offers in-depth financial research with over 30years of proven results.,https://finnhub.io/api/news?id=9cda83b3426fe7f9699d18d0eb72fbecc5c02b37f4602ddee94e031b2c7d8ffa
company,1625493301,CME Group (CME) Q2 Volumes Increase Y/Y in Four Product Lines,68604788,https://s.yimg.com/uu/api/res/1.2/ewXk4bDCgYqcxh.hM0k_WQ--~B/aD00MDA7dz02MzU7YXBwaWQ9eXRhY2h5b24-/https://media.zenfs.com/en/zacks.com/cee58fd35cde370e386b797dd13bd8ab,CME,Yahoo,CME Group's (CME) Q2 average daily volumes reflect higher volumes in four of the six product lines.,https://finnhub.io/api/news?id=8c07cd24da9bd08460158e732d5be5f15ad2f319cdd627f82b7aaac9b805d24f
company,1625443320,"Asian shares mixed, US markets closed for Independence Day",68974126,,CME,"Associated Press, The",Looking for stock market analysis and research with proves results? Zacks.com offers in-depth financial research with over 30years of proven results.,https://finnhub.io/api/news?id=a5d8d1d1d0ba931ac35c3df95665d4a8b93e5623f14191e37173bb4701ce40ef
company,1625244240,"CME Group Inc. Cl A stock falls Friday, underperforms market",68592838,https://images.mktw.net/im-220105/social,CME,MarketWatch,"Shares of CME Group Inc. Cl A slipped 0.32% to $213.52 Friday, on what proved to be an all-around positive trading session for the stock market, with the S&P...",https://finnhub.io/api/news?id=83de6587dc5977f8920f924b16bfd346b47ff403a9ae1f496f3a318a693d191c
company,1625225400,CME Group Reports Q2 and June 2021 Monthly Market Statistics,68576879,https://s.yimg.com/uu/api/res/1.2/AH_piRPMg3gdbe2SYD.kqg--~B/aD0xNjt3PTE2O2FwcGlkPXl0YWNoeW9u/https://media.zenfs.com/en/prnewswire.com/eccbd0c1f004e4272a7bfafdb6a8c948,CME,Yahoo,"CME Group, the world's leading and most diverse derivatives marketplace, today reported its Q2 and June 2021 market statistics, showing it reached average daily volume (ADV) of 18.4 million contracts for both the second quarter and the month of June. Market statistics are available in greater detail at https://cmegroupinc.gcs-web.com/monthly-volume.",https://finnhub.io/api/news?id=5f357616b183da6486175abe60fdf881077fb7873425f6df7cc5acbdce403015
company,1625218073,"Financial Sector Update for 07/02/2021: SAN, SC, CME, SCHW, XLF, FAS, FAZ",68645200,https://www.nasdaq.com/sites/acquia.prod/files/2019-05/0902-Q19%20Total%20Markets%20photos%20and%20gif_CC8.jpg?1052706851,CME,Nasdaq,Financial stocks were declining premarket Friday as the Select Financial Sector SPDR (XLF) was recently down by 0.11%. The Direxion Daily Financial Bull 3X shares (FAS) were 0.49% lower and its bearish counterpart Direxion Daily Financial Bear 3X shares (FAZ) were down 0.15%.,https://finnhub.io/api/news?id=e749b5365e0a43d70685d9da288014d6e157a32c768134cf3fa572ca8dfb40fd
company,1625211000,CME Group Reports Q2 and June 2021 Monthly Market Statistics,68974127,,CME,PR Newswire,Looking for stock market analysis and research with proves results? Zacks.com offers in-depth financial research with over 30years of proven results.,https://finnhub.io/api/news?id=2b26c52999ff76e9d4d6bdeddad7986ccbdd848fb25dcc1c10900a05f6eaf6fc
company,1625205945,China's first exchange-traded lithium contract to launch on July 5,68651452,https://www.nasdaq.com/sites/acquia.prod/files/2021-07-02T101329Z_1_OP5_RTRLXPP_2_LYNXPACKAGER.JPG?731332001,CME,Nasdaq,China's Wuxi Stainless Steel Exchange said on Friday trading in its new lithium contract - the country's first bourse-based offering for the key ingredient in electric-vehicle (EV) batteries - would begin on July 5.,https://finnhub.io/api/news?id=a6ed8166e96eb3f46291fae6520d550808e9d3d410c0dde343fe93e21bca2b93
company,1625157840,CME Group Inc. Cl A stock outperforms competitors on strong trading day,68569320,https://images.mktw.net/im-220105/social,CME,MarketWatch,"Shares of CME Group Inc. Cl A inched 0.71% higher to $214.20 Thursday, on what proved to be an all-around great trading session for the stock market, with...",https://finnhub.io/api/news?id=38fbf363e61f97275e9767329fd5dd5022bbbbbce5be8f5446a4664ff6312609
company,1625105280,Asian shares mostly decline ahead of watched US jobs report,68974128,,CME,"Associated Press, The",Looking for stock market analysis and research with proves results? Zacks.com offers in-depth financial research with over 30years of proven results.,https://finnhub.io/api/news?id=30310733f342bb96cefda5a7f8794c1cbc72d773c8b15d1c94db4148f54d94bd
company,1625086166,10 Best Cryptocurrencies to Buy for Early Retirement,68538344,https://s.yimg.com/uu/api/res/1.2/aN7DbRv9_u3HYw9pU2vf3A--~B/aD01MDA7dz03NTA7YXBwaWQ9eXRhY2h5b24-/https://media.zenfs.com/en/insidermonkey.com/49ee8ad2af6a6c431f74b082ef275be6,CME,Yahoo,"In this article, we discuss the 10 best cryptocurrencies to buy for early retirement. If you want to skip our detailed analysis of these cryptocurrencies, go directly to the 5 Best Cryptocurrencies to Buy for Early Retirement. Cryptocurrencies have exploded in value over the past few years as a younger generation of internet enthusiasts, who […]",https://finnhub.io/api/news?id=cbc95d003cf48517c0d8e5cfadd37c226f25bd0e31c8bab49a6238cfe84ad8a9
company,1625071440,"CME Group Inc. Cl A stock falls Wednesday, underperforms market",68540187,https://images.mktw.net/im-220105/social,CME,MarketWatch,"Shares of CME Group Inc. Cl A sank 0.29% to $212.68 Wednesday, on what proved to be an all-around favorable trading session for the stock market, with the...",https://finnhub.io/api/news?id=21844000950543f6f8bafc58cbb7293f23c84318c44168797ba9dcb29b630a79
company,1625046240,IN BRIEF: TP ICAP to launch crypto trading platform,68913381,,CME,Alliance News,Looking for stock market analysis and research with proves results? Zacks.com offers in-depth financial research with over 30years of proven results.,https://finnhub.io/api/news?id=85ecb55a2d7d1ac2bcd80c27a41d4122ae908f359e894ea432c1c07fee07d22e
company,1625012760,"Asian shares advance despite weaker factory data, outbreaks",68974130,,CME,"Associated Press, The",Looking for stock market analysis and research with proves results? Zacks.com offers in-depth financial research with over 30years of proven results.,https://finnhub.io/api/news?id=a3846bf8b3220543c13dc57fcfe3d92eb95cf7ba4835c54995b64a6091913e57
company,1624985040,CME Group Inc. Cl A stock underperforms Tuesday when compared to competitors,68540188,https://images.mktw.net/im-220105/social,CME,MarketWatch,"Shares of CME Group Inc. Cl A shed 0.89% to $213.30 Tuesday, on what proved to be an all-around positive trading session for the stock market, with the S&P...",https://finnhub.io/api/news?id=8d00be1a9678ca3a9ac88f2de9024d1387036c49671f7f55f9171b9c1bfe67cc
company,1624966431,Water futures market fails to make a splash with California farmers,68528210,https://static.reuters.com/resources/r/?m=02&d=20210629&t=2&i=1567319358&r=LYNXNPEH5S0L6,CME,Reuters,Former bond trader Alan Boyce is just the type of California farmer expected to dive into the world's first water futures contract.,https://finnhub.io/api/news?id=7085bb4b624874f52c5908bab32c28d0180c95157333ae2bf0c422c7bee5e10e
company,1624964400,Water futures market fails to make a splash with California farmers,68526962,https://s.yimg.com/cv/apiv2/social/images/yahoo_default_logo-1200x1200.png,CME,Yahoo,"Former bond trader Alan Boyce is just the type of California farmer expected to dive into the world's first water futures contract.  Boyce is comfortable navigating financial tools, and he grows irrigated pistachios, tomatoes, alfalfa and other crops in California's drought-prone Central Valley.  Financial exchange operator CME Group launched the contract late last year to help big California water users such as farmers and utilities hedge rising drought risk and give investors a sense of how scarce water is at any given time.",https://finnhub.io/api/news?id=c250c055c1fba45b918889503500c71c9b8006e8c1db542481da8513872d24fd
company,1624950000,Water futures market fails to make a splash with California farmers,68651453,https://www.nasdaq.com/sites/acquia.prod/files/2021-06-29T111239Z_1_YG8_RTRLXPP_2_LYNXPACKAGER.JPG?1321114214,CME,Nasdaq,Former bond trader Alan Boyce is just the type of California farmer expected to dive into the world's first water futures contract.,https://finnhub.io/api/news?id=307f9e6fce28c6fd3b79aee4cb6aed9a796b3fca2d25784975394171e318cbe2
company,1624927990,Charles Schwab Stock Has Limited Upside,68645204,https://www.nasdaq.com/sites/acquia.prod/files/2019-05/0902-Q19%20Total%20Markets%20photos%20and%20gif_CC8.jpg?295678179,CME,Nasdaq,"Charles Schwab stock (NYSE: SCHW), the largest brokerage firm in the U.S., gained roughly 37% – increasing from about $53 at the beginning of 2021 to around $73 currently, outperforming the S&P500, which grew 13% over the same period. The brokerage giant has surp",https://finnhub.io/api/news?id=703595c93fa312283105b41a70848c128b44a87fda1b1646dc7c30f48738ba55
company,1624911051,CME Joins Battle for Retail Bond Traders With Micro Futures,68514740,https://s.yimg.com/uu/api/res/1.2/QmBo64YWceIpBvHA.kJC5Q--~B/aD0xMzMwO3c9MjAwMDthcHBpZD15dGFjaHlvbg--/https://media.zenfs.com/en/bloomberg_markets_842/4e32579b2fb2fe8ce7434749b0218c2e,CME,Yahoo,"(Bloomberg) -- CME Group Inc., whose Treasury futures already dominate among pros, is now trying to lure small traders by offering simpler-to-understand contracts that focus on the numbers the masses care most about anyway: yields.The contracts, when they begin trading on Aug. 16, will rise when Treasury yields increase and fall when they decline -- whereas the existing futures move in the same direction as bond prices, a byzantine turnoff for many investors. The Micro Treasury Yield futures, wh",https://finnhub.io/api/news?id=90bdd1053b4ab8e7585d58a8797b01db9af7787c7e20f302c349df1822ad4d6b
company,1624898640,"CME Group Inc. Cl A stock falls Monday, underperforms market",68540189,https://images.mktw.net/im-220105/social,CME,MarketWatch,"Shares of CME Group Inc. Cl A slipped 1.33% to $215.22 Monday, on what proved to be an all-around mixed trading session for the stock market, with the S&P...",https://finnhub.io/api/news?id=5b3bd238f05291f81eebd6158bb6ed091ab833952ab0d8d13b9d14b69edbdd99
company,1624645440,Micro Bitcoin Futures Surpass 1 Million Contracts Traded,68491908,https://s.yimg.com/uu/api/res/1.2/yxSl.amde6pFb4Ui6H6.8g--~B/aD0xNjt3PTE2O2FwcGlkPXl0YWNoeW9u/https://media.zenfs.com/en/prnewswire.com/a0e8920057896a34cf5f2758dda34b45,CME,Yahoo,"CME Group, the world's leading and most diverse derivatives marketplace, announced that Micro Bitcoin futures volume surpassed 1 million contracts on Friday, June 25.",https://finnhub.io/api/news?id=27ce17ef2bd2f47211b9630c61864d6c1b9d30e4a428624face183499e2de581
company,1624640549,SOFR Is A Dead End: It's AXI Or BSBY,68492940,https://static.seekingalpha.com/cdn/s3/uploads/getty_images/177028779/medium_image_177028779.jpg,CME,SeekingAlpha,"SOFR Academy’s credit risk adjustment index, AXI, should not be lumped together with others such as BSBY. AXI is not intended to replace LIBOR. Read this article to learn more.",https://finnhub.io/api/news?id=371e892c9c8d8c87a1b52225fce53f8b61cd23f625d0216b5d49cbdecba4792f
company,1624639440,CME Group Inc. Cl A stock outperforms market on strong trading day,68505082,https://images.mktw.net/im-220105/social,CME,MarketWatch,"Shares of CME Group Inc. Cl A inched 0.53% higher to $218.12 Friday, on what proved to be an all-around positive trading session for the stock market, with...",https://finnhub.io/api/news?id=bff436202c18136b04df8c106703ac840fad34c5a0cfac230241287fdc9c9f68
company,1624631040,Micro Bitcoin Futures Surpass 1 Million Contracts Traded,68491605,,CME,PR Newswire,Looking for stock market analysis and research with proves results? Zacks.com offers in-depth financial research with over 30years of proven results.,https://finnhub.io/api/news?id=35e46fb13586eb58257685eb1ff8cf166eaa1aa59eb215e708aae4b841568f86
company,1624608720,"Friday’s Top Analyst Upgrades and Downgrades: APA, Arcturus, CME, Darden, First Solar, Logitech, Netflix Nike, Nokia, Sea and More",68487980,https://247wallst.com/wp-content/uploads/2020/04/imageForEntry2-TYi.jpg,CME,247WallSt,"Friday’s top analyst upgrades and downgrades included APA, Arcturus, CME, Darden, First Solar, Logitech, Netflix Nike, Nokia, Sea, and more.",https://finnhub.io/api/news?id=2cecaae69e6b81cc42cb8a13fb9d3803737042ed82f25acf031f67334b62575d
company,1624589380,Crypto Firms Fight for Top Talent With Hundreds of Openings,68475078,https://s.yimg.com/uu/api/res/1.2/Y2m9OgnGETRYeEygRYDjqQ--~B/aD02NzU7dz0xMjAwO2FwcGlkPXl0YWNoeW9u/https://media.zenfs.com/en/bloomberg_technology_68/1ec5d64f88081f699c403d593304a36d,CME,Yahoo,"(Bloomberg) -- Booming cryptocurrency firms say they’re struggling to find the right candidates to fill hundreds of positions as a frenzy of interest in digital currencies and other assets pits them against some of the world’s biggest financial institutions.Despite a rout in May, cryptocurrencies’ total market value is up 400% over the past year to about $1.4 trillion, and traditional financial firms such as Goldman Sachs Group Inc., Bank of New York Mellon Corp. and DBS Group Holdings Ltd. are",https://finnhub.io/api/news?id=3c16f424c3b3cd45a2bae4cb34814140444fb7c04006997e7c1b669189f3ca56
company,1624553040,"CME Group Inc. Cl A stock rises Thursday, outperforms market",68505083,https://images.mktw.net/im-220105/social,CME,MarketWatch,"Shares of CME Group Inc. Cl A advanced 1.03% to $216.98 Thursday, on what proved to be an all-around favorable trading session for the stock market, with the...",https://finnhub.io/api/news?id=6025a96235cc85341671d5ac0cd4dc1e61652f9f12be200f7548bd1e2b9ca442
company,1624544702,Why Should You Retain CME Group (CME) in Your Portfolio?,68464048,https://s.yimg.com/uu/api/res/1.2/t8kqwIbs7PJ.I_cbY.j6Jw--~B/aD00MDA7dz02MzU7YXBwaWQ9eXRhY2h5b24-/https://media.zenfs.com/en/zacks.com/12ea69cf286583cce542f2ce78ef5c5e,CME,Yahoo,"CME Group (CME) is poised to grow, given its market data distribution channels, higher custody fees and prudent capital deployment.",https://finnhub.io/api/news?id=04388108f30dd1da1746165f00d6a15e6030b4b9abfdd2879cdf92d14a8367f8
company,1624521600,CME Group Integrates FX Link with Bloomberg to Support Market Data Distribution and Execution and to Expand FX Swaps Pricing and Liquidity,68462745,https://s.yimg.com/uu/api/res/1.2/2jUC8lv3sLGD0N5iGnpXOQ--~B/aD0xNjt3PTE2O2FwcGlkPXl0YWNoeW9u/https://media.zenfs.com/en/prnewswire.com/fc0c31029be0dbf66773acc84fe5e5a2,CME,Yahoo,"CME Group, the world's leading and most diverse derivatives marketplace, today announced that market data and order entry functionality for FX Link are now available on the Bloomberg Terminal to enable market participants to electronically access pricing, liquidity and trading for FX swaps in G5 currency pairs.",https://finnhub.io/api/news?id=c354d6d68812540b189f3651bd3073b8546289ea1fbf522799d201ac96075702
company,1624507200,CME Group Integrates FX Link with Bloomberg to Support Market Data Distribution and Execution and to Expand FX Swaps Pricing and Liquidity,68458706,,CME,PR Newswire,Looking for stock market analysis and research with proves results? Zacks.com offers in-depth financial research with over 30years of proven results.,https://finnhub.io/api/news?id=ea797df4e9e09a49924f12caff972044f972924909abdaa70541205809368358
company,1624503960,CME Group assumed with a Neutral at Credit Suisse,68475657,,CME,Thefly.com,CME Group assumed with a Neutral at Credit Suisse Credit Suisse CME,https://finnhub.io/api/news?id=ef6deaa90dc92fee1ade279337f6ea1b3553563eec619bb9b1a89e6afe664a24
company,1624497360,Asian shares mixed after listless session on Wall Street,68458707,,CME,"Associated Press, The",Looking for stock market analysis and research with proves results? Zacks.com offers in-depth financial research with over 30years of proven results.,https://finnhub.io/api/news?id=048ccc4984e18b1983958a50a478b2b830d6b12eb76ec26085890a3740740583
company,1624494840,Asian shares mostly higher after listless session on Wall St,68455400,,CME,"Associated Press, The",Looking for stock market analysis and research with proves results? Zacks.com offers in-depth financial research with over 30years of proven results.,https://finnhub.io/api/news?id=9a1d947adc528f4559ce13bd4c88085360d43b1c5791df64491aaaefcc0748a1
company,1624466716,The Many Reasons To Love CME Group,68443380,https://static.seekingalpha.com/cdn/s3/uploads/getty_images/80276995/medium_image_80276995.jpg,CME,SeekingAlpha,"CME Group is the largest provider of derivatives in the world, making it a key company in multiple supply chains and a staple for traders and investors.",https://finnhub.io/api/news?id=acfda6f6e044d06ee7d7f9b544749e60be3611bbadc885225099c1b46d4add7b
company,1624466640,CME Group Inc. Cl A stock underperforms Wednesday when compared to competitors,68505084,https://images.mktw.net/im-220105/social,CME,MarketWatch,"Shares of CME Group Inc. Cl A slipped 0.50% to $214.77 Wednesday, on what proved to be an all-around grim trading session for the stock market, with the S&P...",https://finnhub.io/api/news?id=6da07582c8e2dece69ce6e7718df4de6ddd6a0db92ea8807da02c498a5df9724
company,1624462560,Micro E-mini Equity Options Surpass 1.5 Million Contracts Traded,68437449,https://s.yimg.com/uu/api/res/1.2/eN3dPNVn9k.rkFh5SJsHPQ--~B/aD0xNjt3PTE2O2FwcGlkPXl0YWNoeW9u/https://media.zenfs.com/en/prnewswire.com/09b495ef5fa2719f5ec1d223aa962791,CME,Yahoo,"CME Group, the world's leading and most diverse derivatives marketplace, today announced that its Micro E-mini Equity options surpassed 1.5 million contracts traded on Friday, June 18.",https://finnhub.io/api/news?id=757a812e15ba6fc75fcb52f8191b7e06a181eee875982d3ca01fc1166496dfbe
