category,datetime,headline,id,image,related,source,summary,url
company,1629166200,Wall Street lower as retail sales post steep drop in July,69694855,,CME,"Associated Press, The",Looking for stock market analysis and research with proves results? Zacks.com offers in-depth financial research with over 30years of proven results.,https://finnhub.io/api/news?id=3cfd5300684b67f406f73723f900b8a7e0064f135075a90329517dc6222e7842
company,1628873040,CME Group Inc. Cl A stock outperforms competitors despite losses on the day,69673268,https://images.mktw.net/im-220105/social,CME,MarketWatch,"Shares of CME Group Inc. Cl A slumped 0.65% to $207.03 Friday, on what proved to be an all-around great trading session for the stock market, with the S&P...",https://finnhub.io/api/news?id=9442bfa93fe5c552117cdb27f42670e2fbe21ea5f9f5dedf6e7f6748977f30bb
company,1628824260,Stocks open mixed on Wall Street; Disney sends Dow higher,69652868,,CME,"Associated Press, The",Looking for stock market analysis and research with proves results? Zacks.com offers in-depth financial research with over 30years of proven results.,https://finnhub.io/api/news?id=044eed1d20240e0a38b9f4b3aa899856691883eee029baf8efa0e39c01a84816
company,1628786640,"CME Group Inc. Cl A stock falls Thursday, underperforms market",69673269,https://images.mktw.net/im-220105/social,CME,MarketWatch,"Shares of CME Group Inc. Cl A slumped 0.33% to $208.38 Thursday, on what proved to be an all-around positive trading session for the stock market, with the...",https://finnhub.io/api/news?id=7cb5143514a64c8cde2349b3453b09a191045aca13b1a01f05599a7abf8209d2
company,1628782621,Ex-Yum CEO on labor shortage: People leave companies for 2 reasons,69635428,,CME,Yahoo,"David Novak, founder and CEO of David Novak Leadership and co-founder and former CEO of Yum! Brands, sat down with Yahoo Finance Editor-in-Chief Andy Serwer to discuss leadership and how to retain employees amid a labor shortage.


.",https://finnhub.io/api/news?id=f1651da9274c4624e29e506812ee44e58a387443b43e5de2cf261f915c470e7b
company,1628700240,"CME Group Inc. Cl A stock rises Wednesday, still underperforms market",69628030,https://images.mktw.net/im-220105/social,CME,MarketWatch,"Shares of CME Group Inc. Cl A inched 0.07% higher to $209.07 Wednesday, on what proved to be an all-around great trading session for the stock market, with...",https://finnhub.io/api/news?id=bbf7a7c99ec50ba58c720bceb1f238f899280b66cde89a9fd081d166f792e16a
company,1628654100,UBS to hold a virtual conference,69614154,,CME,Thefly.com,"Financial Services Virtua... AXS, BK, BPOP, CBOE, CBRE, CG, CME, FDS, GCMG, HLNE, IBTX, IFCZF, IVZ, JLL, JPM, KMPR, LPLA, MCO, NDAQ, OWL, PRU, SPGI, STEP, VCTR, WAL, WETF, WTFC",https://finnhub.io/api/news?id=ebd9830172442c485bc3c67d66d819a56f948e5ffdd27f2f22589af3943cddf8
company,1628650380,"US stocks open slightly higher, pushing indexes past records",69614240,,CME,"Associated Press, The",Looking for stock market analysis and research with proves results? Zacks.com offers in-depth financial research with over 30years of proven results.,https://finnhub.io/api/news?id=6c88cb2ef7a9455a3f6bc923b3f57b7a0c0cc08eef62b6614d3475f801a9d0c2
company,1628613840,CME Group Inc. Cl A stock outperforms competitors despite losses on the day,69628031,https://images.mktw.net/im-220105/social,CME,MarketWatch,"Shares of CME Group Inc. Cl A dropped 0.09% to $208.93 Tuesday, on what proved to be an all-around positive trading session for the stock market, with the...",https://finnhub.io/api/news?id=62e818d6872c500d1914d0286b7c5511dd4573ff03e65f9c87d7e58564a31503
company,1628584740,"Stonehage Fleming Financial Services Holdings Ltd Buys CME Group Inc, BTC iShares MSCI United Kingdom Small-Cap ETF, Taiwan Semiconductor Manufacturing Co, Sells Lockheed Martin Corp, Raytheon Technologies Corp, Kingsoft Cloud Holdings",69614241,,CME,GuruFocus,,https://finnhub.io/api/news?id=dcc5f5478e377dc8d6726286cf122eaa33e923a200d86a3dbaa03c40d93b0b6d
company,1628567700,UBS to hold a virtual conference,69594243,,CME,Thefly.com,"Financial Services Virtua... AXS, BK, BPOP, CBOE, CBRE, CG, CME, FDS, GCMG, HLNE, IBTX, IFCZF, IVZ, JLL, JPM, KMPR, LPLA, MCO, NDAQ, OWL, PRU, SPGI, STEP, VCTR, WAL, WETF, WTFC",https://finnhub.io/api/news?id=c6ea36b01120ad8d949f50b6a3f83e83850c1071a83e7b233ef7869b1a9fba5e
company,1628544720,"CME Group Chief Commercial Officer, Global Head of Commodities and Options Products, and Global Head of Financial and OTC Products to Present at UBS Financial Services Virtual Conference",69587074,https://s.yimg.com/uu/api/res/1.2/0NgxIhpC7TSzVllDAJyikg--~B/aD0xNjt3PTE2O2FwcGlkPXl0YWNoeW9u/https://media.zenfs.com/en/prnewswire.com/5e224b2976520633900d3778916f43b5,CME,Yahoo,"CME Group announced today that Julie Winkler, Chief Commercial Officer; Derek Sammann, Global Head of Commodities and Options Products; and Sean Tully, Global Head of Financial and OTC Products, will present at the UBS Financial Services Virtual Conference on Wednesday, August 11, 2021 at 8:00 a.m. (Eastern Time).",https://finnhub.io/api/news?id=bfbe984751c73a47b69aeffd3332de4043debdc01d58e01c845e8e0b914a5e90
company,1628530320,"CME Group Chief Commercial Officer, Global Head of Commodities and Options Products, and Global Head of Financial and OTC Products to Present at UBS Financial Services Virtual Conference",69599582,,CME,PR Newswire,Looking for stock market analysis and research with proves results? Zacks.com offers in-depth financial research with over 30years of proven results.,https://finnhub.io/api/news?id=14a60f77296ef7f739d803c72d91659172c6cb875f11f4e77c8579f9c7a45f93
company,1628527440,"CME Group Inc. Cl A stock falls Monday, underperforms market",69628032,https://images.mktw.net/im-220105/social,CME,MarketWatch,"Shares of CME Group Inc. Cl A slipped 0.35% to $209.11 Monday, on what proved to be an all-around grim trading session for the stock market, with the S&P 500...",https://finnhub.io/api/news?id=5bb9529f4000add829f36a238b7821937511a66258278c3fc85fa1b736563f66
company,1628514000,Micro WTI Crude Oil Futures Surpass 1 Million Contracts Traded,69583296,https://s.yimg.com/uu/api/res/1.2/i4DJWIm6ot4dY.4XzqKbkA--~B/aD0xNjt3PTE2O2FwcGlkPXl0YWNoeW9u/https://media.zenfs.com/en/prnewswire.com/4dcb5c4ca2dc5db50afea0a650769ddd,CME,Yahoo,"CME Group, the world's leading and most diverse derivatives marketplace, today announced that Micro WTI Crude Oil futures volume surpassed 1 million contracts on Friday, August 6, 2021.",https://finnhub.io/api/news?id=fb6e20248b818295a07ecc9d15a5d7308de52eaa07fa31e5a2992329d4e7f39d
company,1628499600,Micro WTI Crude Oil Futures Surpass 1 Million Contracts Traded,69580788,,CME,PR Newswire,Looking for stock market analysis and research with proves results? Zacks.com offers in-depth financial research with over 30years of proven results.,https://finnhub.io/api/news?id=690491b21664e0d8023183d8699009ef204e3069346527aa2b70a3cf2b49dbb9
company,1628484660,UBS to hold a virtual conference,69594244,,CME,Thefly.com,"Financial Services Virtua... AXS, BK, BPOP, CBOE, CBRE, CG, CME, FDS, GCMG, HLNE, IBTX, IFCZF, IVZ, JLL, JPM, KMPR, LPLA, MCO, NDAQ, OWL, PRU, SPGI, STEP, VCTR, WAL, WETF, WTFC",https://finnhub.io/api/news?id=7b6ff01b3577208a6953b153811ae07ed806dfc391b8338da21aa18986bc73b6
company,1628475600,Energy stocks lead major indexes lower in early US trading,69580043,,CME,"Associated Press, The",Looking for stock market analysis and research with proves results? Zacks.com offers in-depth financial research with over 30years of proven results.,https://finnhub.io/api/news?id=f3aeba13b8679121a3b198a6db0f45c8816962cc760d3eabbefa8269984596c1
company,1628472238,BGC Partners: Exploring The Misunderstood Potential Of Fenics,69574980,https://static.seekingalpha.com/cdn/s3/uploads/getty_images/1249306214/medium_image_1249306214.jpg,CME,SeekingAlpha,BGC Partners is an under-the-radar fintech market leader in a relatively less-understood segment. Click to read about four verticals of Fenics and company's other catalysts.,https://finnhub.io/api/news?id=e94cbdd774b9b0f86ab4eda7e3ec5ec570ae4d3457f70101f849f0f24992fef0
company,1628466240,Asian stocks follow Wall Street up as virus curbs tightened,69580790,,CME,"Associated Press, The",Looking for stock market analysis and research with proves results? Zacks.com offers in-depth financial research with over 30years of proven results.,https://finnhub.io/api/news?id=d553aa59a55de334ffdb4467522bd48e0b617b3d35afbe4ce869e72f5f28018c
company,1628268240,CME Group Inc. Cl A stock outperforms market on strong trading day,69557035,https://images.mktw.net/im-220105/social,CME,MarketWatch,"Shares of CME Group Inc. Cl A inched 0.76% higher to $209.84 Friday, on what proved to be an all-around great trading session for the stock market, with the...",https://finnhub.io/api/news?id=2626f633de05f131fae22eb2fc21f4e15348b44208c39cd8fd172ed9decefcde
company,1628185861,Howard Lutnick Takes Aim at CME’s Dominant U.S. Rates Market,69527069,https://s.yimg.com/cv/apiv2/social/images/yahoo_default_logo-1200x1200.png,CME,Yahoo,"(Bloomberg) -- Howard Lutnick shook up Treasuries trading in the 1990s, and now he wants to take another crack at it, this time in the market for futures linked to U.S. government debt.The billionaire, speaking on BGC Partners Inc.’s earnings conference call Wednesday, said he plans to create a futures exchange to take on CME Group Inc.’s dominant franchise for interest-rate derivatives. Lutnick is chairman and chief executive officer of BGC, a broker affiliated with Cantor Fitzgerald LP.Lutnick",https://finnhub.io/api/news?id=c8965413f2080b38ef3ff6cbd9023f5660600abf3ed057cef9151bc1646555ce
company,1628182680,SEC’s Gary Gensler may have just laid out the clearest road map to the first U.S. bitcoin ETF,69527070,,CME,Yahoo,"Every week we highlight the most timely exchange-traded fund news, from new launches to inflows and performance.",https://finnhub.io/api/news?id=baba8c15b943d66c980b6b91d005e317257373fe50e7d56e8b558a811096dff0
company,1628181840,"CME Group Inc. Cl A stock falls Thursday, underperforms market",69557036,https://images.mktw.net/im-220105/social,CME,MarketWatch,"Shares of CME Group Inc. Cl A dropped 0.12% to $208.25 Thursday, on what proved to be an all-around positive trading session for the stock market, with the...",https://finnhub.io/api/news?id=e157fd635ed4d5cdef39bfe3d1f19b42e0b5fb753eb710c0bd43aa036821aec5
company,1628168280,SEC’s Gary Gensler may have just laid out the clearest road map to the first U.S. bitcoin ETF,69537915,https://images.mktw.net/im-337931/social,CME,MarketWatch,"Every week we highlight the most timely exchange-traded fund news, from new launches to inflows and performance.",https://finnhub.io/api/news?id=4805075eda6b8f0203753ded49cacf08823d41be3535dce7526f83599e4a0ddc
company,1628163000,CME Group Declares Quarterly Dividend,69513530,https://s.yimg.com/uu/api/res/1.2/x7YXgkma7M9xGanRJ61Uxg--~B/aD0xNjt3PTE2O2FwcGlkPXl0YWNoeW9u/https://media.zenfs.com/en/prnewswire.com/0fa0acdd5dca163ea9e2fd28fa4001ec,CME,Yahoo,"CME Group Inc., the world's leading and most diverse derivatives marketplace, today declared a third-quarter dividend of $0.90 per share. The dividend is payable September 27, 2021, to shareholders of record as of September 10, 2021.",https://finnhub.io/api/news?id=fcc0703c3f10c89309ff2e5740fe341fbf77064c417436a8647098f9a8009a76
company,1628148600,CME Group Declares Quarterly Dividend,69515609,,CME,PR Newswire,Looking for stock market analysis and research with proves results? Zacks.com offers in-depth financial research with over 30years of proven results.,https://finnhub.io/api/news?id=c74a46ce0f2cfacf9a6f41c8cb50ee4402d6dc09a8c8765dbf2255a858e12085
company,1628136000,Silver Prices Are Set to Rally Again. Here’s When You Should Buy.,69557034,https://images.barrons.com/im-379783/social,CME,MarketWatch,"Silver prices are vulnerable to a wave of selling this month and into September but then are expected to rise, analysts say.",https://finnhub.io/api/news?id=cd252bd1148a27d1c766969ca081f348918c8197f236a94064c4897824de3dc8
company,1628135100,Former Bank of America traders convicted over spoofing,69530807,https://www.fnlondon.com/icons/social-icon.png,CME,DowJones,The proceeding was a test of prosecutors’ efforts to punish spoofing activity that predated a law making it illegal,https://finnhub.io/api/news?id=e39486b9c68d04f8bfa83e35b58ed7271c57cc23b0627e8e2f1e1bcd8901cebd
company,1628131500,"Wall Street opens higher, led by energy, retail stocks",69515610,,CME,"Associated Press, The",Looking for stock market analysis and research with proves results? Zacks.com offers in-depth financial research with over 30years of proven results.,https://finnhub.io/api/news?id=5a1bdf81d51748598043deeb7518c15ec24230a6c3ffffd8ff3e3edbfba20337
company,1628098800,Two Ex-Bank of America Traders Accused of Spoofing Found Guilty,69530808,https://images.wsj.net/im-379580/social,CME,DowJones,Edward Bases and John Pacilio were convicted of rigging precious-metals prices with a tactic known as spoofing after a criminal trial in Chicago.,https://finnhub.io/api/news?id=997f24d8543dc34c5faf7de91b632a3e6e6560a3e7f6295cbcec21fa8b0d0b76
company,1628095440,"CME Group Inc. Cl A stock falls Wednesday, still outperforms market",69557038,https://images.mktw.net/im-220105/social,CME,MarketWatch,"Shares of CME Group Inc. Cl A sank 0.13% to $208.50 Wednesday, on what proved to be an all-around poor trading session for the stock market, with the S&P 500...",https://finnhub.io/api/news?id=29bad9a0e562560c08031bfa427e91a58b19288adbfb9d15778bb1035b2d16f5
company,1628074320,7 of the Best Blockchain Stocks to Buy in Lieu of Crypto,69495567,https://investorplace.com/wp-content/uploads/2019/12/blockchain.jpg,CME,InvestorPlace,These blockchain stocks will benefit from the increased use of use blockchain-related products and services in areas other than crypto.,https://finnhub.io/api/news?id=0ad118e22a38c639e17ed2340b607310b4ed21596dc351acc891f5e6cb18703e
company,1628060241,CME Group (NASDAQ:CME) Has Gifted Shareholders With A Fantastic 140% Total Return On Their Investment,69489064,https://s.yimg.com/uu/api/res/1.2/IdK9fRSL1YQdZi2FvBwWGg--~B/aD00MzI7dz0xMTk0O2FwcGlkPXl0YWNoeW9u/https://media.zenfs.com/en/simply_wall_st__316/be6f527a4905b8847401a72fc5d80c0c,CME,Yahoo,"The most you can lose on any stock (assuming you don't use leverage) is 100% of your money. But on a lighter note, a...",https://finnhub.io/api/news?id=31734de2186f3aa7a87af4e092d3fe6727d6ad6978b20a1cacab3489ecfc1dcc
company,1628046240,Banks and energy companies pulls stocks lower on Wall Street,69489514,,CME,"Associated Press, The",Looking for stock market analysis and research with proves results? Zacks.com offers in-depth financial research with over 30years of proven results.,https://finnhub.io/api/news?id=4704340f34674967b672ff0dda146162d8dc84619fad5d0ba6cb35c215d690fc
company,1628015640,CME Group Announces First Trades of Nature-Based Global Emissions Offset (N-GEO) Futures,69479025,https://s.yimg.com/uu/api/res/1.2/VjpNG5SY4vslppzfwy2kSw--~B/aD0xNjt3PTE2O2FwcGlkPXl0YWNoeW9u/https://media.zenfs.com/en/prnewswire.com/5fa51a5ecd2e6b7b0ac214bb217d6c85,CME,Yahoo,"CME Group, the world's leading and most diverse derivatives marketplace, today announced that its Nature-Based Global Emissions Offset (N-GEO) futures have launched and are available for trading. 1,315 total contracts have traded since launching on August 1, equivalent to over 1.3 million environmental offsets, with participation from 10 firms, including Andurand Capital Management, Hartree Partners, Macquarie Group and Vitol.",https://finnhub.io/api/news?id=0d90057ad18c9b1e60a728b86061a8b57bdbb7e7b3e5a6c95bc8debcff2c0286
company,1628009040,"CME Group Inc. Cl A stock falls Tuesday, underperforms market",69557039,https://images.mktw.net/im-220105/social,CME,MarketWatch,"Shares of CME Group Inc. Cl A slid 1.29% to $208.77 Tuesday, on what proved to be an all-around positive trading session for the stock market, with the S&P...",https://finnhub.io/api/news?id=aa1ac49e9d380549eee8b64c7f7aa463a82b9d3afeedd702a8c4fa5389bde868
company,1628001240,CME Group Announces First Trades of Nature-Based Global Emissions Offset (N-GEO) Futures,69495569,,CME,PR Newswire,Looking for stock market analysis and research with proves results? Zacks.com offers in-depth financial research with over 30years of proven results.,https://finnhub.io/api/news?id=e3fe38d243c99056c82895f5c269e7a28937e31cb95624b71ab81aea13759d0b
company,1627999266,The Highest Quality Dividend Growth Stocks,69473450,https://static.seekingalpha.com/cdn/s3/uploads/getty_images/912726380/medium_image_912726380.jpg,CME,SeekingAlpha,Our scoring system assesses the quality of dividend growth stocks. Find out the 7 companies that passed our stringent quality screen and have perfect scores.,https://finnhub.io/api/news?id=2f618c841a3cf1c6d41fab2fe4bb314242aef8bac8ee1290925ae8017fe79add
company,1627997400,"As producer sentiment holds steady, farmers weigh in on rising input prices and farmland values",69479026,https://s.yimg.com/uu/api/res/1.2/XddO8O0sxGhkfT3d.Y7vEQ--~B/aD0xNjt3PTE2O2FwcGlkPXl0YWNoeW9u/https://media.zenfs.com/en/prnewswire.com/1d29d385a7709dc5454b443655fa3634,CME,Yahoo,"The Purdue University/CME Group Ag Economy Barometer leveled off after two months of sharp declines, down just 3 points to a reading of 134 in July. Both producers' sentiment regarding current and future conditions also dropped. The Index of Current Conditions was down 6 points to a reading of 143, primarily as a result of weakened principal crop prices. The Index of Future Expectations was down 2 points to a reading of 130. The Ag Economy Barometer is calculated each month from 400 U.S. agricul",https://finnhub.io/api/news?id=699add39cccd5241d85f7bb51ed0d6d64388912bb957cde2cd9403a6175cd887
company,1627990200,CME Group Reports July 2021 Monthly Market Statistics,69462637,https://s.yimg.com/uu/api/res/1.2/DL0Zu9XGl7yBaAmIdiz8uA--~B/aD0xNjt3PTE2O2FwcGlkPXl0YWNoeW9u/https://media.zenfs.com/en/prnewswire.com/b7bb492a54288f9dd924185a32de36c1,CME,Yahoo,"CME Group, the world's leading and most diverse derivatives marketplace, today reported July 2021 market statistics, including average daily volume (ADV) of 17.1 million contracts during the month. Market statistics are available in greater detail at https://cmegroupinc.gcs-web.com/monthly-volume.",https://finnhub.io/api/news?id=ea195a5b98d99b8d6044cca37d94d84d56f8c0f552a972999ad2a4dfbb5c117f
company,1627983000,"As producer sentiment holds steady, farmers weigh in on rising input prices and farmland values",69466256,,CME,PR Newswire,Looking for stock market analysis and research with proves results? Zacks.com offers in-depth financial research with over 30years of proven results.,https://finnhub.io/api/news?id=60fc43d08a01d86c836bda1ea09a76df750ff38426454d58edadedd76e10fd8b
company,1627975800,CME Group Reports July 2021 Monthly Market Statistics,69466257,,CME,PR Newswire,Looking for stock market analysis and research with proves results? Zacks.com offers in-depth financial research with over 30years of proven results.,https://finnhub.io/api/news?id=d61663ee1a8b9a524d38c08fa6300d0cd5f78256112cddfaf2392a2526cc0d94
company,1627972560,CME Group reports July average daily volume of 17.1M contracts,69466258,,CME,Thefly.com,CME Group reported July m... CME,https://finnhub.io/api/news?id=63a0df174504b68c802de635066e822e124b6456e453757030d844318c81d436
company,1627956120,Stocks open mixed as investors pore over earnings reports,69466259,,CME,"Associated Press, The",Looking for stock market analysis and research with proves results? Zacks.com offers in-depth financial research with over 30years of proven results.,https://finnhub.io/api/news?id=72f71789e0a63267eb135c0dbe72798fd0c42cc97c73dfa89ccfb47532d5a57b
company,1627922640,"CME Group Inc. Cl A stock falls Monday, underperforms market",69557040,https://images.mktw.net/im-220105/social,CME,MarketWatch,"Shares of CME Group Inc. Cl A shed 0.30% to $211.50 Monday, on what proved to be an all-around dismal trading session for the stock market, with the S&P 500...",https://finnhub.io/api/news?id=f79a66745291093bbabf8d8c59b9d9d9e2009883452a38325455becccd800713
company,1627862520,Stocks open August higher after posting 6th monthly gain,69447241,,CME,"Associated Press, The",Looking for stock market analysis and research with proves results? Zacks.com offers in-depth financial research with over 30years of proven results.,https://finnhub.io/api/news?id=ef4cf0ebb71b4365af31963625619befd83057ecd8568977f5220e2645d9a009
company,1627696174,Tracking William Von Mueffling's Cantillon Capital Management Portfolio - Q2 2021 Update,69417733,,CME,SeekingAlpha,,https://finnhub.io/api/news?id=f1c34648878b8d798a9107192e86ed3180aabad50ba26e74c5c84a100c3417f9
company,1627663440,CME Group Inc. Cl A stock underperforms Friday when compared to competitors,69557041,https://images.mktw.net/im-220105/social,CME,MarketWatch,"Shares of CME Group Inc. Cl A shed 1.20% to $212.13 Friday, on what proved to be an all-around rough trading session for the stock market, with the S&P 500...",https://finnhub.io/api/news?id=fbbd2c366b952eedd56e558b9d8796e18a9457c275464fb3dd803850924a3644
company,1627627140,"Value Partner Investments Inc. Buys Lockheed Martin Corp, Bentley Systems Inc, Enbridge Inc, Sells FedEx Corp, Johnson & Johnson, The Home Depot Inc",69406048,,CME,GuruFocus,,https://finnhub.io/api/news?id=6567614dbc450a11340ab71f78a50673b68ab268d7aceb76740ac58212486cd6
company,1627619940,"Rathbone Brothers plc Buys DexCom Inc, Intuitive Surgical Inc, Monster Beverage Corp, Sells Nike Inc, RingCentral Inc, Netflix Inc",69419208,,CME,GuruFocus,,https://finnhub.io/api/news?id=87c71980425003f1ab920c2c77671313dcf3d38ab0f602941655615523dab3ed
company,1627603860,"Stocks open lower, but still on track for 6th monthly gain",69410641,,CME,"Associated Press, The",Looking for stock market analysis and research with proves results? Zacks.com offers in-depth financial research with over 30years of proven results.,https://finnhub.io/api/news?id=168d47efc3b910b9836281d9f365c6c99a0d1525a47c861804046bf397c32192
company,1627577040,CME Group Inc. Cl A stock outperforms market on strong trading day,69398498,https://images.mktw.net/im-220105/social,CME,MarketWatch,"Shares of CME Group Inc. Cl A inched 0.60% higher to $214.70 Thursday, on what proved to be an all-around favorable trading session for the stock market,...",https://finnhub.io/api/news?id=d1f0778b1284bbd72a0598bf507f11c45628d5859aae4e72bab989c40ad5015a
company,1627575720,CME Group Statement on ARRC Formal Recommendation of CME Term SOFR Reference Rates,69392907,https://s.yimg.com/uu/api/res/1.2/70iZPmo.QFoK4Tyx7LT.9w--~B/aD0xNjt3PTE2O2FwcGlkPXl0YWNoeW9u/https://media.zenfs.com/en/prnewswire.com/af7012ff96dcc6707d4e129ab6b06d9d,CME,Yahoo,"CME Group, the world's leading and most diverse derivatives marketplace, today issued the following statement in response to the Alternative Reference Rates Committee's (ARRC) formal recommendation of CME Term SOFR Reference Rates for use based on their previously outlined best practices:",https://finnhub.io/api/news?id=9b50db57ef9c8ea008f81ad7b8e5d58108d0af3022bc8e034259fa804ae36e89
company,1627573083,"CME Group (CME) Q2 Earnings Beat, Revenues Decrease Y/Y",69383543,https://s.yimg.com/uu/api/res/1.2/k801.RUJ07Ee7atwPd.DSQ--~B/aD00MDA7dz02MzU7YXBwaWQ9eXRhY2h5b24-/https://media.zenfs.com/en/zacks.com/f54f709ae65e32f6086a21eeef8d44f3,CME,Yahoo,CME Group's (CME) Q2 results reflect higher market data and information services and lower expenses as well as increase in average daily volume in four of the six products lines.,https://finnhub.io/api/news?id=ec910387080772811d8e021164c36fd1caf527900d0171d287f039571b3ddcf8
company,1627567200,U.S. benchmark rate committee recommends CME SOFR term rates,69392909,https://s.yimg.com/cv/apiv2/social/images/yahoo_default_logo-1200x1200.png,CME,Yahoo,"A group of banks and investors overseeing the shift of trillions of dollars to the new benchmark U.S. interest rate SOFR said on Thursday that they are recommending the use of the CME Group’s term SOFR rates in a move that should boost the move away from Libor.  “This formal recommendation of SOFR Term Rates is an achievement for the USD LIBOR transition specifically and for financial stability overall,” said Tom Wipf, the Alternative Reference Rates Committee (ARRC) chairman and vice chairman of institutional securities at Morgan Stanley, in a statement.  Investors are facing a year-end deadline to stop basing new loans and trades on Libor, the London Interbank Offered Rate, which is being phased out due to concerns about the amount of derivatives using the rate, which in many cases is based on assumptions about their borrowing costs and not actual trades.",https://finnhub.io/api/news?id=c6721e967667a41ede0609d34e33054e5ca337c97fd3af5cef6a44d5d6ab5dbb
company,1627561320,CME Group Statement on ARRC Formal Recommendation of CME Term SOFR Reference Rates,69410642,,CME,PR Newswire,Looking for stock market analysis and research with proves results? Zacks.com offers in-depth financial research with over 30years of proven results.,https://finnhub.io/api/news?id=bad30718b3473e62c4f3883b50b1caf6005d4c475245fab7ba3d229739ba9ffc
company,1627557780,CME Group 'pleased' about ARRC's formal recommendation of SOFR rates,69410643,,CME,Thefly.com,CME Group issued the foll... CME,https://finnhub.io/api/news?id=ca3d0e66f3d858933bc5b58c1c686265d7c11b3ba9156d1aa94f111647b73227
company,1627528500,"Stocks open higher after solid economic, earnings reports",69377699,,CME,"Associated Press, The",Looking for stock market analysis and research with proves results? Zacks.com offers in-depth financial research with over 30years of proven results.,https://finnhub.io/api/news?id=0d90d1bbf390243c76eea3e3d027f37edf72850d5d5b6c9cf5646f7f50e1c947
