category,datetime,headline,id,image,related,source,summary,url
company,1623297720,CME Group downgraded to Neutral from Overweight at Atlantic Equities,68177046,,CME,Thefly.com,CME Group downgraded to Neutral from Overweight at Atlantic Equities Atlantic Equities CME,https://finnhub.io/api/news?id=3fe886b91df5c039f365cf6ad498bb48896101bd5e4d23645f7213b3f92dff47
company,1623284580,Asian shares advance as investors await US inflation data,68177047,,CME,"Associated Press, The",Looking for stock market analysis and research with proves results? Zacks.com offers in-depth financial research with over 30years of proven results.,https://finnhub.io/api/news?id=7663859439d8f7a63aa4aea8164ef11a782112495887452cb478bf50b0805e98
company,1623263290,CME's micro Treasury futures offer simplicity with yield focus,68143800,https://s.yimg.com/cv/apiv2/social/images/yahoo_default_logo-1200x1200.png,CME,Yahoo,"The CME Group’s new micro Treasury futures will likely attract traders of stocks and other asset classes as the first contracts at the exchange that are based on yield moves in the most actively traded Treasuries, an exchange official said on Wednesday.  The CME on Wednesday said it will launch new micro futures contracts based on two-year, five-year, 10-year and 30-year Treasuries in August, subject to regulatory approval.  The contracts will be intuitively easier to understand for non-fixed income professional investors who may otherwise struggle with its existing Treasury future products, which are based on prices, said Sean Tully, CME Group Global Head of Financial and OTC Products in an interview.",https://finnhub.io/api/news?id=09b158866bf2e89ed0fff8d59543544a053471da5803af4fc148d581ecd820d0
company,1623263290,CME's micro Treasury futures offer simplicity with yield focus,68141111,,CME,Reuters,"The CME Group’s new micro Treasury futures will likely attract traders of stocks and other asset classes as the first contracts at the exchange that are based on yield moves in the most actively traded Treasuries, an exchange official said on Wednesday.",https://finnhub.io/api/news?id=10042b4393251e2e006c8e5c2b1e9e99ce17ae2462e2836a058c01a4c1843507
company,1623257040,CME Group Inc. Cl A stock underperforms Wednesday when compared to competitors,68181313,https://images.mktw.net/im-220105/social,CME,MarketWatch,"Shares of CME Group Inc. Cl A sank 0.57% to $215.51 Wednesday, on what proved to be an all-around dismal trading session for the stock market, with the S&P...",https://finnhub.io/api/news?id=1dff629f261e1c2ab7446016b7d52dd70ad623d3a0ac25db667cb470ccdc1688
company,1623248890,CME's micro Treasury futures offer simplicity with yield focus,68360709,https://www.nasdaq.com/sites/acquia.prod/files/2021-06-09T183031Z_1_TQ6_RTRLXPP_2_LYNXPACKAGER.JPG?268041151,CME,Nasdaq,"The CME Group’s new micro Treasury futures will likely attract traders of stocks and other asset classes as the first contracts at the exchange that are based on yield moves in the most actively traded Treasuries, an exchange official said on Wednesday.",https://finnhub.io/api/news?id=6dcb96a63b33267512a7db0c47244992e607449d50d8dfffb21074b9811d2688
company,1623240000,CME Group to Launch Micro Treasury Yield Futures,68101990,https://s.yimg.com/uu/api/res/1.2/zO5BTpDKNki1LHvCGYstHA--~B/aD0xNjt3PTE2O2FwcGlkPXl0YWNoeW9u/https://media.zenfs.com/en/prnewswire.com/1369d759c323be677a898c7ca0b425ee,CME,Yahoo,"CME Group, the world's leading and most diverse derivatives marketplace, today announced it will expand its suite of deeply liquid U.S. Treasury futures and options with the introduction of four new Micro Treasury Yield futures contracts on August 16, pending regulatory review.",https://finnhub.io/api/news?id=e995e3a85ac5198ce0c974516ef57fc9b0f9296b23b914bda96f9e2235302973
company,1623225600,CME Group to Launch Micro Treasury Yield Futures,68127597,,CME,PR Newswire,Looking for stock market analysis and research with proves results? Zacks.com offers in-depth financial research with over 30years of proven results.,https://finnhub.io/api/news?id=86092e6e15a64cea2392c0835245f04406aa715e4d15a10c46a421198f825b4a
company,1623222180,CME Group to launch micro treasury yield futures,68127598,,CME,Thefly.com,CME Group to launch micro treasury yield futures CME,https://finnhub.io/api/news?id=7a75c36c3b0a1193ac0823084347416f5bf240b83661d63fcad28bd0a23ff228
company,1623197640,Asian shares mixed as China reports jump in inflation,68086669,,CME,"Associated Press, The",Looking for stock market analysis and research with proves results? Zacks.com offers in-depth financial research with over 30years of proven results.,https://finnhub.io/api/news?id=9a33ef784d54582fc29c8ac20570eed4534c06656c1eb15f376bc652ed04801c
company,1623170640,CME Group Inc. Cl A stock underperforms Tuesday when compared to competitors,68181314,https://images.mktw.net/im-220105/social,CME,MarketWatch,"Shares of CME Group Inc. Cl A slid 0.21% to $217.64 Tuesday, on what proved to be an all-around mixed trading session for the stock market, with the S&P 500...",https://finnhub.io/api/news?id=b8e41b0facd5b020e4d6ea0a861f2a9385cffd12afd8897e648c1a5d1107af48
company,1623164162,CME Group (CME) to Introduce Adjusted Interest Rate TRF,68080946,https://s.yimg.com/uu/api/res/1.2/RS6UaJuKviLAv4Ms6FoR3Q--~B/aD00MDA7dz02MzU7YXBwaWQ9eXRhY2h5b24-/https://media.zenfs.com/en/zacks.com/cd4890ce95ed3d4fd1550ac1148dd8f2,CME,Yahoo,CME Group (CME) to boost its robust suite of futures and options with the addition of Adjusted Interest Rate TRF.,https://finnhub.io/api/news?id=a521255b04acea7304b66f5f91f84618e4ceff31a5c0202078d1b43bc63d7db2
company,1623158934,"Noteworthy Tuesday Option Activity: MU, CME, LH",68360710,https://www.nasdaq.com/sites/acquia.prod/files/2019-05/0902-Q19%20Total%20Markets%20photos%20and%20gif_CC8.jpg?2002104611,CME,Nasdaq,"Among the underlying components of the S&P 500 index, we saw noteworthy options trading volume today in Micron Technology Inc. (Symbol: MU), where a total of 170,036 contracts have traded so far, representing approximately 17.0 million underlying shares.  That amounts to ab",https://finnhub.io/api/news?id=21dff9598e471063be2a19f8a5d32b669fe725e986fd455e5fd7f7c4cfc3c692
company,1623142807,"CME Group Inc. (CME) Ex-Dividend Date Scheduled for June 09, 2021",68360712,https://www.nasdaq.com/sites/acquia.prod/files/2019-05/0902-Q19%20Total%20Markets%20photos%20and%20gif_CC8.jpg?1372325470,CME,Nasdaq,"CME Group Inc. (CME) will begin trading ex-dividend on June 09, 2021. A cash dividend payment of $0.9 per share is scheduled to be paid on June 25, 2021.  Shareholders who purchased CME prior to the ex-dividend date are eligible for the cash dividend payment.  This represents an",https://finnhub.io/api/news?id=c6a72bcd96e014e8a936702ae42d7f700cc3b0d868724cf0d7362bbf3d865388
company,1623119580,Stock are off to a mixed start on Wall Street; tech rises,68070089,,CME,"Associated Press, The",Looking for stock market analysis and research with proves results? Zacks.com offers in-depth financial research with over 30years of proven results.,https://finnhub.io/api/news?id=fcd58a0216a1f789473423a1fbcbd0272cf7ffd322883497e47198a875d1d933
company,1623119580,Asian shares edge lower after mixed finish on Wall Street,68037617,,CME,"Associated Press, The",Looking for stock market analysis and research with proves results? Zacks.com offers in-depth financial research with over 30years of proven results.,https://finnhub.io/api/news?id=dc7466b2288f9ba2245e857bfe976cbb6d43303436d65285e3eead67e3621703
company,1623093970,China's Wuxi exchange plans to launch lithium contract as soon as July - sources,68360714,https://www.nasdaq.com/sites/acquia.prod/files/2019-05/0902-Q19%20Total%20Markets%20photos%20and%20gif_CC8.jpg?597759589,CME,Nasdaq,"China's Wuxi Stainless Steel Exchange plans to launch a lithium contract as soon as July in response to strong market demand to trade the metal used in electric vehicle batteries, according to two sources with knowledge of the matter and a draft document.",https://finnhub.io/api/news?id=5188a72f8ca67356f71920b06239b75353b6b3060eebbfd6151203c735c54e36
company,1623084240,"CME Group Inc. Cl A stock falls Monday, underperforms market",68181315,https://images.mktw.net/im-220105/social,CME,MarketWatch,"Shares of CME Group Inc. Cl A slid 0.12% to $218.10 Monday, on what proved to be an all-around grim trading session for the stock market, with the S&P 500...",https://finnhub.io/api/news?id=63eca344ac289486f6bb23e7cafb52706486e019b0c2434f2996cd90adafd0b1
company,1623061217,"Ex-Dividend Reminder: CME Group, American Assets Trust and Meta Financial Group",67996147,https://www.nasdaq.com/sites/acquia.prod/files/2019-05/0902-Q19%20Total%20Markets%20photos%20and%20gif_CC8.jpg?1511674594,CME,Nasdaq,"Looking at the universe of stocks we cover at Dividend Channel, on 6/9/21, CME Group (Symbol: CME), American Assets Trust Inc (Symbol: AAT), and Meta Financial Group Inc (Symbol: CASH) will all trade ex-dividend for their respective upcoming dividends.  CME Group will pay its q",https://finnhub.io/api/news?id=5fcdffe2174f766cd52eb1b1e7c7799803062bdb5ab67b2bfe8ae2ac974258d1
company,1623057540,"Ex-Dividend Reminder: CME Group, American Assets Trust and Meta Financial Group",68001555,,CME,Dividend Channel,"dividend channel,CME,AAT,CASH,",https://finnhub.io/api/news?id=d68ada86787fba89131690002279af8968ee46126766df7b17f0b5ec658c7701
company,1623053147,China's Wuxi exchange plans to launch lithium contract as soon as July - sources,68360717,https://www.nasdaq.com/sites/acquia.prod/files/2019-05/0902-Q19%20Total%20Markets%20photos%20and%20gif_CC8.jpg?1272371591,CME,Nasdaq,"China's Wuxi Stainless Steel Exchange plans to launch a lithium contract as soon as July in response to strong market demand to trade the metal used in electric vehicle batteries, according to two sources with knowledge of the matter and a draft document.",https://finnhub.io/api/news?id=62c4eba18212ef9a22104e1a3352ba8aced30e4c3bae6c5de95f4a071646ae76
company,1623052800,CME Group Launches FTSE 100 Adjusted Interest Rate Total Return Futures,68095179,https://s.yimg.com/uu/api/res/1.2/vjwPYiCfye5LcalHxvQZOA--~B/aD0xNjt3PTE2O2FwcGlkPXl0YWNoeW9u/https://media.zenfs.com/en/prnewswire.com/8abf6779352ef15883926c3fbd3b8351,CME,Yahoo,"CME Group, the world's leading and most diverse derivatives marketplace, today launched FTSE 100 Adjusted Interest Rate (AIR) Total Return futures.",https://finnhub.io/api/news?id=2b9142c612ed500a82d4553acabf61f8ac548a89b99698580566e6f57ed8e0bf
company,1623038400,CME Group Launches FTSE 100 Adjusted Interest Rate Total Return Futures,68001556,,CME,PR Newswire,Looking for stock market analysis and research with proves results? Zacks.com offers in-depth financial research with over 30years of proven results.,https://finnhub.io/api/news?id=34806bd4ae8013917a30c6b81817f57dd1df0af1926263693c13f1e6521aafb4
company,1623035820,Asian shares edge lower after mixed finish on Wall Street,68025734,,CME,"Associated Press, The",Looking for stock market analysis and research with proves results? Zacks.com offers in-depth financial research with over 30years of proven results.,https://finnhub.io/api/news?id=3ebbd96a06f5729ce2c9d049aa0712a0b8c044d86496d05b61e9239be2ed411d
company,1623035820,"US stocks edge mostly higher, hovering near record highs",68001557,,CME,"Associated Press, The",Looking for stock market analysis and research with proves results? Zacks.com offers in-depth financial research with over 30years of proven results.,https://finnhub.io/api/news?id=acdc72df2af2a8ba872b1f904440c112fff46efe9ce2b343eff5cf14645de792
company,1623021840,Asian shares trading mixed as optimism wears off on US rally,68001558,,CME,"Associated Press, The",Looking for stock market analysis and research with proves results? Zacks.com offers in-depth financial research with over 30years of proven results.,https://finnhub.io/api/news?id=293fca874938ce38623a501013a8c238d91691a65bb4d3a5851e26689867362e
company,1622892205,Dividend Champion And Contender Highlights: Week Of June 6,67978553,https://static.seekingalpha.com/cdn/s3/uploads/getty_images/1072593728/medium_image_1072593728.jpg,CME,SeekingAlpha,A weekly summary of dividend activity for Dividend Champions and Contenders. Read more to find out the companies with upcoming ex-dividend dates and upcoming pay dates.,https://finnhub.io/api/news?id=b2693d11d3e4d8ff43f70c569a34c64a4e8d2050eb53d9fd5f197c5f2b9a6640
company,1622883900,5 Safe And Cheap Dividend Stocks To Invest In (June 2021),67978194,https://static.seekingalpha.com/cdn/s3/uploads/getty_images/1249993252/medium_image_1249993252.jpg,CME,SeekingAlpha,"This article is part of our monthly series where we highlight five companies that are large cap, relatively safe, dividend-paying, and are offering large discounts to their historical norms.",https://finnhub.io/api/news?id=93c290aae8d8eb70ed1fbaf8e68746d28b111ddf48698e5f75c9cc4e725d3182
company,1622878615,CME Group Inc. (NASDAQ:CME) Will Pay A US$0.90 Dividend In Three Days,68095180,https://s.yimg.com/uu/api/res/1.2/IdK9fRSL1YQdZi2FvBwWGg--~B/aD00MzI7dz0xMTk0O2FwcGlkPXl0YWNoeW9u/https://media.zenfs.com/en/simply_wall_st__316/be6f527a4905b8847401a72fc5d80c0c,CME,Yahoo,"Regular readers will know that we love our dividends at Simply Wall St, which is why it's exciting to see CME Group...",https://finnhub.io/api/news?id=7112f2cab217a88d4c6ceb9bb0e0f830b1dc17f59d8e7913268b7e8e7e29d00b
company,1622863587,CME Group Inc. (NASDAQ:CME) Pays A US$0.90 Dividend In Just Three Days,68360719,https://www.nasdaq.com/sites/acquia.prod/files/2019-05/0902-Q19%20Total%20Markets%20photos%20and%20gif_CC8.jpg?1079378943,CME,Nasdaq,"Some investors rely on dividends for growing their wealth, and if you're one of those dividend sleuths, you might be intrigued to know that CME Group Inc. (NASDAQ:CME) is about to go ex-dividend in just three days.  The ex-dividend date is one business day before a company's rec",https://finnhub.io/api/news?id=025cd9de0882407c950bc68fa4a3f5332f0752281c07d344d2a1d50a718a9b73
company,1622843520,CME Group Chairman and Chief Executive Officer Terry Duffy to Present at Piper Sandler Global Exchange and FinTech Virtual Conference,68095181,https://s.yimg.com/uu/api/res/1.2/pAawrtGSGE0wjK0xot8.Zw--~B/aD0xNjt3PTE2O2FwcGlkPXl0YWNoeW9u/https://media.zenfs.com/en/prnewswire.com/f2f09be7351401920db0667531319cf8,CME,Yahoo,"CME Group announced today that Terry Duffy, Chairman and Chief Executive Officer, will present at the Piper Sandler Global Exchange and FinTech Virtual Conference on Thursday, June 10, 2021 at 10:30 a.m. (Eastern Time).",https://finnhub.io/api/news?id=a2f2c60fb4de6a4f5e5e3b5a78c14c61089c5058da0f0a912c197efdbcd89c6c
company,1622829120,CME Group Chairman and Chief Executive Officer Terry Duffy to Present at Piper Sandler Global Exchange and FinTech Virtual Conference,68001559,,CME,PR Newswire,Looking for stock market analysis and research with proves results? Zacks.com offers in-depth financial research with over 30years of proven results.,https://finnhub.io/api/news?id=b0829efe8faf29ae6f9d4751eafbc46cfbe6d07654197393cb619d29ddc40fce
company,1622825426,10 Best Stocks to Buy According to Billionaire David Harding,67987982,https://s.yimg.com/uu/api/res/1.2/GiTp2aUM_Z3ZCmduWkm41Q--~B/aD02MDA7dz00NTA7YXBwaWQ9eXRhY2h5b24-/https://media.zenfs.com/en/insidermonkey.com/d4b6d884c60c264975137f5a3204f42b,CME,Yahoo,"In this article we discuss the 10 best stocks to buy according to billionaire David Harding. If you want to skip our detailed analysis of Harding’s history and hedge fund performance, go directly to the 5 Best Stocks to Buy According to Billionaire David Harding. David Harding is a British billionaire businessman and the founder […]",https://finnhub.io/api/news?id=835a7cd90a74177ddb24068fc5184f59ca83ae7648a478571cfc42894a20a009
company,1622773860,"Asian shares slip, dragged lower by Wall Street tech fall",67994383,,CME,"Associated Press, The",Looking for stock market analysis and research with proves results? Zacks.com offers in-depth financial research with over 30years of proven results.,https://finnhub.io/api/news?id=9545870c759c46c50acb34ef871922e1ecb0db287fed8a306ee528a51ada5569
company,1622725032,CME Group (CME) May ADV Increases at Five Product Lines,68090044,https://s.yimg.com/uu/api/res/1.2/8mzbDk9FtDB2n52lesd0wg--~B/aD01MDY7dz05MDA7YXBwaWQ9eXRhY2h5b24-/https://media.zenfs.com/en/zacks.com/acd639313640dc1f5191af135f3008f0,CME,Yahoo,CME Group's (CME) average daily volume of 20.5 million contracts per day increases 15% year over year attributable to higher volumes in five of the six product lines.,https://finnhub.io/api/news?id=784e75d051b088540e395434c7b6aa7c9d2a1344f06240a6ad7a9bf1bd6cebd0
company,1622680080,"Asian shares track tech, energy-led gains on Wall Street",67992315,,CME,"Associated Press, The",Looking for stock market analysis and research with proves results? Zacks.com offers in-depth financial research with over 30years of proven results.,https://finnhub.io/api/news?id=3a6e29ebbb0ec15788e6901c38a15c4076314e08316d977417f56a11ae5970ca
company,1622636400,Harding Loevner Global Equity Fund Q1 2021 Letter,67965263,https://static.seekingalpha.com/assets/og_image_1200-29b2bfe1a595477db6826bd2126c63ac2091efb7ec76347a8e7f81ba17e3de6c.png,CME,SeekingAlpha,Harding Loevner is an investment manager that invests primarily in publicly traded global equities. We were founded in 1989 by former managers for the Rockefeller family.,https://finnhub.io/api/news?id=07941e536ad7c01dac75a03e14a910485541bd85a3e5418cd932688626271009
company,1622633400,CME Group Reports May 2021 Monthly Market Statistics,68095187,https://s.yimg.com/uu/api/res/1.2/oSuEa.YwnueXBjjDgJUY6w--~B/aD0xNjt3PTE2O2FwcGlkPXl0YWNoeW9u/https://media.zenfs.com/en/prnewswire.com/1950007097183236b9921409053a5d11,CME,Yahoo,"CME Group, the world's leading and most diverse derivatives marketplace, today reported May 2021 market statistics, including average daily volume (ADV) of 20.6 million contracts during the month. Market statistics are available in greater detail at https://cmegroupinc.gcs-web.com/monthly-volume.",https://finnhub.io/api/news?id=8987b99ac7da2e6ae25ca0ecc5cf2631190f09bf65818155426ed43ba57204cc
company,1622626005,"Financial Sector Update for 06/02/2021: SLCT, FBNC, RGA, CME, XLF, FAS, FAZ",67993530,https://www.nasdaq.com/sites/acquia.prod/files/2019-05/0902-Q19%20Total%20Markets%20photos%20and%20gif_CC8.jpg?1239489197,CME,Nasdaq,Financial stocks were climbing in Wednesday's pre-bell trading as the Select Financial Sector SPDR (XLF) was recently advancing by 0.21%. The Direxion Daily Financial Bull 3X shares (FAS) were 0.8% higher and its bearish counterpart Direxion Daily Financial Bear 3X shares (FAZ),https://finnhub.io/api/news?id=0f669f1d27dc2644fbdb2cda133bcff1173ee6f9b8dda775d85a1db7a8ca31f2
company,1622619000,CME Group Reports May 2021 Monthly Market Statistics,68001562,,CME,PR Newswire,Looking for stock market analysis and research with proves results? Zacks.com offers in-depth financial research with over 30years of proven results.,https://finnhub.io/api/news?id=fba8c351607d086bfdeef4c5b2dc5552a883a74deed3336db23c36d6ea757e94
company,1622615760,CME Group reached ADV of 20.6M contracts in May,68001563,,CME,Thefly.com,CME Group reached ADV of 20.6M contracts in May CME,https://finnhub.io/api/news?id=7126251682c1f88411a5b7491db7716a8a5603c69ef8caaa4f602cbd4ea6264f
company,1622597611,Subdued Growth No Barrier To CME Group Inc.'s (NASDAQ:CME) Price,68360721,https://www.nasdaq.com/sites/acquia.prod/files/2019-05/0902-Q19%20Total%20Markets%20photos%20and%20gif_CC8.jpg?1232859849,CME,Nasdaq,"When close to half the companies in the United States have price-to-earnings ratios (or ""P/E's"") below 19x, you may consider CME Group Inc. (NASDAQ:CME) as a stock to avoid entirely with its 39.9x P/E ratio.  Nonetheless, we'd need to dig a little deeper to determine if there is",https://finnhub.io/api/news?id=ff56c2d126bcfa958be79aab4350f93359b0931ccc08123b7620eb57495590cf
company,1622592660,Asian shares mixed after lackluster day on Wall Street,67971912,,CME,"Associated Press, The",Looking for stock market analysis and research with proves results? Zacks.com offers in-depth financial research with over 30years of proven results.,https://finnhub.io/api/news?id=c808e9520a95bbd70e4964243afcf37b2778e07d58d4ea15bf872b7e572e86f8
company,1622565300,CME Group Chief Commercial Officer and Global Head of Commodities and Options Products to Present at Deutsche Bank Global Financial Services & FinTech / Info Services Virtual Conference,68095188,https://s.yimg.com/uu/api/res/1.2/XLHv9ZiRtQiqBi9VIoMwdg--~B/aD0xNjt3PTE2O2FwcGlkPXl0YWNoeW9u/https://media.zenfs.com/en/prnewswire.com/a6120e79348ff08e984d14313a19aa56,CME,Yahoo,"CME Group announced today that Julie Winkler, Chief Commercial Officer, and Derek Sammann, Global Head of Commodities and Options Products, will present at the Deutsche Bank Global Financial Services & FinTech / Info Services Conference on Wednesday, June 2, 2021, at 11:05 a.m. (Eastern Time).",https://finnhub.io/api/news?id=87067bb608659f6b47a6c4f60ffa5867b556fdcb75fe47c5142eb0603b8756f9
company,1622559472,7 Stocks to Buy Amid Exploding Copper Prices and Global Rebound Optimism,67990307,https://www.nasdaq.com/sites/acquia.prod/files/2019-05/0902-Q19%20Total%20Markets%20photos%20and%20gif_CC8.jpg?1587648442,CME,Nasdaq,"InvestorPlace - Stock Market News, Stock Advice & Trading Tips",https://finnhub.io/api/news?id=3482d5660991bb10594ace757d4f3edaddf82eca271cd83cd8b56d1bf40a2c43
company,1622554200,Ag Economy Barometer declines sharply; producers remain bullish on farmland values,68095189,https://s.yimg.com/uu/api/res/1.2/G8tBAq.ASy.lr0KbLityAw--~B/aD0xNjt3PTE2O2FwcGlkPXl0YWNoeW9u/https://media.zenfs.com/en/prnewswire.com/00a5435eb9e545501ed47e8c17947ee2,CME,Yahoo,"The Purdue University/CME Group Ag Economy Barometer saw a significant decline in May, down 20 points to a reading of 158. This marks the lowest reading for the survey since September of 2020. Producers were less optimistic about both current conditions and the future of the agricultural economy. The Index of Current Conditions dropped 17 points to a reading of 178 and the Index of Future Expectations fell 20 points to a reading of 149. The Ag Economy Barometer is calculated each month from 400 U.S. agricultural producers' responses to a telephone survey. This month's survey was conducted from May 10-14, 2021.",https://finnhub.io/api/news?id=fcf380c2aac94b92c4f7f7b1cae7fb2c9a20ea0e82252ed70ea66a35ba521419
company,1622550900,CME Group Chief Commercial Officer and Global Head of Commodities and Options Products to Present at Deutsche Bank Global Financial Services & FinTech / Info Services Virtual Conference,68001565,,CME,PR Newswire,Looking for stock market analysis and research with proves results? Zacks.com offers in-depth financial research with over 30years of proven results.,https://finnhub.io/api/news?id=43e8420b0d6a9ab2302541d7fccab526722b1fa97b2e9bbdf55778c022a85711
company,1622540040,OPEC ups crude production as economies recover,68001566,,CME,"Associated Press, The",Looking for stock market analysis and research with proves results? Zacks.com offers in-depth financial research with over 30years of proven results.,https://finnhub.io/api/news?id=84502629ede96e0604604938264126212396194858d66f1298e1eba037448456
company,1622539800,Ag Economy Barometer declines sharply; producers remain bullish on farmland values,68001567,,CME,PR Newswire,Looking for stock market analysis and research with proves results? Zacks.com offers in-depth financial research with over 30years of proven results.,https://finnhub.io/api/news?id=6b67b1f76401ac6945e09e93cb425d0fe41d5257cd8c67477b5809074ecc7061
company,1622535603,"Wheat premium in Chicago could boost sustainability shift, says InVivo",67963000,https://www.nasdaq.com/sites/acquia.prod/files/2021-06-01T122543Z_1_CT0_RTRLXPP_2_LYNXPACKAGER.JPG?356048651,CME,Nasdaq,"The development of a price premium for sustainable wheat on the Chicago exchange could help to expand more environment-friendly farming practices, the chief executive of French agricultural group InVivo said on Tuesday.",https://finnhub.io/api/news?id=340608c8c8c12fae952e48b358c1d13592c1ccd1faecda6d96e85d1f580dbace
company,1622515784,NASDAQ Stock Has Limited Scope For Growth,67962992,https://www.nasdaq.com/sites/acquia.prod/files/2019-05/0902-Q19%20Total%20Markets%20photos%20and%20gif_CC8.jpg?1609848651,CME,Nasdaq,"NASDAQ stock (NASDAQ: NDAQ), a global financial exchange group, gained roughly 25% – increasing from about $133 at the beginning of 2021 to around $165 currently, outperforming the S&P500, which grew 12% over the same period. The exchange’s top-line has ben",https://finnhub.io/api/news?id=aa0d5d96d2979cf446afc77fe6ffa2489120f0ca27f8b27df62eebc8807ad59c
company,1622512680,7 Stocks to Buy Amid Exploding Copper Prices and Global Rebound Optimism,67967282,https://investorplace.com/wp-content/uploads/2019/07/copper1600-1.jpg,CME,InvestorPlace,Copper is a leading barometer for global economic health. Here are seven copper stocks if you are optimistic on the economy.,https://finnhub.io/api/news?id=12d963d7f28faf96f910082014f955f6fb3e07ce8c34e963ae9d8b5b1932f985
company,1622506620,Stocks open higher on Wall Street; AMC jumps on stock sale,67965482,,CME,"Associated Press, The",Looking for stock market analysis and research with proves results? Zacks.com offers in-depth financial research with over 30years of proven results.,https://finnhub.io/api/news?id=de0fd926eaaf3e08e85dc03771fa13c75b7c9d9897235c3811a1e319a60c641e
