category,datetime,headline,id,image,related,source,summary,url
company,1620566204,"Fintech Focus Roundup For May 9, 2021",67703431,https://s.yimg.com/uu/api/res/1.2/1DOkmSAmdFK9tqTyNlzpyg--~B/aD0xNDY7dz03OTY7YXBwaWQ9eXRhY2h5b24-/https://media.zenfs.com/en/Benzinga/6a01fe4a5fd19aed3e3df06516740e55,CME,Yahoo,"Founder At Miami-Based Accelerator TheVentureCity Talks Returnly Exit, #MiamiTech And More Affirm, a leader in payments, recently announced it would acquire Returnly, a return and post-purchase payments solution, for $300 million. Benzinga spoke with Laura González-Estéfani, the founder and CEO of Miami-based TheVentureCity, on her firm’s role in bolstering Returnly growth initiatives and steps going forward. CME Group Ends In-Person Trade, Successfully Launches Micro Bitcoin Futures What Happened: Founded in 1848, CME Group is an exchange that builds markets around derivatives like futures, or agreements to buy and sell assets at a particular price and time in the future. The company has a long-standing history, offering global benchmark products based on interest rates, equity indices, foreign exchange, and commodities. In addition to building products, CME also facilitates and clears trades through its clearinghouse, CME Clearing. The organization’s move to end in-person trade for most products accelerated around 2015, after open outcry fell to just 1% of total volume. Now, only CME’s Eurodollar options pit will continue to operate. Takeaway: The move to end in-person trade comes as the pandemic accelerated the digital disruption in finance; by and large, market participants demand the efficiency, transparency, and prospects of growth electronic markets offer. Adding, CME, in meeting the demands of emerging market participants, recently launched Micro Bitcoin futures, which are 1/10 the size of one bitcoin and 1/50 the size of the standard CME Bitcoin future. The smaller size makes the product easier to consume by smaller participants. The product, thus far, has been well-received trading nearly 2.5 times as many contracts as the standard Bitcoin future, Tuesday. Fintech Spotlight: Metromile To Accept Premiums, Pay Claims In Bitcoin Metromile Inc, an insurance-focused fintech powered by data science and machine learning, announced Thursday it will allow policyholders the option to pay for insurance and receive payment for claims in Bitcoin or U.S. dollars. JPMorgan, Confluence Expand Partnership, Improve Multi-Asset Portfolio Analytics J.P. Morgan Chase & Co and global tech provider Confluence announced a new development in their partnership to deliver advanced multi-asset portfolio analytics solutions. Lynk, UBS Group Collab Over Actionable, AI-Driven Insights Lynk, an AI-driven knowledge-as-a-service platform, and global wealth manager UBS Group AG formally announced a collaboration to help UBS’s institutional clients tap into expert insights during their investment process. TikTok Superstar Griffin Johnson Explains His Vision To Innovate And Inspire Influencer marketing, which is on track to become a $15 billion industry by 2022, is a unique way for creators to monetize their content and outreach. The problem with this industry is both the supply and demand dynamics, as well as an unfulfilling culture, according to some. More and more, creators are being faced with a tough decision, innovate or die. 22-year-old Illinois native Griffin Johnson has done just that. The media influencer, who recently made a pivot into angel investing and entrepreneurship, is not only looking to diversify his earnings but also spread increased value to his highly engaged audience, from his experiences networking with the likes of hedge fund manager Steve Cohen, Miami mayor Francis X. Suarez and others. In an exclusive interview, Benzinga chatted with Johnson to learn more about his pivot to investing and entrepreneurship, as well as his vision for the future and how he will continue to engage those followers that have been with him since the beginning. See more from BenzingaClick here for options trades from BenzingaFintech Focus For May 7, 2021TikTok Superstar Griffin Johnson Explains His Vision To Innovate And Inspire© 2021 Benzinga.com. Benzinga does not provide investment advice. All rights reserved.",https://finnhub.io/api/news?id=dd011e610b334cb6d49f2dae7a401bf14968bc1e5b2949ff63cfac1dbaba94a7
company,1620464400,5 Safe And Cheap Dividend Stocks To Invest In (May 2021),67689315,https://static.seekingalpha.com/cdn/s3/uploads/getty_images/1249993252/medium_image_1249993252.jpg,CME,SeekingAlpha,"This is part of a monthly series where we highlight five stocks of companies that are large cap, relatively safe, dividend-paying, and are offering large discounts to their historical norms.",https://finnhub.io/api/news?id=bd20df78037cc447c82d7b1410c8c35b987324b54e492e9a115d5d8ff77cedcc
company,1620406276,NYSE to ease floor restrictions for vaccinated traders,67667877,https://static.reuters.com/resources/r/?m=02&d=20210507&t=2&i=1561309012&r=LYNXMPEH4611M,CME,Reuters,"The New York Stock Exchange will allow more traders to return to its 11 Wall Street trading floor, based on vaccination rates, and ease restrictions for people who have had a shot, its President Stacey Cunningham said on Friday.",https://finnhub.io/api/news?id=9dabb0b5f7df7ef26605f6732444bbc00aee435866775313969fad098e6c189f
company,1620405840,"CME Group Inc. Cl A stock falls Friday, underperforms market",67697356,https://images.mktw.net/im-220105/social,CME,MarketWatch,"Shares of CME Group Inc. Cl A slipped 0.70% to $202.92 Friday, on what proved to be an all-around great trading session for the stock market, with the S&P...",https://finnhub.io/api/news?id=975a716310ad60c49c59a41ab35768e31bcd23d808a6b6960eaad240ca8d94b1
company,1620398069,"Friday Sector Laggards: Consumer Products, Financial",67673865,https://www.nasdaq.com/sites/acquia.prod/files/2019-05/0902-Q19%20Total%20Markets%20photos%20and%20gif_CC8.jpg?1765279445,CME,Nasdaq,"The worst performing sector as of midday Friday is the Consumer Products sector, up 0.4%.  Within that group, Monster Beverage Corp  (Symbol: MNST) and Kellogg Co (Symbol: K) are two large stocks that are lagging, showing a loss of 5.1% and 1.5%, respectively.  Among consumer p",https://finnhub.io/api/news?id=e1833c8480da9c5c0c200565efacc886d25768b6724094a29ce5ffe34100013b
company,1620391662,NYSE to ease floor restrictions for vaccinated traders,67667767,https://www.nasdaq.com/sites/acquia.prod/files/2021-05-07T165324Z_1_KD3_RTRLXPP_2_LYNXPACKAGER.JPG?1301519753,CME,Nasdaq,"The New York Stock Exchange will allow more traders to return to its 11 Wall Street trading floor, based on vaccination rates, and ease restrictions for people who have had a shot, its President Stacey Cunningham said on Friday.",https://finnhub.io/api/news?id=f63bd61b2999291d890a9e9f250d28a8f175e2f448c117808672357a3c974516
company,1620387266,Goldman launches cryptocurrency trading team -memo,67667768,https://www.nasdaq.com/sites/acquia.prod/files/2021-05-07T154336Z_1_HG2_RTRLXPP_2_LYNXPACKAGER.JPG?769679276,CME,Nasdaq,"Goldman Sachs Group Inc on Friday revealed details on its cryptocurrency trading group, according to a staff memo seen by Reuters.",https://finnhub.io/api/news?id=48f11f0a5c6728ed97ceb85906f40a9e63e805ec61268659ee1203c0645da1dd
company,1620385260,Why Rising Interest Rates Are Helping CME Group,67659792,https://s.yimg.com/uu/api/res/1.2/QG9CiKjww0XgIVkAG.IV8w--~B/aD0xMDMzO3c9MTQwMDthcHBpZD15dGFjaHlvbg--/https://media.zenfs.com/en/motleyfool.com/ec40f3e378d4c13d14afa9b0b97ca04f,CME,Yahoo,"Last year was characterized by extreme volatility in the financial markets, especially early on.  For CME Group (NASDAQ: CME), the first quarter of 2020 gave way to a steep drop-off in volume for its flagship interest-rate derivatives.  CME Group is the biggest derivatives exchange operator in the world, handling stock index futures, commodity futures, and options, along with currencies and interest-rate products.",https://finnhub.io/api/news?id=9b3dfb7e4ba45df8ae1ec935832ed51389714d11593d075f2bf1242fec90053a
company,1620375300,"Winklevoss, Musk, Cuban: Here’s who’s backing dogecoin",67692824,https://images.fnlondon.com/im-335509/?width=749&height=499,CME,DowJones,"Dogecoin's market cap is now higher than Nintendo, CME Group, Twitter and Colgate-Palmolive",https://finnhub.io/api/news?id=b8d826461a1c989d94c41ed734a8ca8cb95127f20c8417b69bc67fb3c6638408
company,1620375180,"Copper looks to set fresh record Friday as economic recovery, electric-cars drive rise in metal’s price",67697357,https://images.mktw.net/im-329401/social,CME,MarketWatch,"Copper futures trade at records Friday morning, putting the industrial metal on track to deepen its ascent to new heights as economic reopening from COVID...",https://finnhub.io/api/news?id=7ec9809d53a2a7360a324710a36328164dca189f919d79778028c666c27b9924
company,1620370860,Why Rising Interest Rates Are Helping CME Group,67662932,https://www.nasdaq.com/sites/acquia.prod/files/2019-05/0902-Q19%20Total%20Markets%20photos%20and%20gif_CC8.jpg?1560019774,CME,Nasdaq,"Last year was characterized by extreme volatility in the financial markets, especially early on. The COVID-19 pandemic triggered a major sell-off in stocks, and a corresponding rally in bonds.As a general rule, investing in exchange operators is a smart move during these types of",https://finnhub.io/api/news?id=3040345c2ee5c2d28415e414db4915b35c17de93a83a4fbf19db0089b56a5d38
company,1620355500,Asian shares mostly rise on US rally; eyes on jobs data,67656069,,CME,"Associated Press, The",Looking for stock market analysis and research with proves results? Zacks.com offers in-depth financial research with over 30years of proven results.,https://finnhub.io/api/news?id=dc75d6645b6a018d2a0e8527eb8f56e9372c2f6b09daa347620524923d16b4e4
company,1620350700,"Goldman Sachs opens up trading with new Bitcoin derivatives, Bloomberg says",67672218,,CME,Thefly.com,"Goldman Sachs opens up trading with new Bitcoin derivatives, Bloomberg says GS CME BTC BITCOIN",https://finnhub.io/api/news?id=f300cff91a4de86089424571d140e5d7ef428c63f5122c57bf01299bbaef30ad
company,1620331248,Goldman Sachs offers bitcoin derivatives to investors - Bloomberg News,67645196,https://static.reuters.com/resources/r/?m=02&d=20210506&t=2&i=1561191889&r=LYNXMPEH4517K,CME,Reuters,"Goldman Sachs Group Inc is allowing Wall Street investors to trade with a derivative tied to bitcoin prices, Bloomberg News reported on Thursday.",https://finnhub.io/api/news?id=3d30963451a9eb8ce93a1f3c4513d948609d0afb7f28f303dc787f03cb3d24b0
company,1620331155,Goldman Sachs offers bitcoin derivatives to investors- Bloomberg News,67667262,,CME,Reuters,"Goldman Sachs Group Inc is allowing Wall Street investors to trade with a derivative tied to bitcoin prices, Bloomberg News reported on Thursday.",https://finnhub.io/api/news?id=50f14f796fb232aa8a59126f25e8997eb6055b87ecbc192041e017167f2992ed
company,1620323825,How Do You Trade Options on Bitcoin?,67642085,https://s.yimg.com/uu/api/res/1.2/OLLyh6ovH3rQL6cWNIIzqw--~B/aD00MDA7dz02MzU7YXBwaWQ9eXRhY2h5b24-/https://media.zenfs.com/en/zacks.com/40b3c11ab65693676425f4ab90613967,CME,Yahoo,How Do You Trade Options on Bitcoin?,https://finnhub.io/api/news?id=be38208370f1c4426eb6a13d8b3d474b0f4a7bcfd8c7a8307e590d4816b7ede5
company,1620320608,U.S. benchmark rate committee sets out path for SOFR forward rate,67646097,https://static.reuters.com/resources/r/?m=02&d=20210506&t=2&i=1561174798&r=LYNXMPEH45128,CME,Reuters,A group of banks and investors overseeing the shift of trillions of dollars to the new benchmark U.S. interest rate SOFR on Thursday published a list of indicators that it wants to see progress in so it can recommend a forward-looking SOFR rate.,https://finnhub.io/api/news?id=f69049f1d95334c1cee3dbac6e4ff9c60c0f8bdc23b69c7935ab06c7eeb2df19
company,1620320400,U.S. benchmark rate committee sets out path for SOFR forward rate,67627201,,CME,Reuters,A group of banks and investors overseeing the shift of trillions of dollars to the new benchmark U.S. interest rate SOFR on Thursday published a list of indicators that it wants to see progress in so it can recommend a forward-looking SOFR rate.,https://finnhub.io/api/news?id=c98bae64a19f0142db0d9da24f971454c1a91db713e03873e21f4d9261129a58
company,1620319440,"CME Group Inc. Cl A stock rises Thursday, still underperforms market",67697358,https://images.mktw.net/im-220105/social,CME,MarketWatch,"Shares of CME Group Inc. Cl A inched 0.64% higher to $204.35 Thursday, on what proved to be an all-around great trading session for the stock market, with...",https://finnhub.io/api/news?id=e174fc622542b3931ea62ee9f3832a6698cdd340327c7cba05b8e0b856c9a61e
company,1620316755,Goldman Sachs offers bitcoin derivatives to investors- Bloomberg News,67636380,https://www.nasdaq.com/sites/acquia.prod/files/2021-05-06T200307Z_1_BC0_RTRLXPP_2_LYNXPACKAGER.JPG?1155073945,CME,Nasdaq,"Goldman Sachs Group Inc is allowing Wall Street investors to trade with a derivative tied to bitcoin prices, Bloomberg News reported on Thursday.",https://finnhub.io/api/news?id=9c32a1631ed7b064a6a42401ac1d70f3b2daf1929e591c743238c1d01118043d
company,1620304740,"Inlet Private Wealth, LLC Buys GAN, Merck Inc, PulteGroup Inc, Sells Fox Corp, Invesco, ...",67611995,,CME,GuruFocus,GuruFocus Article or News written by insider and the topic is about: ,https://finnhub.io/api/news?id=3a33550e58265854691c7fa1825a60a08d6accca01da16b26432d4df1fb928f8
company,1620300900,CME June 25th Options Begin Trading,67628798,,CME,Stock Options Channel,"Staff article entitled CME June 25th Options Begin Trading, about stock options, from Stock Options Channel.",https://finnhub.io/api/news?id=f5b548e5329405b940661c99ac4c0d1db657797ca3a620ef0e7a42964165d863
company,1620295560,Intercontinental Exchange: Steady Growth From a Fairly Valued Company,67625400,,CME,GuruFocus,GuruFocus Article or News written by Robert Abbott and the topic is about: The owner of the New York Stock Exchange and other assets also offers a growing dividend,https://finnhub.io/api/news?id=03d23fe27f46497a6564ffef11cd88b89e544bd696fd8ac97169defc4be4c554
company,1620295200,RPT-Death of Chicago's grain options pits hits traders as crop prices soar,67615562,https://s.yimg.com/cv/apiv2/social/images/yahoo_default_logo-1200x1200.png,CME,Yahoo,"U.S. grain brokers and analysts on Wednesday lamented CME Group Inc's decision to permanently end open-outcry options trading at a time when crop prices are surging, saying that pit traders could help navigate volatile markets.  The owner of the Chicago Board of Trade (CBOT) on Tuesday said it will never reopen physical trading pits it shut last March due to the COVID-19 pandemic, though a Eurodollar options pit will remain open.  Traders and brokers who work away from CBOT's grain pits found it easier to execute complicated options transactions with help from the floor.",https://finnhub.io/api/news?id=7db7885cbe1ede6b42ebbb7b46c3383376b770a47ccf162c0299ba5f3f632999
company,1620294060,Intercontinental Exchange: Steady Growth from a Fairly-Valued Company,67623894,,CME,GuruFocus,GuruFocus Article or News written by Robert Abbott and the topic is about: The owner of the New York Stock Exchange and other assets also offers a growing dividend,https://finnhub.io/api/news?id=9331986290d6f87d25dcab443de66b72adafd77ebf860078a3fdb5f352ea2b63
company,1620280800,Death of Chicago's grain options pits hits traders as crop prices soar,67620874,https://www.nasdaq.com/sites/acquia.prod/files/2021-05-05T213534Z_1_YR8_RTRLXPP_2_LYNXPACKAGER.JPG?1358305732,CME,Nasdaq,"U.S. grain brokers and analysts on Wednesday lamented CME Group Inc's decision to permanently end open-outcry options trading at a time when crop prices are surging, saying that pit traders could help navigate volatile markets.",https://finnhub.io/api/news?id=82916f9bc1c56fc73c17d90e5a30456a691a2e2aa0c2cffd4f2dc72cf2177872
company,1620277589,CME Group Closes Curtains On Most Open Outcry Trading Pits; Launches Micro Bitcoin Futures,67610346,https://s.yimg.com/uu/api/res/1.2/gwt9LM4iMYhVlFylFbVkFQ--~B/aD02MDQ7dz0xMDI0O2FwcGlkPXl0YWNoeW9u/https://media.zenfs.com/en/smarteranalyst_347/e44202b694192441bb90161beade396d,CME,Yahoo,"Derivatives marketplace CME Group (CME) will not be reopening its physical open outcry trading pits, which have been closed since the onset of the COVID-19 pandemic last year. The Group’s Eurodollar options pit, however, will continue to operate, as it has done since its reopening in August 2020. Furthermore, CME Group announced that subject to approvals, it will delist floor-based S&P 500 futures and options contracts once its contracts expire in September 2021. Post this delisting, the remaining open interest will be shifted to E-mini S&P 500 futures and options contracts. These contracts are available in electronic format on CME Globex. (See CME Group stock analysis on TipRanks) One day before it announced the closing of its trading pits, CME Group launched Micro Bitcoin futures, thereby increasing its crypto derivatives product offerings. CME Group Global Head of Equity Index and Alternative Investment Products Tim McCourt said, “At one-tenth the size of one bitcoin, Micro Bitcoin futures will provide an efficient, cost-effective way for a broad array of market participants- from institutions to sophisticated, active traders- to fine-tune their bitcoin exposure and enhance their trading strategies, all while retaining the benefits of CME Group’s standard Bitcoin futures.” On April 28, Raymond James analyst Patrick O’Shaughnessy reiterated a Buy rating on the stock and maintained a $218 price target (6.7% upside potential). Reacting to the company’s Q1 performance, O’Shaughnessy said, “While 1Q21 faced difficult year-on-year comp, trends were generally healthy as a rising rate environment jump-started rate volatility and CME’s interest rates franchise.” O’Shaughnessy believes “CME enjoys a very high barrier to entry business model, an attractive incremental margin profile, and upside to interest rates moving higher from here.” Consensus on the Street is that CME Group is a Moderate Buy based on 6 Buys, 6 Holds, and 2 Sells. The average analyst price target of $206.25 implies the stock is fairly priced at current level. Shares have gained about 18.4% over the past year. Related News: Facebook’s 1Q Results Outperform As Ad Revenue Jumps; Shares Pop 6% Advanced Micro Devices Posts Better-Than-Expected 1Q Results, 2Q Forecasts Top Estimates Realty Income Inks Deal To Acquire VEREIT More recent articles from Smarter Analyst: Jamieson Wellness Delivers Double-Digit Revenue Growth In 1Q good natured Products To Acquire Illinois-Based Ex-Tech Plastics; Shares Pop 20% Apollo Global's 1Q Results Shatter Records, Dividend Confirmed Maple Leaf Foods Earns C$47.7M Profit In 1Q; Shares Fall 4%",https://finnhub.io/api/news?id=27643257084405939e3e09e6c5cd67cf453514a2c8dbd4a6eab4ef48eeb87367
company,1620262257,CME Group Declares Fresh Dividend; Yield Is 1.8%,67610348,,CME,Yahoo,"Previous to that, CME Group had paid $0.85 per share.  As a business that throws off a lot of cash, CME Group typically has scope for dividend payments.  As a result, CME Group's revenue has risen commensurately; from 2016 to 2020, its annual revenue advanced from nearly $3.6 billion to almost $4.9 billion.",https://finnhub.io/api/news?id=94c43e0407ba92a490852c22f0e7cce2287c82c89b85ba552097fdf9b32559d4
company,1620259680,"Asian stocks mixed, echoing Wall St sentiments on pandemic",67608872,,CME,"Associated Press, The",Looking for stock market analysis and research with proves results? Zacks.com offers in-depth financial research with over 30years of proven results.,https://finnhub.io/api/news?id=a4b3e86bf5a46bb660e2e01e3dd22de18712be40337ab5df61431c07e9b80e71
company,1620250221,Death of Chicago's grain options pits hits traders as crop prices soar,67603343,https://s.yimg.com/cv/apiv2/social/images/yahoo_default_logo-1200x1200.png,CME,Yahoo,"U.S. grain brokers and analysts on Wednesday lamented CME Group Inc's decision to permanently end open-outcry options trading at a time when crop prices are surging, saying that pit traders could help navigate volatile markets.  The owner of the Chicago Board of Trade (CBOT) on Tuesday said it will never reopen physical trading pits it shut last March due to the COVID-19 pandemic, though a Eurodollar options pit will remain open.  Traders and brokers who work away from CBOT's grain pits found it easier to execute complicated options transactions with help from the floor.",https://finnhub.io/api/news?id=9ccb395e9ccacd0151fdb6cbb3febf55d308e2704e9783837d9be195b5fa7263
company,1620250221,Death of Chicago's grain options pits hits traders as crop prices soar,67604597,,CME,Reuters,"U.S. grain brokers and analysts on Wednesday lamented CME Group Inc's decision to permanently end open-outcry options trading at a time when crop prices are surging, saying that pit traders could help navigate volatile markets.",https://finnhub.io/api/news?id=3c3f4b27e77e43d5e11313609f5f0f9f23fef1e0821f96d598761e1d8498e9c4
company,1620247857,CME Group Declares Fresh Dividend; Yield Is 1.8%,67605201,https://www.nasdaq.com/sites/acquia.prod/files/2019-05/0902-Q19%20Total%20Markets%20photos%20and%20gif_CC8.jpg?71474387,CME,Nasdaq,"It's dividend payout time at securities market operator CME Group (NASDAQ: CME). On Wednesday, the company announced that it had declared a new quarterly dividend of $0.90 per share, which is to be paid on June 25 to stockholders of record as of June 10.This amount matches the pr",https://finnhub.io/api/news?id=9d2038ccc6a69e37759dbdd1721a6ba35b1476bf651e9190221c1a8c21bbedbe
company,1620243000,CME Group Inc. Announces Preliminary Results from its 2021 Annual Meeting of Shareholders,67610351,https://s.yimg.com/uu/api/res/1.2/SC_F8rEDktwFL5ghCh4Leg--~B/aD0xNjt3PTE2O2FwcGlkPXl0YWNoeW9u/https://media.zenfs.com/en/prnewswire.com/a4380faad89627092dafdd45cb395048,CME,Yahoo,CME Group Inc. (NASDAQ: CME) today announced the preliminary shareholder voting results from its 2021 annual meeting.,https://finnhub.io/api/news?id=f0af75ebc4f3373e63c0d4598422e8b103b339c3f8df240a70dba815ad16eb70
company,1620235821,Death of Chicago's grain options pits hits traders as crop prices soar,67605202,https://www.nasdaq.com/sites/acquia.prod/files/2021-05-05T213534Z_1_YR8_RTRLXPP_2_LYNXPACKAGER.JPG?1020044372,CME,Nasdaq,"U.S. grain brokers and analysts on Wednesday lamented CME Group Inc's decision to permanently end open-outcry options trading at a time when crop prices are surging, saying that pit traders could help navigate volatile markets.",https://finnhub.io/api/news?id=d5bd8ce2a6f8c3e0b259e254b4ba1f1e38c0bd38ca21fe1ddb08a882d17db9f5
company,1620233040,"CME Group Inc. Cl A stock falls Wednesday, underperforms market",67611845,https://images.mktw.net/im-220105/social,CME,MarketWatch,"Shares of CME Group Inc. Cl A slid 0.64% to $203.06 Wednesday, on what proved to be an all-around positive trading session for the stock market, with the S&P...",https://finnhub.io/api/news?id=63188f72158b9c3125bf2b043cf81d4d00606ac1ee8dc430a3b4c9a86eaebd30
company,1620228600,CME Group Inc. Announces Preliminary Results from its 2021 Annual Meeting of Shareholders,67602850,,CME,PR Newswire,Looking for stock market analysis and research with proves results? Zacks.com offers in-depth financial research with over 30years of proven results.,https://finnhub.io/api/news?id=fb3385faa8a37c3afd740fc9b6efb1c3a48db9df9df50bf01412fdec416d3590
company,1620218340,"Congress Asset Management Co  Buys Pioneer Natural Resources Co, Freeport-McMoRan Inc, Asbury ...",67597623,,CME,GuruFocus,GuruFocus Article or News written by insider and the topic is about: ,https://finnhub.io/api/news?id=30eada557c800771a27f92f930f212dc2490bce4e46de88d3854ddb0011756da
company,1620218340,"NGAM Advisors, L.P. Buys iShares MSCI EAFE Small-Cap ETF, Alphabet Inc, Pioneer Natural ...",67599843,,CME,GuruFocus,GuruFocus Article or News written by insider and the topic is about: ,https://finnhub.io/api/news?id=c5c616b10199f21cb24bac9a1629d7135456d168fbe324ac6f17d965d6b9d282
company,1620217922,Britain to scrap EU rule giving choice of clearer in derivatives,67592243,,CME,Reuters,"Britain will scrap a rule inherited from the European Union that aimed to open the listed derivatives market to more competition, saying it was not appropriate for Britain to implement it alone.",https://finnhub.io/api/news?id=21a339492031ab60525a41d07fc0140aac24ca26a9083d9892abaf14eb8a540f
company,1620216828,"Daily Dividend Report: PEP,CME,EMR,SYK,SPG",67598247,https://www.nasdaq.com/sites/acquia.prod/files/2019-05/0902-Q19%20Total%20Markets%20photos%20and%20gif_CC8.jpg?1010054080,CME,Nasdaq,,https://finnhub.io/api/news?id=0b3cca0879465b7d8b6cc202ea0b56cefd53cc1130e264fae9f009a26f33d37f
