category,datetime,headline,id,image,related,source,summary,url
company,1623930191,"The Zacks Analyst Blog Highlights: Emerson Electric, Deere, Caterpillar, Xylem and Parker-Hannifin Corp",68323987,https://s.yimg.com/uu/api/res/1.2/cpWMk4.U6KPGCf2qRzq_Ng--~B/aD00MDA7dz02MzU7YXBwaWQ9eXRhY2h5b24-/https://media.zenfs.com/en/zacks.com/70d18c3939818a82d18f339f698677b5,DE,Yahoo,"The Zacks Analyst Blog Highlights: Emerson Electric, Deere, Caterpillar, Xylem and Parker-Hannifin Corp",https://finnhub.io/api/news?id=3c7512ebd4a7e3700b067c649eb678f6bb27eb5c08dfe9327910b5a87ad2d566
company,1623928746,DE August 20th Options Begin Trading,68361150,https://www.nasdaq.com/sites/acquia.prod/files/2019-05/0902-Q19%20Total%20Markets%20photos%20and%20gif_CC8.jpg?105893693,DE,Nasdaq,"Investors in Deere & Co. (Symbol: DE) saw new options become available today, for the August 20th expiration.   At Stock Options Channel, our YieldBoost formula has looked up and down the DE options chain for the new August 20th contracts and identified one put and one call",https://finnhub.io/api/news?id=f2a441de897c5a520a6257129f0548b1961895865dc210eee99e9c5145eccc9c
company,1623925140,DE August 20th Options Begin Trading,68328702,,DE,Stock Options Channel,"Staff article entitled DE August 20th Options Begin Trading, about stock options, from Stock Options Channel.",https://finnhub.io/api/news?id=c34bda85b1948d5cd78b870aaa436eef67cab59b3639934e3983329b847a1c52
company,1623862020,Deere & Co. stock outperforms competitors despite losses on the day,68497476,https://images.mktw.net/im-220105/social,DE,MarketWatch,"Shares of Deere & Co. sank 0.46% to $336.56 Wednesday, on what proved to be an all-around grim trading session for the stock market, with the S&P 500 Index...",https://finnhub.io/api/news?id=63e8abb8495a96a5884f9a803caf05d6297376f27915ba17e66e1129dd5d2053
company,1623846672,Industrial Production Continues to Expand: 5 Solid Picks,68302171,https://s.yimg.com/uu/api/res/1.2/AF3528SCtRjHxvzegajwVA--~B/aD00MDA7dz02MzU7YXBwaWQ9eXRhY2h5b24-/https://media.zenfs.com/en/zacks.com/297c456506b59c5b7c5c36c8e155a8b4,DE,Yahoo,"People are spending more on goods than services in the pandemic, which is driving industrial output, thus helping stocks like Caterpillar (CAT), Deere & Company (DE) and Dover Corporation (DOV).",https://finnhub.io/api/news?id=968de4a4a950dbcc226bf462fcca579ba33f7e5bb5a797bf4fe1a834faf82d71
company,1623837610,5 Industrial Production Stocks to Buy on Solid Data for May,68297411,https://s.yimg.com/uu/api/res/1.2/Xn4IlFN0kGMQaU7HvcMFyQ--~B/aD00MDA7dz02MzU7YXBwaWQ9eXRhY2h5b24-/https://media.zenfs.com/en/zacks.com/04468e71b09d9a1e99a8e7d4f4d5871e,DE,Yahoo,"We have narrowed down our search to five industrial product stocks that have strong growth potential for the rest of 2021. These are: DE, CAT, PH, EMR and XYL.",https://finnhub.io/api/news?id=34066de3d78e82df151383a6b8f0e62b730a480ab83157ff4c7af4538142d3a4
company,1623831722,Implied VOOG Analyst Target Price: $280,68361151,https://www.nasdaq.com/sites/acquia.prod/files/2019-05/0902-Q19%20Total%20Markets%20photos%20and%20gif_CC8.jpg?458298101,DE,Nasdaq,"Looking at the underlying holdings of the ETFs in our coverage universe at ETF Channel, we have compared the trading price of each holding against the average analyst 12-month forward target price, and computed the weighted average implied analyst target price for the ETF itsel",https://finnhub.io/api/news?id=63dc17d0349b6b06f53e8540a807ebb5675ea90db0adaf2c82f4cdcad60e8562
company,1623775680,Deere & Co. stock outperforms market on strong trading day,68497477,https://images.mktw.net/im-220105/social,DE,MarketWatch,"Shares of Deere & Co. inched 0.76% higher to $338.10 Tuesday, on what proved to be an all-around dismal trading session for the stock market, with the S&P...",https://finnhub.io/api/news?id=0f2cb1581036d8375a60092fd249af7002cb38f1103e82bf825961c13d14aa2d
company,1623762961,Here's Why Deere (DE) is Poised for a Turnaround After Losing 12.5% in 4 Weeks,68284543,https://s.yimg.com/uu/api/res/1.2/JWPF9ki46uuC6_FbV2S_pw--~B/aD02MDA7dz05MDA7YXBwaWQ9eXRhY2h5b24-/https://media.zenfs.com/en/zacks.com/1062f9b82c216dd59cc121deddf15c8a,DE,Yahoo,"Deere (DE) is technically in oversold territory now, so the heavy selling pressure might have exhausted. This along with strong agreement among Wall Street analysts in raising earnings estimates could lead to a trend reversal for the stock.",https://finnhub.io/api/news?id=d18c143d07fc52035fb7b804c800d1576f118b6a7adaec98c02f36d5ae3da703
company,1623726495,After An 11% Fall Deere Stock Looks Undervalued,68361152,https://www.nasdaq.com/sites/acquia.prod/files/2019-05/0902-Q19%20Total%20Markets%20photos%20and%20gif_CC8.jpg?1938058308,DE,Nasdaq,[Updated: 6/11/2021] DE Stock Decline,https://finnhub.io/api/news?id=fdfddcea6907594f8bd678d08f41e6ce76c65652ae7887dd6212b81b9d9c7fe0
company,1623726492,Despite A 7% Fall This Week Caterpillar Stock May Have More Downside,68361153,https://www.nasdaq.com/sites/acquia.prod/files/2019-05/0902-Q19%20Total%20Markets%20photos%20and%20gif_CC8.jpg?341018917,DE,Nasdaq,[Updated: 6/11/2021] CAT Stock Decline,https://finnhub.io/api/news?id=848d1d6834aed114a4b30db58ced190409596053c185ecf2072721024b4b851d
company,1623689280,"Deere & Co. stock falls Monday, underperforms market",68497479,https://images.mktw.net/im-220105/social,DE,MarketWatch,"Shares of Deere & Co. slipped 1.77% to $335.54 Monday, on what proved to be an all-around mixed trading session for the stock market, with the S&P 500 Index...",https://finnhub.io/api/news?id=a5a28a1339bc3dcfd11202e6e1a7e69b7f886b1f3becc7d318de8d0bc599c535
company,1623674952,Here's Why You Should Add Deere (DE) to Your Portfolio Now,68261726,https://s.yimg.com/uu/api/res/1.2/MjK52b_6ekqa.QogYnVS.g--~B/aD00MDA7dz02MzU7YXBwaWQ9eXRhY2h5b24-/https://media.zenfs.com/en/zacks.com/5734850a9cc180ec0157d710abb68a1a,DE,Yahoo,"Deere (DE) is poised well to gain on demand in agricultural and construction sectors, acquisitions, focus on advanced technologies in products and expansion in precision agriculture.",https://finnhub.io/api/news?id=e37613d068f521b675e1015166320c17de56015d1ec4f5c970d5d9ea47ab12f3
company,1623666720,Deere is Oversold,68261553,,DE,Dividend Channel,"dividend channel,DE,",https://finnhub.io/api/news?id=8cc7a77342f68a2ab94eb4676b12183b43fd8d5e860989e331711f18065b80f4
company,1623419223,"Noteworthy Friday Option Activity: DE, VLO, PSA",68352293,https://www.nasdaq.com/sites/acquia.prod/files/2019-05/0902-Q19%20Total%20Markets%20photos%20and%20gif_CC8.jpg?1011057351,DE,Nasdaq,"Looking at options trading activity among components of the S&P 500 index, there is noteworthy activity today in Deere & Co. (Symbol: DE), where a total volume of 18,092 contracts has been traded thus far today, a contract volume which is representative of approximately",https://finnhub.io/api/news?id=6442a360f913df1874c2424a01d43e4d9c849df1b8762e0f3a45cd543fa67fdb
company,1623415560,"Noteworthy Friday Option Activity: DE, VLO, PSA",68204766,,DE,Stock Options Channel,"Staff article entitled Noteworthy Friday Option Activity: DE, VLO, PSA, about stock options, from Stock Options Channel.",https://finnhub.io/api/news?id=3126dd1066ec8e85725f4e2f869d01904b36ed00cd49566791c096e3b97d8a10
company,1623405300,Deere Insights: Return On Capital Employed,68750438,https://cdn.benzinga.com/files/imagecache/og_image_social_share_1200x630/sites/all/themes/bz2/images/bz-icon.png,DE,Benzinga,"Looking at Q2, Deere (NYSE:DE) earned $2.58 billion, a 249.59% increase from the preceding quarter. Deere also posted a total of $12.06 billion in sales, a 49.77% increase since...",https://finnhub.io/api/news?id=202ceb1b23836e7a5b0f51fbfbd1f9eee43e5b983215410ceaa2a8201de30c03
company,1623323700,Dividend Income Summary: Lanny's May 2021 Summary,68174164,https://static.seekingalpha.com/cdn/s3/uploads/getty_images/1249993252/medium_image_1249993252.jpg,DE,SeekingAlpha,"Dividend Income is the fruit from the labor of investing your money in the stock market. In total, dividend increases created a total of $54.26 in additional passive dividend income.",https://finnhub.io/api/news?id=a456833304d17aa0fd120204ea75466a38535a6008b1a78a241ba0f7287e335b
company,1623305820,You Don't Want to Overlook This Electric Vehicle Stock,68358602,https://www.nasdaq.com/sites/acquia.prod/files/2019-05/0902-Q19%20Total%20Markets%20photos%20and%20gif_CC8.jpg?2070814302,DE,Nasdaq,"Electric vehicle technology company Proterra is set to go public via a merger with special purpose acquisition company ArcLight Clean Transition Corp (NASDAQ: ACTC). But despite having some impressive potential, it isn't one of the best-known EV stocks. In this Fool Live video cl",https://finnhub.io/api/news?id=d4f30c2ffbc30487e6e443dad4e4b6669f423a58fa4a9888cd7a27bea2001696
company,1623245161,Is Deere (DE) Stock a Solid Choice Right Now?,68139139,https://s.yimg.com/uu/api/res/1.2/cpWMk4.U6KPGCf2qRzq_Ng--~B/aD00MDA7dz02MzU7YXBwaWQ9eXRhY2h5b24-/https://media.zenfs.com/en/zacks.com/70d18c3939818a82d18f339f698677b5,DE,Yahoo,"Deere (DE) has seen solid earnings estimate revision activity over the past month, and belongs to a strong industry as well.",https://finnhub.io/api/news?id=aebc88b069212b40489eac8aa9bd0820bc793c09c6054492dd223417244d4d14
company,1623172542,Top Agriculture Stocks for Q3 2021,68075331,https://s.yimg.com/cv/apiv2/social/images/yahoo_default_logo-1200x1200.png,DE,Yahoo,"These are the agriculture stocks with the best value, fastest growth, and most momentum for Q3 2021.",https://finnhub.io/api/news?id=6050d2d41e73581fa37d44fefd29ef813b6be2af51859beaf0fba9d91cad5ae9
company,1623171463,Is Deere (DE) A Great Company to Invest In?,68098685,https://s.yimg.com/uu/api/res/1.2/uCZDgtqtaE5ZDdCDbrO8xw--~B/aD01NjI7dz03NTA7YXBwaWQ9eXRhY2h5b24-/https://media.zenfs.com/en/insidermonkey.com/0fc89264eaffb294a03836b523589a28,DE,Yahoo,"ClearBridge Investments, an investment management firm, published its “Large Cap Value Strategy” first quarter 2021 investor letter – a copy of which can be downloaded here. The ClearBridge Large Cap Value Strategy underperformed its Russell 1000 Value Index benchmark during the first quarter. On an absolute basis, the Strategy had gains in 10 of 11 […]",https://finnhub.io/api/news?id=4be873d74234d3e20c035d500ab275fe6f4ce4efdc9338bd17fe75f49d3c7e05
company,1623160800,John Deere Brings the Farm Home with New Minecraft World,68098686,https://s.yimg.com/uu/api/res/1.2/9KRkgXp06Y_Dfmd0vXntxg--~B/aD0xNjt3PTE2O2FwcGlkPXl0YWNoeW9u/https://media.zenfs.com/en/prnewswire.com/d6006fa2d70d896d1ccb02d443ea8ee2,DE,Yahoo,"John Deere (NYSE: DE) is bringing the farm to young game enthusiasts with the latest version of FarmCraft, a Minecraft experience. Created by Blockworks, in collaboration with John Deere, the Minecraft experience gives players an introduction to modern agriculture through the virtual use of machines, processes and decisions that go into farming today.",https://finnhub.io/api/news?id=70b906e46db2e6cbd93acf8086e9630ae75d04417b8532941a89caebfb77af70
company,1623146400,John Deere Brings the Farm Home with New Minecraft World,68068615,,DE,PR Newswire,Looking for stock market analysis and research with proves results? Zacks.com offers in-depth financial research with over 30years of proven results.,https://finnhub.io/api/news?id=3183e471d33dc15205057dbc27f3cce71c69f907bfb5a66a4886113ce8ead5f1
company,1623137460,The Bulls Are Stuck In The Dog Days Of Summer As Stocks Stall Again,68078050,,DE,TalkMarkets,Content,https://finnhub.io/api/news?id=a5d37d230369eb2521a309247fcafe2c4d6c397a6dda8e30d8876012b0e75ce4
company,1623060392,DE Trading Below Director's Recent Buy Price,67993679,https://www.nasdaq.com/sites/acquia.prod/files/2019-05/0902-Q19%20Total%20Markets%20photos%20and%20gif_CC8.jpg?1929021571,DE,Nasdaq,"There's an old saying on Wall Street about insider buying: there are many possible reasons to sell a stock, but only one reason to buy.  Back on June 2, Deere & Co.'s Director, Tami A. Erwin, invested $98,892.80 into 275 shares of DE, for a cost per share of $359.61.  Barga",https://finnhub.io/api/news?id=232b2431cabd10f87ffbd1f69e3639bd08dd4e388a49e8c57913e73bc5c6a5cb
company,1623056760,DE Trading Below Director`s Recent Buy Price,67990583,,DE,Dividend Channel,"dividend channel,DE,",https://finnhub.io/api/news?id=68c78405d55fbf8ee64370b9523ee1ac2bd7552bb496a0fb8115d6f3bc4aa7bb
company,1622890860,Deere Stock Shows Every Sign Of Being Significantly Overvalued,67982892,,DE,GuruFocus,GuruFocus Article or News written by GF Value and the topic is about: ,https://finnhub.io/api/news?id=56df40ad2dd7c1eab58c0824097bdc15d240a034857fcdbdc9e07bf546dd616f
company,1622879941,Independent Director Tamara Erwin Just Bought 22% More Shares In Deere & Company (NYSE:DE),68034927,https://s.yimg.com/uu/api/res/1.2/DhUm7_fsRB3iB.QuO44ylA--~B/aD00MzI7dz0xMTk0O2FwcGlkPXl0YWNoeW9u/https://media.zenfs.com/en/simply_wall_st__316/66c3209cd42fcb6666461634077a457f,DE,Yahoo,"Whilst it may not be a huge deal, we thought it was good to see that the Deere & Company ( NYSE:DE ) Independent...",https://finnhub.io/api/news?id=cb5c1f4514f53b0998c732fdff63a9d7c0dc95564c0b41d533521680b0cd4bcd
company,1622864340,"Trade Alert: The Independent Director Of Deere & Company (NYSE:DE), Tamara Erwin, Has Just Spent US$99k Buying 22% More Shares",67993680,https://www.nasdaq.com/sites/acquia.prod/files/2019-05/0902-Q19%20Total%20Markets%20photos%20and%20gif_CC8.jpg?1326764557,DE,Nasdaq,"Whilst it may not be a huge deal, we thought it was good to see that the Deere & Company (NYSE:DE) Independent Director, Tamara Erwin, recently bought US$99k worth of stock, for US$360 per share.    That purchase might not be huge but it did increase their holding by 22%.",https://finnhub.io/api/news?id=d4eb984f9ec90e4958b35e90841da9bf4f0f39d27f1e586b34efd2bf32fe38aa
company,1622825280,"Deere & Co. stock falls Friday, underperforms market",67988158,https://images.mktw.net/im-220105/social,DE,MarketWatch,"Shares of Deere & Co. dropped 0.63% to $356.64 Friday, on what proved to be an all-around favorable trading session for the stock market, with the S&P 500...",https://finnhub.io/api/news?id=eab52aae60b6ff423a9f2758951ff9b4729dfb28a876869720ffe1875c72c6e1
company,1622804269,7 Best Manufacturing Stocks to Buy on Record-High Growth Data,67990299,https://www.nasdaq.com/sites/acquia.prod/files/2019-05/0902-Q19%20Total%20Markets%20photos%20and%20gif_CC8.jpg?1622921992,DE,Nasdaq,"InvestorPlace - Stock Market News, Stock Advice & Trading Tips",https://finnhub.io/api/news?id=0662513b5e8091f58727c6a37cbc9a0242227f128489b02b9587fdc095b19cf5
company,1622804053,"Noteworthy ETF Outflows: SPYG, DHR, SPGI, DE",67993682,https://www.nasdaq.com/sites/acquia.prod/files/2019-05/0902-Q19%20Total%20Markets%20photos%20and%20gif_CC8.jpg?1844485520,DE,Nasdaq,"Looking today at week-over-week shares outstanding changes among the universe of ETFs covered at ETF Channel, one standout is the SPDR— Portfolio S&P 500— Growth ETF (Symbol: SPYG) where we have detected an approximate $88.7 million dollar outflow -- that's a 0.",https://finnhub.io/api/news?id=17a7578c4ca7b7783caaa69c64560bc13fb60632039902ee8d7ba3a4b248028d
company,1622800680,7 Best Manufacturing Stocks to Buy on Record-High Growth Data,67982893,https://investorplace.com/wp-content/uploads/2021/03/manufacturing-1600.jpg,DE,InvestorPlace,"As the economy recovers, manufacturing stocks are a critical investment opportunity. Here are seven to consider for your portfolio.",https://finnhub.io/api/news?id=47c454ae13cb96f41908c4231fa14bd8020e499b7270edc43119f2603a216e67
company,1622793086,2 Agriculture Stocks to Bet on Rising Commodity Prices,67991944,https://www.nasdaq.com/sites/acquia.prod/files/2019-05/0902-Q19%20Total%20Markets%20photos%20and%20gif_CC8.jpg?564523875,DE,Nasdaq,"InvestorPlace - Stock Market News, Stock Advice & Trading Tips",https://finnhub.io/api/news?id=86b924352c14ba0d41b0c14a3b7e7614a0011d413b5ed42ca6ea81a8686cca34
company,1622789460,2 Agriculture Stocks to Bet on Rising Commodity Prices,67982894,https://investorplace.com/wp-content/uploads/2020/04/farmtogether1600-1024x576.jpg,DE,InvestorPlace,"Due to improving economic conditions and inflationary concerns, global commodity prices have been soaring, boosting agriculture stocks.",https://finnhub.io/api/news?id=73cbfb2806ffa65167354a2a0782687a3b44b6d139c29ab1d8d6a8a93e3f8d0a
company,1622738880,"Deere & Co. stock rises Thursday, outperforms market",67988159,https://images.mktw.net/im-220105/social,DE,MarketWatch,"Shares of Deere & Co. inched 0.62% higher to $358.91 Thursday, on what proved to be an all-around rough trading session for the stock market, with the S&P...",https://finnhub.io/api/news?id=0edf44951514a9d9e0624303441afdfaa131492acf3dc5bb4f3c1eb7131d5b8c
company,1622734266,"Noteworthy Thursday Option Activity: WOW, DE, WW",67993684,https://www.nasdaq.com/sites/acquia.prod/files/2019-05/0902-Q19%20Total%20Markets%20photos%20and%20gif_CC8.jpg?267463457,DE,Nasdaq,"Among the underlying components of the Russell 3000 index, we saw noteworthy options trading volume today in WideOpenWest Inc (Symbol: WOW), where a total of 3,695 contracts have traded so far, representing approximately 369,500 underlying shares.  That amounts to about 93.6% o",https://finnhub.io/api/news?id=29e394ce3dbe9c13dfdbc951695d68d1be28c84b7a42ad02a0349163cb252a3b
company,1622725260,John Deere Adopts Vuzix M400 Smart Glasses in Brazil for Equipment Training,67992501,https://cdn.benzinga.com/files/imagecache/og_image_social_share_1200x630/images/story/2012/aapharma_568.png,DE,Benzinga,Vuzix Corporation (NASDAQ: VUZI) announced that agri equipment manufacturer Deere & Co (NYSE: DE) had deployed Vuzix M400 Smart Glasses in Brazil via...,https://finnhub.io/api/news?id=4f715c84fac960115c1579bb121c441460bd6d38e3daffcd92f7455aa6f3e7e1
company,1622722872,4 Top Farm Equipment Stocks to Grab on Solid Farm Prospects,68028568,https://s.yimg.com/uu/api/res/1.2/MX3Ymci0.N_ggA93Cx4jMQ--~B/aD00MDA7dz02MzU7YXBwaWQ9eXRhY2h5b24-/https://media.zenfs.com/en/zacks.com/30a16cf29adcb5e8d3fc109971d25783,DE,Yahoo,"As higher agricultural commodity prices are driving the Manufacturing - Farm Equipment industry, Deere (DE), AGCO Corp (AGCO), Titan International (TWI) and Lindsay (LNN) are poised to ride on this trend.",https://finnhub.io/api/news?id=781182e08e6e6310870e0e1008d89587e490cfdee0a4e5faad77289686e37967
company,1622722752,"The Zacks Analyst Blog Highlights: Deere, Caterpillar, Xylem, Parker-Hannifin and Illinois Tool Works",68007748,https://s.yimg.com/uu/api/res/1.2/rj9rvD0uUgpZgYYbvMEcMw--~B/aD00MDA7dz02MzU7YXBwaWQ9eXRhY2h5b24-/https://media.zenfs.com/en/zacks.com/dfbf477ce67e2ca9b1c9e4b00f36cf66,DE,Yahoo,"The Zacks Analyst Blog Highlights: Deere, Caterpillar, Xylem, Parker-Hannifin and Illinois Tool Works",https://finnhub.io/api/news?id=2e7159e97679fa55a724defc8257b0de8886f80fcef564b3f9d8bbdd6e1b8c53
company,1622718085,DE July 23rd Options Begin Trading,67993685,https://www.nasdaq.com/sites/acquia.prod/files/2019-05/0902-Q19%20Total%20Markets%20photos%20and%20gif_CC8.jpg?1686065290,DE,Nasdaq,"Investors in Deere & Co. (Symbol: DE) saw new options become available today, for the July 23rd expiration.   At Stock Options Channel, our YieldBoost formula has looked up and down the DE options chain for the new July 23rd contracts and identified one put and one call con",https://finnhub.io/api/news?id=d623dba925b040093d36e2a485600c5d80fbeb0efd1c7cb44adf622d36a02ace
company,1622714460,DE July 23rd Options Begin Trading,67982895,,DE,Stock Options Channel,"Staff article entitled DE July 23rd Options Begin Trading, about stock options, from Stock Options Channel.",https://finnhub.io/api/news?id=2f1c0598712d606a591d710772992612ece8f1aeff475799203d554e6a886cbe
company,1622631430,U.S. Manufacturing Thriving Amid Supply Bottleneck: 5 Picks,68007749,https://s.yimg.com/uu/api/res/1.2/XcmQneZbpcCcRSrOlixJHA--~B/aD00MDA7dz02MzU7YXBwaWQ9eXRhY2h5b24-/https://media.zenfs.com/en/zacks.com/215f7abe7215efd784f7c8d711b9aa26,DE,Yahoo,"We have narrowed down our search to five manufacturing stocks with strong growth potential for 2021. These are: CAT, DE, PH, ITW and XYL.",https://finnhub.io/api/news?id=662561d948c870458c7c0feb4bc998b3fc0403e2242c7f43fa09045261ce0672
company,1622622600,U.S. Manufacturing Thriving Amid Supply Bottleneck: 5 Picks,67970900,,DE,TalkMarkets,Content,https://finnhub.io/api/news?id=2385e7579a73b579413ba6328ceed2bd78a34439e6c6754838e315ef18a032f0
company,1622550012,Deere (DE) Up 34% So Far This Year: What's Driving the Stock?,68034944,https://s.yimg.com/uu/api/res/1.2/MjK52b_6ekqa.QogYnVS.g--~B/aD00MDA7dz02MzU7YXBwaWQ9eXRhY2h5b24-/https://media.zenfs.com/en/zacks.com/5734850a9cc180ec0157d710abb68a1a,DE,Yahoo,Forecast-topping results so far this year and an upbeat outlook for fiscal 2021 have contributed to the run-up in Deere & Company's (DE) shares.,https://finnhub.io/api/news?id=752993bff9a7cb194f87a1dc9f7daca91f044b10df028282459cc512be3a260e
company,1622473482,Best Industrial Stocks To Buy Right Now? 3 Trending Names To Watch,67955221,https://www.nasdaq.com/sites/acquia.prod/files/2019-05/0902-Q19%20Total%20Markets%20photos%20and%20gif_CC8.jpg?1489750001,DE,Nasdaq,"3 Top Industrial Stocks To Watch In June 2021It would not surprise me to see that industrial stocks are still among the most active stocks in the stock market now. After all, as most would know, the U.S. economy remains on the upswing. In turn, industrial companies which are argu",https://finnhub.io/api/news?id=eb7a2d512e2c9e3a36e1e749272761cd3b350f0b3d543b8d455b8ef5ce2fde25
company,1622363046,These are Wall Street’s top analysts favorite stocks heading into June,67949927,https://image.cnbcfm.com/api/v1/image/105736734-1550070490099gettyimages-474418294.jpeg?v=1622131398,DE,CNBC,"TipRanks analyst ranking service pinpoints Wall Street's best-performing stocks, like Deere & Advanced Micro Devices.",https://finnhub.io/api/news?id=70abc72ebf8f1c971d14249c5739718048558cbc2ec5ffbadc47f93faea8730e
company,1622355476,Wall Street Breakfast: The Week Ahead,67946767,https://static3.seekingalpha.com/assets/podcasts/wsb-d57bf915fd82bac19817953c2e226c7610de9fc3a36c166d7c276e18e86311ea.png,DE,SeekingAlpha,"Our weekend preview of earnings reports, conference presentations, investor days, IPOs, FDA decisions, Barron's mentions and other key events that could impact stocks.",https://finnhub.io/api/news?id=d2be95c4cc0df1d02a84ad1f0a94243a89078dc29a479cb189f800b3d1651f51
company,1622295960,"Forget Crypto, Farming Is the Red-Hot Sector in 2021",68034947,https://s.yimg.com/uu/api/res/1.2/gJATgX58mHWWmFza_J3Mjg--~B/aD05MzQ7dz0xNDAwO2FwcGlkPXl0YWNoeW9u/https://media.zenfs.com/en/motleyfool.com/aba581f25a325bfd282bf18862e20b42,DE,Yahoo,"Investors shouldn't overlook the growth potential in the agricultural sector, and John Deere stock in particular.",https://finnhub.io/api/news?id=16d7a2b444e4f2b1dec9a06a517be03d7347f0144410a53f0fea8249a83f95ce
company,1622257897,Insights From Earnings Calls: Labor Shortages Persist,67940606,https://static.seekingalpha.com/cdn/s3/uploads/getty_images/1264980571/medium_image_1264980571.jpg,DE,SeekingAlpha,Businesses continue to experience staff shortages as they reopen. An increase in in-store traffic is driving revenue for retailers.,https://finnhub.io/api/news?id=26a59cf11dec5b099218a8c692f4bf5ed363e5be4d65eae28820abd2df7cf544
company,1622211062,Deere (DE) Bets on Improving Agriculture & Construction Markets,68034950,https://s.yimg.com/uu/api/res/1.2/MjK52b_6ekqa.QogYnVS.g--~B/aD00MDA7dz02MzU7YXBwaWQ9eXRhY2h5b24-/https://media.zenfs.com/en/zacks.com/5734850a9cc180ec0157d710abb68a1a,DE,Yahoo,Deere (DE) is poised well to benefit from demand for agricultural equipment stemming from improving farm fundamentals and construction demand led by strong housing market.,https://finnhub.io/api/news?id=4e3f35417102c67274e78231ca3b514ff3e4cae921dad33d48c857c1884cf060
company,1622151600,Why This Agriculture Equipment Dealer's Stock Soared Today,67988368,https://s.yimg.com/uu/api/res/1.2/UpEgn.DgBTuO1432E2q9Bw--~B/aD05MzM7dz0xNDAwO2FwcGlkPXl0YWNoeW9u/https://media.zenfs.com/en/motleyfool.com/b4f0a73efee6ebe0cc19ef85da770d12,DE,Yahoo,Earnings from this New Holland and Case equipment dealer is more evidence of an ongoing boom in agriculture.,https://finnhub.io/api/news?id=82ee1dcf8572bf6f2fbe992ece5afd5f97035f389bea39062f6e3993c29dbd06
company,1622148906,10 Best Dividend Stocks to Buy According to Cathie Wood,68007919,https://s.yimg.com/uu/api/res/1.2/VFIvepRv_dTLck0n.Amj_g--~B/aD02MDA7dz00NzM7YXBwaWQ9eXRhY2h5b24-/https://media.zenfs.com/en/insidermonkey.com/33ede3b2a4dafa7bc9d5d35b0755b9e1,DE,Yahoo,"In this article we discuss the 10 best dividend stocks to buy according to Cathie Wood. If you want to skip our detailed analysis of Wood‘s history, and hedge fund performance, go directly to the 5 Best Dividend Stocks to Buy According to Cathie Wood. Catherine Wood of ARK Investment Management is a renowned name […]",https://finnhub.io/api/news?id=db16910db986ad6d4e6ced2e4c91666e1e6abcc12c813319cead8e3d161e27f4
company,1622114171,"The Zacks Analyst Blog Highlights: Texas Instruments, CSX Corp, Norfolk Southern Corp, Deere and UBS Group",68011719,https://s.yimg.com/uu/api/res/1.2/EEa6bvQgPJQx5hd.yXNHpA--~B/aD00MDA7dz02MzU7YXBwaWQ9eXRhY2h5b24-/https://media.zenfs.com/en/zacks.com/b63375e1154ac83fb8cbeef632d2a6fd,DE,Yahoo,"The Zacks Analyst Blog Highlights: Texas Instruments, CSX Corp, Norfolk Southern Corp, Deere and UBS Group",https://finnhub.io/api/news?id=ef46fa4587fa7354cfdb6af29a443acada3567d1c237183c342ebb99c07cf9d7
