category,datetime,headline,id,image,related,source,summary,url
company,1626187200,ClearBridge Large Cap Value Strategy Portfolio Manager Commentary Q2 2021,68706482,https://static.seekingalpha.com/assets/og_image_1200-29b2bfe1a595477db6826bd2126c63ac2091efb7ec76347a8e7f81ba17e3de6c.png,DE,SeekingAlpha,ClearBridge is a leading global asset manager committed to active management.,https://finnhub.io/api/news?id=6638074f259d3afcb3ee83950cbb40540641163068768c9abc8eca1d609e4b6b
company,1626185326,Deere Is an Actual Buy-the-Dip Opportunity,68744729,https://www.nasdaq.com/sites/acquia.prod/files/2019-05/0902-Q19%20Total%20Markets%20photos%20and%20gif_CC8.jpg?428322107,DE,Nasdaq,"InvestorPlace - Stock Market News, Stock Advice & Trading Tips",https://finnhub.io/api/news?id=8b6cba534646093d88235e5d94580a65e3dae74f164a6ae71df884f12bcaf731
company,1626183001,Earnings Growth & Price Strength Make Deere (DE) a Stock to Watch,68704965,https://s.yimg.com/uu/api/res/1.2/e0VWXB5.wUFiKGuJPPpLzg--~B/aD02MDA7dz05MDA7YXBwaWQ9eXRhY2h5b24-/https://media.zenfs.com/en/zacks.com/a7cdcede0bb5a646be035f4a7e678781,DE,Yahoo,"Finding strong, market-beating stocks with a positive earnings outlook becomes easier with the Focus List, a top feature of the Zacks Premium portfolio service.",https://finnhub.io/api/news?id=7eaae2c856639895f9c1ac08cd5b13aa7e4e5b8ae4ecd3a39190d51c6b88ab18
company,1626179940,"Gillespie Robinson & Grimm Inc Buys Fortive Corp, BlackRock Inc, Cisco Systems Inc, Sells BTC BlackRock Short Maturity Bond ETF, Kansas City Southern, Microchip Technology Inc",68741213,,DE,GuruFocus,,https://finnhub.io/api/news?id=eeabe93ef6c9c26e2dede7bad769f1964ff53787925aef1450407d1a64b3467e
company,1626173755,"Noteworthy ETF Outflows: MTUM, DE, SCHW, SQ",68744730,https://www.nasdaq.com/sites/acquia.prod/files/2019-05/0902-Q19%20Total%20Markets%20photos%20and%20gif_CC8.jpg?106046748,DE,Nasdaq,"Looking today at week-over-week shares outstanding changes among the universe of ETFs covered at ETF Channel, one standout is the iShares MSCI USA Momentum Factor ETF (Symbol: MTUM) where we have detected an approximate $96.1 million dollar outflow -- that's a 0.6% decrease wee",https://finnhub.io/api/news?id=3114c3fcbb6ecc97517fa2f8a4ad068ae729561937c295b86dc84dd3863c21df
company,1626162240,"JPMorgan sees opportunities in machinery, upgrades three to Overweight",68738729,,DE,Thefly.com,"JPMorgan sees opportunities in machinery, upgrades three to Overweight JPMorgan PCAR AGCO TEX CAT DE EPAC ALSN",https://finnhub.io/api/news?id=6b2b86b42dd69a3f26c8c8afb16ad27eb78606e1da7cab4498f59a7c487cd9bd
company,1626138540,DE Stock: Deere Is an Actual Buy-the-Dip Opportunity,68790914,https://investorplace.com/wp-content/uploads/2021/06/de_deere_1600.jpg,DE,InvestorPlace,"Many encourage investors to ""buy the dip."" But there is a skill to it and DE stock is one that ticks all of the right boxes.",https://finnhub.io/api/news?id=ace6dc6fb40c61c2889a6fa9dbd986f9ee515e07220edc2c66214456d7574c06
company,1626108480,Deere & Co. stock outperforms competitors on strong trading day,69201424,https://images.mktw.net/im-220105/social,DE,MarketWatch,"Shares of Deere & Co. advanced 1.37% to $354.28 Monday, on what proved to be an all-around great trading session for the stock market, with the S&P 500 Index...",https://finnhub.io/api/news?id=bb45d5800feeab3cea31487993f8be342f00f579fb539eff34bb0ba0f5e3d68b
company,1626086340,"Fulcrum Asset Management LLP Buys GFL Environmental Inc, NVR Inc, American Homes 4 Rent, Sells Alphabet Inc, Tesla Inc, Facebook Inc",68761206,,DE,GuruFocus,,https://finnhub.io/api/news?id=0e5b810ce8a202f51a669bc4175efb06520fb8313005d289fec0f5cda44278f2
company,1626069646,7 Best Stocks To Buy Now if You Want To Get In at the Bottom,68744731,https://www.nasdaq.com/sites/acquia.prod/files/2019-05/0902-Q19%20Total%20Markets%20photos%20and%20gif_CC8.jpg?348821060,DE,Nasdaq,"InvestorPlace - Stock Market News, Stock Advice & Trading Tips",https://finnhub.io/api/news?id=394c359f1f72280c5f61b21afd63713dee69fa60286b2865d50b47aad6884eae
company,1626066360,7 Best Stocks To Buy Now if You Want To Get In at the Bottom,68743002,https://investorplace.com/wp-content/uploads/2020/10/buy-low-sell-high.jpg,DE,InvestorPlace,"A lot of great stocks are on sale right now. Companies that are household names have seen their share prices pushed down in recent months, including these seven.",https://finnhub.io/api/news?id=6409f0340a63bbd9a406fc62f55319026ecdc4485de9e8180d1e19fc7306d6fb
company,1626061461,We Like These Underlying Return On Capital Trends At Deere (NYSE:DE),68744732,https://www.nasdaq.com/sites/acquia.prod/files/2019-05/0902-Q19%20Total%20Markets%20photos%20and%20gif_CC8.jpg?219960029,DE,Nasdaq,"Did you know there are some financial metrics that can provide clues of a potential multi-bagger?  Ideally, a business will show two trends; firstly a growing return on capital employed (ROCE) and secondly, an increasing amount of capital employed.  Put simply, these types of bu",https://finnhub.io/api/news?id=c8de841dd11c24012ab7f7a9b50c45225c28b01d65b7a0e91c84d34a2bc0c1b0
company,1626051600,ANALYSIS-Treasury rally leaves investors scrambling for yield plays,68744733,https://www.nasdaq.com/sites/acquia.prod/files/2021-07-09T073316Z_1_CD0_RTRLXPP_2_LYNXPACKAGER.JPG?185984806,DE,Nasdaq,"A tumble in Treasury yields is pushing some investors toward other income-generating vehicles including dividend-paying stocks and emerging market bonds, often in exchange for a greater degree of risk.",https://finnhub.io/api/news?id=13d26deaeb84973a5e5239590daaf6ee22b8f28525c54aaf2dcc3f6de8987b58
company,1625994000,ANALYSIS-Treasury rally leaves investors scrambling for yield plays,68744734,https://www.nasdaq.com/sites/acquia.prod/files/2021-07-09T054526Z_1_ME4_RTRLXPP_2_LYNXPACKAGER.JPG?206167068,DE,Nasdaq,"A tumble in Treasury yields is pushing some investors toward other income-generating vehicles including dividend-paying stocks and emerging market bonds, often in exchange for a greater degree of risk.",https://finnhub.io/api/news?id=a74afa10e5e8c1219d520e6d9902db48da20e2b3483fe3c5124f308bc130caa8
company,1625867109,Deere (DE) Outpaces Stock Market Gains: What You Should Know,68669574,https://s.yimg.com/uu/api/res/1.2/eeFsK50..hTdRBoBNDEyoA--~B/aD03MTE7dz05MDA7YXBwaWQ9eXRhY2h5b24-/https://media.zenfs.com/en/zacks.com/d2f7ed3d1940141716bfd200f5c94c6b,DE,Yahoo,"Deere (DE) closed at $349.48 in the latest trading session, marking a +1.72% move from the prior day.",https://finnhub.io/api/news?id=cdd478725c67843054f9c86e9bc2ed389a0820be52be869f4da7c5dbaee8d8e2
company,1625849280,Deere & Co. stock outperforms market on strong trading day,68681252,https://images.mktw.net/im-220105/social,DE,MarketWatch,"Shares of Deere & Co. advanced 1.72% to $349.48 Friday, on what proved to be an all-around positive trading session for the stock market, with the S&P 500...",https://finnhub.io/api/news?id=6a1346b5be798f653771808e3f72a2be1f6402e60b0a04db08857ed6200a3171
company,1625834340,"First Citizens Financial Corp Buys iShares MSCI USA Small-Cap Multifactor ETF, BTC iShares MSCI EAFE Value ETF, Alliant Energy Corp, Sells iShares S&P 500 Growth ETF",68790917,,DE,GuruFocus,,https://finnhub.io/api/news?id=4e1a4a121030330700a41fda73013b6844ac7bb146285a399ae3427838988ed7
company,1625827140,"Paragon Advisors, LLC Buys RH, Deere, Lithia Motors Inc, Sells Paycom Software Inc, Avalara Inc, Bright Horizons Family Solutions Inc",68785427,,DE,GuruFocus,,https://finnhub.io/api/news?id=0f4d88c6b76f236c843464d022de7341b1c2571c76b0a2e64942d5e09299a5e8
company,1625762880,Deere & Co. stock underperforms Thursday when compared to competitors,68681253,https://images.mktw.net/im-220105/social,DE,MarketWatch,"Shares of Deere & Co. shed 2.36% to $343.58 Thursday, on what proved to be an all-around grim trading session for the stock market, with the S&P 500 Index...",https://finnhub.io/api/news?id=587fc187842203bc07718b51feb4ddc05994657009a2a89ff620de97ee782347
company,1625758848,"Notable Thursday Option Activity: SPOT, MRTN, DE",68744735,https://www.nasdaq.com/sites/acquia.prod/files/2019-05/0902-Q19%20Total%20Markets%20photos%20and%20gif_CC8.jpg?1495223436,DE,Nasdaq,"Looking at options trading activity among components of the Russell 3000 index, there is noteworthy activity today in Spotify Technology SA (Symbol: SPOT), where a total volume of 6,080 contracts has been traded thus far today, a contract volume which is representative of appro",https://finnhub.io/api/news?id=87a29b62e126170b089ca916b97b0ddac7e732a0b66585cdfa738f4bdd78f052
company,1625755262,"Deere, Beyond Meat, Palo Alto Networks, CrowdStrike and Zscaler highlighted as Zacks Bull and Bear of the Day",68646403,https://s.yimg.com/uu/api/res/1.2/cpWMk4.U6KPGCf2qRzq_Ng--~B/aD00MDA7dz02MzU7YXBwaWQ9eXRhY2h5b24-/https://media.zenfs.com/en/zacks.com/70d18c3939818a82d18f339f698677b5,DE,Yahoo,"Deere, Beyond Meat, Palo Alto Networks, CrowdStrike and Zscaler highlighted as Zacks Bull and Bear of the Day",https://finnhub.io/api/news?id=5f0279265b30643343d1688b0729c4e11f8cdcf8eaec44012f738538356e3625
company,1625747940,"S.A. Mason LLC Buys iShares Morningstar Mid-Cap ETF, Nuance Communications Inc, Huntington Bancshares Inc, Sells iShares Gold Trust, TCF Financial Corp, ",68780065,,DE,GuruFocus,,https://finnhub.io/api/news?id=eff03e551aa742b7f32d67a8083f8aeb87c4e80931a47154a2cd3fd952032c10
company,1625743342,Interesting DE Put And Call Options For August 27th,68647707,https://www.nasdaq.com/sites/acquia.prod/files/2019-05/0902-Q19%20Total%20Markets%20photos%20and%20gif_CC8.jpg?23895878,DE,Nasdaq,"Investors in Deere & Co. (Symbol: DE) saw new options begin trading today, for the August 27th expiration.   At Stock Options Channel, our YieldBoost formula has looked up and down the DE options chain for the new August 27th contracts and identified one put and one call co",https://finnhub.io/api/news?id=c48be2275e9415c5e39653cf9b49fa7be2a7f09fb0991a6401fa84d58050a334
company,1625741110,Bull of the Day: Deere and Company (DE),68646404,https://s.yimg.com/uu/api/res/1.2/k1h7Nf7YKXEJVG0fEMqg6A--~B/aD01ODc7dz05MDA7YXBwaWQ9eXRhY2h5b24-/https://media.zenfs.com/en/zacks.com/d9b3f7b5ae7f67e58a203af36b3a7698,DE,Yahoo,Bull of the Day: Deere and Company (DE),https://finnhub.io/api/news?id=dc326699098d925f1227bcaaa6a44180a26061a33ae960fc1a46717055b1b7c5
company,1625739720,Interesting DE Put And Call Options For August 27th,68790920,,DE,Stock Options Channel,"Staff article entitled Interesting DE Put And Call Options For August 27th, about stock options, from Stock Options Channel.",https://finnhub.io/api/news?id=1d1aea671bb2853e779322bcd73c9bd30959db49f5f376f9d5c74a17f5feb61e
company,1625731500,"Thursday’s Top Analyst Upgrades and Downgrades: Charles Schwab, Datadog, Deere, Dish Network, Etsy, Freeport-McMoRan, Regions Financial and More",68739459,https://247wallst.com/wp-content/uploads/2019/02/imageforentry2-ajg.jpg,DE,247WallSt,"Thursday's top analyst upgrades and downgrades included Beyond Meat, Charles Schwab, Datadog, Deere, Dish Network, Etsy, Freeport-McMoRan and Regions Financial.",https://finnhub.io/api/news?id=68a9e9fbaa9c09c04a57cda01494444af4fcb738c5296018eb203ff70ac57aa7
company,1625676480,Deere & Co. stock outperforms competitors on strong trading day,68644598,https://images.mktw.net/im-220105/social,DE,MarketWatch,"Shares of Deere & Co. inched 0.70% higher to $351.88 Wednesday, on what proved to be an all-around great trading session for the stock market, with the S&P...",https://finnhub.io/api/news?id=930fe59a5201017adff19e0a41c7882f6b073c6233e5cb85261b48ec0477114a
company,1625663486,Hot Stock or Hot Air: Analyzing the Virgin Galactic Battle,68744737,https://www.nasdaq.com/sites/acquia.prod/files/2019-05/0902-Q19%20Total%20Markets%20photos%20and%20gif_CC8.jpg?183824363,DE,Nasdaq,"InvestorPlace - Stock Market News, Stock Advice & Trading Tips",https://finnhub.io/api/news?id=ce147d887dea1afbdd74938290266dbf0b8ca9b6bb0aeb82aaca4453e6cba7c0
company,1625659860,Hot Stock or Hot Air: Analyzing the Virgin Galactic Battle,68778683,https://investorplace.com/wp-content/uploads/2020/06/spce-1600.jpg,DE,InvestorPlace,"SPCE stock is bitterly controversial right now. Here are four key bull and bear talking points, and how investors should view the argument.",https://finnhub.io/api/news?id=5a3c68906b43bf8951fad0badf17fab0b0a7d71292c26de6a2785a59b6b3543b
company,1625590946,"UPDATE 3-Biden seeks to lift limits on farmer deals with meat processors, tractor makers",68616794,https://s.yimg.com/cv/apiv2/social/images/yahoo_default_logo-1200x1200.png,DE,Yahoo,"President Joe Biden wants to give U.S. farmers more power in negotiating the sale of livestock to big processors and in deciding who repairs their tractors, the White House said on Tuesday.  The executive order, expected within days, will also address such competitive issues as delayed airline baggage, cellphone company practices and Pentagon contracts, a source briefed on the matter told Reuters.  The order would encourage the Federal Trade Commission to limit the ability of farm equipment manufacturers to prevent tractor owners from using independent repair shops or repairing their own equipment.",https://finnhub.io/api/news?id=f66cffda315f9e24d3a45491e0825f039cc8f50d0cc0472c1d2b87804a2e986c
company,1625590080,"Deere & Co. stock falls Tuesday, underperforms market",68623296,https://images.mktw.net/im-220105/social,DE,MarketWatch,"Shares of Deere & Co. shed 0.87% to $349.45 Tuesday, on what proved to be an all-around dismal trading session for the stock market, with the S&P 500 Index...",https://finnhub.io/api/news?id=ce097129a9242ede43e76b06fb76075dc5c01804cefc3f8d1e5c519d07d68552
company,1625576546,"EXCLUSIVE-Biden plans steps to help farmers deal with meat processors, tractor makers",68645216,https://www.nasdaq.com/sites/acquia.prod/files/2021-07-06T133755Z_1_RR6_RTRLXPP_2_LYNXPACKAGER.JPG?291862830,DE,Nasdaq,"President Joe Biden plans an executive order that seeks to give U.S. farmers more leverage in dealing with big processors who buy their livestock and with manufacturers whose software makes it difficult for users to repair tractors, a source briefed on the matter told Reuters Tuesday.",https://finnhub.io/api/news?id=0725cb23fff710e6e451c2f879e37569cba8180c7e7b139a8e6936c2989c05fc
company,1625575752,6 Reasons to Add Deere (DE) Stock to Your Portfolio Now,68613042,https://s.yimg.com/uu/api/res/1.2/oo_BIbrvizk7t7v4NokEKg--~B/aD00MDA7dz02MzU7YXBwaWQ9eXRhY2h5b24-/https://media.zenfs.com/en/zacks.com/0cde845739c4df6feb5b3c37a0127ad8,DE,Yahoo,Deere (DE) is poised well to gain on favorable demand in agricultural and construction sectors and efforts to bring technologically advanced products in the market.,https://finnhub.io/api/news?id=a22ea6926f026ec894337bd35c4379bddbb9e07b6ca95e61b1dfe8fe16703539
company,1625568095,EXCLUSIVE-Biden sides with farmers over 'Right to Repair' tractor software battle,68647709,https://www.nasdaq.com/sites/acquia.prod/files/2021-07-06T134811Z_1_PL5_RTRLXPP_2_LYNXPACKAGER.JPG?1055101816,DE,Nasdaq,"U.S. President Joe Biden wants the Federal Trade Commission to limit the ability of farm equipment manufacturers to restrict tractor owners from using independent repair shops or complete some repairs on their own, a source briefed on the matter told Reuters Tuesday.",https://finnhub.io/api/news?id=08f779e1ef07e50e3649bc15b2714e72dd0e3ff215d3668ef74d7549e1e4c0b3
company,1625567762,Deere Slips As Biden Says Farmers Have 'Right to Repair' Tractor Software,68613044,https://s.yimg.com/cv/apiv2/social/images/yahoo_default_logo-1200x1200.png,DE,Yahoo,By Dhirendra Tripathi,https://finnhub.io/api/news?id=7ca0528c81330dcf636b73deecab684657718530b7da29e406dc119a78f4d053
company,1625566020,Deere Slips As Biden Says Farmers Have 'Right to Repair' Tractor Software By Investing.com,68790923,https://i-invdn-com.investing.com/news/LYNXMPEA7E0LA_L.jpg,DE,Investing.com,Deere Slips As Biden Says Farmers Have 'Right to Repair' Tractor Software,https://finnhub.io/api/news?id=80bb6f8f7440e361702d036d705a82cb4bd456c706c5bd8f0381379530f33580
company,1625563092,EXCLUSIVE-Biden sides with farmers over 'Right to Repair' tractor software battle,68647710,https://www.nasdaq.com/sites/acquia.prod/files/2021-07-06T133755Z_1_RR6_RTRLXPP_2_LYNXPACKAGER.JPG?1739796502,DE,Nasdaq,"U.S. President Joe Biden wants the Federal Trade Commission to limit the ability of farm equipment manufacturers to restrict tractor owners from using independent repair shops or complete some repairs on their own, a source briefed on the matter told Reuters Tuesday.",https://finnhub.io/api/news?id=a4f4ac2c795a8f21fce1318ada541f0a559a248d23ebc13354de00f166a07f71
company,1625551300,"No Matter How ‘Techy’ Tractor Maker Deere Might Seem, It’s No Tech Stock",68645217,https://www.nasdaq.com/sites/acquia.prod/files/2019-05/0902-Q19%20Total%20Markets%20photos%20and%20gif_CC8.jpg?1860397411,DE,Nasdaq,"InvestorPlace - Stock Market News, Stock Advice & Trading Tips",https://finnhub.io/api/news?id=9579269b5da193feff31bbb8da3b4b7943427594a7c9df3b197ed72af565ba83
company,1625547900,"No Matter How 'Techy' Tractor Maker Deere Might Seem, It's No Tech Stock",68756778,https://investorplace.com/wp-content/uploads/2021/07/r4f046587_vs.jpg,DE,InvestorPlace,DE stock rolled over after the equipment maker recorded a strong April quarter and hiked its dividend. But there’s a limited opportunity for Deere & Company's fancy tractors and combines.,https://finnhub.io/api/news?id=5018224923a4743055e0339245698f0a167a0e642de9e4eaf077b4308a453804
company,1625244480,Deere & Co. stock underperforms Friday when compared to competitors,68604351,https://images.mktw.net/im-220105/social,DE,MarketWatch,"Shares of Deere & Co. shed 0.51% to $352.50 Friday, on what proved to be an all-around great trading session for the stock market, with the S&P 500 Index...",https://finnhub.io/api/news?id=728694b8552582a86066ef0a74267f5a13d6f6abd4658256eacdfebdd63a56c1
company,1625224500,Top 5 Dividend Growth Stocks to Buy in July,68647712,https://www.nasdaq.com/sites/acquia.prod/files/2019-05/0902-Q19%20Total%20Markets%20photos%20and%20gif_CC8.jpg?738953865,DE,Nasdaq,"Have you heard of the magic of compound interest? It's been called the eighth wonder of the world, and it can be an extremely powerful wealth-creation tool. Compounding allows a sum of money to grow faster than simple interest since you are earning returns on top of returns. By i",https://finnhub.io/api/news?id=7154b6cb858f75ca4e9c5e02a7d2304ceb2ac7175faf541a60061e0f2f93a928
company,1625216940,7 Inflation Stocks to Buy Now as Consumer Prices Surge,68760002,https://investorplace.com/wp-content/uploads/2021/06/inflation-1-scaled.jpg,DE,InvestorPlace,"Abundant liquidity, surging demand following pandemic lockdowns and supply-side constraints are leading investors to seek inflation stocks.",https://finnhub.io/api/news?id=edbfef43203396df119d7b9304fc8706566f1fe220eedb14782c2c8a196a7a1c
company,1625175909,Deere (DE) Gains But Lags Market: What You Should Know,68570400,https://s.yimg.com/uu/api/res/1.2/AwCmIhR0z9Bg4cEkwuNQjw--~B/aD02MDE7dz05MDA7YXBwaWQ9eXRhY2h5b24-/https://media.zenfs.com/en/zacks.com/8442d24e11d454aa89061259a9714d43,DE,Yahoo,"In the latest trading session, Deere (DE) closed at $354.29, marking a +0.45% move from the previous day.",https://finnhub.io/api/news?id=9bfdd2270f075b0cde6612e153718f06c448de74d3738ab85bd26e8830cfc859
company,1625158080,"Deere & Co. stock rises Thursday, still underperforms market",68604352,https://images.mktw.net/im-220105/social,DE,MarketWatch,"Shares of Deere & Co. inched 0.45% higher to $354.29 Thursday, on what proved to be an all-around favorable trading session for the stock market, with the...",https://finnhub.io/api/news?id=14c94a45ee334fa4a605ea42ab8bfb9f2bba95d55df12c18c4ce7cd518b4a173
company,1625146921,"4 Farm Equipment Stocks to Buy as Soybean, Corn Prices Gain",68554207,https://s.yimg.com/uu/api/res/1.2/d_GFF0iHhZBlP3nIcZ0i4g--~B/aD00MDA7dz02MzU7YXBwaWQ9eXRhY2h5b24-/https://media.zenfs.com/en/zacks.com/759e68e3c80b362825e704eb2f6c1837,DE,Yahoo,"The US Agriculture Department reported lower-than-expected plantings and reduced stocks for soybean and corn, which triggered a price jump. This is going to benefit stocks like DE, KUBTY, AGCO and LNN.",https://finnhub.io/api/news?id=76408b6302feefce90fa06f3068d641167dc04d7bebf21eb0cd215ccdd3b304e
company,1625141280,The Top 3 Stocks to Own on Potential Passage of Infrastructure Bill,68790926,https://investorplace.com/wp-content/uploads/2020/06/infrastructure-stocks.jpg,DE,InvestorPlace,"U.S. infrastructure has been a slow-motion train wreck. However, If the proposed infrastructure bill passes, these stocks should benefit.",https://finnhub.io/api/news?id=b0933102c40c9469c95ec2a5255c3cdac96ed8b35c393b12c816a37cb4e824ed
company,1625114280,"Park National Corp  Buys First Trust Preferred Securities and Income ETF, PayPal Holdings Inc, Qualcomm Inc, Sells Intel Corp, AstraZeneca PLC, Dollar General Corp",68790927,,DE,GuruFocus,,https://finnhub.io/api/news?id=0089fe6b7ed535f14c802c5dd806ffbb7c93b265129e67eb1521a096754998fd
company,1625071767,7 Stocks to Buy That Look Cheap Based on Their Cash Flows,68647045,https://www.nasdaq.com/sites/acquia.prod/files/2019-05/0902-Q19%20Total%20Markets%20photos%20and%20gif_CC8.jpg?1273844349,DE,Nasdaq,"InvestorPlace - Stock Market News, Stock Advice & Trading Tips",https://finnhub.io/api/news?id=70a78f5cb7823e01f59802862459b1c8648895db9afafde2e4c8bf8546ecec64
company,1625071680,Deere & Co. stock outperforms market on strong trading day,68547574,https://images.mktw.net/im-220105/social,DE,MarketWatch,"Shares of Deere & Co. rallied 1.08% to $352.71 Wednesday, on what proved to be an all-around favorable trading session for the stock market, with the S&P 500...",https://finnhub.io/api/news?id=e17bd92660103aaa08e8dc3a6115a94eb71d8d4c57fff404ac7c6bb9335cf57a
company,1625024940,7 Stocks to Buy That Look Cheap Based on Their Cash Flows,68790928,https://investorplace.com/wp-content/uploads/2019/07/cash1600e.jpg,DE,InvestorPlace,If you're an investor who's a firm believer in Warren Buffett's 'Cash Is King' saying then these seven stocks to buy are meant for you.,https://finnhub.io/api/news?id=620bed01f0816af785d0477c8861864537e0060ca944def053e853f1547d3fb2
company,1624985280,"Deere & Co. stock falls Tuesday, underperforms market",68547576,https://images.mktw.net/im-220105/social,DE,MarketWatch,"Shares of Deere & Co. slid 0.02% to $348.93 Tuesday, on what proved to be an all-around great trading session for the stock market, with the S&P 500 Index...",https://finnhub.io/api/news?id=41faa0ff30a31123d6e964820dd5145de76917035a71d82be31ac59e1aad1bbb
company,1624971063,3 Stocks This Top Hedge Fund Manager Has Been Buying,68530345,https://s.yimg.com/uu/api/res/1.2/SYTl2P_fcn9HKulnXSKhwg--~B/aD03NTI7dz0xNDAwO2FwcGlkPXl0YWNoeW9u/https://media.zenfs.com/en/motleyfool.com/18fc63a5677b3de5502efef3a95fc5fc,DE,Yahoo,"Leading hedge fund manager Ole Andreas Halvorsen of Viking Global Investors bought more stock in industrial companies Deere (NYSE: DE) and Fortive (NYSE: FTV) and elevator and escalator company Otis (NYSE: OTIS) earlier in the year, according to SEC filings.  Halvorsen is a highly successful long/short stock picker and his firm currently manages $44 billion in assets, having notably managed a portfolio that finished flat in 2008, the same year that the S&P 500 index fell nearly 40%.",https://finnhub.io/api/news?id=f19532b3618cce82f3c1fdd987997fc4c8891b84edf4228ae0fbc0a3fe6fc105
company,1624962970,"The Zacks Analyst Blog Highlights: Greif, Caterpillar, Deere & Co, Sealed Air Corp and Berry Global Group",68526062,https://s.yimg.com/uu/api/res/1.2/rj9rvD0uUgpZgYYbvMEcMw--~B/aD00MDA7dz02MzU7YXBwaWQ9eXRhY2h5b24-/https://media.zenfs.com/en/zacks.com/dfbf477ce67e2ca9b1c9e4b00f36cf66,DE,Yahoo,"The Zacks Analyst Blog Highlights: Greif, Caterpillar, Deere & Co, Sealed Air Corp and Berry Global Group",https://finnhub.io/api/news?id=21b28a49481e7bc1706859fc9467f2366c367eaf76b318983597ab1d7189a69f
company,1624956663,3 Stocks This Top Hedge Fund Manager Has Been Buying,68646945,https://www.nasdaq.com/sites/acquia.prod/files/2019-05/0902-Q19%20Total%20Markets%20photos%20and%20gif_CC8.jpg?718421182,DE,Nasdaq,"Leading hedge fund manager Ole Andreas Halvorsen of Viking Global Investors bought more stock in industrial companies Deere (NYSE: DE) and Fortive (NYSE: FTV) and elevator and escalator company Otis (NYSE: OTIS) earlier in the year, according to SEC filings.",https://finnhub.io/api/news?id=a427ce75a9a2efdaacdee0d3db048b98207c7ce6bf970c95093a6c625d62a4a6
company,1624898880,Deere & Co. stock underperforms Monday when compared to competitors,68512379,https://images.mktw.net/im-220105/social,DE,MarketWatch,"Shares of Deere & Co. slipped 0.03% to $349.89 Monday, on what proved to be an all-around mixed trading session for the stock market, with the S&P 500 Index...",https://finnhub.io/api/news?id=1a6d79de876f2e79df61a3ab6e25c42747a2715fb35b71b9a5f0b09569aadd91
company,1624888561,Buy these 5 Industrial Stocks That Outperformed S&P 500 YTD,68514062,https://s.yimg.com/uu/api/res/1.2/Z2186ts3qOgMcyEa.WQTgw--~B/aD00MDA7dz02MzU7YXBwaWQ9eXRhY2h5b24-/https://media.zenfs.com/en/zacks.com/f2a906017e21a0754bed854592195b05,DE,Yahoo,"With the ongoing expansion in manufacturing activity, it is prudent to invest in stocks like CAT, DE, SEE, BERY and GEF that are outperforming the S&P 500 and are set to gain further.",https://finnhub.io/api/news?id=acbcbd34f92c73f155fd9c4259c05287c4162aa923c4616514c5008ba2f94c4d
