category,datetime,headline,id,image,related,source,summary,url
company,1629205200,"Deere, UAW begin negotiations on labor agreement",69697472,https://s.yimg.com/uu/api/res/1.2/I8c31olGJesMNXOj6OpmLg--~B/aD0xNjt3PTE2O2FwcGlkPXl0YWNoeW9u/https://media.zenfs.com/en/prnewswire.com/4d4c81664ec6b1e4a75dffd91505db4f,DE,Yahoo,"Deere & Company (NYSE: DE) and the International Union, United Automobile, Aerospace, and Agricultural Implement Workers of America (UAW) have started negotiations on a new labor agreement. The current six-year master agreement covers approximately 10,100 production and maintenance employees at 12 Deere facilities and expires on Oct.1.",https://finnhub.io/api/news?id=faa60bdefbff3f60a98ddd6dfbe9ea650c5f7afd8d8f5346665b707fff7387a4
company,1629194460,A Look Into Deere's Debt,69696522,https://cdn.benzinga.com/files/imagecache/og_image_social_share_1200x630/sites/all/themes/bz2/images/bz-icon.png,DE,Benzinga," 
Shares of Deere (NYSE:DE) moved higher by 6.02% in the past three months. Before we understand the importance of debt, let us look at how much debt Deere has.
Deere's...",https://finnhub.io/api/news?id=51a87901a229637624ff0a7b86e09420a56adb11c15d6a5b66a0ef0d5f499a05
company,1629193200,John Deere's Charts Are Bullish,69697473,,DE,Yahoo,"Monday night Jim Cramer told his Mad Money viewers that he added John Deere to his list of infrastructure picks. Let's check out the charts and indicators of this iconic agriculture company.    In this daily bar chart of DE, below, we can see that prices are in a longer-term uptrend but are retesting their May highs.",https://finnhub.io/api/news?id=e459cbd9a4693858f9e4824651f92bb16df6e464e5c1d503e304905ac3efcc7e
company,1629190800,"Deere, UAW begin negotiations on labor agreement",69697757,,DE,PR Newswire,Looking for stock market analysis and research with proves results? Zacks.com offers in-depth financial research with over 30years of proven results.,https://finnhub.io/api/news?id=7796d1312e0f5998fb7c585fc39a3a877a6556da62ff00ece56de62c220b39c5
company,1629187320,"Deere, UAW begin negotiations on labor agreement",69697758,,DE,Thefly.com,Deere & Company and t... DE,https://finnhub.io/api/news?id=74c31f74925fcf51777f55aed1a00e944098f57b542c90a012946058648ea17b
company,1629185266,XLI: Industrials Dashboard For August,69692689,,DE,SeekingAlpha,,https://finnhub.io/api/news?id=525c507fc375be237b769e39d04f531f8dfe850f2c84617547754c9bc6fc2a64
company,1629150309,Deere (DE) Stock Sinks As Market Gains: What You Should Know,69689025,https://s.yimg.com/uu/api/res/1.2/OL7xfT5pzuzwP2wxb1pcSw--~B/aD02MjU7dz05MDA7YXBwaWQ9eXRhY2h5b24-/https://media.zenfs.com/en/zacks.com/7ea641b46fe75c0a913349e5e610d6a2,DE,Yahoo,"Deere (DE) closed the most recent trading day at $383.03, moving -0.25% from the previous trading session.",https://finnhub.io/api/news?id=7dbe7e1c8a1bf10b7f43eed697a132fa586de4e3b409abaee417ded48cf4f0a4
company,1629132480,Deere & Co. stock outperforms competitors despite losses on the day,69685735,https://images.mktw.net/im-220105/social,DE,MarketWatch,"Shares of Deere & Co. slid 0.25% to $383.03 Monday, on what proved to be an all-around positive trading session for the stock market, with the S&P 500 Index...",https://finnhub.io/api/news?id=9c0f02a03082e4f264726476b59fdee1bc821c77d4e1c8d7f69ade207f7a57d1
company,1629128943,Deere (DE) to Report Q3 Earnings: What's in the Offing?,69690891,https://s.yimg.com/uu/api/res/1.2/T33RbqIviOewyK7IWe4LAg--~B/aD00MDA7dz02MzU7YXBwaWQ9eXRhY2h5b24-/https://media.zenfs.com/en/zacks.com/b99039b906bd1b350c188ea9518bf43f,DE,Yahoo,Deere's (DE) Q3 results likely to reflect increased farm equipment demand on higher commodity prices and benefits from the company's margin-improvement plan.,https://finnhub.io/api/news?id=02d3f4aed53848529a73c245096844346f05af822de20240eb2862b48f77e0ca
company,1629118380,Canada Peterbilt Dealer Cervus To Go Private In $240M Sale To Brandt Tractor,69696523,https://cdn.benzinga.com/files/imagecache/og_image_social_share_1200x630/images/story/2012/peterbilt-4886201_1920.jpg,DE,Benzinga,"Heavy equipment seller Cervus Equipment, which owns a large Peterbilt dealer network in Canada, has agreed to be acquired by Brandt Tractor for CA$302 million ($240 million) in a...",https://finnhub.io/api/news?id=c4e40bba7d2da055d050841b32c8f1316a416c74280b9511c1f8342b8e57dfa8
company,1629076200,"This Week: Walmart, Deere earnings, housing starts",69679841,,DE,"Associated Press, The",Looking for stock market analysis and research with proves results? Zacks.com offers in-depth financial research with over 30years of proven results.,https://finnhub.io/api/news?id=20034c475c567d0101c254662eb1e2926d06d55b7a7d216be5c61b62b65157ac
company,1629073997,"GAB: Tempting Distribution Yield, Potential Opportunity",69677578,https://static.seekingalpha.com/cdn/s3/uploads/getty_images/1282691609/medium_image_1282691609.jpg,DE,SeekingAlpha,GAB carries a high distribution rate on a fairly vanilla portfolio. Click here to read about this CEF and its holdings and why it's potentially presenting an opportunity to enter a position.,https://finnhub.io/api/news?id=434d6214d06ead0509afedac34eec23e73a59d81d62dee2d73e175f3774f17d9
company,1629012211,"Earnings to Watch Next Week: Home Depot, Walmart, Target and Deere in Focus",69675729,,DE,Yahoo,"Following is a list of company earnings scheduled for release August 16-20, along with earnings previews for select companies. Next week’s earnings are of much significance for major market movements as Q2 is believed to be a quarter of significant recovery, with growth accelerating and the outlook for the coming periods gradually improving.",https://finnhub.io/api/news?id=5ddf2699e24be7119e3e9b4482a606ee0ac90694081c71f83b1bcc06e0ba9576
company,1629010304,Wall Street Breakfast: The Week Ahead (Podcast),69675105,https://static3.seekingalpha.com/assets/podcasts/wsb-d57bf915fd82bac19817953c2e226c7610de9fc3a36c166d7c276e18e86311ea.png,DE,SeekingAlpha,Investors will get some hard reads on the U.S. consumer next week.,https://finnhub.io/api/news?id=5ba515c79b6d84a68892be2c3e23ee10bc8829bad19ea83f44c9e7d4eca3edb7
company,1629009351,Wall Street Breakfast: The Week Ahead,69675061,https://static.seekingalpha.com/assets/og_image_1200-29b2bfe1a595477db6826bd2126c63ac2091efb7ec76347a8e7f81ba17e3de6c.png,DE,SeekingAlpha,"Listen on the go! A daily podcast of Wall Street Breakfast will be available by 8:00 a.m. on Seeking Alpha, iTunes, Stitcher and Spotify.",https://finnhub.io/api/news?id=c89e6c9b31c73b20d9a080bdb29020f4cb6872b1f2b384dfee77eea283567aec
company,1628935404,Stocks To Watch: Retailers Step Out And Tesla Talks AI,69667037,https://static.seekingalpha.com/assets/og_image_1200-29b2bfe1a595477db6826bd2126c63ac2091efb7ec76347a8e7f81ba17e3de6c.png,DE,SeekingAlpha,Welcome to Seeking Alpha's Stocks to Watch - a preview of key events scheduled for the next week,https://finnhub.io/api/news?id=63ffccc036f3522a1025b7fa2dc17734a6a90416c32fd8458739fa86b0b08b4e
company,1628896260,"Bill Gates Transfers Deere, Canadian National, and AutoNation Stock",69661289,,DE,Yahoo,"Bill Gates’ investment vehicle Cascade Investment transferred Deere, Canadian National, and AutoNation stock to Melinda French Gates as a result of a finalized divorce.",https://finnhub.io/api/news?id=095a39238963e881e2b8f0a16384c3a3491bf69e2cf673ce69c696bb1d3ff56c
company,1628886300,S&P 500 Earnings: Q3 '21 S&P 500 EPS Growth Is Looking Pretty Healthy Already,69661299,https://static.seekingalpha.com/cdn/s3/uploads/getty_images/1250581414/medium_image_1250581414.jpg,DE,SeekingAlpha,"Walmart reports their July ’21 quarter this coming Tuesday morning, which traditionally and unofficially ends the quarterly reporting period.",https://finnhub.io/api/news?id=8ff360dfde29c2f50509b80a02b711510420a0428a3edd241c7c61b83d5403fa
company,1628881860,"Bill Gates Transfers Deere, Canadian National, and AutoNation Stock",69667273,https://images.barrons.com/im-369833/social,DE,MarketWatch,"Bill Gates’ investment vehicle Cascade Investment transferred Deere, Canadian National, and AutoNation stock to Melinda French Gates as a result of a...",https://finnhub.io/api/news?id=110b9101b22778fb32b96694c037b7a9e51c8115c6b96852c9397f012a27bccd
company,1628881207,Deere (DE) Earnings Expected to Grow: What to Know Ahead of Next Week's Release,69661290,https://s.yimg.com/uu/api/res/1.2/0K2vxHTAGj_tGrBqjPJ8Cg--~B/aD02MDA7dz05MDA7YXBwaWQ9eXRhY2h5b24-/https://media.zenfs.com/en/zacks.com/f889276f4a638f3c7a79c0e3e6b768c1,DE,Yahoo,Deere (DE) possesses the right combination of the two key ingredients for a likely earnings beat in its upcoming report. Get prepared with the key expectations.,https://finnhub.io/api/news?id=ce420abd591222630e5cd4dfce623eb270cac23f2f238dc75db4bf446b572975
company,1628873280,Deere & Co. stock outperforms competitors despite losses on the day,69667290,https://images.mktw.net/im-220105/social,DE,MarketWatch,"Shares of Deere & Co. slumped 0.42% to $384.00 Friday, on what proved to be an all-around great trading session for the stock market, with the S&P 500 Index...",https://finnhub.io/api/news?id=413a76f010d2d8350eea86a0b9a67dc5741cb8dfc594b5393b4b9ed52d3e835d
company,1628867819,Deere Could Hit New All-Time High on Strong Q3 Earnings; Target Price $421,69661291,https://s.yimg.com/uu/api/res/1.2/B5B3FBIPp303qlEH07ulag--~B/aD00MTA7dz02MTU7YXBwaWQ9eXRhY2h5b24-/https://media.zenfs.com/en/fx_empire_176/2e412d6a5520716432530b4bfe12b00e,DE,Yahoo,"Deere & Company, the world’s largest maker of farm equipment, is expected to report its fiscal third-quarter earnings of $4.57 per share, which represents year-over-year growth of over 77% from $2.57 per share seen in the same period a year ago.",https://finnhub.io/api/news?id=626e42270d580550a6f746d7b771b0bc002ef7e6bee88818435d3479ef4d7b44
company,1628864495,"Bridgewater adds new stakes in chip makers and boosts GE bet, while selling off Boeing, Delta, UPS holdings",69659329,https://s.wsj.net/public/resources/MWimages/MW-GP644_MicroS_ZG_20180906154215.jpg,DE,MarketWatch,Bridgewater Associates LP has disclosed that the value of its equity holdings as of the end of the second quarter increased by 37.5% from the end of the...,https://finnhub.io/api/news?id=2155ce9f01c318894923227576f6c3b6ee262b79aeee45146ca50014a1a17462
company,1628854091,Searching for Earnings Beat? Play These 5 Stocks,69651737,,DE,Yahoo,Invest in top-ranked stocks that are likely to beat their earnings estimates in the upcoming releases.,https://finnhub.io/api/news?id=0eb3607857941e1e77e1f6c26bf0d71a5b4879909d604950fc3738521b5552b2
company,1628786880,"Deere & Co. stock falls Thursday, underperforms market",69647331,https://images.mktw.net/im-220105/social,DE,MarketWatch,"Shares of Deere & Co. slumped 0.12% to $385.62 Thursday, on what proved to be an all-around great trading session for the stock market, with the S&P 500...",https://finnhub.io/api/news?id=ead63049a8138591bc1d816cb2b074ed558134d969efb150375f2dff31ad4d07
company,1628771412,Here's How Much a $1000 Investment in Deere Made 10 Years Ago Would Be Worth Today,69636012,https://s.yimg.com/uu/api/res/1.2/F3nzpi36wi9juoO_v9PrEA--~B/aD02MDA7dz05MDA7YXBwaWQ9eXRhY2h5b24-/https://media.zenfs.com/en/zacks.com/2a50596f066181e48e4ae0ad6be00462,DE,Yahoo,"Why investing for the long run, especially if you buy certain popular stocks, could reap huge rewards.",https://finnhub.io/api/news?id=2bfd66cd9af15c91fe74c866f8e28da92739ef83b31ed72170edf0182f6340d6
company,1628762040,DE October 1st Options Begin Trading,69655138,,DE,Stock Options Channel,"Staff article entitled DE October 1st Options Begin Trading, about stock options, from Stock Options Channel.",https://finnhub.io/api/news?id=fe21c1f0fd4c0be568eadb3df94ed6fcca5e6d6669a1015f8662419189c4787c
company,1628755020,DE Crosses Above Average Analyst Target,69635777,,DE,ETF Channel,"Staff article entitled DE Crosses Above Average Analyst Target, about ETFs, from ETF Channel.",https://finnhub.io/api/news?id=5a7cb57ee8f4c1946096f63b61ec23d444e4d3d48c0be8fb640beaeb86b2ebc9
company,1628700480,Deere & Co. stock underperforms Wednesday when compared to competitors despite daily gains,69647332,https://images.mktw.net/im-220105/social,DE,MarketWatch,"Shares of Deere & Co. rose 2.51% to $386.08 Wednesday, on what proved to be an all-around great trading session for the stock market, with the S&P 500 Index...",https://finnhub.io/api/news?id=740e9d0b7fad5a1fd674e095ca078f87d8fb62f9332941ad70c49511467f5c83
company,1628658000,Ways to Gear Up Your Portfolio for Inflation Concerns,69627013,https://images.barrons.com/im-368386/social,DE,MarketWatch,"While the Fed has pinned the rise in consumer prices on transitory factors related to the pandemic’s impact on supply chains, other experts aren't so convinced.",https://finnhub.io/api/news?id=951876de8d98700b765640e95c1841514065a32d3452248543028953f8c0c5d1
company,1628614080,Deere & Co. stock underperforms Tuesday when compared to competitors despite daily gains,69647334,https://images.mktw.net/im-220105/social,DE,MarketWatch,"Shares of Deere & Co. advanced 1.98% to $376.62 Tuesday, on what proved to be an all-around positive trading session for the stock market, with the S&P 500...",https://finnhub.io/api/news?id=87842117fba268d7d4cf0c0fa7b8a5176c3bfdaecde0b3d084f198e86272ba11
company,1628608620,Using Enterprise-Augmented Reality Solutions to Solve Post-Pandemic Challenges,69603131,https://cdn.benzinga.com/files/imagecache/og_image_social_share_1200x630/sites/all/themes/bz2/images/bz-icon.png,DE,Benzinga,"As the COVID-19 pandemic still looms over us globally, our technological landscape has grown exponentially, aiding in consumer adoption of the new standards of safety. From...",https://finnhub.io/api/news?id=44a3fe4d749b49c01a509cd1c574544aabd089df7fa6e16aa1f1434ff79feece
company,1628597550,Deere: Recent Acquisition Helps Solve A Huge Problem,69599462,https://static.seekingalpha.com/cdn/s3/uploads/getty_images/471504047/medium_image_471504047.jpg,DE,SeekingAlpha,Deere is a great company that stacks up well against competitors. The Bear Flag Robotics acquisition aims to reduce the gap between supply and demand in the farming industry.,https://finnhub.io/api/news?id=84c89efba189e6e6a316156a0f48e05c6c99b32c8e2fd6f780e305eafaa81931
company,1628591940,"Menora Mivtachim Holdings Ltd. Buys BP PLC, Amazon.com Inc, Apple Inc, Sells NVIDIA Corp, PagSeguro Digital, Micron Technology Inc",69615800,,DE,GuruFocus,,https://finnhub.io/api/news?id=365d52978b98f23f1095c4d228404cbf658652d4ce39801e336cd9321b34a0bb
company,1628591520,"Without 'right to repair,' businesses lose time and money",69597340,,DE,"Associated Press, The",Looking for stock market analysis and research with proves results? Zacks.com offers in-depth financial research with over 30years of proven results.,https://finnhub.io/api/news?id=9789f795a0124c09a5c6c76f69bf70a9fc5e566ef1f92415cb7aa2c93d17cab2
company,1628545509,Deere (DE) Gains As Market Dips: What You Should Know,69590826,https://s.yimg.com/uu/api/res/1.2/eeFsK50..hTdRBoBNDEyoA--~B/aD03MTE7dz05MDA7YXBwaWQ9eXRhY2h5b24-/https://media.zenfs.com/en/zacks.com/d2f7ed3d1940141716bfd200f5c94c6b,DE,Yahoo,"In the latest trading session, Deere (DE) closed at $369.32, marking a +0.67% move from the previous day.",https://finnhub.io/api/news?id=77c9e229c7ae5d715694aac6f4d2d51c73c9f2e27a8bd26ce6a2dba01b6d0025
company,1628527680,Deere & Co. stock outperforms competitors on strong trading day,69647335,https://images.mktw.net/im-220105/social,DE,MarketWatch,"Shares of Deere & Co. inched 0.67% higher to $369.32 Monday, on what proved to be an all-around dismal trading session for the stock market, with the S&P 500...",https://finnhub.io/api/news?id=8f05aa931973697101dbea72ae7576f2081d7013da3bca7898cf8246d81e11f5
company,1628302020,A Permanently-Rising Funhouse,69570634,,DE,TalkMarkets,,https://finnhub.io/api/news?id=5f668aae553b70ef9f208255ceaa944aa481da024883311f30283da023d3f105
company,1628268480,"Deere & Co. stock rises Friday, outperforms market",69554804,https://images.mktw.net/im-220105/social,DE,MarketWatch,"Shares of Deere & Co. inched 0.70% higher to $366.88 Friday, on what proved to be an all-around favorable trading session for the stock market, with the S&P...",https://finnhub.io/api/news?id=b1177fc1050cb377cb5935a31d9d9466079652d12eb2f6517507109b9f88c756
company,1628242089,5 Corporate Giants to Buy Ahead of Earnings Results This Month,69540859,https://s.yimg.com/uu/api/res/1.2/ShfhwtDyA2WzDBKdAL7M8Q--~B/aD00MDA7dz02MzU7YXBwaWQ9eXRhY2h5b24-/https://media.zenfs.com/en/zacks.com/6f2cab89bf2cbad1966358e04258e202,DE,Yahoo,"Five corporate bigwigs are slated to release their earnings results this month. These are: WMT, A, TGT, DE and ULTA.",https://finnhub.io/api/news?id=0f3b0887ba204422b2b911d3856321357b7785b4aa49f0a0cdd6a69e2210a72f
company,1628192482,"Deere, Bear Flag aim to automate tractors as 'fast as possible'",69532645,https://s.yimg.com/uu/api/res/1.2/Slm5G1knnBCGLSpB9LtyOg--~B/aD01MzU7dz04MDA7YXBwaWQ9eXRhY2h5b24-/https://media.zenfs.com/en/reuters-finance.com/2bb1ed98e9ddd04cdbb771863dd11c00,DE,Yahoo,"U.S. tractor maker Deere & Co said on Thursday it would buy agriculture tech startup Bear Flag Robotics for $250 million, with the goal of developing over the next year systems Deere can sell to allow farm tractors to operate without a human driver in the cab.  ""We are effectively in market with real customers today,"" Dan Leibfried, Deere's Director of Automation and Autonomy, told Reuters.  Bear Flag has been testing automated tractors on farms in California.",https://finnhub.io/api/news?id=74d7c27c9231d43e119e642b4f6d83809f22db41ce085a7ba97e5540a71cac4b
company,1628191980,"UPDATE 1-Deere, Bear Flag aim to automate tractors as 'fast as possible'",69532646,https://s.yimg.com/cv/apiv2/social/images/yahoo_default_logo-1200x1200.png,DE,Yahoo,"U.S. tractor maker Deere & Co said on Thursday it would buy agriculture tech startup Bear Flag Robotics for $250 million, with the goal of developing over the next year systems Deere can sell to allow farm tractors to operate without a human driver in the cab.  ""We are effectively in market with real customers today,"" Dan Leibfried, Deere's Director of Automation and Autonomy, told Reuters.  Bear Flag has been testing automated tractors on farms in California.",https://finnhub.io/api/news?id=5157c41dc2377799ec6da35fa4172f9594427d55dd5c0bf9144cc09e489e942b
company,1628185696,John Deere Buys Autonomous Driving Startup Amid Labor Shortages,69532647,https://s.yimg.com/uu/api/res/1.2/1KNMDfKJMOksMJ9XdQUL6Q--~B/aD0xMzMzO3c9MjAwMDthcHBpZD15dGFjaHlvbg--/https://media.zenfs.com/en/bloomberg_markets_842/18aa374aed1d3d62a0b0c301e2d42ea0,DE,Yahoo,"(Bloomberg) -- John Deere, the world’s biggest tractor maker, will acquire autonomous driving technology startup Bear Flag Robotics for $250 million, a bet that farming will continue becoming more automated.Automation is thought to be key to solving farm labor shortages, which have long been rife in the sector. Growers are struggling to get enough workers to bring crops from fields at a time when global hunger is on the rise.“One of the biggest challenges farmers face today is the availability o",https://finnhub.io/api/news?id=6f5c2dec67ec7005ee54d04412c60fa63aef01cefe119c0deb4f4c9eef6af0e5
company,1628182800,John Deere Acquires Bear Flag Robotics to Accelerate Autonomous Technology on the Farm,69532648,https://s.yimg.com/uu/api/res/1.2/RIHLOEjLxhPTelwf.GHpyg--~B/aD0zMDA7dz00MDA7YXBwaWQ9eXRhY2h5b24-/https://media.zenfs.com/en/prnewswire.com/3fa6d240a81e105c6fd831e29c10b161,DE,Yahoo,"Deere & Company (NYSE: DE) has signed a definitive agreement to acquire Bear Flag Robotics for $250 million USD. Founded in 2017, the Silicon Valley-based startup develops autonomous driving technology compatible with existing machines. The deal accelerates the development and delivery of automation and autonomy on the farm and supports John Deere's long-term strategy to create smarter machines with advanced technology to support individual customer needs.",https://finnhub.io/api/news?id=aa56fb6091cd3d7e2660497ce40b47473d9a775d67e99396ec1a90eab0d16bbc
company,1628182080,"Deere & Co. stock rises Thursday, outperforms market",69530946,https://images.mktw.net/im-220105/social,DE,MarketWatch,"Shares of Deere & Co. rose 1.01% to $364.32 Thursday, on what proved to be an all-around great trading session for the stock market, with the S&P 500 Index...",https://finnhub.io/api/news?id=99c8907d387c94336a4a8a581ab97d56e70c87bc9adf050a096c8b9165bb0fda
company,1628180579,"Deere, Caterpillar reinstate mask mandates",69527888,https://s.yimg.com/cv/apiv2/social/images/yahoo_default_logo-1200x1200.png,DE,Yahoo,"Caterpillar Inc and Deere & Co reintroduced mask mandates for employees, suppliers and visitors to their facilities regardless of vaccination status, the companies said.  The two companies revised their mask policies this week after the U.S. Centers for Disease Control and Prevention (CDC) last week recommended fully vaccinated people wear masks in indoor public places.  Kate Kenny, a Caterpillar spokesperson, said the company is encouraging employees to get vaccinated.",https://finnhub.io/api/news?id=1d178d3aee8c808af53bc58f9714c739fe0cbdbe554c95f591ead5b4b24d070e
company,1628178000,Deere Acquires Bear Flag Robotics For $250M,69543439,https://cdn.benzinga.com/files/imagecache/og_image_social_share_1200x630/images/story/2012/industrial_pic_214.jpg,DE,Benzinga,"Deere & Company (NYSE: DE) has agreed to acquire Silicon Valley-based startup Bear Flag Robotics for $250 million.
Founded in 2017, Bear Flag...",https://finnhub.io/api/news?id=7446db0488752f9f7d162a5a7c44dae38bc0a1f0bc07c0bdb7ec3074086ca212
company,1628169180,Deere Buys Autonomous Technology Startup Bear Flag Robotics for $250 Million,69530947,https://mw3.wsj.net/mw5/content/logos/mw_logo_social.png,DE,MarketWatch,By Robb M. Stewart Deere &amp; Co. has agreed to buy a Silicon Valley-based startup for $250 million in a bid to accelerate the development of autonomous...,https://finnhub.io/api/news?id=92eb5101340c2fa9eb40c380d906697a9de3c99bf5489e5e708fc5a2b90c8d88
company,1628168400,John Deere Acquires Bear Flag Robotics to Accelerate Autonomous Technology on the Farm,69545888,,DE,PR Newswire,Looking for stock market analysis and research with proves results? Zacks.com offers in-depth financial research with over 30years of proven results.,https://finnhub.io/api/news?id=4182ae0a7c75e0fbf0f61eac9a518bc76f5c9ed815fec04030758a10822bc0b1
company,1628167332,5 Top Industrial Stocks to Buy With Strong Potential Upside,69519422,https://s.yimg.com/uu/api/res/1.2/LHXL_mQ4csBp8jOUHZ7m4A--~B/aD00MDA7dz02MzU7YXBwaWQ9eXRhY2h5b24-/https://media.zenfs.com/en/zacks.com/f36d3fed597825aa5142f8bfa39b4d2c,DE,Yahoo,"With American industries bouncing back from the coronavirus-led drubbing it took last year, it's now prudent to invest in sound industrial stocks like Terex (TEX), Deere (DE) & A. O. Smith (AOS).",https://finnhub.io/api/news?id=691618cb5c41529840f368f0026dd4e0e1e65c9337d5911bb0c3d30292917a2a
company,1628165100,Deere acquires Bear Flag Robotics for $250M,69545889,,DE,Thefly.com,Deere & Company has s... DE,https://finnhub.io/api/news?id=5fa9070f5d7cbcef645e3c034d8bc0706923e520cbff91de240a3d62b63fcaed
company,1628157480,September 24th Options Now Available For Deere (DE),69545890,,DE,Stock Options Channel,"Staff article entitled September 24th Options Now Available For Deere (DE), about stock options, from Stock Options Channel.",https://finnhub.io/api/news?id=999c74049e27522ed57e2d48bd468d61757def62e592f5afe2b07f52138cd17b
company,1628095680,Deere & Co. stock outperforms competitors despite losses on the day,69530948,https://images.mktw.net/im-220105/social,DE,MarketWatch,"Shares of Deere & Co. slid 1.42% to $360.67 Wednesday, on what proved to be an all-around grim trading session for the stock market, with the S&P 500 Index...",https://finnhub.io/api/news?id=faf359021d80c7c7f60ecee4c461902e21f705994c8c05aee9f7f1a4ba084401
company,1628075891,5 Stocks to Gain From Continued Uptick in Factory Orders,69488604,https://s.yimg.com/uu/api/res/1.2/EH1fN.zYGpjc8jtW3svXQw--~B/aD00MDA7dz02MzU7YXBwaWQ9eXRhY2h5b24-/https://media.zenfs.com/en/zacks.com/0cc239f466e6f574dd1552e7b8fa1661,DE,Yahoo,"Invest in the likes of Schnitzer Steel (SCHN), AZZ (AZZ), Deere & Co. (DE), J & J Snack Foods (JJSF) and Bassett Furniture (BSET) as factory orders continue to increase.",https://finnhub.io/api/news?id=6b814b7c5e7e2db49dfc13299b520337c86695e5cc50642eda089c0f1459ebbf
company,1628059140,"Leverage Partners Absolute Return Fund SPC Buys Deere, Gap Inc, Microsoft Corp, Sells Dollar General Corp, The Walt Disney Co, Starbucks Corp",69489414,,DE,GuruFocus,,https://finnhub.io/api/news?id=87f3bb09045f4f38826d64267c4818df0d4f7d4912d56c66c01410d0a7c11680
company,1628051940,"Nvwm, Llc Buys JPMorgan Ultra-Short Income ETF, Thermo Fisher Scientific Inc, Invesco NASDAQ Next Gen 100 ETF, Sells iShares Gold Trust, iShares S&P Global Timber & Forestry Index Fund, Ally Financial Inc",69514389,,DE,GuruFocus,,https://finnhub.io/api/news?id=f3cbefcc105eb45190d89524eb275672869543aec8dbaa20d13856a151768993
company,1628009280,Deere & Co. stock outperforms market on strong trading day,69530949,https://images.mktw.net/im-220105/social,DE,MarketWatch,"Shares of Deere & Co. rose 2.78% to $365.86 Tuesday, on what proved to be an all-around great trading session for the stock market, with the S&P 500 Index...",https://finnhub.io/api/news?id=ceee600984afba4ad9f2aa3d66db24d1b1fc0c33448f18d9accf474d8ddde2ea
