category,datetime,headline,id,image,related,source,summary,url
company,1620896040,Fly Intel: Top five analyst downgrades,67801556,,DE,Thefly.com,Fly Intel: Top five analyst downgrades  DE LITE ATH GRAY SOLY,https://finnhub.io/api/news?id=03571e0fa787cf69db2fc4bfa61a388a79f9e7c6baa92d0a2d934cfb49624d69
company,1620895140,"Qtron Investments LLC Buys Gerdau SA, Energy Company of Minas Gerais, Banco Santander Chile, ...",67821723,,DE,GuruFocus,GuruFocus Article or News written by insider and the topic is about: ,https://finnhub.io/api/news?id=f7e7bead71f74f55274ab09a6eb6f39c964238e1a39d6d18b512a0876638c315
company,1620895140,"Robbins Farley Llc Buys Schwab US Dividend Equity ETF, Coca-Cola Co, Autodesk Inc, Sells ...",67803526,,DE,GuruFocus,GuruFocus Article or News written by insider and the topic is about: ,https://finnhub.io/api/news?id=28ec64aad35641cb86766c3baad227d0b3eeea42ecc77a48348274221f1746bb
company,1620894480,"Thursday’s Top Analyst Upgrades and Downgrades: Baker Hughes, Boeing, Cisco, Coinbase, Deere, General Dynamics, Halliburton and More",67801523,https://247wallst.com/wp-content/uploads/2021/03/imageForEntry1-nmL.jpg,DE,247WallSt,"Thursday's top analyst upgrades and downgrades included Array Technologies, Baker Hughes, Boeing, Cisco Systems, Coinbase, Deere, General Dynamics and Halliburton.",https://finnhub.io/api/news?id=74a9d93cb4d4df377dd97969ac5fd677b927f77d10ce1bf9d87ca48a5bb5081c
company,1620885300,Deere downgraded to Market Perform from Outperform at BMO Capital,67796924,,DE,Thefly.com,Deere downgraded to Market Perform from Outperform at BMO Capital BMO Capital DE,https://finnhub.io/api/news?id=46e56efcc41b95740550e437180324adaa5585b0f9f54b501438ce2c13ba7bc2
company,1620885300,Deere price target raised to $425 from $375 at Baird,67796923,,DE,Thefly.com,Deere price target raised to $425 from $375 at Baird Baird DE,https://finnhub.io/api/news?id=21b43764f92eb17cb4bee7982c44658fffa3979d9eeb6790bcab532a6a5d5450
company,1620879960,First Eagle Investment`s Top 1st-Quarter Trades,67813616,,DE,GuruFocus,"GuruFocus Article or News written by Margaret Moran and the topic is about: Firm invests in Alibaba, sells 3M",https://finnhub.io/api/news?id=e004f531962a9f8064cfa5894779e0f05d7d1ade980414da212ea6b943363d88
company,1620873540,"Korea Investment CORP Buys Uber Technologies Inc, Analog Devices Inc, Applied Materials Inc, ...",67808252,,DE,GuruFocus,GuruFocus Article or News written by insider and the topic is about: ,https://finnhub.io/api/news?id=10ad8a539f4bcb107398147fe291c74beaa43988b24cd65a1a97a46bba001224
company,1620838080,"Deere & Co. stock falls Wednesday, underperforms market",67794214,https://images.mktw.net/im-220105/social,DE,MarketWatch,"Shares of Deere & Co. slid 2.50% to $373.63 Wednesday, on what proved to be an all-around poor trading session for the stock market, with the S&P 500 Index...",https://finnhub.io/api/news?id=c950c543d0d034a9d87cff5456f6ba94a907dcd74450918630e1a8d0df55ae22
company,1620826142,"Notable Wednesday Option Activity: LEN, ALL, DE",67778498,https://www.nasdaq.com/sites/acquia.prod/files/2019-05/0902-Q19%20Total%20Markets%20photos%20and%20gif_CC8.jpg?1139561734,DE,Nasdaq,"Among the underlying components of the S&P 500 index, we saw noteworthy options trading volume today in Lennar Corp (Symbol: LEN), where a total of 15,905 contracts have traded so far, representing approximately 1.6 million underlying shares.  That amounts to about 87.3% of",https://finnhub.io/api/news?id=e0fec15ca739f8bd22c5d9fe7aa4a6eab6d5ece18e858687b80fadf195990f07
company,1620825661,"The Zacks Analyst Blog Highlights: Deere, Cognex, Rockwell Automation, ABB and Intuitive Surgical",67774415,https://s.yimg.com/uu/api/res/1.2/XvIRSQ5L_z3ea3ozZusXAw--~B/aD00MDA7dz02MzU7YXBwaWQ9eXRhY2h5b24-/https://media.zenfs.com/en/zacks.com/22ec7092c130fbbbb009806c8cb76dab,DE,Yahoo,"The Zacks Analyst Blog Highlights: Deere, Cognex, Rockwell Automation, ABB and Intuitive Surgical",https://finnhub.io/api/news?id=4851cd789bc0e62c05864f54cf21c01c91ba7da0a618714629b2cb13598d57cc
company,1620822540,Cannabis company executives saw double-digit salary gains in first quarter amid shortage of experienced workers,67792510,https://images.mktw.net/im-337393/social,DE,MarketWatch,"Experienced managers and C-suite executives in the cannabis business enjoyed double-digit salary increases in 2021 compared with 2020, according to a new...",https://finnhub.io/api/news?id=4557444c72030fcf93f0736afbda68576c159d42d13131d2f3e744781297ce77
company,1620804660,Deere price target raised to $455 from $389 at Evercore ISI,67779073,,DE,Thefly.com,Deere price target raised to $455 from $389 at Evercore ISI Evercore ISI DE,https://finnhub.io/api/news?id=c983d8d6af8965ec8c7a082a10a0306adbb3e3094d9c7ab6f924c3e6d0eda2b3
company,1620794340,"Capital Management Associates  Buys Deere, Freeport-McMoRan Inc, Pioneer Natural Resources Co, ...",67781334,,DE,GuruFocus,GuruFocus Article or News written by insider and the topic is about: ,https://finnhub.io/api/news?id=315fd37e19057377a82d281e7f630b6a3306a50681f158ee94bc227447e53845
company,1620787140,"Tower Bridge Advisors Buys United Parcel Service Inc, Intercontinental Exchange Inc, Best Buy ...",67779074,,DE,GuruFocus,GuruFocus Article or News written by insider and the topic is about: ,https://finnhub.io/api/news?id=ae9ef60f7b2afc1daa9ef4ad08d37de5c07e703af87231a655f6704a8e3d1873
company,1620751680,"Deere & Co. stock falls Tuesday, underperforms market",67794216,https://images.mktw.net/im-220105/social,DE,MarketWatch,"Shares of Deere & Co. slid 2.10% to $383.20 Tuesday, on what proved to be an all-around dismal trading session for the stock market, with the S&P 500 Index...",https://finnhub.io/api/news?id=ebb5da65501c132d41a95d46d9e374fedae63c29724b0d83ff8e4476f3bdf0a1
company,1620722340,"Birinyi Associates Inc Buys Goldman Sachs Group Inc, iShares Russell 2000 ETF, Palo Alto ...",67760543,,DE,GuruFocus,GuruFocus Article or News written by insider and the topic is about: ,https://finnhub.io/api/news?id=2a194a8e818d293c7c4cf691b3418087c0d37a05f68ddfb4019e1aa63f372534
company,1620707940,"Northeast Investment Management Buys Morgan Stanley, ASML Holding NV, ServiceNow Inc, Sells ...",67755950,,DE,GuruFocus,GuruFocus Article or News written by insider and the topic is about: ,https://finnhub.io/api/news?id=b9089dc7a8312936ad38e33262a2874c76b6950287fce1b3a5b87c5fda984460
company,1620707940,"Palisades Hudson Asset Management, L.P. Buys iShares Gold Trust, Deere, The Hartford Financial ...",67736001,,DE,GuruFocus,GuruFocus Article or News written by insider and the topic is about: ,https://finnhub.io/api/news?id=d5419ae7869e127ac0d35e23c75f355837d3a6e887b4b6ae3b476716b437c323
company,1620691800,Divorce Asset Split Starts: Melinda Gates Now Owns Stakes In These 4 Stocks,67732305,https://cdn.benzinga.com/files/imagecache/og_image_social_share_1200x630/images/story/2012/1600px-melinda_gates_co-founder_bill_and_melinda_gates_foundation_15222588424.jpeg,DE,Benzinga,The divorce between Microsoft Corporation (NASDAQ: MSFT) co-founder Bill Gates and Melinda Gates is well-publicized. The event could lead to the splitting up of a fortune worth $...,https://finnhub.io/api/news?id=d38153c512b7842348d5edcd2df5906c8d686b0a29e63f48c4c0d30b7bcb0c74
company,1620671890,"Investors are being driven out of the flashy stocks into 'boring' names as the economy grows, Jim Cramer says",67723715,https://image.cnbcfm.com/api/v1/image/106789960-1605036627852-106789960-1605017978931NYSE-Election-Day-Photo-20201103-320-jpg.jpg?v=1605036666,DE,CNBC,"""The stocks that held up today are the ones that belong to companies with products that are in strong demand,"" the ""Mad Money"" host said. ",https://finnhub.io/api/news?id=397541b0278b0022f52ad1ab412471f76243845912b8f48e86c8156be8e191d3
company,1620668997,Deere Stock Bull Put Spread Offers 39% Return Potential,67716260,,DE,Yahoo,"With Deere's 21-day moving average around 380, a bull put spread could be placed with the short put at 380 and the long put at 375.",https://finnhub.io/api/news?id=f0488f8be57838ddcbfa32b7649985f49cbe8a12946b9b503bc965e482ac8dd2
company,1620665280,Deere & Co. stock underperforms Monday when compared to competitors,67794217,https://images.mktw.net/im-220105/social,DE,MarketWatch,"Shares of Deere & Co. slumped 0.72% to $391.40 Monday, on what proved to be an all-around grim trading session for the stock market, with the S&P 500 Index...",https://finnhub.io/api/news?id=d40c0d53acca88973bf2319cb66287cc8c5db9a899b1ce88fd73ea3e9a6bb71d
company,1620645960,Stocks That Hit 52-Week Highs On Monday,67716697,https://cdn.benzinga.com/files/imagecache/og_image_social_share_1200x630/sites/all/themes/bz2/images/bz-icon.png,DE,Benzinga," 
This morning 792 companies reached new 52-week highs.
Points of Interest:

JPMorgan Chase (NYSE: JPM) was the largest company by market cap to set a new 52-week high.
The...",https://finnhub.io/api/news?id=fca861f1f6bbd5058326cfd7bbf53e1df73d052654baf2ea28deb00f6dfecdaf
company,1620639001,Everyone's Wrong About This 4.6% Dividend (It Will Double),67715849,https://www.nasdaq.com/sites/acquia.prod/files/2019-05/0902-Q19%20Total%20Markets%20photos%20and%20gif_CC8.jpg?1043742907,DE,Nasdaq,"Don't listen to the naysayers--tech stocks are set to thrive in the coming months, and the sector is still a great place for us to go hunting for big, and growing, dividends.",https://finnhub.io/api/news?id=0570959fa8be3c8e3420422898142a2cab114c4f69dfedb2991998c29d51162e
company,1620619260,Everyone`s Wrong About This 4.6% Dividend (It Will Double),67707387,,DE,The Online Investor,,https://finnhub.io/api/news?id=6511c923495db453d02cda0ce1785b643b62810091f86131927429fd9ceb7c48
company,1620618240,Deere Stock: Speculators Are Piling into Tractor Company,67723230,https://investorplace.com/wp-content/uploads/2019/11/de-stock.jpg,DE,InvestorPlace,"Analysts have been treating Deere as a tech stock lately, bidding it up over 45% so far in 2021. But it's not a tech stock.",https://finnhub.io/api/news?id=a156582de06274c8d960f3067ab2a33bd40886b94eeabd4fb3c71b31e2251c78
company,1620557820,"Barron's Picks And Pans: Hannon Armstrong, Seagate, Tesla, Virtu Financial And More",68750449,https://cdn.benzinga.com/files/imagecache/og_image_social_share_1200x630/images/story/2012/austin-distel-dfjjmvhwh_8-unsplash_2.jpg,DE,Benzinga,"This weekend's Barron's cover story helps investors to prepare for the changes ahead.
Other featured articles discuss how to invest in tomorrow's big tech trends,...",https://finnhub.io/api/news?id=701fb7fb51b92eac08ce53186269c6fe31112e4934e846c69300273f29e099a1
company,1620543900,Fly Intel: Top five weekend stock stories,67703333,,DE,Thefly.com,Fly Intel: Top five weekend stock stories STPC FEYE BP CVX COP XOM RDS.A RDS.B TOT TSLA STLA STX CTVA FMC DE AGCO MOS NKE TJX RVLV AEO,https://finnhub.io/api/news?id=2b92647084f8dcba63f8a39154c9286f58b9265aa30e5818c34b507f61bc30ff
company,1620536071,Is Now An Opportune Moment To Examine Deere & Company (NYSE:DE)?,67700083,https://www.nasdaq.com/sites/acquia.prod/files/2019-05/0902-Q19%20Total%20Markets%20photos%20and%20gif_CC8.jpg?1292082425,DE,Nasdaq,"Today we're going to take a look at the well-established Deere & Company (NYSE:DE). The company's stock    received a lot of attention from a substantial price increase on the NYSE over the last few months.    With many analysts covering the large-cap stock, we may expect an",https://finnhub.io/api/news?id=39383507a54d2c3e147b588b82bc57b7e36d12aa7a7cb1e2f7c4d42f1db7b846
company,1620478800,Want to Invest in Space? Try These ETFs,67703634,https://s.yimg.com/uu/api/res/1.2/8lQ92x8aKbIUopWEZs7Z_w--~B/aD0zNjk7dz01NTM7YXBwaWQ9eXRhY2h5b24-/https://media.zenfs.com/en/wsj.com/d2c402860e70a3f3efceeda62af50a44,DE,Yahoo,"As the options expand, investors can choose from an array of approaches.",https://finnhub.io/api/news?id=fa67ecb64998e27fb9bc8c7c62299f3a14b2a285f7d4101f449859a57bd4df6b
company,1620477071,"Deere, Thor Industries Lead Five Stocks Near Buy Points Riding Strong Trends",67689683,,DE,Yahoo,"Five stocks riding broader trends are just above or below buy points right now, including Deere, Thor Industries and MarineMax.",https://finnhub.io/api/news?id=cd4aa63fef639fd18d2a1267f4527a02e63f8e744f97b8b5dca4f53a2898b7b4
company,1620467340,"Corteva, FMC poised to ride food prices higher, Barron`s says",67691661,,DE,Thefly.com,"Corteva, FMC poised to ride food prices higher, Barron's says CTVA FMC AGCO DE MOS NTR",https://finnhub.io/api/news?id=15f9f8c47ad32fd1f2dbd16f54e90a5d4417a1b286662e752351d7404996fa49
company,1620464400,Want to Invest in Space? Try These ETFs,67692802,https://images.wsj.net/im-335863/social,DE,DowJones,"As the options expand, investors can choose from an array of approaches.",https://finnhub.io/api/news?id=8925e25aa46b8a56a14d548e10752ef7a7852a33cf3db1264922e1db9830a00b
company,1620423909,Deere (DE) Outpaces Stock Market Gains: What You Should Know,67681121,https://s.yimg.com/uu/api/res/1.2/YliGu3uiWo7T6YkWQuaEpA--~B/aD02MDE7dz05MDA7YXBwaWQ9eXRhY2h5b24-/https://media.zenfs.com/en/zacks.com/62d8c8e05376a18ba1420a1733ffdda4,DE,Yahoo,"In the latest trading session, Deere (DE) closed at $394.22, marking a +1.11% move from the previous day.",https://finnhub.io/api/news?id=77842871b989e687f6d1559c403d8f5db35bcfabc0997b3454075f339c2ca9d1
company,1620420240,6 Agricultural Stocks Poised to Ride Food Prices Higher,67685440,https://images.barrons.com/im-335969/social,DE,MarketWatch,"Prices of corn, wheat, and other agricultural commodities have been soaring. Yet some agricultural stocks have not been keeping pace. That’s created a buying...",https://finnhub.io/api/news?id=01c20b806efb20d4351519d0d7bac56dae387c5aee683eab510de7330bba31e0
company,1620407331,Should You Consider Investing in Deere and Co. (DE)?,67668709,https://s.yimg.com/uu/api/res/1.2/DotkX3cuNwkbAlz1OLIuaA--~B/aD01MDA7dz03NTA7YXBwaWQ9eXRhY2h5b24-/https://media.zenfs.com/en/insidermonkey.com/6bc1cc92d7234eea87f9a7bfa9c51abc,DE,Yahoo,"Harding Loevner, an investment management firm, published its “Global Equity Fund” first quarter 2021 investor letter – a copy of which can be downloaded here. A return of 1.68% was recorded by the fund for the Q1 of 2021, trailing the benchmark, which returned 4.68%. You can view the fund’s top 5 holdings to have […]",https://finnhub.io/api/news?id=35f4abc54464e922b5b5e7d4410adaf5a6842ce0ee3ad2f3be409efe0b3e69e2
company,1620406080,Deere & Co. stock underperforms Friday when compared to competitors despite daily gains,67685441,https://images.mktw.net/im-220105/social,DE,MarketWatch,"Shares of Deere & Co. advanced 1.11% to $394.22 Friday, on what proved to be an all-around great trading session for the stock market, with the S&P 500 Index...",https://finnhub.io/api/news?id=a4305ba903bea8455beb38a8642f2fd36c9533234cb7fc9715fdcbb3e99cb15f
company,1620384900,Barron’s Is Launching a New Way to Track the Modern Economy. Introducing the Barron’s Future Focus Stock Index.,67682487,https://images.barrons.com/im-335196/social,DE,MarketWatch,"Barron’s, in partnership with the Drucker Institute, is launching a new index to track leaders of the modern economy. How we chose 138 stocks.",https://finnhub.io/api/news?id=121fe0e5ebe21754b4272596cc07b4bb4c6791de43844acfc629b99be4ea455b
company,1620319680,Deere & Co. stock outperforms competitors on strong trading day,67685443,https://images.mktw.net/im-220105/social,DE,MarketWatch,"Shares of Deere & Co. advanced 2.92% to $389.91 Thursday, on what proved to be an all-around favorable trading session for the stock market, with the S&P 500...",https://finnhub.io/api/news?id=8a27e369cf9d4ec8133c0d6387e1ee1951986ad256235dbe0c17f7c2b6d4202f
company,1620318199,"Dow Jones Rallies To New High As Jobless Claims Fall, But Nasdaq, Small-Cap Stocks Lag",67647618,https://s.yimg.com/uu/api/res/1.2/sXTpfHUoNe9BNdytn6JOeg--~B/aD01NjM7dz0xMDAwO2FwcGlkPXl0YWNoeW9u/https://media.zenfs.com/en/ibd.com/45e589cf57b3451603fbe0c30c124ed6,DE,Yahoo,"Stocks were mixed midday Thursday, as the Dow Jones Industrial Average rallied 175 points to a new high but the Nasdaq slipped.",https://finnhub.io/api/news?id=3f216df2656fbd092b68423f3a74b4455e41848fefad5fc4d4de030239d4c6e9
company,1620302418,A Look Inside Bill Gates' Stock Portfolio Reveals His Big Winners,67622760,,DE,Yahoo,Bill Gates' divorce filing is drawing attention to his financial assets. And investors get a glimpse at his stock picks blowing away the S&P 500.,https://finnhub.io/api/news?id=235443c18abda7e08c97b9de87f900a61f3d440b11b42cf7b5f1a498b088e92f
company,1620297730,"The Zacks Analyst Blog Highlights: Caterpillar, Deere & Co, Dover Corp, Graco and Applied Industrial Technologies",67619239,https://s.yimg.com/uu/api/res/1.2/rj9rvD0uUgpZgYYbvMEcMw--~B/aD00MDA7dz02MzU7YXBwaWQ9eXRhY2h5b24-/https://media.zenfs.com/en/zacks.com/dfbf477ce67e2ca9b1c9e4b00f36cf66,DE,Yahoo,"The Zacks Analyst Blog Highlights: Caterpillar, Deere & Co, Dover Corp, Graco and Applied Industrial Technologies",https://finnhub.io/api/news?id=9fe8e29e6b69c035d995b958bd4421ba5b59fd5b1e33f82fdb9e0815dda10834
company,1620290340,"Marietta Wealth Management, LLC Buys BP PLC, Applied Materials Inc, BTC iShares Floating Rate ...",67647750,,DE,GuruFocus,GuruFocus Article or News written by insider and the topic is about: ,https://finnhub.io/api/news?id=74a0b7e16433ce72d1fb28a06fb184149508eab16228f4babb04107bce181c11
company,1620243441,"Deere Near Buy Point After 300% Run; ARK's Cathie Wood Owns It, Too",67609652,,DE,Yahoo,"Farm equipment giant Deere, featured in today's IBD 50 Stocks To Watch, is not your grandfather's stodgy old-school stock.",https://finnhub.io/api/news?id=370715d4b866a14382d108556de9ddb873b4b038541a6861c0c73a8d23707f2c
company,1620233280,Deere & Co. stock underperforms Wednesday when compared to competitors,67685444,https://images.mktw.net/im-220105/social,DE,MarketWatch,"Shares of Deere & Co. sank 0.19% to $378.86 Wednesday, on what proved to be an all-around favorable trading session for the stock market, with the S&P 500...",https://finnhub.io/api/news?id=c02c693c2653c5bd5708917105e2348321a987f0b58ae909c718cf3c586399c9
company,1620227820,The Bill And Melinda Gates Divorce: $130B And More Is At Stake,67630063,https://cdn.benzinga.com/files/imagecache/og_image_social_share_1200x630/images/story/2012/gates_3.jpg,DE,Benzinga,"When Microsoft (NASDAQ: MSFT) co-founder and ex-CEO Bill Gates announced the end of his marriage to Melinda Gates, he requested “space and privacy for our family as we begin...",https://finnhub.io/api/news?id=6037fe0b4c65f9b25d7d142390f9df9c006f5234e82119918cf9309149f1910c
company,1620213371,U.S. Manufacturing Activity Continues to Expand: 5 Winners,67563515,,DE,Yahoo,"People have been spending more on goods than services during the pandemic which is giving a boost to manufacturing activity which is helping stocks like Caterpillar (CAT), Deere & Company (DE) and Dover Corporation (DOV).",https://finnhub.io/api/news?id=de9161e927f73610d6263609362b8061dbe482473d6729572e8d7f06611d7599
company,1620203940,"Bridges Investment Management Inc Buys Texas Pacific Land Corp, American Tower Corp, BWX ...",67605854,,DE,GuruFocus,GuruFocus Article or News written by insider and the topic is about: ,https://finnhub.io/api/news?id=731d5fae1239c8786cb3519bb42f1947d6cce90c88442ad65d4f5f099141c116
company,1620167651,Was The Smart Money Right About Piling Into Deere & Company (DE)?,67511495,https://s.yimg.com/uu/api/res/1.2/FmSSxeqSQ87cFOMD0sYeWw--~B/aD02MDA7dz00NTA7YXBwaWQ9eXRhY2h5b24-/https://media.zenfs.com/en/insidermonkey.com/aac5937a7353b9570945eaf65ba53916,DE,Yahoo,"Most investors tend to think that hedge funds and other asset managers are worthless, as they cannot beat even simple index fund portfolios. In fact, most people expect hedge funds to compete with and outperform the bull market that we have witnessed in recent years. However, hedge funds are generally partially hedged and aim at […]",https://finnhub.io/api/news?id=bb3054349d78ea9e900c373749b34cc968fde476fdd27d553d0cf81c8708416d
company,1620146880,"Deere & Co. stock rises Tuesday, outperforms market",67685445,https://images.mktw.net/im-220105/social,DE,MarketWatch,"Shares of Deere & Co. advanced 1.55% to $379.58 Tuesday, on what proved to be an all-around mixed trading session for the stock market, with the Dow Jones...",https://finnhub.io/api/news?id=744aa04858b60c96c15725ebe590d34e258ff47f9aba29afe21e8b3ffc58e5cb
company,1620142107,"Noteworthy Tuesday Option Activity: DAL, GRWG, DE",67484171,https://www.nasdaq.com/sites/acquia.prod/files/2019-05/0902-Q19%20Total%20Markets%20photos%20and%20gif_CC8.jpg?984523499,DE,Nasdaq,"Among the underlying components of the Russell 3000 index, we saw noteworthy options trading volume today in Delta Air Lines Inc  (Symbol: DAL), where a total of 71,589 contracts have traded so far, representing approximately 7.2 million underlying shares.  That amounts to abou",https://finnhub.io/api/news?id=9c736836717a9e441bfc76318267222076d8d870c72b7167bb08bad4bdfe614a
company,1620137820,"Agriculture is ‘only in the early innings’ of a bullish upcycle, says Putnam Investment",67603549,https://images.mktw.net/im-333928/social,DE,MarketWatch,"China is buying up U.S. corn and soybeans again, but that's not the only reason why Putnam Investments is the most bullish it's been on agriculture since...",https://finnhub.io/api/news?id=5b10c1d5e9c06135ac80bc72983c09091a2f1e2f4ecc7c8970a1ba7936cc493d
company,1620124740,"Gunderson Capital Management Inc. Buys Deere, Dow Inc, Corteva Inc, Sells Advanced Micro ...",67468646,,DE,GuruFocus,GuruFocus Article or News written by insider and the topic is about: ,https://finnhub.io/api/news?id=923740deeb8d2d1cda99c5848bbbf466dc4002572f4a2d6b619d3b3d569311b7
company,1620118800,Fast Company Names John Deere a Winner of its 2021 World Changing Ideas Awards,67454850,https://s.yimg.com/uu/api/res/1.2/aLilQRESwpWYciPCA_1Riw--~B/aD0yNjc7dz00MDA7YXBwaWQ9eXRhY2h5b24-/https://media.zenfs.com/en/prnewswire.com/7c5625bfe7c212b25cac737e123e7de3,DE,Yahoo,"John Deere (NYSE: DE) believes farmers can make the world better. To recognize the company's recent work with smallholder farm families in northern Nigeria to unlock their potential to sustain themselves and those around them, Fast Company selected John Deere as the Winner in the Corporate Social Responsibility category of the 2021 World Changing Ideas Awards.",https://finnhub.io/api/news?id=9081eabf48b3ad09b86fc2eadd94c3e7fac7d93062b1124dd35c7082fea0dbba
company,1620111600,"bidadoo Continues International Expansion with Canadian Industry Veterans, Record Demand Fuels Online Marketplace Growth",67439340,,DE,PR Web,Looking for stock market analysis and research with proves results? Zacks.com offers in-depth financial research with over 30years of proven results.,https://finnhub.io/api/news?id=689cab0a30ec37222ce55ff9baeae7ce6f0ef9d257801b1116243d04ba951d28
company,1620111409,Here's Why I Think Deere (NYSE:DE) Might Deserve Your Attention Today,67454852,https://s.yimg.com/uu/api/res/1.2/DhUm7_fsRB3iB.QuO44ylA--~B/aD00MzI7dz0xMTk0O2FwcGlkPXl0YWNoeW9u/https://media.zenfs.com/en/simply_wall_st__316/66c3209cd42fcb6666461634077a457f,DE,Yahoo,"It's only natural that many investors, especially those who are new to the game, prefer to buy shares in 'sexy' stocks...",https://finnhub.io/api/news?id=fe1e39ab25593dac9d0885bcb65c14471ffaf92f1e61effa935cde3135bc33ca
company,1620104400,Fast Company Names John Deere a Winner of its 2021 World Changing Ideas Awards,67442178,,DE,PR Newswire,Looking for stock market analysis and research with proves results? Zacks.com offers in-depth financial research with over 30years of proven results.,https://finnhub.io/api/news?id=99fca65aa137cb8b5b0e2d58b7810c26049d93c241cd1c6aba1212e5d6a59e66
