category,datetime,headline,id,image,related,source,summary,url
company,1624295407,FUTY: Utilities Dashboard For June,68405343,https://static.seekingalpha.com/cdn/s3/uploads/getty_images/157586989/medium_image_157586989.jpg,ED,SeekingAlpha,"A dashboard with industry metrics in utilities. Value and quality scores, and their evolution since last month.",https://finnhub.io/api/news?id=259970d86cc7a85c9f8a76fe42cb3f877931e08df5cd99512eee177cd6139f19
company,1624294260,"Consolidated Edison Inc. stock rises Monday, still underperforms market",68413414,https://images.mktw.net/im-220105/social,ED,MarketWatch,"Shares of Consolidated Edison Inc. inched 0.94% higher to $75.19 Monday, on what proved to be an all-around positive trading session for the stock market,...",https://finnhub.io/api/news?id=0c5bd0322b998f93753b512e36ae0b39b9fbe12ad4b4b3f0a53e2b21c3cbeeb6
company,1624264134,"Pre-Market Most Active for Jun 21, 2021 :  MNOV, AMC, WISH, ORPH, AHT, SQQQ, SOS, F, AAPL, CLNE, RLX, EDU",68471478,https://www.nasdaq.com/sites/acquia.prod/files/2019-05/0902-Q19%20Total%20Markets%20photos%20and%20gif_CC8.jpg?706023325,ED,Nasdaq,"The NASDAQ 100 Pre-Market Indicator is down -1.95 to 14,047.63.  The total Pre-Market volume is currently 23,148,495 shares traded.The following are the most active stocks for the pre-market session: MediciNova, Inc. (MNOV) is +1.56 at $5.32, with 5,343,657 shares traded., follow",https://finnhub.io/api/news?id=6e34114c818f885e693cc48b3adcffd9a1cf7a4700c8e0d698317a97419f5373
company,1624258800,NextEra Energy: ESG Enthusiasm Has Led To Overvaluation,68393875,https://static.seekingalpha.com/cdn/s3/uploads/getty_images/1220875999/medium_image_1220875999.jpg,ED,SeekingAlpha,"NextEra has attracted huge investment flows thanks to leading the way on ESG principles. Unfortunately, NEE's underlying earnings haven't kept up with the stock price.",https://finnhub.io/api/news?id=88b9961af7199630a96bc57c415987ea5e4309305527b75c49c61687a7ba2d49
company,1624182985,65 Dividend Aristocrats Show 3 Ready Buys For June,68386222,https://static.seekingalpha.com/cdn/s3/uploads/getty_images/1182951913/medium_image_1182951913.jpg,ED,SeekingAlpha,"Dividend Aristocrats in the S&P 500 Index have raised their annual payouts every year for at least 25 years. My top-ten yields are from WBA, ED, AMCR, O, PBCT, IBM, ABBV, CVX, XOM, & T.",https://finnhub.io/api/news?id=1d1bb91748d7dae7fb989df190a56aec1468751c771b85414376ff4358524102
company,1624035060,Consolidated Edison Inc. stock outperforms competitors despite losses on the day,68413415,https://images.mktw.net/im-220105/social,ED,MarketWatch,"Shares of Consolidated Edison Inc. slid 2.35% to $74.49 Friday, on what proved to be an all-around poor trading session for the stock market, with the S&P...",https://finnhub.io/api/news?id=5e0b9ea364df280d6f9b41ff58e41d70d471df7a088cefeb5ca95b5320237d47
company,1624031927,Consolidated Edison Breaks Below 200-Day Moving Average - Notable for ED,68368864,https://www.nasdaq.com/sites/acquia.prod/files/2019-05/0902-Q19%20Total%20Markets%20photos%20and%20gif_CC8.jpg?668874908,ED,Nasdaq,"In trading on Friday, shares of Consolidated Edison Inc (Symbol: ED) crossed below their 200 day moving average of $74.95, changing hands as low as $74.82 per share.  Consolidated Edison Inc shares are currently trading off about 1.5% on the day.  The chart below shows the one",https://finnhub.io/api/news?id=8e89366001d74030bca4d1096027be2fbdecb98803f8ccea639629d2ffc286ec
company,1623985080,Consolidated Edison Breaks Below 200-Day Moving Average - Notable for ED,68363600,,ED,Energy Stock Channel,"energy stock channel,ED,",https://finnhub.io/api/news?id=2196595070335eac07cc60daf60bf2ed2effbfa863403951fc60a9ff94331c18
company,1623948660,Consolidated Edison Inc. stock underperforms Thursday when compared to competitors despite daily gains,68348446,https://images.mktw.net/im-220105/social,ED,MarketWatch,"Shares of Consolidated Edison Inc. inched 0.08% higher to $76.28 Thursday, on what proved to be an all-around dismal trading session for the stock market,...",https://finnhub.io/api/news?id=9bb3ffba395cdb25fae64f40ebd154a75a97da512d772872785fc2ff39d0c5f8
company,1623929500,February 2022 Options Now Available For Consolidated Edison (ED),68356451,https://www.nasdaq.com/sites/acquia.prod/files/2019-05/0902-Q19%20Total%20Markets%20photos%20and%20gif_CC8.jpg?2021046265,ED,Nasdaq,"Investors in Consolidated Edison Inc (Symbol: ED) saw new options become available today, for the February 2022 expiration.  One of the key data points that goes into the price an option buyer is willing to pay, is the time value, so with 246 days until expiration the newly ava",https://finnhub.io/api/news?id=72bdb7ef99b550bf12655c009845068ff1a426ea59850e68b5840b71db841720
company,1623925860,February 2022 Options Now Available For Consolidated Edison (ED),68334350,,ED,Stock Options Channel,"Staff article entitled February 2022 Options Now Available For Consolidated Edison (ED), about stock options, from Stock Options Channel.",https://finnhub.io/api/news?id=b37017477ebf576fd0c5f48cc4bb47514edbd198f0237ded3ceda1c29c6e025d
company,1623862260,"Consolidated Edison Inc. stock falls Wednesday, underperforms market",68348447,https://images.mktw.net/im-220105/social,ED,MarketWatch,"Shares of Consolidated Edison Inc. slid 1.97% to $76.22 Wednesday, on what proved to be an all-around poor trading session for the stock market, with the S&P...",https://finnhub.io/api/news?id=628e626940a20eff57f17366f0c6034be32a1536843f4f84ecccee459a6d9e3c
company,1623841200,MLP Monthly Report: June 2021,68301635,https://static.seekingalpha.com/cdn/s3/uploads/getty_images/1215727712/medium_image_1215727712.jpg,ED,SeekingAlpha,"Midstream MLPs, as measured by the Solactive MLP Infrastructure Index, increased 6.84% last month. The index has increased by 42.76% since last May.",https://finnhub.io/api/news?id=2930a01032a9e73e7afe56f3db626e7a944d5ef37b2e695136de740689748bf0
company,1623831240,Consolidated Edison 10.1M share Spot Secondary priced at $76.90,68301590,,ED,Thefly.com,Consolidated Edison 10.1M share Spot Secondary priced at $76.90 ED,https://finnhub.io/api/news?id=64bf9a16d950220b7f50dcea7c57b9a7a00ab8fa006313821a42eecdde96143c
company,1623830400,Midstream/MLPs Reap Benefits From Selective Divestitures,68298420,,ED,SeekingAlpha,,https://finnhub.io/api/news?id=8e5cc1f9229a2df57ca85c65b8091f2a5788cefdc53c2f54e705bc6fc2e0dcaf
company,1623830040,A Look Into Consolidated Edison's Debt,68749083,https://cdn.benzinga.com/files/imagecache/og_image_social_share_1200x630/sites/all/themes/bz2/images/bz-icon.png,ED,Benzinga," 
Over the past three months, shares of Consolidated Edison (NYSE:ED) moved higher by 6.58%. Before we understand the importance of debt, let us look at how much debt...",https://finnhub.io/api/news?id=fb432f682dbb59d65c8b1bc5068915207bc5670188639efa9cb8afc9220ecf30
company,1623827400,19 Blue Chip Stocks To Hold Forever,68316279,,ED,TalkMarkets,Content,https://finnhub.io/api/news?id=98d2a001f775884c13c6d004feaa3faf06f76ceeb2080e67778a658719a66631
company,1623789600,Con Edison Announces Public Offering Of Common Shares,68289633,https://s.yimg.com/uu/api/res/1.2/abaRp715JglQ7D5BygzEQg--~B/aD0xNjt3PTE2O2FwcGlkPXl0YWNoeW9u/https://media.zenfs.com/en/prnewswire.com/b6a4cf44cac0169109f6257e27709c71,ED,Yahoo,"Consolidated Edison, Inc. (""Con Edison"") (NYSE: ED) announced today it has agreed to issue 10,100,000 of its common shares. These common shares are being offered by Barclays under Con Edison's effective shelf registration statement filed with the Securities and Exchange Commission (the ""Commission""). The underwriter may offer the common shares in transactions on the New York Stock Exchange LLC, in the over-the-counter market or through negotiated transactions at market prices or at negotiated pr",https://finnhub.io/api/news?id=3f753227b4bcde92523977d9ba2a1ba2056e6d71389577bb1538eaddfa90f83d
company,1623775860,"Consolidated Edison Inc. stock remains steady Tuesday, still outperforms market",68304103,https://images.mktw.net/im-220105/social,ED,MarketWatch,"Shares of Consolidated Edison Inc. were unchanged Tuesday, on what proved to be an all-around poor trading session for the stock market, with the S&P 500...",https://finnhub.io/api/news?id=ea3556fa692576ea3ca7a8e222366e574e8a1d418a6f357d5f11027326e3d17d
company,1623775200,Con Edison Announces Public Offering Of Common Shares,68292158,,ED,PR Newswire,Looking for stock market analysis and research with proves results? Zacks.com offers in-depth financial research with over 30years of proven results.,https://finnhub.io/api/news?id=46d0168727ae64a7a5515b5eb2e468c5d20b79e9f4066cfea0c5fedabc177ca5
company,1623728520,Consolidated Edison announces offering of 10.1M common shares,68292160,,ED,Thefly.com,Consolidated Edison announces offering of 10.1M common shares ED,https://finnhub.io/api/news?id=e3c9364ea21fe4f29d53fac27b77f4ffc80064eee66a4cdee4abe0dceaed44cb
company,1623689460,"Consolidated Edison Inc. stock rises Monday, outperforms market",68304104,https://images.mktw.net/im-220105/social,ED,MarketWatch,"Shares of Consolidated Edison Inc. inched 0.67% higher to $77.75 Monday, on what proved to be an all-around mixed trading session for the stock market, with...",https://finnhub.io/api/news?id=8bebfd34652a5b4f15f728cfac863e57b17e04af48273a1303cddf149233031f
company,1623649200,Consolidated Edison price target raised to $78 from $68 at Mizuho,68259263,,ED,Thefly.com,Consolidated Edison price target raised to $78 from $68 at Mizuho Mizuho ED,https://finnhub.io/api/news?id=24eb22943023536ba0a2bce1fbb1292d27f495aa2aca82b77a0396cb0c6f3af4
company,1623572229,"Have Insiders Been Buying Consolidated Edison, Inc. (NYSE:ED) Shares This Year?",68243142,https://s.yimg.com/uu/api/res/1.2/naUy9BSoI62CZsfZfNs5GQ--~B/aD00MzI7dz0xMTk0O2FwcGlkPXl0YWNoeW9u/https://media.zenfs.com/en/simply_wall_st__316/e44b48510541f08ce6d7c1a7b2f6b239,ED,Yahoo,We've lost count of how many times insiders have accumulated shares in a company that goes on to improve markedly. The...,https://finnhub.io/api/news?id=283d04052ef191254b45666ce2df63cc17dbd8116ec1d089fba29bf4b47247e8
company,1623571334,June's 40-Year-Plus Annual Dividend Boosters,68241134,https://static.seekingalpha.com/cdn/s3/uploads/getty_images/1173954887/medium_image_1173954887.jpg,ED,SeekingAlpha,3 of the 66 40-year dividend hiking stocks showed annual dividends from a $1K investment exceeding their single share price. 66 select dividend stocks ranged 0.70% to 6.86% in annual yield,https://finnhub.io/api/news?id=ffe6c941f4cfb504f7d8e878877ab0da1334f37b9cd96e5789ebd2ff6ba69b6a
company,1623558167,The Stocks To Focus On Today,68238718,https://static.seekingalpha.com/cdn/s3/uploads/getty_images/949211586/medium_image_949211586.jpg,ED,SeekingAlpha,Inflation is here; and that means these groups ought to be on your radar. The best stocks within every sector now.,https://finnhub.io/api/news?id=11851a7d3519b8540b9cab305fd7732f311c2c186dfc9c5beb709ba3c6f53a8c
company,1623493790,Dividend Champion And Contender Highlights: Week Of June 13,68233035,https://static.seekingalpha.com/cdn/s3/uploads/getty_images/1072593728/medium_image_1072593728.jpg,ED,SeekingAlpha,A weekly summary of dividend activity for Dividend Champions and Contenders. Click here to find out the companies with upcoming ex-dividend dates and with upcoming pay dates.,https://finnhub.io/api/news?id=963275f3cc30b8e0804fbb7abd7f054592f5e9de22e42b40a2e4bc9c881ec67b
company,1623428820,"Con Edison Is East's Top Energy Company When It Comes To Diversity, Says Group",68205981,https://s.yimg.com/uu/api/res/1.2/Ox_MmmpLw9wYWrNiS1Bn8w--~B/aD0zMDA7dz00MDA7YXBwaWQ9eXRhY2h5b24-/https://media.zenfs.com/en/prnewswire.com/cc971b7c2395215a2c119dd68d6becd5,ED,Yahoo,"Con Edison has been ranked the top energy company in the eastern United States when it comes to commitment to diversity, equality and inclusion.",https://finnhub.io/api/news?id=59b156f3445539bafa6458e83df29888b1053934ebf547ba468a12fe9291af9a
company,1623422690,10 Best Dividend Stocks to Buy According to Billionaire George Soros,68200221,https://s.yimg.com/uu/api/res/1.2/hRc5luGTyodU5ft6BJx3hg--~B/aD02MDA7dz00NDk7YXBwaWQ9eXRhY2h5b24-/https://media.zenfs.com/en/insidermonkey.com/66756118a0a6fa0793c6d7eaac10ee23,ED,Yahoo,"In this article, we discuss the 10 best dividend stocks to buy according to billionaire George Soros. If you want to skip our detailed analysis of Soros’ history and hedge fund performance, go directly to the 5 Best Dividend Stocks to Buy According to Billionaire George Soros. Legendary hedge fund manager George Soros is one […]",https://finnhub.io/api/news?id=852f66e40b3c412697512a3f6a2c038059487be33ab770d98e1f5d3b80a8f0d3
company,1623420857,Investing in the Pipeline Industry,68356452,https://www.nasdaq.com/sites/acquia.prod/files/2019-05/0902-Q19%20Total%20Markets%20photos%20and%20gif_CC8.jpg?1251878196,ED,Nasdaq,"In this episode of Industry Focus: Energy, The Motley Fool Canada's Nate Parmelee joins the show to break down the pipeline industry and look at an ongoing bidding war between Pembina Pipeline (NYSE: PBA) and Brookfield Infrastructure (NYSE: BIP) for ownership of the pipeline ass",https://finnhub.io/api/news?id=8e2797a0fe2bc79a1f82ace10e8977414baa0eb97a01716fe2f1994928beda9f
company,1623414420,"Con Edison Is East's Top Energy Company When It Comes To Diversity, Says Group",68205314,,ED,PR Newswire,Looking for stock market analysis and research with proves results? Zacks.com offers in-depth financial research with over 30years of proven results.,https://finnhub.io/api/news?id=699d1e97e5e0b81913fb58ec144ea0b048aa4539f163cca83c55ad8626c299f0
company,1623382009,Returns On Capital At Consolidated Edison (NYSE:ED) Have Stalled,68356454,https://www.nasdaq.com/sites/acquia.prod/files/2019-05/0902-Q19%20Total%20Markets%20photos%20and%20gif_CC8.jpg?1448292886,ED,Nasdaq,"If we want to find a potential multi-bagger, often there are underlying trends that can provide clues.  In a perfect world, we'd like to see a company investing more capital into its business and ideally the returns earned from that capital are also increasing.  Basically this m",https://finnhub.io/api/news?id=dc5393c21458b6c64d0eb0b5594cc62441f2ff7b54fa31fde5c3a3e72970579c
company,1623257460,"Consolidated Edison Inc. stock rises Wednesday, outperforms market",68174854,https://images.mktw.net/im-220105/social,ED,MarketWatch,"Shares of Consolidated Edison Inc. inched 0.77% higher to $76.88 Wednesday, on what proved to be an all-around dismal trading session for the stock market,...",https://finnhub.io/api/news?id=a210a054192879851c7de58d37ff1c7976d41620f98ee73ac24d6eaf06256614
company,1623171060,Consolidated Edison Inc. stock underperforms Tuesday when compared to competitors,68174855,https://images.mktw.net/im-220105/social,ED,MarketWatch,"Shares of Consolidated Edison Inc. slid 1.32% to $76.29 Tuesday, on what proved to be an all-around mixed trading session for the stock market, with the S&P...",https://finnhub.io/api/news?id=c08e65b2f6d39b7fa7f29eab2db2bab2bf95f8d4db2a776f270550d05f9c9ac5
company,1623084600,Consolidated Edison Inc. stock outperforms market on strong trading day,68174856,https://images.mktw.net/im-220105/social,ED,MarketWatch,"Shares of Consolidated Edison Inc. inched 0.09% higher to $77.31 Monday, on what proved to be an all-around dismal trading session for the stock market, with...",https://finnhub.io/api/news?id=fd1e07b3acacf09f2149726c799fe06e2165f7caafea9b9fb731747ef295ebb0
company,1623078737,"Weekly Midstream Review For June 4, 2021",67994856,https://static.seekingalpha.com/cdn/s3/uploads/getty_images/489194691/medium_image_489194691.jpg,ED,SeekingAlpha,Midstream indices have risen for eight consecutive months and in eight of the past nine weeks. Read more here on the prospects for continued midstream outperformance.,https://finnhub.io/api/news?id=983cdbb8f7769b4950b2d30e3ee9fb738ce0e1f3dceb50442574cb08bf8d4f63
company,1622959260,Consolidated Edison Stock Is Believed To Be Fairly Valued,67997161,,ED,GuruFocus,GuruFocus Article or News written by GF Value and the topic is about: ,https://finnhub.io/api/news?id=ec7c7515c39c04502db0418f5dcfea847b804ecd4d8ace403add216c3da0af99
company,1622648100,These High-Yield Dividend Stocks Are Making a Needle-Moving Swap,68040144,https://s.yimg.com/uu/api/res/1.2/BpIyvZz3zT6WbFObfzzFXw--~B/aD05MzM7dz0xNDAwO2FwcGlkPXl0YWNoeW9u/https://media.zenfs.com/en/motleyfool.com/26949f6427dfbd1ae2aa6f1168577dd0,ED,Yahoo,The transaction boosts the growth prospects of the buyer while enhancing the sellers' balance sheets.,https://finnhub.io/api/news?id=e96b6b6a282f1f4974e7b55803cd2a8edd9bfd7da8b1341ade3f102ca3a96a64
company,1622646240,Con Edison Invests In Summer Reliability While Leading The Clean Energy Transition,68096280,https://s.yimg.com/uu/api/res/1.2/PyVw0PuCFcFf1idtEVtB0A--~B/aD0yODg7dz00MDA7YXBwaWQ9eXRhY2h5b24-/https://media.zenfs.com/en/prnewswire.com/3d833a19c46125613bccd51c748a0ace,ED,Yahoo,Con Edison has completed projects throughout New York City and Westchester County to maintain its industry-leading reliability while continuing to lead the state's shift toward renewables and other clean technologies.,https://finnhub.io/api/news?id=097aa1cad032b5e028d6ca5ef8282eed7b543dafec15a3b1b82513f0f1853e19
company,1622633766,Kinder Morgan to Snap up Stagecoach Gas for $1.2B,68040149,https://s.yimg.com/uu/api/res/1.2/McUtmOzbL4h7JljJ1Xv4fA--~B/aD01MzU7dz04NTA7YXBwaWQ9eXRhY2h5b24-/https://media.zenfs.com/en/smarteranalyst_347/e40847253c0e8c6138b8b2018dc079ec,ED,Yahoo,"Kinder Morgan (KMI) has tabled a $1.225 billion acquisition bid for Stagecoach Gas Services, a unit owned jointly by Consolidated Edison (ED) and Crestwood Equity (CEQP). The transaction should close in the third quarter, subject to regulatory approval under the Hart-Scott-Rodino Act. The unit that Kinder Morgan is acquiring consists of 4 storage facilities for the natural gas pipeline network. The purchase bid represents about ten times Stagecoach’s 2020 EBITDA. The acquisition should allow Kin",https://finnhub.io/api/news?id=28547b1e5859eddef5bff8d06f7de3afbde7883568a32a45505e780b22c50ab0
company,1622633700,These High-Yield Dividend Stocks Are Making a Needle-Moving Swap,67999240,https://www.nasdaq.com/sites/acquia.prod/files/2019-05/0902-Q19%20Total%20Markets%20photos%20and%20gif_CC8.jpg?409195823,ED,Nasdaq,"Kinder Morgan (NYSE: KMI) has agreed to acquire Stagecoach Gas Services, a natural gas pipeline and storage joint venture currently owned by Consolidated Edison (NYSE: ED) and Crestwood Equity Partners (NYSE: CEQP). It's paying $1.225 billion in cash for Stagecoach, which compris",https://finnhub.io/api/news?id=77f216422373479fbc362d2488a8907781fb93500f088637ca633021d84efaf3
company,1622631840,Con Edison Invests In Summer Reliability While Leading The Clean Energy Transition,67997163,,ED,PR Newswire,Looking for stock market analysis and research with proves results? Zacks.com offers in-depth financial research with over 30years of proven results.,https://finnhub.io/api/news?id=e6d389f7b68306d9e8e123823b0e37216edcc1e1591a7443ff159f5a0bda501c
company,1622618108,Kinder Morgan to Snap up Stagecoach Gas for $1.2B,67999241,https://www.nasdaq.com/sites/acquia.prod/files/2019-05/0902-Q19%20Total%20Markets%20photos%20and%20gif_CC8.jpg?1454745091,ED,Nasdaq,"Kinder Morgan (KMI) has tabled a $1.225 billion acquisition bid for Stagecoach Gas Services, a unit owned jointly by Consolidated Edison (ED) and Crestwood Equity (CEQP). The transaction should close in the third quarter, subject to regulatory approval under the Hart-Scott-Rodino Act.

The unit that Kinder Morgan is acquiring consists of 4 storage facilities for the natural gas pipeline network. The purchase bid represents about ten times Stagecoach’s 2020 EBITDA. The acquisition should allow Kinder Morgan to enhance service delivery to customers in the Northeast market.  (See Kinder Morgan stock analysis on TipRanks).

""These natural gas pipeline and storage facilities help connect natural gas supply sources and Northeast demand areas. Natural gas has long been responsible for providing heat and hot water to homes and businesses in the Northeast, and it now has an increasingly vital role as a reliable, low emissions partner backing up growing renewable power generation,"" said Kimberly Watson, KMI's head of Interstate Natural Gas Pipelines. (See Crestwood Equity stock analysis on TipRanks).

Last week, Morgan Stanley analyst Devin McDermott downgraded Kinder Morgan to a Sell citing near-term pandemic headwinds.

“Model adjustments to reflect temporary Winter Storm Uri benefits and certain near-term pandemic headwinds (weaker refined product volumes, lower Jones Act tanker renewal rates) largely wash out from a valuation perspective and unchanged resulting DCF fair value screens more consistent with the Underweight grouping,” McDermott stated.

The analyst has a price target of $18 on the stock, implying 2.76% downside potential to current levels.

Consensus among analysts on Wall Street is a Hold based on 1 Buy, 7 Hold, and 2 Sell ratings. The average analyst price target of $17.44 implies 5.78% downside potential to current levels.

KMI scores a 5 out of 10 on TipRanks’ Smart Score rating system, suggesting that the stock is likely to perform in line with market averages.



Related News:
Cloudera Agrees to $5.3B Private Equity Buyout; Stock Up 24%
Coinbase Card Comes to Apple Pay and Google Pay
Apple to Launch Podcast Subscription Service in June - Report",https://finnhub.io/api/news?id=e910405bd63385ac49715f39ac944582ed67e1648040fe8ce90600baa6b44f3a
company,1622562560,"Energy Sector Update for 06/01/2021: EQNR,XOM,DVN,CEQP,ED,KMI,PBA,PPL.TO,IPL.TO,BIP,BIP-UN.TO",67960945,https://www.nasdaq.com/sites/acquia.prod/files/2019-05/0902-Q19%20Total%20Markets%20photos%20and%20gif_CC8.jpg?414151588,ED,Nasdaq,"Energy stocks extended Tuesday's surge late in the afternoon, with the NYSE Energy Sector Index up 3.3%, the SPDR Energy Select Sector ETF (XLE) climbing 3.6% and the Philadelphia Oil Service Sector index rallying 4.4%. The Dow Jones US Utilities Index fell 0.5%.",https://finnhub.io/api/news?id=85080805dfc085889e2e3a050bab907930ef275416bc9f1602b2262c7801b72b
company,1622560312,Kinder Morgan to buy Stagecoach Gas Services for $1.23 billion,67959416,https://static.reuters.com/resources/r/?m=02&d=20210601&t=2&i=1564098541&r=LYNXNPEH501T3,ED,Reuters,Kinder Morgan Inc said on Tuesday it has agreed to buy Stagecoach Gas Services LLC for $1.23 billion as the pipeline operator looks to expand into the northeast U.S. market.,https://finnhub.io/api/news?id=ab25b5282ca1aec38265dfb7884400f60d10b9922912c1a9d8b78fc1980be28e
company,1622552700,Crestwood and Con Edison Announce Divestiture of Stagecoach Gas Services,68040155,https://s.yimg.com/uu/api/res/1.2/BLhBDTLBrm.aMo3o.BfzSw--~B/aD04Mjt3PTQwMDthcHBpZD15dGFjaHlvbg--/https://media.zenfs.com/en/prnewswire.com/74ef9b0479f0c8afe76810157a97b8e2,ED,Yahoo,"Crestwood Equity Partners LP (NYSE: CEQP) (""Crestwood"") and Consolidated Edison, Inc. (NYSE: ED) (""Con Edison"") today announced that their subsidiaries entered into a purchase and sale agreement to divest Stagecoach Gas Services LLC (""Stagecoach""), to a subsidiary of Kinder Morgan, Inc. (NYSE: KMI) for $1.225 billion. The cash proceeds from the divestiture will be split pro rata between Crestwood and Con Edison in line with each member's 50% ownership interest in the joint venture. The agreement was signed on May 31, 2021 and is subject to two closing periods. The first closing consists of the transfer of the Stagecoach subsidiaries (with the exception of Twin Tier Pipeline LLC) valued at $1.195 billion, and is expected to occur following approval under Hart-Scott-Rodino, during the third quarter of 2021.",https://finnhub.io/api/news?id=1ece7d1ede01f2ede56cfffa48e0630e1a4708de8327abbbce291c2a0721d8b8
company,1622552554,"Energy Sector Update for 06/01/2021: DVN,CEQP,ED,KMI,PBA,PPL.TO,IPL.TO,BIP,BIP-UN.TO",67962788,https://www.nasdaq.com/sites/acquia.prod/files/2019-05/0902-Q19%20Total%20Markets%20photos%20and%20gif_CC8.jpg?2016847966,ED,Nasdaq,"Energy stocks were surging this afternoon, overtaking big gains earlier Tuesday in commodity prices. At last look, the NYSE Energy Sector Index climbing 2.8% while the SPDR Energy Select Sector ETF was up 3.3%.",https://finnhub.io/api/news?id=22f0e51eb32251ef463e3790ec4244f6f3bec49793364e26dfdd88be89db7236
company,1622278800,Options Income Series: How To Earn 10% Consistently - May 2021,67941662,https://static.seekingalpha.com/cdn/s3/uploads/getty_images/1313760522/medium_image_1313760522.jpg,ED,SeekingAlpha,We explain why selling cash-covered puts and covered calls is a safe way to earn income. Here are four lists of ten stocks that would be suitable option plays to generate consistent income.,https://finnhub.io/api/news?id=d2e9a613dbc27cebd59cf24241bd71134ac8cf8f23fa1252c2ffbe83b084b884
company,1622139406,The Top Stocks You Can Buy Now,67932458,https://static.seekingalpha.com/cdn/s3/uploads/getty_images/998851206/medium_image_998851206.jpg,ED,SeekingAlpha,"Market leadership by sector and market cap. Sectors remain tilted toward mid-cycle ideas. However, stock-specific ideas are available in every basket.",https://finnhub.io/api/news?id=21d8a4d0581775f08e6093cd8b20044615ef621e5c9e0cffb0ae45d08406ead3
company,1621950197,3 Dividend Aristocrats to Buy and Hold Forever,68010673,https://s.yimg.com/uu/api/res/1.2/jKznMFuP4Wrb8WQAnhdsIQ--~B/aD05MzM7dz0xNDAwO2FwcGlkPXl0YWNoeW9u/https://media.zenfs.com/en/motleyfool.com/ed133a9d0e01937ac373e61b32b76e9f,ED,Yahoo,There are just some income-oriented companies you know are going to be market leaders for the long haul.,https://finnhub.io/api/news?id=f0c40cf81f073bd762134c1086b222f704fb42744cdd83f15641697c4b6ecba2
