category,datetime,headline,id,image,related,source,summary,url
company,1616457600,"Household Energy Use Surged During the Pandemic, But Customer Satisfaction with Energy Utilities Barely Changed, ACSI Data Show",64803828,https://mms.businesswire.com/media/20210323005689/en/866858/23/21mar_gas-electric.jpg,ED,businesswire,"Household power consumption surged during the pandemic, but customer perceptions of utilities barely budged. Residential customer satisfaction with th",https://finnhub.io/api/news?id=39f2b0f966e32469c66ae0547b92dcc143c82d332f9aa661010dcbf1ce544ca1
company,1616441040,Con Edison & Partners Placing Solar Panels On NYC Housing Authority Developments,66358202,https://s.yimg.com/uu/api/res/1.2/cAZsPllXHCkj_KV4NOzf9Q--~B/aD0yNDA7dz00MDA7YXBwaWQ9eXRhY2h5b24-/https://media.zenfs.com/en/prnewswire.com/3d5dc4d8b89f391fc3c64639dc4fad3a,ED,Yahoo,Twelve newly trained solar installers are placing panels on New York City Housing Authority developments to provide clean power at discounted rates for low- and moderate-income subscribers.,https://finnhub.io/api/news?id=5706eb6758ed6e9008ce91b82200d0dd1707e361f393607d696ac9799607233e
company,1616431860,Consolidated Edison Inc. stock underperforms Monday when compared to competitors,64796009,https://images.mktw.net/im-220105/social,ED,MarketWatch,"Shares of Consolidated Edison Inc. slipped 0.35% to $72.05 Monday, on what proved to be an all-around positive trading session for the stock market, with the...",https://finnhub.io/api/news?id=00e6d4803bfde78e8f47fbdfc45cea190e27f2919bd8e9fffc9e205c52928f34
company,1616254203,Why Is Con Ed (ED) Up 3.3% Since Last Earnings Report?,66358204,https://s.yimg.com/uu/api/res/1.2/gUf3JPAiwp3PVjuDKftvaA--~B/aD04NDU7dz05MDA7YXBwaWQ9eXRhY2h5b24-/https://media.zenfs.com/en/zacks.com/26a86d59f0e8f1e82a35a92ae5684cd9,ED,Yahoo,Con Ed (ED) reported earnings 30 days ago. What's next for the stock? We take a look at earnings estimates for some clues.,https://finnhub.io/api/news?id=abaa4db51ed8b34982edc65d59356813502cdcfc6c217f59cf3ea98b0729165c
company,1616172660,Consolidated Edison Inc. stock outperforms market on strong trading day,64764415,https://images.mktw.net/im-220105/social,ED,MarketWatch,"Shares of Consolidated Edison Inc. inched 0.11% higher to $72.30 Friday, on what proved to be an all-around poor trading session for the stock market, with...",https://finnhub.io/api/news?id=7052c6870c7dec8bc4bdcbaf61e2f374656e6502c6c86bbf045f069243b394e1
company,1616086260,Consolidated Edison Inc. stock outperforms competitors on strong trading day,64741981,https://images.mktw.net/im-220105/social,ED,MarketWatch,"Shares of Consolidated Edison Inc. inched 0.60% higher to $72.22 Thursday, on what proved to be an all-around dismal trading session for the stock market,...",https://finnhub.io/api/news?id=ece1bdcda107329d037bcf3d9e52ba795c64565e83b50fddcf339a13c80ce43b
company,1615999860,Consolidated Edison Inc. stock outperforms competitors despite losses on the day,64718226,https://images.mktw.net/im-220105/social,ED,MarketWatch,"Shares of Consolidated Edison Inc. slumped 0.40% to $71.79 Wednesday, on what proved to be an all-around favorable trading session for the stock market, with...",https://finnhub.io/api/news?id=1b4ff31acc2153b6a15641035505c11c9d4338d61d453f2e0a9a06f2c64b9a02
company,1615913520,Consolidated Edison Inc. stock outperforms market on strong trading day,64693924,https://images.mktw.net/im-220105/social,ED,MarketWatch,"Shares of Consolidated Edison Inc. inched 0.36% higher to $72.08 Tuesday, on what proved to be an all-around rough trading session for the stock market, with...",https://finnhub.io/api/news?id=540ca8bb7a6d22a8f3a2a34a975f0c087f326a5ac24bc64fcf2abf5c8e58e8b1
company,1615835973,S&P 500 Dividend Aristocrats Reveal 4 Ideal Dogs For March,64669617,https://static.seekingalpha.com/uploads/2021/3/15/748328-16158381435593557.png,ED,SeekingAlpha,$5k invested March 12 in the top-yield lowest-priced Aristocrats showed 75.53% less net-gain than from $5k invested all the top stocks. Bigger (higher-priced) equities lead this March list.,https://finnhub.io/api/news?id=7420d14d7bd2f1e8f4fa619bcaf398f019b497eaf3d176c4aefd6c9fa4e5e465
company,1615819242,3 Top Retirement Stocks For Reliable Dividends,64665213,https://investorplace.com/wp-content/uploads/2019/07/retire-retirement-ahead-sign.jpg,ED,https://investorplace.com,Picking the right retirement stocks can mean the difference between a so-so retirement and a great one. Here are three to consider.,https://finnhub.io/api/news?id=ae2b05b3475e46685833a178469b187c478af299d3ea42c51dbe4f324dc7f127
company,1615799700,The Top-Ranked Dividend Champions,64657590,,ED,SeekingAlpha,,https://finnhub.io/api/news?id=f76f800edfbb8303fc16d6642309e0793c222159032d2ac445cf8495cc497108
company,1615568160,"Consolidated Edison Inc. stock rises Friday, outperforms market",64640680,https://images.mktw.net/im-220105/social,ED,MarketWatch,"Shares of Consolidated Edison Inc. advanced 1.60% to $70.94 Friday, on what proved to be an all-around positive trading session for the stock market, with...",https://finnhub.io/api/news?id=6b409ce1a890562bc9e51682adb1b00fc926e20dc28e0e746c81b5202a12e3e5
company,1615481760,Consolidated Edison Inc. stock outperforms competitors despite losses on the day,64618371,https://images.mktw.net/im-220105/social,ED,MarketWatch,"Shares of Consolidated Edison Inc. slipped 0.78% to $69.82 Thursday, on what proved to be an all-around favorable trading session for the stock market, with...",https://finnhub.io/api/news?id=3a79e0869ffcc0e3966a2254287228bf82592ab01767745d3f85a6d18c31767f
company,1615400390,66 40-Year Plus Annual Dividend Boosters Of March 2021,64588051,,ED,SeekingAlpha,,https://finnhub.io/api/news?id=d01d9054aedf9592953a8a3cd719f13f1609fe198b04020ef0a44b16c4391be6
company,1615395360,"Consolidated Edison Inc. stock rises Wednesday, outperforms market",64588689,https://images.mktw.net/im-220105/social,ED,MarketWatch,"Shares of Consolidated Edison Inc. inched 0.98% higher to $70.37 Wednesday, on what proved to be an all-around favorable trading session for the stock...",https://finnhub.io/api/news?id=65a42a9b51822c2c6be436898c7d47ec0aa4fba7cc7b94710c0cb08564df61ba
company,1615339412,IMF January And February Buys: The 11 Stocks Added To My Fund,64560997,https://static.seekingalpha.com/uploads/2021/3/9/saupload_702ad57318559783639ff3a19f05a3d6.png,ED,SeekingAlpha,"9 buys for January/February, plus 2 dividend reinvestments. New positions for the IMF in Lockheed Martin and Alsea.",https://finnhub.io/api/news?id=ec7aa67c01efe0516a8d1e068192028e95e716b47d52436c9ea434ab02596eb6
company,1615321138,Dividend Champions On Sale - The March 2021 Heat Map,64557885,https://static.seekingalpha.com/uploads/2021/3/9/saupload_uERBLt7cFfJWrwroDJO4pZFvV5GO2R9T6iq3hAg85PKEPMyP1Yv_VdCfhrWpUCM_8b5PGFJJnIgicB0oY3IpU3rsqEwZyzQNwfG0Qv5SigPJRdSCGFn6hJ3OaeEwC6uI38oYzbJm.png,ED,SeekingAlpha,"Dividend Champions can form the cornerstone of any income-oriented portfolio, but most of us don’t have enough time to analyze all 142 stocks thoroughly.",https://finnhub.io/api/news?id=5e5a832c8d275bb6f65fe1651165a10b2c0259fa952f684da943123efc069002
company,1615308960,"Consolidated Edison Inc. stock rises Tuesday, still underperforms market",64557204,https://images.mktw.net/im-220105/social,ED,MarketWatch,"Shares of Consolidated Edison Inc. inched 0.27% higher to $69.69 Tuesday, on what proved to be an all-around positive trading session for the stock market,...",https://finnhub.io/api/news?id=6c2809f3cd735c543e0eac4de57c1e1b4d080d70bfe7c21e2530f6dd606a279e
company,1615287799,"Sorry, But Consolidated Edison Is Not A Dividend Growth Stock",64547746,https://static.seekingalpha.com/uploads/2021/2/5/20475971-16125294384999561.png,ED,SeekingAlpha,Consolidated Edison has decent valuation but there are other regulated utilities which offer better dividend yields. See why ED is not a dividend growth stock.,https://finnhub.io/api/news?id=05be7fab72a913710bcaa0430c1a0f15fd6db90b3223491d9637dd372809493f
company,1615248000,"Health Recovery Solutions, Remote Patient Monitoring and Telehealth Leader, Completes Series C with LLR Partners",64545249,https://mms.businesswire.com/media/20210309005107/en/863778/23/HRS_Color_Logo_%230197d6.jpg,ED,businesswire,"Health Recovery Solutions, a leading provider of telehealth and remote patient monitoring solutions, completed its Series C led by LLR Partners",https://finnhub.io/api/news?id=1ce2751c0277c242f614b0f79ced9ed477da687887ff2639de60b8568d28596e
company,1615222560,"Consolidated Edison Inc. stock rises Monday, outperforms market",64538977,https://images.mktw.net/im-220105/social,ED,MarketWatch,"Shares of Consolidated Edison Inc. rose 1.76% to $69.50 Monday, on what proved to be an all-around mixed trading session for the stock market, with the Dow...",https://finnhub.io/api/news?id=b66bc5310c7543934df0c57879c5e9438bd26af8582b2712791c88cbe5bfd801
company,1615042620,3 Top Energy Dividend Stocks to Buy in March,66358207,https://s.yimg.com/uu/api/res/1.2/7crcT2LxGEU8E12Cf8.F6Q--~B/aD05MzM7dz0xNDAwO2FwcGlkPXl0YWNoeW9u/https://media.zenfs.com/en/motleyfool.com/37ae4a564dd8d7c49519a034bf17eea7,ED,Yahoo,"The energy sector can be a challenging place for income investors.  Energy-price volatility has caused many energy companies to reduce their dividends in the past.  Three excellent ones to consider buying this March are Canadian energy infrastructure giant Enbridge (NYSE: ENB), utility Consolidated Edison (NYSE: ED), and clean-energy producer Clearway Energy (NYSE: CWEN) (NYSE: CWEN.A).",https://finnhub.io/api/news?id=384c4406b91337d6d039a9fa9b410ddcae200c7b6ebb985d4e6b1ffc94bf9324
company,1615039893,Dividend Champion And Contender Highlights: Week Of March 7,64505973,https://static3.seekingalpha.com/assets/og_image_192-59bfd51c9fe6af025b2f9f96c807e46f8e2f06c5ae787b15bf1423e6c676d4db.png,ED,SeekingAlpha,A weekly summary of dividend activity for Dividend Champions and Contenders. Companies which changed their dividends. Companies with upcoming ex-dividend dates.,https://finnhub.io/api/news?id=908c5ad38e2f801a7efc899989fb99066944c4d03b80d2b3ad59e3c5180a5cb0
company,1615030121,"Magellan Asset Management Ltd Buys 12,887 Shares of Consolidated Edison, Inc. (NYSE:ED)",64510111,https://www.marketbeat.com/logos/consolidated-edison-inc-logo.jpg,ED,https://www.thelincolnianonline.com,"Magellan Asset Management Ltd lifted its holdings in shares of Consolidated Edison, Inc. (NYSE:ED) by 4.1% in the 4th quarter, HoldingsChannel reports. The fund owned 325,749 shares of the utilities provider’s stock after purchasing an additional 12,887 shares during the period. Magellan Asset Management Ltd’s holdings in Consolidated Edison were worth $23,542,000 as of its […]",https://finnhub.io/api/news?id=46a71d50016122457915be15b7ca3a072fb741661036a8728e7bdd6222dc031d
company,1614963360,Consolidated Edison Inc. stock underperforms Friday when compared to competitors despite daily gains,64492210,https://images.mktw.net/im-220105/social,ED,MarketWatch,"Shares of Consolidated Edison Inc. rallied 2.00% to $68.30 Friday, on what proved to be an all-around great trading session for the stock market, with the...",https://finnhub.io/api/news?id=cac8f412e0766c64a5ed8bdfca96e410857e7d2f00ac7e8c26706c370dbc114d
company,1614881200,"Retirement Strategy: National Fuel Gas - A Smart, Safe, Simple Dividend King To Avoid The Market Turmoil",64467586,https://static.seekingalpha.com/uploads/2021/3/4/saupload_photo-1447727214830-cbcbf097b52c.jpeg,ED,SeekingAlpha,Dividend Kings like National Fuel Gas should take the sting out of the market turmoil. The rising use of liquid natural gas should offer both growth and income for decades.,https://finnhub.io/api/news?id=c5558080b1c564c7973986b1a397ec7bd13089bd966076c752608951216224a5
company,1614876960,"Consolidated Edison Inc. stock falls Thursday, still outperforms market",64468638,https://images.mktw.net/im-220105/social,ED,MarketWatch,"Shares of Consolidated Edison Inc. shed 0.70% to $66.96 Thursday, on what proved to be an all-around poor trading session for the stock market, with the S&P...",https://finnhub.io/api/news?id=429aebb5f0f8479c6efbce95debb8e8bdeabeee54067df0a7dc57b19901b4eed
company,1614790560,"Consolidated Edison Inc. stock rises Wednesday, outperforms market",64439551,https://images.mktw.net/im-220105/social,ED,MarketWatch,"Shares of Consolidated Edison Inc. inched 0.52% higher to $67.43 Wednesday, on what proved to be an all-around poor trading session for the stock market,...",https://finnhub.io/api/news?id=bb7a9039194b53ae3184d6b26350535fddcbb66f54d65b5c2fdbea7174b8c725
company,1614704160,Consolidated Edison Inc. stock outperforms competitors on strong trading day,64401387,https://images.mktw.net/im-220105/social,ED,MarketWatch,"Shares of Consolidated Edison Inc. inched 0.06% higher to $67.08 Tuesday, on what proved to be an all-around rough trading session for the stock market, with...",https://finnhub.io/api/news?id=0bf48c5014d42bd6fc032cf2eda6d63773a1fdfd9129d964d6b2f4cdfdf8fd2c
company,1614680694,Dividend Aristocrat Performance: February 2021,64389219,https://static.seekingalpha.com/uploads/2021/1/2/1112099-16095986490648289.png,ED,SeekingAlpha,Components of the S&P 500 that have paid steadily increasing dividends for at least 25 years have outperformed the broader market over time.,https://finnhub.io/api/news?id=b17bd43950a386313c6e9a149221af4c963bcb1fd1e101ca7c0da8431124ceb8
company,1614681874,"Rates, Inflation, Market Valuation",64390761,http://valueplays.net/wp-content/uploads/Screen-Shot-2021-03-01-at-5.03.10-PM-624x411.png,ED,SeekingAlpha,Rising rates reflect investors shifting capital out of fixed income into other assets believed to offer better risk/return parameters.,https://finnhub.io/api/news?id=fd20b3e16bc8bda1dac468999fc24430e218c1f2497fa786757f15a22a1fa9d3
company,1614617760,"Consolidated Edison Inc. stock rises Monday, still underperforms market",64366507,https://images.mktw.net/im-220105/social,ED,MarketWatch,"Shares of Consolidated Edison Inc. rose 2.12% to $67.04 Monday, on what proved to be an all-around favorable trading session for the stock market, with the...",https://finnhub.io/api/news?id=2629a78bb990deeb34ff353e6b8652279401e80ad8fc252e478f0e8ac464ae80
company,1614615489,3 Dividend Stocks to Bankroll Your Retirement,66358209,https://s.yimg.com/uu/api/res/1.2/DtNYHYCXG9WEbAIrrsKczg--~B/aD05MzM7dz0xNDAwO2FwcGlkPXl0YWNoeW9u/https://media.zenfs.com/en/motleyfool.com/b55900bc3258af69875686bda39b9f3d,ED,Yahoo,Big yields don't mean much if the payouts aren't reliable and aren't poised to at least outgrow inflation.,https://finnhub.io/api/news?id=1c1beda3b28a374b6b0f2c3a2118453942078ea3fde84a6ac1f51eb031ee2bab
company,1614597682,"Amid Trillions In Stimulus, These Dividend Stocks Are Strong Buys",64355161,https://static.seekingalpha.com/uploads/2021/2/28/49873922-16145232643239996.jpg,ED,SeekingAlpha,The stimulus package that was recently passed by the House has investors worried about inflation. See which dividend stocks are best amid trillions in stimulus.,https://finnhub.io/api/news?id=5c2ad927176cbf420026ef7c607be3f3f1b9edac22b52e3c8247242ec3486d17
company,1614597480,3 Dividend Stocks to Bankroll Your Retirement,64508286,https://www.nasdaq.com/sites/acquia.prod/files/2019-05/0902-Q19%20Total%20Markets%20photos%20and%20gif_CC8.jpg?1921686901,ED,Nasdaq,"Younger investors with many years of work ahead of them can afford to prioritize growth over income in their portfolios. After all, time is going to do most of their heavy lifting for the foreseeable future, and it's likely to erase any short-term setbacks the market might dish o",https://finnhub.io/api/news?id=8e985de024b126ad58c64516e2c1ae01254ad3bb9a484729b41fd40b6cc21634
company,1614439200,3 Dividend Stocks to Buy on Sale,66358212,https://s.yimg.com/uu/api/res/1.2/UPWC5jIaT0B5vlpepb4N2A--~B/aD05MzM7dz0xNDAwO2FwcGlkPXl0YWNoeW9u/https://media.zenfs.com/en/motleyfool.com/aac29d64bb5317ad435a21ed034e3968,ED,Yahoo,"Dividend stocks have a long history of enriching investors by providing them with income and the upside from a rising share price.  Three dividend stocks currently on sale are utility Consolidated Edison (NYSE: ED), energy infrastructure giant Enbridge (NYSE: ENB), and office REIT SL Green Realty (NYSE: SLG).",https://finnhub.io/api/news?id=8e705854b4f24a9a9719902c135bc56f41c5b9a93d750591f5fe6441783a0b77
company,1614421200,3 Dividend Stocks to Buy on Sale,64357731,https://www.nasdaq.com/sites/acquia.prod/files/2019-05/0902-Q19%20Total%20Markets%20photos%20and%20gif_CC8.jpg?723064597,ED,Nasdaq,"Dividend stocks have a long history of enriching investors by providing them with income and the upside from a rising share price. However, sometimes even the best dividend payers hit a rough patch where their shares slump. Those sell-offs have their benefits, as they cause divid",https://finnhub.io/api/news?id=dee3f2cb2f86820b8e15684c85e08047241d05aff50f47ea418ece92a68db243
company,1614358560,Consolidated Edison Inc. stock outperforms competitors despite losses on the day,64318739,https://images.mktw.net/im-220105/social,ED,MarketWatch,"Shares of Consolidated Edison Inc. slid 2.23% to $65.65 Friday, on what proved to be an all-around grim trading session for the stock market, with the S&P...",https://finnhub.io/api/news?id=a341a9dd6e5596af8d1484267888ad42391c599259a9e6816a204969532394ce
company,1614272160,"Consolidated Edison Inc. stock rises Thursday, outperforms market",64318740,https://images.mktw.net/im-220105/social,ED,MarketWatch,"Shares of Consolidated Edison Inc. inched 0.75% higher to $67.15 Thursday, on what proved to be an all-around rough trading session for the stock market,...",https://finnhub.io/api/news?id=3254118140976b5b1493a0b337cb7b4b323ed3c73b894a6be804e16d01b16fa8
company,1614185760,Consolidated Edison Inc. stock underperforms Wednesday when compared to competitors,64154140,https://images.mktw.net/im-220105/social,ED,MarketWatch,"Shares of Consolidated Edison Inc. shed 1.51% to $66.65 Wednesday, on what proved to be an all-around positive trading session for the stock market, with the...",https://finnhub.io/api/news?id=58abd36307f4a82ff4aff961811edc5b10e6f34cdb3f38d9d9abfc054ad4b88d
company,1614124800,Phillips Edison & Company to Issue Fourth Quarter 2020 Earnings Release and Host Results Webinar Presentation,64090768,http://www.businesswire.com/images/bwlogo_square.png,ED,businesswire,"Phillips Edison & Company, Inc., an internally-managed real estate investment trust (“REIT”) and one of the nation’s largest owners and operators",https://finnhub.io/api/news?id=671846425dea000ef466027da1ed85a52f0e25eedf7099bea5e0c53d9a0523a2
company,1614099360,Consolidated Edison Inc. stock underperforms Tuesday when compared to competitors,64154150,https://images.mktw.net/im-220105/social,ED,MarketWatch,"Shares of Consolidated Edison Inc. slid 0.44% to $67.67 Tuesday, on what proved to be an all-around great trading session for the stock market, with the S&P...",https://finnhub.io/api/news?id=c973d04aa1b948d84667cf01ac85a219046d0ab8ccdfdfce7d452f61422382a0
company,1614010573,ConEd earmarks $480 million for pension plan contributions,64091928,https://s3-prod.pionline.com/s3fs-public/styles/800x600/public/consolidated_edison_1550-main_i.jpg,ED,https://www.pionline.com,,https://finnhub.io/api/news?id=e7baa639478ef479bd913b6f5812752a224891fa9e38e1685bb3cc9e7e50862d
company,1614007027,Retirement Strategy: Surprise! United Bankshares Has Been Paying And Increasing Dividends For 47 Years,63747277,https://static.seekingalpha.com/uploads/2021/2/22/saupload_photo-1515606378517-3451a4fa2e12.jpeg,ED,SeekingAlpha,"United Bankshares has been flying under the radar, but UBSI's dividend history is seriously impressive. Plus, UBSI shares are a bargain in the current overstretched market.",https://finnhub.io/api/news?id=666d77bd1e4db39f365636f9fce1973585e413685f93ee4b595e2d1c890d5c69
company,1613977350,Sand In My Shoes - January Update,63726105,https://static.seekingalpha.com/uploads/2021/2/20/saupload_6cd3fc62139563d127261485674ce507.png,ED,SeekingAlpha,"The Sand In Shoes portfolio finished slightly better, up 0.15% for the month.",https://finnhub.io/api/news?id=34910200a00f3c73e336872132472ebfc6092669563f0a1c7e12c74afc2cdb40
company,1613899800,The Dividend Aristocrats Ranked By Quality Scores,63721931,https://static.seekingalpha.com/uploads/2021/2/20/1033943-16138642261502476.png,ED,SeekingAlpha,This article ranks the 65 Dividend Aristocrats using DVK Quality Snapshots.,https://finnhub.io/api/news?id=59cde416cdab2164fba83be5396c2b0fa4fd47e5205ad74cae1ab0bd34d7f6f3
company,1613897829,"Calculating The Fair Value Of Consolidated Edison, Inc. (NYSE:ED)",66358214,https://s.yimg.com/uu/api/res/1.2/naUy9BSoI62CZsfZfNs5GQ--~B/aD00MzI7dz0xMTk0O2FwcGlkPXl0YWNoeW9u/https://media.zenfs.com/en/simply_wall_st__316/e44b48510541f08ce6d7c1a7b2f6b239,ED,Yahoo,"Does the February share price for Consolidated Edison, Inc. ( NYSE:ED ) reflect what it's really worth? Today, we will...",https://finnhub.io/api/news?id=9b6d24b0ed8873fe67e9126bcfe31e03c6b57a63e25174fdc3e1bb1167c2c45d
company,1613758105,New S&P Dividend Aristocrats Sport 5 Ideal Dogs For February,63705502,https://static.seekingalpha.com/uploads/2021/2/19/748328-16137675139997346.png,ED,SeekingAlpha,Dividend Aristocrats in the S&P 500 Index have raised their annual payouts every year for at least 25 consecutive years.,https://finnhub.io/api/news?id=dd185f0d918bb0b343a82c313f0a36f3523c99ccdbcd8a938212a1d1f4c3a3fd
company,1613755620,"Eversource Energy stock falls Friday, underperforms market",63704314,https://images.mktw.net/im-220105/social,ED,MarketWatch,"Shares of Eversource Energy shed 1.32% to $81.46 Friday, on what proved to be an all-around mixed trading session for the stock market, with the Dow Jones...",https://finnhub.io/api/news?id=11f380e8d89063ee875fafad2591667f42740da5a8dd0ddc0695673e54ad7b58
company,1613753760,Consolidated Edison Inc. stock underperforms Friday when compared to competitors,63703881,https://images.mktw.net/im-220105/social,ED,MarketWatch,"Shares of Consolidated Edison Inc. slid 2.63% to $68.18 Friday, on what proved to be an all-around mixed trading session for the stock market, with the Dow...",https://finnhub.io/api/news?id=bc3b72a9912ec40c9aae1e2cbc9aac19428487a9d037f0ceb2c3a24a34d67f93
company,1613732138,"Friday's ETF Movers: PBW, XLU",64671260,https://www.nasdaq.com/sites/acquia.prod/files/2019-05/0902-Q19%20Total%20Markets%20photos%20and%20gif_CC8.jpg?1847220391,ED,Nasdaq,"In trading on Friday, the Invesco WilderHill Clean Energy ETF (PBW) is outperforming other ETFs, up about 4.1% on the day.  Components of that ETF showing particular strength include shares of Fuelcell Energy (FCEL), up about 13.5% and shares of Plug Power (PLUG), up about 12.2",https://finnhub.io/api/news?id=a39e691fca729ceccff7fa99cb5cfbc5cc0108b4c9dcc53e981f77ebbac85643
company,1613720118,"Consolidated Edison, Inc. 2020 Q4 - Results - Earnings Call Presentation",63684224,https://static3.seekingalpha.com/assets/og_image_192-59bfd51c9fe6af025b2f9f96c807e46f8e2f06c5ae787b15bf1423e6c676d4db.png,ED,SeekingAlpha,"The following slide deck was published by Consolidated Edison, Inc.",https://finnhub.io/api/news?id=d6cada5299993b791dada004460faad0c7c3831c45feb42cf66810f6172ff32f
company,1613687280,Con Edison Reports 2020 Earnings,66358216,https://s.yimg.com/uu/api/res/1.2/ukRvGVPb1zdkD94UOuIYVQ--~B/aD0xNjt3PTE2O2FwcGlkPXl0YWNoeW9u/https://media.zenfs.com/en/prnewswire.com/d2de310781d22576853e666759105d36,ED,Yahoo,"Consolidated Edison, Inc. (Con Edison) (NYSE: ED) today reported 2020 net income for common stock of $1,101 million or $3.29 a share compared with $1,343 million or $4.09 a share in 2019. Adjusted earnings were $1,399 million or $4.18 a share in 2020 compared with $1,438 million or $4.38 a share in 2019. Adjusted earnings and adjusted earnings per share in 2020 exclude the impact of the impairment loss related to Con Edison's investment in Mountain Valley Pipeline, LLC. Adjusted earnings and adjusted earnings per share in 2020 and 2019 exclude the effects of hypothetical liquidation at book value (HLBV) accounting for tax equity investments in certain renewable electric production projects of Con Edison Clean Energy Businesses, Inc. (the Clean Energy Businesses) and the net mark-to-market effects of the Clean Energy Businesses.",https://finnhub.io/api/news?id=5d5328951de2598b79564f9bc240fa9c3a26a4456f2665600a60f27a7c5a48f5
company,1613669220,Eversource Energy stock outperforms market on strong trading day,63671453,https://images.mktw.net/im-220105/social,ED,MarketWatch,"Shares of Eversource Energy inched 0.26% higher to $82.55 Thursday, on what proved to be an all-around grim trading session for the stock market, with the...",https://finnhub.io/api/news?id=8ead8fb655fe6e578b1358ea8692c36c1e7acf9853e9514bef1a6d5d2f85587e
company,1613667360,Consolidated Edison Inc. stock outperforms market despite losses on the day,63670589,https://images.mktw.net/im-220105/social,ED,MarketWatch,"Shares of Consolidated Edison Inc. slid 0.20% to $70.02 Thursday, on what proved to be an all-around rough trading session for the stock market, with the S&P...",https://finnhub.io/api/news?id=67b0c02d7dd4bb50b788fdf3f4042137edb664416d5d5ad73c6a0798a026a0db
company,1613622480,"Earnings Scheduled For February 18, 2021",63655075,https://cdn.benzinga.com/files/imagecache/og_image_social_share_1200x630/images/story/2012/earnings_scheduled_1803.png,ED,Benzinga," 
Companies Reporting Before The Bell
• InterDigital (NASDAQ:IDCC) is projected to report quarterly loss at $0.03 per share on revenue of $88.11 million.
• Atlas...",https://finnhub.io/api/news?id=c9f70c76a69802d3c4fb502b530817b716a7f1b9f365a18753b48374f581e8f1
