category,datetime,headline,id,image,related,source,summary,url
company,1620048360,Midtown Building Is First With Vehicle Chargers under Con Edison's Power-Ready Program,67374371,,ED,PR Newswire,Looking for stock market analysis and research with proves results? Zacks.com offers in-depth financial research with over 30years of proven results.,https://finnhub.io/api/news?id=968fd5f05953c59333bfb391fe40c7e7afc591da03f2772564a41de1f0469864
company,1619801460,"Consolidated Edison Inc. stock rises Friday, outperforms market",67171925,https://images.mktw.net/im-220105/social,ED,MarketWatch,"Shares of Consolidated Edison Inc. inched 0.91% higher to $77.41 Friday, on what proved to be an all-around dismal trading session for the stock market, with...",https://finnhub.io/api/news?id=9bdd4efe5ae411dd561abd5f1f0881fafae57028769444398b13ec7061bde28e
company,1619800023,North Carolina again denies permit for Mountain Valley gas pipe extension,67169267,https://www.nasdaq.com/sites/acquia.prod/files/2021-04-30T203421Z_1_FD2_RTRLXPP_2_LYNXPACKAGER.JPG?384247284,ED,Nasdaq,The North Carolina Department of Environmental Quality (DEQ) again denied Mountain Valley Pipeline's (MVP) request for a water permit for its proposed Southgate natural gas pipeline project from Virginia to North Carolina.,https://finnhub.io/api/news?id=79ae47fdbae25aa1be67b47ebc1bba0d8f904f9d969ce050c23704fb0d57dcdc
company,1619795716,"More earnings, April's big jobs report and inflation worries could swing markets in the week ahead",67163813,https://image.cnbcfm.com/api/v1/image/106868333-16184237615573-PRESS-YTPG-Photo-20210414-5-jpg?v=1618423815,ED,CNBC,"April's jobs report and a barrage of earnings news make for another busy week for markets, as the calendar rolls into May.",https://finnhub.io/api/news?id=0925a266d6597cdc2e8623f2b8afb89a0f80f38824697dde278b6c6559e5f2c9
company,1619787389,Electricity usage will take ‘until 2022 to get back to 2019 levels’: Duke Energy CEO,67149807,https://s.yimg.com/ny/api/res/1.2/LyG.Spwfcw4KV2QVjJfs6g--/YXBwaWQ9aGlnaGxhbmRlcjt3PTIwMDA7aD0xMTI0/https://s.yimg.com/hd/cp-video-transcode/prod/2021-04/30/608bfe7f5aec9a4527e617a3/608bfe7f5aec9a4527e617a4_o_U_v2.jpg,ED,Yahoo,Duke Energy CEO Lynn Good joins 'Influencers with Andy Serwer' to disccuss the pandemic's long-term impact on the energy industry.,https://finnhub.io/api/news?id=9be78529ded21775fef40d6270ccef766fc5f8be99fb18d09963264740cd1a88
company,1619787340,North Carolina again denies permit for Mountain Valley gas pipe extension,67162371,https://www.nasdaq.com/sites/acquia.prod/files/2019-05/0902-Q19%20Total%20Markets%20photos%20and%20gif_CC8.jpg?1239485498,ED,Nasdaq,The North Carolina Department of Environmental Quality (DEQ) again denied Mountain Valley Pipeline's (MVP) request for a water permit for its proposed Southgate natural gas pipeline project from Virginia to North Carolina.,https://finnhub.io/api/news?id=ba13b42441289ba83585b6d0ff284f7590cba169d2724f148213cd9999fdb39d
company,1619782560,3 Dividend Stocks That Pay You Better Than Coca-Cola Does,67146952,https://s.yimg.com/uu/api/res/1.2/dFCeUQsnz0UYGM1ZJXJH3Q--~B/aD04ODE7dz0xNDAwO2FwcGlkPXl0YWNoeW9u/https://media.zenfs.com/en/motleyfool.com/8be1233f29d9c5f962c8a8102ad41966,ED,Yahoo,"Coca-Cola offers a generous 3.1% yield today, but you can do even better than that with this trio of high-yield dividend stocks.",https://finnhub.io/api/news?id=09a6ba26cbf86f049ef4955dcc9ac253783e3dc3abec7a18a278ba4b23c8716e
company,1619780460,3 Great Stocks for Low-Risk Investors,67147764,https://s.yimg.com/uu/api/res/1.2/Uj03oceEXNg2ZcT3h8NHwQ--~B/aD05MzM7dz0xNDAwO2FwcGlkPXl0YWNoeW9u/https://media.zenfs.com/en/motleyfool.com/10a25299684689316fb88c024a73a85d,ED,Yahoo,"If you want to avoid risk, then you should take a look at this trio of longtime dividend payers. They're boring, but that's pretty good.",https://finnhub.io/api/news?id=8211276bcf832dc74799e50160231299965f3c4480e184f7e25fd19993cb7409
company,1619768160,3 Dividend Stocks That Pay You Better Than Coca-Cola Does,67148819,https://www.nasdaq.com/sites/acquia.prod/files/2019-05/0902-Q19%20Total%20Markets%20photos%20and%20gif_CC8.jpg?488909752,ED,Nasdaq,"The S&P 500 Index is yielding a paltry 1.4% right now, which makes beverage giant Coca-Cola's (NYSE: KO) 3.1% yield look huge by comparison. But on an absolute basis, Coca-Cola's dividend yield is still pretty modest.You can find better yields. Here are three options to consi",https://finnhub.io/api/news?id=1ccefd6ec9550f89a7018eb3084e33b08b2b9b37be5dcb0ab2ee92c3014304bd
company,1619766060,3 Great Stocks for Low-Risk Investors,67157021,https://www.nasdaq.com/sites/acquia.prod/files/2019-05/0902-Q19%20Total%20Markets%20photos%20and%20gif_CC8.jpg?646997875,ED,Nasdaq,"In general, there's a risk/reward trade-off that investors have to make on Wall Street. The risk piece of that can be a problem for more conservative types, but don't let that stop you from investing -- there are plenty of desirable companies out there that offer juicy returns, o",https://finnhub.io/api/news?id=f1b5b76e0a76a699d0c80f708b0215783c6916124b4ea2734989071c8e1c5376
company,1619730369,Consolidated Edison (ED) Earnings Expected to Grow: Should You Buy?,67139077,https://s.yimg.com/uu/api/res/1.2/kz0ozt3ejWMPXKci2JxOBw--~B/aD03NTQ7dz0xMDAwO2FwcGlkPXl0YWNoeW9u/https://media.zenfs.com/en/zacks.com/d7dcbe11345e3f8e5e71e6827fe3c4c9,ED,Yahoo,Con Ed (ED) doesn't possess the right combination of the two key ingredients for a likely earnings beat in its upcoming report. Get prepared with the key expectations.,https://finnhub.io/api/news?id=4810de216f26121f86f4b12c718699e5d90f8db339c2c86ade21aea63a30964a
company,1619715060,"Consolidated Edison Inc. stock rises Thursday, still underperforms market",67153146,https://images.mktw.net/im-220105/social,ED,MarketWatch,"Shares of Consolidated Edison Inc. inched 0.66% higher to $76.71 Thursday, on what proved to be an all-around favorable trading session for the stock market,...",https://finnhub.io/api/news?id=f77baa47b27eb67425676a6f949b3e630a9e8a5b4a273149b5b79f419b7ef3ac
company,1619695800,New Indexes to Marry ESG Principles and Dividend Aristocrats,67142857,https://images.barrons.com/im-331489/social,ED,MarketWatch,"For those who’d like a little green with their green, S&P Dow Jones Indices is launching a series of indexes to capture both yield and social-impact...",https://finnhub.io/api/news?id=121716a203621878c43927e8d32abc131f5a2c5272290518cf53f6b9ce766ab3
company,1619690400,Influencers with Andy Serwer: Lynn Good,67110320,https://s.yimg.com/hd/cp-video-transcode/prod/2021-04/29/6089ef3860b4aa69ce254f90/608a0b455aec9a4527e60ed3_o_U_v3.png,ED,Yahoo,Duke Energy President & CEO Lynn Good joins 'Influencers' to discuss the future of renewable energy and her plans to achieve 'net zero'.,https://finnhub.io/api/news?id=b63e9b6ff242e005c86ee781be873e10ed13dd94532305377adb9291c8d2fab7
company,1619676780,Consolidated Edison Stock Appears To Be Fairly Valued,67115197,,ED,GuruFocus,GuruFocus Article or News written by GF Value and the topic is about: ,https://finnhub.io/api/news?id=1933362a4a60831553fd93cfa1ce4513f0dd0c2d34010a27151c0389987dd923
company,1619628660,Consolidated Edison Inc. stock outperforms competitors on strong trading day,67153149,https://images.mktw.net/im-220105/social,ED,MarketWatch,"Shares of Consolidated Edison Inc. inched 0.03% higher to $76.21 Wednesday, on what proved to be an all-around grim trading session for the stock market,...",https://finnhub.io/api/news?id=6d90fd9531461438e73ad55859b06ddaa5d99b29cb7be6a9eb8ad4a1e279660e
company,1619604000,Trump tax cut allowed Duke Energy to reduce costs for customers ‘by over a billion dollars’: Lynn Good,67052960,https://s.yimg.com/ny/api/res/1.2/3YYsD.mg0tdlpBIb0uRY9A--/YXBwaWQ9aGlnaGxhbmRlcjt3PTIwMDA7aD0xMTI1/https://s.yimg.com/hd/cp-video-transcode/prod/2021-04/28/6089f43160b4aa69ce254fb0/6089f43160b4aa69ce254fb1_o_U_v2.jpg,ED,Yahoo,Duke Energy President & CEO Lynn Good joins 'Influencers with Andy Serwer' to discuss how Washington policy can affect your energy costs.,https://finnhub.io/api/news?id=f9a165bd7793feb3d35a89d4dc5b948d90d89344e1700d4b6e38dcb592aeb58f
company,1619600344,Crestwood: Fantastic Operating Numbers And Potential Asset Sale Coming Soon,66915073,https://media.gettyimages.com/vectors/web-banner-template-industrial-background-with-yellow-pipeline-oil-vector-id1194157123?b=1&k=6&m=1194157123&s=170667a&w=0&h=5g6p-yuRzNTBXOz9CQ8ejMg3xUUK1gW3SSt0U4O4fwk=,ED,SeekingAlpha,Crestwood's (CEQP) first quarter EBITDA came in solidly ahead of estimates. Quarterly free cash flow per share covered the dividend 2x. Here's why I'm Bullish.,https://finnhub.io/api/news?id=4d565aa85d0e47ba9925f2e9183005eb611b027a3c1645e9d20345c2f8e4ddf8
company,1619581140,"Spearhead Capital Advisors, LLC Buys Roper Technologies Inc, Costco Wholesale Corp, ...",67010505,,ED,GuruFocus,GuruFocus Article or News written by insider and the topic is about: ,https://finnhub.io/api/news?id=b94f16f2ab1aa49554971436d78ba77288fa9edbb870a335b1deaa2e77ef2182
company,1619542260,"Consolidated Edison Inc. stock falls Tuesday, underperforms market",66785841,https://images.mktw.net/im-220105/social,ED,MarketWatch,"Shares of Consolidated Edison Inc. slid 0.88% to $76.19 Tuesday, on what proved to be an all-around mixed trading session for the stock market, with the Dow...",https://finnhub.io/api/news?id=9d8b388dca1e7d9bec714b64113a3627c6d1e73dc21b6f663a44dd0c1eebf397
company,1619517600,The climate transition demands ‘a massive change in infrastructure’: Duke Energy CEO,66770696,https://s.yimg.com/ny/api/res/1.2/gEA4RHmJ9S_7dGf3wvmz5g--/YXBwaWQ9aGlnaGxhbmRlcjt3PTIwMDA7aD0xMTI0/https://s.yimg.com/hd/cp-video-transcode/prod/2021-04/28/6088b111b2bd3f3204a9ce15/6088b111b2bd3f3204a9ce16_o_U_v2.jpg,ED,Yahoo,Duke Energy CEO Lynn Good joins 'Influencers with Andy Serwer' to discuss the latest advancements in clean energy technology.,https://finnhub.io/api/news?id=688683fbdd435766e5989b0f3740eb6e51d65259d2d0bf21a64fc15eb0ef100b
company,1619506800,Retirement Strategy: The Beauty Of Compounding,66608073,https://static.seekingalpha.com/cdn/s3/uploads/getty_images/928069578/medium_image_928069578.jpg,ED,SeekingAlpha,One of the best ways to teach anyone about investing is to explain the power of compounding: the concept of getting interest on interest.,https://finnhub.io/api/news?id=b5848209503ec7b18b3807e8b443bcc16131de995af95daf53331ae9f06c1f5a
company,1619455860,Consolidated Edison Inc. stock outperforms competitors despite losses on the day,66785843,https://images.mktw.net/im-220105/social,ED,MarketWatch,"Shares of Consolidated Edison Inc. dropped 0.75% to $76.87 Monday, on what proved to be an all-around mixed trading session for the stock market, with the...",https://finnhub.io/api/news?id=16a83c5b2f628ea772ad12410d1845fa07947274a1455c86105996acca714be2
company,1619364613,OGE Energy Is A High-Yielding Utility That May Replace PPL In My Portfolio,66266892,https://static.seekingalpha.com/cdn/s3/uploads/getty_images/1128492098/medium_image_1128492098.jpg,ED,SeekingAlpha,"In this article, I analyze five stocks from the utilities sector; each stock was evaluated on eight guidelines and was assigned a rating for each. OGE is high yielding dividend growth stock.",https://finnhub.io/api/news?id=4d81098f153f24b81512b8d0ee3c9bba9d31b9b8a4f47dc4d8e03bc308ab3867
company,1619361660,3 Stocks With World-Class Dividends,66267371,https://s.yimg.com/uu/api/res/1.2/w7L6cy9ZgvMpg3vYrBogoA--~B/aD05MjE7dz0xNDAwO2FwcGlkPXl0YWNoeW9u/https://media.zenfs.com/en/motleyfool.com/9b8ce3a2f2cc91c80ed9bc05ad76fb27,ED,Yahoo,"The best dividend stocks have one thing in common.  Three dividend stocks in this elite category of multi-decade dividend growth are utility Consolidated Edison (NYSE: ED), Canadian energy infrastructure company Enbridge (NYSE: ENB), and real estate investment trust (REIT) Realty Income (NYSE: O).",https://finnhub.io/api/news?id=4375360cae5f76d900562745c1e15f7d2f1820b7331b8a1a07c7880e867599cb
company,1619347260,3 Stocks With World-Class Dividends,66261681,https://www.nasdaq.com/sites/acquia.prod/files/2019-05/0902-Q19%20Total%20Markets%20photos%20and%20gif_CC8.jpg?944881530,ED,Nasdaq,"The best dividend stocks have one thing in common. They've increased their payouts like clockwork for decades. Those steadily growing income streams tend to add up over time, enabling these companies to deliver superior total returns.Three dividend stocks in this elite category o",https://finnhub.io/api/news?id=c2333a326ea889afaa0190901fbdb7433840a57597887bcc027f9952f3c12d9d
company,1619323744,One Last Hurrah? The Stocks To Buy Now,66243334,https://static.seekingalpha.com/uploads/2021/4/23/486106-1619222908388881_origin.png,ED,SeekingAlpha,"Warning signals are flashing, suggesting it could be smart to fade the next move up. The strongest sectors currently include financials, REITs, and consumer goods.",https://finnhub.io/api/news?id=15660c3b80c6ac06438c0199b68804eebace5b9a2854cb0b752c7db9b0506215
company,1619258930,56 Outstanding Dividend Buds Now Show 11 Flowering For May,66220234,https://static.seekingalpha.com/uploads/2021/4/24/748328-1619238911291941_origin.png,ED,SeekingAlpha,"From May to July 2020, Kiplinger Today listed five sets of dividend stocks sorted as favorites, super-safe, durable, centenarian, and MoPays.",https://finnhub.io/api/news?id=e07896958cbe5df4d6632a5b4d32eb1c845cdf693df6bdce1951121b4b5f9cd4
company,1619085360,Interesting ED Put And Call Options For June 4th,66450704,,ED,Stock Options Channel,"Staff article entitled Interesting ED Put And Call Options For June 4th, about stock options, from Stock Options Channel.",https://finnhub.io/api/news?id=f57a201a7eeeb46b09f935533bc87802ea4c448549b615b5a18af731a3455273
company,1619069940,"Forte Capital Llc  Buys Vanguard Small Cap Growth ETF, Consolidated Edison Inc, DraftKings Inc, ...",66255333,https://static.gurufocus.com/photos/gurus/guru_logo_square.jpg,ED,GuruFocus,"Forte Capital Llc  Buys Vanguard Small Cap Growth ETF, Consolidated Edison Inc, DraftKings Inc, Sells iShares Intermediate Credit Bond ETF, Paycom Software Inc, Vanguard FTSE Developed Markets ETF, Stocks: ED,TRP,CL,VV,MXIM,GIS,VBK,DKNG,CAH,IEMG,GS,KLAC,IG, release date:Apr 22, 2021",https://finnhub.io/api/news?id=c62a20134b25cd1167bf42b871faa0774567251a00357ed4036775c53c976127
company,1619037000,Con Edison to Report 1st Quarter 2021 Earnings on May 6,66358180,https://s.yimg.com/uu/api/res/1.2/TTrzhplUl2UWzuW57iwvYQ--~B/aD0xNjt3PTE2O2FwcGlkPXl0YWNoeW9u/https://media.zenfs.com/en/prnewswire.com/3edf12977ca8ca85181b50d69a74bd43,ED,Yahoo,"Consolidated Edison, Inc. (Con Edison) (NYSE: ED) plans to report its 1st Quarter 2021 earnings on May 6, 2021 after the market closes.",https://finnhub.io/api/news?id=01e888ee65b8521e96ce14c7c5ed4f24705a380c439ebdf4ef94fb0b4bd20cbf
company,1619031600,Con Edison's 'Smart' Ideas Earn Recognition From Consumer Research Group,66358181,https://s.yimg.com/uu/api/res/1.2/_kXuQi8SuhU7UVwenZXSqA--~B/aD0xNjt3PTE2O2FwcGlkPXl0YWNoeW9u/https://media.zenfs.com/en/prnewswire.com/b4c6f33fb34ed65eef0f8525892a6d53,ED,Yahoo,A consumer research group today bestowed an award on Con Edison for using its new smart meters to improve programs that pay residential customers for reducing their usage at times of high demand.,https://finnhub.io/api/news?id=f9e667cee9962857dc8a5b196fa8b4057c0a7a06f0ffc0136359c0ba4fc75b12
company,1619023860,Consolidated Edison Inc. stock underperforms Wednesday when compared to competitors,66190176,https://images.mktw.net/im-220105/social,ED,MarketWatch,"Shares of Consolidated Edison Inc. shed 1.25% to $78.36 Wednesday, on what proved to be an all-around great trading session for the stock market, with the...",https://finnhub.io/api/news?id=331f7417f98a7328e5fbdb6b030004fbc6b90e989b21a8052639eb20d7e4c99a
company,1619022600,Con Edison to Report 1st Quarter 2021 Earnings on May 6,66450709,,ED,PR Newswire,Looking for stock market analysis and research with proves results? Zacks.com offers in-depth financial research with over 30years of proven results.,https://finnhub.io/api/news?id=37eb9996f42f5b3cd3ccf458b6728501b9204f75cdb4d199a79b2f70ed1a36de
company,1619017200,Con Edison's 'Smart' Ideas Earn Recognition From Consumer Research Group,66450711,,ED,PR Newswire,Looking for stock market analysis and research with proves results? Zacks.com offers in-depth financial research with over 30years of proven results.,https://finnhub.io/api/news?id=066aa75c0c42012a1e277353049fa11f8e2669aa5b16b35b4985e5bc92cdd7a5
company,1619008200,Con Edison and National Grid Select CPower for Dynamic Load Management Program in New York,66324740,https://s.yimg.com/uu/api/res/1.2/0DmlAVzGuS_8ygGOytExCA--~B/aD00MDA7dz00MDA7YXBwaWQ9eXRhY2h5b24-/https://media.zenfs.com/en/prnewswire.com/dab49e4754899833d9ccf27f08212c81,ED,Yahoo,"CPower Energy Management (""CPower""), a leading energy solutions provider, today announced that it has been selected as one of the awardees by Con Edison and Niagara Mohawk Power Corporation d/b/a National Grid (""National Grid"") for each utility's Term-Dynamic Load Management (DLM) Program (""Term-DLM Program"") in New York. The Term-DLM Program is a day-ahead peak-shaving program that will incentivize customers to provide load relief with 21 hours of notice or more. The program offers fixed pricing for contract lengths of three to five years and longer-term price certainty compared to tariff-based DLM programs, which can change pricing annually.",https://finnhub.io/api/news?id=9e2aced78db7bb1dfca7283e055b37274b9c24b20337692ed6f16eb42e124db5
company,1618993800,Con Edison and National Grid Select CPower for Dynamic Load Management Program in New York,66248914,,ED,PR Newswire,Looking for stock market analysis and research with proves results? Zacks.com offers in-depth financial research with over 30years of proven results.,https://finnhub.io/api/news?id=12f6c8a4a43a278f56b62efadeee09aa803d37c0847a4866ba9d253f1bfd259e
company,1618976340,"Ellsworth Advisors, LLC Buys General Dynamics Corp, Anthem Inc, Costco Wholesale Corp, Sells ...",66295675,https://static.gurufocus.com/photos/gurus/guru_logo_square.jpg,ED,GuruFocus,"Ellsworth Advisors, LLC Buys General Dynamics Corp, Anthem Inc, Costco Wholesale Corp, Sells Kimberly-Clark Corp, Mantech International Corp, Balchem Corp, Stocks: CSCO,SLV,ED,T,PRU,PFE,GD,ANTM,COST,CNC,MSI,BDX,KMB, release date:Apr 21, 2021",https://finnhub.io/api/news?id=a513dfb37b8d2e8ff2a70e47d7895117a4a738180e61d16d4f860ad23fb3ee5e
company,1618937460,"Consolidated Edison Inc. stock rises Tuesday, outperforms market",66182256,https://images.mktw.net/im-220105/social,ED,MarketWatch,"Shares of Consolidated Edison Inc. advanced 1.28% to $79.35 Tuesday, on what proved to be an all-around grim trading session for the stock market, with the...",https://finnhub.io/api/news?id=296787585fd8cfeeab0c5c5e40c477aa98ebaf7c38a03b19c937cbdf6dd2a3e9
company,1618936174,12 Of 41 Reliable Retiree Dividend Stocks Bloom In April,66180932,https://static.seekingalpha.com/cdn/s3/uploads/getty_images/1188679591/medium_image_1188679591.jpg,ED,SeekingAlpha,Kiplinger Investing periodically lists retirement tips. This 41 stock list comes from two articles.,https://finnhub.io/api/news?id=339c285d755bc6210df6677bfa9924dd0bae39f416cee77bd14fb01ed1fb1603
company,1618862106,Is ED Stock A Buy or Sell?,66358184,https://s.yimg.com/uu/api/res/1.2/1Bu21zLbOxX0TNwVtybc1g--~B/aD0yMDQ4O3c9MTYxMzthcHBpZD15dGFjaHlvbg--/https://media.zenfs.com/en/insidermonkey.com/c151ebdb4b633550b37a61bfb32cbc96,ED,Yahoo,"In this article you are going to find out whether hedge funds think Consolidated Edison, Inc. (NYSE:ED) is a good investment right now. We like to check what the smart money thinks first before doing extensive research on a given stock. Although there have been several high profile failed hedge fund picks, the consensus picks […]",https://finnhub.io/api/news?id=029c836e890a95cd9573c87c23c6fefa1fb617da0471b6059f26ea579af1069a
company,1618851060,Consolidated Edison Inc. stock outperforms competitors on strong trading day,66182257,https://images.mktw.net/im-220105/social,ED,MarketWatch,"Shares of Consolidated Edison Inc. inched 0.18% higher to $78.35 Monday, on what proved to be an all-around poor trading session for the stock market, with...",https://finnhub.io/api/news?id=f20c46e47bab2ce58c50e8eb77a1bc3675cf6f9274bcccf08ad05d233c76c9bf
company,1618805238,Hard To Find A Diamond In The Utilities Rough,66171142,https://static.seekingalpha.com/cdn/s3/uploads/getty_images/1249324925/medium_image_1249324925.jpg,ED,SeekingAlpha,"Even during normal times, the Utilities sector is anything but sexy.",https://finnhub.io/api/news?id=b871e572b60aea1cd3dd9b6c45ab5f26db08e916fc2a3aa40ed0e2e21b0dfd0e
company,1618803540,"Gyroscope Capital Management Group, LLC Buys Cisco Systems Inc, Chubb, Sherwin-Williams Co, ...",66263997,https://static.gurufocus.com/photos/gurus/guru_logo_square.jpg,ED,GuruFocus,"Gyroscope Capital Management Group, LLC Buys Cisco Systems Inc, Chubb, Sherwin-Williams Co, Sells American Express Co, Intel Corp, JPMorgan Chase, Stocks: CSCO,SHW,MSFT,ED,LDOS,GPN,CB,AMT,WDFC,VIG,TGT,K,AX, release date:Apr 19, 2021",https://finnhub.io/api/news?id=add0aaa6505cfeaf4a332f478d7cef9a465eefef4a77b839fd045de7be81481e
company,1618737468,If You Had Bought Consolidated Edison's (NYSE:ED) Shares A Year Ago You Would Be Down 13%,66358186,https://s.yimg.com/uu/api/res/1.2/naUy9BSoI62CZsfZfNs5GQ--~B/aD00MzI7dz0xMTk0O2FwcGlkPXl0YWNoeW9u/https://media.zenfs.com/en/simply_wall_st__316/e44b48510541f08ce6d7c1a7b2f6b239,ED,Yahoo,"Consolidated Edison, Inc. ( NYSE:ED ) shareholders should be happy to see the share price up 12% in the last quarter...",https://finnhub.io/api/news?id=adfc74177d2e14bab7dcce0a9fdd37dadd79162349f140c5925a04dbf9ffdf23
company,1618700647,Dividend Income Summary: Bert's March 2021 Summary,66165541,https://static.seekingalpha.com/uploads/2021/4/17/saupload_dividend-income-march-image.png,ED,SeekingAlpha,"I could not be happier and more excited with our March dividend income results. We crossed a huge milestone figure during the month, earning over $4,000 in dividend income.",https://finnhub.io/api/news?id=9a8ea98a5cf2f17283cb0ae05c0efb5234645c3cfd65225b03ba58500e73e82d
company,1618642800,AstraZeneca Is One Very Safe Hyper-Growth Blue Chip,66162046,https://static.seekingalpha.com/cdn/s3/uploads/getty_images/158951998/medium_image_158951998.jpg,ED,SeekingAlpha,"In a world where hyper growth often trades at dangerous valuations, and growth is never guaranteed, we consider AstraZeneca one very safe hyper-growth blue chip.",https://finnhub.io/api/news?id=4b891844c118386a13cca518367306f2953893bc55bdf5cac53e655d6f739144
company,1618591860,Consolidated Edison Inc. stock outperforms competitors on strong trading day,66173390,https://images.mktw.net/im-220105/social,ED,MarketWatch,"Shares of Consolidated Edison Inc. rose 1.32% to $78.21 Friday, on what proved to be an all-around great trading session for the stock market, with the S&P...",https://finnhub.io/api/news?id=8d477dff94ce9f12f1cd6f2ba0826c62a1325a92823392af3c4c174b2e6bada2
company,1618518600,Con Edison Declares Common Stock Dividend,66358188,https://s.yimg.com/uu/api/res/1.2/edZRELqxhyHqs7C3h.rkZw--~B/aD0xNjt3PTE2O2FwcGlkPXl0YWNoeW9u/https://media.zenfs.com/en/prnewswire.com/0b8e88254da72bdb04e58388cbf30ae0,ED,Yahoo,"Consolidated Edison, Inc. (Con Edison) (NYSE: ED) declared a quarterly dividend of 77.5 cents a share on its common stock, payable June 15, 2021 to stockholders of record as of May 19, 2021.",https://finnhub.io/api/news?id=8169499a9d65ae5a2d48b1c53563971be602bc74399cefc573457336fb8ff246
company,1618506644,New York approves Con Edison's proposed $800 mln power line projects,66358190,https://s.yimg.com/cv/apiv2/social/images/yahoo_default_logo-1200x1200.png,ED,Yahoo,"New York state utility regulators on Thursday approved Consolidated Edison Co of New York Inc's (Con Edison) request to recover costs for three transmission projects in its New York City service area.  The projects, which the state Public Service Commission said represent an $800 million investment, would maintain and improve reliability and allow several fossil fuel-fired power plants to retire.  The projects include transmission from New York neighborhoods Rainey to Corona, Gowanus to Greenwood and Goethals to Greenwood.",https://finnhub.io/api/news?id=d201c0e8ee5705d7f562125ae533e0f10ce140a17528bda2f3628f8723d26013
company,1618505460,Consolidated Edison Inc. stock outperforms market on strong trading day,66157473,https://images.mktw.net/im-220105/social,ED,MarketWatch,"Shares of Consolidated Edison Inc. rallied 1.35% to $77.19 Thursday, on what proved to be an all-around favorable trading session for the stock market, with...",https://finnhub.io/api/news?id=9bc74448252d14a242ff18b9d83435a7c5484ef3694ade4c62c74527eca8f7e2
company,1618504200,Con Edison Declares Common Stock Dividend,66450721,,ED,PR Newswire,Looking for stock market analysis and research with proves results? Zacks.com offers in-depth financial research with over 30years of proven results.,https://finnhub.io/api/news?id=571c93b944a49a92407fcf1c64bb50744fd120d4f61355d33df81a458a92e215
company,1618481280,June 18th Options Now Available For Consolidated Edison (ED),66450724,,ED,Stock Options Channel,"Staff article entitled June 18th Options Now Available For Consolidated Edison (ED), about stock options, from Stock Options Channel.",https://finnhub.io/api/news?id=1082e479f7325546706be9a61990a40989049852c0b09b522abe26bd87e57660
