category,datetime,headline,id,image,related,source,summary,url
company,1620321540,"Kount, An Equifax Company, Announces New Dispute and Chargeback Management Solution, Integrating Major Card Brand Offerings in One Dashboard",67645909,,EFX,PR Newswire,Looking for stock market analysis and research with proves results? Zacks.com offers in-depth financial research with over 30years of proven results.,https://finnhub.io/api/news?id=6b9cea0fbf380be4e2fb88349f24affbdc5c3691e5f1af63213436a7bf420640
company,1620320520,"Kount, An Equifax Company, Announces Partnership with Ethoca for Dispute Management",67645910,,EFX,PR Newswire,Looking for stock market analysis and research with proves results? Zacks.com offers in-depth financial research with over 30years of proven results.,https://finnhub.io/api/news?id=423092895eef4262890babadec0fe98f08c2f94a6c7ff981d1808250d6220fe2
company,1620319860,"Equifax Inc. stock falls Thursday, underperforms market",67675711,https://images.mktw.net/im-220105/social,EFX,MarketWatch,"Shares of Equifax Inc. slipped 1.12% to $237.16 Thursday, on what proved to be an all-around great trading session for the stock market, with the S&P 500...",https://finnhub.io/api/news?id=d4a5e7de1caef58a7b0c6270ddddbe5d74ebf9c96979569a0af4e15a2f38f834
company,1620310500,Equifax Board of Directors Declares Quarterly Dividend,67631829,,EFX,PR Newswire,Looking for stock market analysis and research with proves results? Zacks.com offers in-depth financial research with over 30years of proven results.,https://finnhub.io/api/news?id=30247710b0e03f635cdcf9635444bf07c9b273b38c3c9555aa48ac591bcccc49
company,1620297540,"Zwj Investment Counsel Inc Buys Equifax Inc, DISH Network Corp, Northrop Grumman Corp, Sells ...",67651391,,EFX,GuruFocus,GuruFocus Article or News written by insider and the topic is about: ,https://finnhub.io/api/news?id=641089cb27baf89c7ecb10316261664ab2fd8a241b0b79f07179b0fd1dcd05a3
company,1620289860,Credit Suisse to hold a virtual conference,67622894,,EFX,Thefly.com,Credit Suisse to hold a virtual conference ADT ARMK ASGN AMK ADP BV CLVT FIX DNB ECL EEX EFX FCN RGP RANJY WM VVNT ECOL TBI TNET MCO NDAQ MGRC TRU TRI TMX KFY MAN HSII HRB,https://finnhub.io/api/news?id=b3aa87986838f2dc5950d53b186f3b76a7ac2b22bb8b219099cdd816335ce252
company,1620234000,Enerflex Announces First Quarter 2021 Financial Results and Quarterly Dividend,67604795,,EFX,GlobeNewswire,Looking for stock market analysis and research with proves results? Zacks.com offers in-depth financial research with over 30years of proven results.,https://finnhub.io/api/news?id=3985a9b971abc150b3b13db59dc357b65311336abbc8c4fac67f3fc14b68935f
company,1620233460,"Equifax Inc. stock rises Wednesday, outperforms market",67675712,https://images.mktw.net/im-220105/social,EFX,MarketWatch,"Shares of Equifax Inc. advanced 1.20% to $239.85 Wednesday, on what proved to be an all-around favorable trading session for the stock market, with the S&P...",https://finnhub.io/api/news?id=d83617c2995bb17cbd3e6c2b9ac4807ec5a0c13ceb906ad75ecd83e048a21cbd
company,1620216000,Equifax Launches 2020 Security Annual Report,67570767,https://s.yimg.com/uu/api/res/1.2/3J1mh1mQJUkZdpOkmCMZAg--~B/aD03NTt3PTQwMDthcHBpZD15dGFjaHlvbg--/https://media.zenfs.com/en/prnewswire.com/bb4651d6cacbdff7475ec36c4b336df8,EFX,Yahoo,"Equifax Inc., a data, analytics and technology company, today released an inaugural 2020 Security Annual Report, detailing the company's three-year enterprise-wide cloud-technology and security transformation, establishing the company as a leader in security. The steps Equifax has taken to quickly rebuild its entire organization from technology to culture serve as a blueprint for how other organizations can establish a security-first approach to maintain success and protect themselves and their customers.",https://finnhub.io/api/news?id=da175d4c6a081981a1caf3547e9c1b94d0f403bbe4e27f97373055c427da9bad
company,1620201600,Equifax Launches 2020 Security Annual Report,67571527,,EFX,PR Newswire,Looking for stock market analysis and research with proves results? Zacks.com offers in-depth financial research with over 30years of proven results.,https://finnhub.io/api/news?id=983e7cd4efe05cfc7ba78d1f3eb3f7b10efe0e2fbf82faa30fa55a6b80ea3bb4
company,1620194409,A credit rating dispute could cost me getting a mortgage renewal,67537090,https://s.yimg.com/uu/api/res/1.2/6bISBatlkgwwAFcIZckabA--~B/aD0zMDA7dz01MDA7YXBwaWQ9eXRhY2h5b24-/https://media.zenfs.com/en/theguardian_763/f2ac6f8031b0784073e5824d7043dbcc,EFX,Yahoo,A credit rating dispute could cost me getting a mortgage renewalI am caught between Sainsbury’s Bank and Equifax over a default notice error Getting a low credit score can seriously affect people’s lives. Photograph: Feng Yu/Alamy,https://finnhub.io/api/news?id=8aaacff9b73baad710d70975f07910bc027cbec5d3e5a1ca996c011cf4a1a588
company,1620168666,Tracking William Von Mueffling's Cantillon Capital Management Portfolio - Q1 2021 Update,67520608,https://static.seekingalpha.com/cdn/s3/uploads/getty_images/186805810/medium_image_186805810.jpg,EFX,SeekingAlpha,William von Mueffling's 13F portfolio value increased this quarter from $13.34B to $13.74B. The portfolio continues to be very concentrated with the top 5 positions accounting for ~25%.,https://finnhub.io/api/news?id=aabcf6f472c2b71658489a05dcd704cf4f515999c25fb7a5f68e1cbcedaf2bbb
company,1620165923,Top 5 Trades of Tom Gayner's Markel in 1st Quarter,67496631,,EFX,Yahoo,Firm takes position in pharmaceutical company,https://finnhub.io/api/news?id=d670903823f1822fc676e48c19eb267757e51df44969a5151028bcade006b74d
company,1620158580,Enerflex Announces Election of Board of Directors,67509510,,EFX,GlobeNewswire,Looking for stock market analysis and research with proves results? Zacks.com offers in-depth financial research with over 30years of proven results.,https://finnhub.io/api/news?id=277efaf4381127773964e16288b7be51158d4ebd72e6e49b0b5e819dd5107f80
company,1620147060,Equifax Inc. stock outperforms market on strong trading day,67596324,https://images.mktw.net/im-220105/social,EFX,MarketWatch,"Shares of Equifax Inc. advanced 1.33% to $237.01 Tuesday, on what proved to be an all-around mixed trading session for the stock market, with the Dow Jones...",https://finnhub.io/api/news?id=bb336a29be0bf0c72a36e968bd4698c44483adaabef288acbd438be4194d24da
company,1620125504,"RSP, KSU, EFX, IQV: ETF Inflow Alert",67464346,https://www.nasdaq.com/sites/acquia.prod/files/2019-05/0902-Q19%20Total%20Markets%20photos%20and%20gif_CC8.jpg?126461383,EFX,Nasdaq,"Looking today at week-over-week shares outstanding changes among the universe of ETFs covered at ETF Channel, one standout is the Invesco S&P 500— Equal Weight ETF (Symbol: RSP) where we have detected an approximate $223.7 million dollar inflow -- that's a 0.8% increa",https://finnhub.io/api/news?id=ef94a91543499eb249083624085528a307666d0cb3cc4338b0d2822ea88376a2
company,1620101160,Top 5 Trades of Tom Gayner`s Markel in 1st Quarter,67497617,,EFX,GuruFocus,GuruFocus Article or News written by James Li and the topic is about: Firm takes position in pharmaceutical company,https://finnhub.io/api/news?id=56117f9f64f9132b2c219ea6fa7408ed3f9800978338bf71d865902e15d468c5
company,1620060660,Equifax Inc. stock outperforms competitors on strong trading day,67433919,https://images.mktw.net/im-220105/social,EFX,MarketWatch,"Shares of Equifax Inc. rallied 2.03% to $233.89 Monday, on what proved to be an all-around favorable trading session for the stock market, with the S&P 500...",https://finnhub.io/api/news?id=6b3c33947e29a58685d6696fe84264babb4fd1dff11e18e9fdb5ba9ec47b9191
company,1620054847,"Exclusive: Ford, BMW lead $130 million investing round in solid-state battery startup",67356838,https://s.yimg.com/uu/api/res/1.2/b564M6OBS.FxdsFbKCR_Yw--~B/aD01MzM7dz04MDA7YXBwaWQ9eXRhY2h5b24-/https://media.zenfs.com/en/reuters.com/33068343604f78d634cf73584c1742ae,EFX,Yahoo,"Ford Motor Co and BMW AG are leading a $130 million funding round in a solid-state battery startup, Solid Power, as carmakers push to lower the cost of electric vehicles by investing in the development of affordable but powerful rechargeable batteries, the companies said on Monday.  The Series B investment round, which includes venture capital firm Volta Energy Technologies, allows Solid Power to expand in-house manufacturing capabilities and positions the battery maker to eventually supply future EVs, possibly by the end of the decade according to BMW battery cell technology chief Peter Lamp.",https://finnhub.io/api/news?id=2e3d6d812ba8192c26ddd396a8145d94166d00ea3fc4b6ad09c0fe43dd8868dc
company,1620045180,7 Overvalued Blue-Chip Stocks That Are Not Tech Stocks,67364515,https://investorplace.com/wp-content/uploads/2019/07/blue-chip-newspaper.jpg,EFX,InvestorPlace,"While tech stocks are expected to be highly valued, it makes no sense for mature blue-chip stocks to be valued so highly.",https://finnhub.io/api/news?id=ee5206b640729e78617e3be7d5d4eb25c7c0e7c134d3200f2136808e9756d5be
company,1620043211,"4 Stocks Turned $10,000 Into $35,864 In Just 4 Months",67339265,,EFX,Yahoo,"Talk about an amazing start to a year — the S&P 500 just notched 2021's best month so far. And if you're not paying attention, you're missing out.",https://finnhub.io/api/news?id=71ec43833129f9b528d56838119c613e531178441bf7ed86ab2166ffb6152b8a
company,1619807317,Stocks With The Best History Of Beating Estimates,67171568,https://static.seekingalpha.com/cdn/s3/uploads/getty_images/1141354730/medium_image_1141354730.jpg,EFX,SeekingAlpha,Top-rated stocks in our research that also have a strong track record of beating analyst expectations. Stock ideas cutting across most sectors.,https://finnhub.io/api/news?id=7b3a7e88b1aa677bf322fd24181341a2d709ee1c5dbf5ce4fc3b52eb57c9a8c1
company,1619801460,Equifax Inc. stock outperforms competitors on strong trading day,67367943,https://images.mktw.net/im-220105/social,EFX,MarketWatch,"Shares of Equifax Inc. inched 0.54% higher to $229.23 Friday, on what proved to be an all-around grim trading session for the stock market, with the S&P 500...",https://finnhub.io/api/news?id=938d807c8951fa47fbc7d27ca53be946bbf2455d092fdc734b9892a32251b7d2
company,1619761736,Here's Why Equifax Inc.'s (NYSE:EFX) CEO Compensation Is The Least Of Shareholders' Concerns,67149378,https://s.yimg.com/uu/api/res/1.2/94bcc5bcuvrJNKUdDP7UgA--~B/aD00MzI7dz0xMTk0O2FwcGlkPXl0YWNoeW9u/https://media.zenfs.com/en/simply_wall_st__316/58df37cadd48c6619bbe022c72dae85c,EFX,Yahoo,Performance at Equifax Inc. ( NYSE:EFX ) has been reasonably good and CEO Mark Begor has done a decent job of steering...,https://finnhub.io/api/news?id=fc70734f4bf4a2d688e8f3c91a0376de5cadf405f534d019747b4d73a569f423
company,1619747725,Equifax Inc.'s (NYSE:EFX) CEO Compensation Looks Acceptable To Us And Here's Why,67148832,https://www.nasdaq.com/sites/acquia.prod/files/2019-05/0902-Q19%20Total%20Markets%20photos%20and%20gif_CC8.jpg?655106299,EFX,Nasdaq,"Under the guidance of CEO Mark Begor, Equifax Inc. (NYSE:EFX) has performed reasonably well recently.  As shareholders go into the upcoming AGM on 06 May 2021, CEO compensation will probably not be their focus, but rather the steps management will take to continue the growth mom",https://finnhub.io/api/news?id=7ee8fe3abfbf10adedca6c7c81bf84f95aefaf1d5c93fa730e0877934473d164
company,1619715060,"Equifax Inc. stock rises Thursday, still underperforms market",67367945,https://images.mktw.net/im-220105/social,EFX,MarketWatch,"Shares of Equifax Inc. inched 0.31% higher to $228.00 Thursday, on what proved to be an all-around great trading session for the stock market, with the S&P...",https://finnhub.io/api/news?id=a6ae9352df758fa8f045e308e578d0f6d45172ca6c4e89b44f21203d7168ef5a
company,1619681940,"Aevitas Wealth Management, Inc. Buys ARK Genomic Revolution ETF, ARK Innovation ETF, Novartis ...",67112903,,EFX,GuruFocus,GuruFocus Article or News written by insider and the topic is about: ,https://finnhub.io/api/news?id=a21c073dd2459cf2210a00fe9b5d15e0da74fdc7afa37cc7d0118025006c5dec
company,1619667540,"RiverFront Investment Group, LLC Buys Vanguard Intermediate-Term Government Bond ETF, BTC ...",67124745,,EFX,GuruFocus,GuruFocus Article or News written by insider and the topic is about: ,https://finnhub.io/api/news?id=3e18e0ec2ef1dd1b59b49b972c67f0d472e68c71df2833b7ecfc1bc6095e32de
company,1619628660,Equifax Inc. stock underperforms Wednesday when compared to competitors,67367948,https://images.mktw.net/im-220105/social,EFX,MarketWatch,"Shares of Equifax Inc. slipped 3.00% to $227.30 Wednesday, on what proved to be an all-around grim trading session for the stock market, with the S&P 500...",https://finnhub.io/api/news?id=83adf956c154b4e21af0790e37ec8e112999f0e4afc1d9288dd092ab837fb635
company,1619626804,Earnings Estimates Moving Higher for Equifax (EFX): Time to Buy?,67081178,https://s.yimg.com/uu/api/res/1.2/F3nzpi36wi9juoO_v9PrEA--~B/aD02MDA7dz05MDA7YXBwaWQ9eXRhY2h5b24-/https://media.zenfs.com/en/zacks.com/2a50596f066181e48e4ae0ad6be00462,EFX,Yahoo,"Equifax (EFX) shares have started gaining and might continue moving higher in the near term, as indicated by solid earnings estimate revisions.",https://finnhub.io/api/news?id=ff69492a9cd1e09d0eb6752e4efddb9ded984492623fab92c28753732ea7a99d
company,1619625604,Here's Why Momentum Investors Will Love Equifax (EFX),67081182,https://s.yimg.com/uu/api/res/1.2/I67vygGrP1BjgOjVx.apeA--~B/aD03Mjg7dz05MDA7YXBwaWQ9eXRhY2h5b24-/https://media.zenfs.com/en/zacks.com/b9775f315e7b6c4ada6e36d0048a929a,EFX,Yahoo,Does Equifax (EFX) have what it takes to be a top stock pick for momentum investors? Let's find out.,https://finnhub.io/api/news?id=81e28a7203eecf86c7f6784455e9033292b89a00b995b179de198954e1cf4dc5
company,1619598240,TransUnion price target raised to $120 from $100 at Truist,66953873,,EFX,Thefly.com,TransUnion price target raised to $120 from $100 at Truist Truist TRU EFX,https://finnhub.io/api/news?id=5fdfb12b2bdfdcabf969da6999f43d2fc2c1c9d9f0982af807b63992c4a819c6
company,1619587560,Equifax price target raised to $270 from $210 at Barclays,66976134,,EFX,Thefly.com,Equifax price target raised to $270 from $210 at Barclays Barclays EFX,https://finnhub.io/api/news?id=daa5ebedbd966b123788f740a87955c0a93782c00f1521dc7c8343f41bd19a56
company,1619573784,Equifax Inc. (NYSE:EFX) Looks Just Right With A 28% Price Jump,67013485,https://www.nasdaq.com/sites/acquia.prod/files/2019-05/0902-Q19%20Total%20Markets%20photos%20and%20gif_CC8.jpg?177355037,EFX,Nasdaq,"Equifax Inc. (NYSE:EFX) shareholders have had their patience rewarded with a 28% share price jump in the last month.    Looking back a bit further, it's encouraging to see the stock is up 67% in the last year.    Since its price has surged higher, Equifax's price-to-earnings (or",https://finnhub.io/api/news?id=3f429c42e5c43eaf2d2e9b206b7c6d53e55b77f8c2273cfc863daf0138b44232
company,1619542260,Equifax Inc. stock outperforms market on strong trading day,66833524,https://images.mktw.net/im-220105/social,EFX,MarketWatch,"Shares of Equifax Inc. rose 3.91% to $234.34 Tuesday, on what proved to be an all-around mixed trading session for the stock market, with the Dow Jones...",https://finnhub.io/api/news?id=36080b375aaeb4f348d36bfd284ecd2456a3736d3da93fffe7bf84eeffb2cea7
company,1619523900,Revolut Selects Equifax as U.S. Data and Analytics Partner,66637932,https://s.yimg.com/uu/api/res/1.2/3J1mh1mQJUkZdpOkmCMZAg--~B/aD03NTt3PTQwMDthcHBpZD15dGFjaHlvbg--/https://media.zenfs.com/en/prnewswire.com/bb4651d6cacbdff7475ec36c4b336df8,EFX,Yahoo,"Global data, analytics and technology company Equifax (NYSE: EFX), and global fintech innovator, Revolut today announced a new strategic relationship. Used by more than 15 million people globally to make over 100 million transactions a month, Revolut has selected Equifax to better serve its customers in the United States and provide a more diverse range of services. Equifax was chosen for the ability to provide cloud-native differentiated data assets and real-time predictive analytics for a faster, more informed view of customers and prospects.",https://finnhub.io/api/news?id=d4c706a4755476acfb16e4a9a66f78fe38690267cec9848de4dba62d34d63e88
company,1619523000,Equifax Accelerates Fintech Innovation With New InnovationX Immersive Experience,66637936,https://s.yimg.com/uu/api/res/1.2/3J1mh1mQJUkZdpOkmCMZAg--~B/aD03NTt3PTQwMDthcHBpZD15dGFjaHlvbg--/https://media.zenfs.com/en/prnewswire.com/bb4651d6cacbdff7475ec36c4b336df8,EFX,Yahoo,"Equifax (NYSE: EFX) has introduced a new InnovationX immersive experience to help fintechs, established financial institutions and other organizations accelerate innovation in today's competitive market. This unique testing ground for new financial services products enables organizations to validate ideas and understand new markets with ready access to real-time, cloud-native data and advanced analytics that only Equifax can provide. New innovations are developed in close collaboration with Equifax executive leadership and the best-of-the-best in data science. InnovationX will be led by Peter Maynard, Ph.D, the newly appointed Senior Vice President of Data and Analytics for Equifax United States Information Solutions (USIS).",https://finnhub.io/api/news?id=5fccd4e34d4e559d5d49cdad6db5df591aa409f4b07abc78846eb1dd32ffddef
company,1619509500,Revolut Selects Equifax as U.S. Data and Analytics Partner,66640001,,EFX,PR Newswire,Looking for stock market analysis and research with proves results? Zacks.com offers in-depth financial research with over 30years of proven results.,https://finnhub.io/api/news?id=964a74f53d8e8d41e270f9640390ecf5ec58c2780baf1d0d92764441a1562315
company,1619508600,Equifax Accelerates Fintech Innovation With New InnovationX Immersive Experience,66640006,,EFX,PR Newswire,Looking for stock market analysis and research with proves results? Zacks.com offers in-depth financial research with over 30years of proven results.,https://finnhub.io/api/news?id=1de352ec5ca56ff1017ad6154d5e83d635e9eb14756b161e6ad171ee33661573
company,1619505960,Equifax and Revolut announce new strategic relationship,66640010,,EFX,Thefly.com,Equifax and Revolut announce new strategic relationship EFX,https://finnhub.io/api/news?id=a2ec02c4270a15f7713a738a73f64cbde02d69cae0d3b5f67b6ccc70914e3a72
company,1619462967,Equifax: Well-Managed And Cheaper Than Its Peers,66467152,https://static.seekingalpha.com/cdn/s3/uploads/getty_images/1267661932/medium_image_1267661932.jpg,EFX,SeekingAlpha,"Equifax is undervalued when compared to its competitors, but the industry is a bit expensive at the moment.",https://finnhub.io/api/news?id=44635623c63976aefb1b6ce99ef2c6c057a3b9183296708545e572c64aa46132
company,1619455860,Equifax Inc. stock underperforms Monday when compared to competitors,66577097,https://images.mktw.net/im-220105/social,EFX,MarketWatch,"Shares of Equifax Inc. slid 1.82% to $225.53 Monday, on what proved to be an all-around mixed trading session for the stock market, with the S&P 500 Index...",https://finnhub.io/api/news?id=a7203343c0af2162caac998625538debe7761accb1f140e3d8e206873873fb39
company,1619438040,Equifax Workforce Solutions offers Compliance Center Advanced to help employers with remote hiring and rehires,66637944,https://s.yimg.com/uu/api/res/1.2/3J1mh1mQJUkZdpOkmCMZAg--~B/aD03NTt3PTQwMDthcHBpZD15dGFjaHlvbg--/https://media.zenfs.com/en/prnewswire.com/bb4651d6cacbdff7475ec36c4b336df8,EFX,Yahoo,"As the Bureau of Labor Statistics (BLS) is reporting initial increases for hiring in March, Equifax (NYSE: EFX) offers Compliance Center Advanced, designed to assist employers with many of the nuances involved in rehiring and remote hiring. More employers have embraced remote hiring practices and as the economy recovers organizations are looking to rehire employees that were let go as part of the downturn associated with the pandemic. The Compliance Center platform from Equifax Workforce Solutions packages and helps deliver a more streamlined service for onboarding paperwork that includes the I-9 Management service with the I-9 Anywhere® nationwide network of local completers, with options to add on state form compliance processes to help accommodate new and remote hires as well as Work Opportunity Tax Credit (WOTC) screening for job applicants.",https://finnhub.io/api/news?id=072e451578fb83d28bfbd0df0e99d22e7613efd5b258a291b0ffc502d8d99a27
company,1619423640,Equifax Workforce Solutions offers Compliance Center Advanced to help employers with remote hiring and rehires,66392431,,EFX,PR Newswire,Looking for stock market analysis and research with proves results? Zacks.com offers in-depth financial research with over 30years of proven results.,https://finnhub.io/api/news?id=66e28875db105b93ba27570a314f3deef3a0ddb4193adea88acfd7ebbae156b4
company,1619323744,One Last Hurrah? The Stocks To Buy Now,66243334,https://static.seekingalpha.com/uploads/2021/4/23/486106-1619222908388881_origin.png,EFX,SeekingAlpha,"Warning signals are flashing, suggesting it could be smart to fade the next move up. The strongest sectors currently include financials, REITs, and consumer goods.",https://finnhub.io/api/news?id=15660c3b80c6ac06438c0199b68804eebace5b9a2854cb0b752c7db9b0506215
company,1619254872,"With EPS Growth And More, Equifax (NYSE:EFX) Is Interesting",66336040,https://s.yimg.com/uu/api/res/1.2/94bcc5bcuvrJNKUdDP7UgA--~B/aD00MzI7dz0xMTk0O2FwcGlkPXl0YWNoeW9u/https://media.zenfs.com/en/simply_wall_st__316/58df37cadd48c6619bbe022c72dae85c,EFX,Yahoo,"Some have more dollars than sense, they say, so even companies that have no revenue, no profit, and a record of falling...",https://finnhub.io/api/news?id=37a563e1e7d787512696577e1651be50429ec7492d4eb9c7b76f01fce286b663
company,1619196660,"Equifax Inc. stock rises Friday, outperforms market",66242524,https://images.mktw.net/im-220105/social,EFX,MarketWatch,"Shares of Equifax Inc. rallied 3.75% to $229.72 Friday, on what proved to be an all-around favorable trading session for the stock market, with the S&P 500...",https://finnhub.io/api/news?id=5d8b3745dd069be72fc3e4347c7a47a37a8cb64675f89e2bf9b366e63eae9ca8
company,1619192151,Capital Gains Tax Fears Crimp Stocks Rally,66202059,https://static.seekingalpha.com/assets/og_image_1200-29b2bfe1a595477db6826bd2126c63ac2091efb7ec76347a8e7f81ba17e3de6c.png,EFX,SeekingAlpha,"Stocks experienced a bit of a rollercoaster, starting off with some selling on Monday and Tuesday before rallying on Wednesday and Thursday morning. Then came President Biden's tax plan.",https://finnhub.io/api/news?id=5bcca03e8fb80ef68a709ec5173b5e716492bec4c0163d788454277e5616c592
company,1619177351,Equifax (EFX) Stock Jumps 14.9%: Will It Continue to Soar?,66336042,https://s.yimg.com/uu/api/res/1.2/UFHVo0nEIlTrfV4hmof8lw--~B/aD02NzU7dz05MDA7YXBwaWQ9eXRhY2h5b24-/https://media.zenfs.com/en/zacks.com/a7a59e19cd76862370d9ebeff33ffd1c,EFX,Yahoo,Equifax (EFX) was a big mover last session on higher-than-average trading volume. The latest trend in earnings estimate revisions might help the stock continue moving higher in the near term.,https://finnhub.io/api/news?id=d19c97f19174061bc448a1f6ba1685475c6ff29e91160f9b1fed0dbbf8e541e9
company,1619166995,EFX Crosses Above Average Analyst Target,68964425,https://www.nasdaq.com/sites/acquia.prod/files/2019-05/0902-Q19%20Total%20Markets%20photos%20and%20gif_CC8.jpg?2092752479,EFX,Nasdaq,"In recent trading, shares of Equifax Inc (Symbol: EFX) have crossed above the average analyst 12-month target price of $203.60, changing hands for $221.41/share.  When a stock reaches the target an analyst has set, the analyst logically has two ways to react: downgrade on valuati",https://finnhub.io/api/news?id=6f57b16732d1c0d2a5c5a3cf3be37c051bb09744488d0581cd5af21e04ffd216
company,1619163000,EFX Crosses Above Average Analyst Target,66392435,,EFX,ETF Channel,"Staff article entitled EFX Crosses Above Average Analyst Target, about ETFs, from ETF Channel.",https://finnhub.io/api/news?id=d5c8a381b55a1bf1d448885055b27afd70deba6dfbcca8627292f2c938ccf77c
company,1619155140,44 Biggest Movers From Yesterday,68739226,https://cdn.benzinga.com/files/imagecache/og_image_social_share_1200x630/images/story/2012/yesterdays_movers_187.png,EFX,Benzinga,"Gainers

KnowBe4, Inc. (NASDAQ: KNBE) shares jumped 50.9% to close at $24.14 on Thursday after the company priced its IPO at $16 per share.
Neuropace, Inc. (NASDAQ: NPCE) shares...",https://finnhub.io/api/news?id=d637a54af49b2e6b50d5220804f30d518568723f883f08c09636d50e3605a220
