category,datetime,headline,id,image,related,source,summary,url
company,1624899060,Equifax Inc. stock outperforms competitors despite losses on the day,68515610,https://images.mktw.net/im-220105/social,EFX,MarketWatch,"Shares of Equifax Inc. shed 0.64% to $237.45 Monday, on what proved to be an all-around mixed trading session for the stock market, with the S&P 500 Index...",https://finnhub.io/api/news?id=402b25d2883e475a5fe934029c08bccfee82d9d0994fd24a5b2721382c1cdb46
company,1624639860,"Equifax Inc. stock falls Friday, underperforms market",68515612,https://images.mktw.net/im-220105/social,EFX,MarketWatch,"Shares of Equifax Inc. slumped 0.08% to $238.99 Friday, on what proved to be an all-around great trading session for the stock market, with the S&P 500 Index...",https://finnhub.io/api/news?id=dc0e542ee90f2d7409e54c65674a67efca1a3064d98d20d040ebc5da03a6b7c3
company,1624553460,Equifax Inc. stock outperforms competitors on strong trading day,68515613,https://images.mktw.net/im-220105/social,EFX,MarketWatch,"Shares of Equifax Inc. rose 1.90% to $239.18 Thursday, on what proved to be an all-around positive trading session for the stock market, with the S&P 500...",https://finnhub.io/api/news?id=60b0c83ad38bd19831d7917ad583115f03d1e54d39745afbac6d4718a2b73aa7
company,1624535100,Equifax Helps Credit Card Issuers Expand Access to Credit with New Insight Score for Credit Cards,68468305,https://s.yimg.com/uu/api/res/1.2/3J1mh1mQJUkZdpOkmCMZAg--~B/aD03NTt3PTQwMDthcHBpZD15dGFjaHlvbg--/https://media.zenfs.com/en/prnewswire.com/bb4651d6cacbdff7475ec36c4b336df8,EFX,Yahoo,"Equifax (NYSE: EFX) is helping credit card issuers expand access to credit with the new Insight Score for Credit Cards. This industry-specific credit risk score combines traditional credit data with differentiated data that only Equifax can provide— utility, pay TV, Internet and wireless phone payment history for more than 430 million accounts from the National Consumer Telecom & Utilities Exchange (NCTUE). Layering NCTUE data with traditional credit information can provide a more complete finan",https://finnhub.io/api/news?id=9275342e12cbb0a169f99362375eb84c864471fb6ae66f159422af1733201a10
company,1624520700,Equifax Helps Credit Card Issuers Expand Access to Credit with New Insight Score for Credit Cards,68461509,,EFX,PR Newswire,Looking for stock market analysis and research with proves results? Zacks.com offers in-depth financial research with over 30years of proven results.,https://finnhub.io/api/news?id=68211cbef97ad019c314bb665dfc61b6d72c9d4468432f92a2bc6b8483141913
company,1624467060,Equifax Inc. stock underperforms Wednesday when compared to competitors,68515615,https://images.mktw.net/im-220105/social,EFX,MarketWatch,"Shares of Equifax Inc. slid 1.42% to $234.73 Wednesday, on what proved to be an all-around rough trading session for the stock market, with the S&P 500 Index...",https://finnhub.io/api/news?id=0b9dff519b8d10c3cee780f2509a3d3ef4fec8ac54c6f4d30fddd0d714e4ff96
company,1624464000,Jack Ma's Ant In Discussion To Share Data With State Firms: WSJ,68769592,https://cdn.benzinga.com/files/imagecache/og_image_social_share_1200x630/images/story/2012/alipay-5417256_1920_0.jpg,EFX,Benzinga,Ant Group Co. discussed with China's state-owned enterprises to form a credit-scoring company by Q3 to put the fintech giant's proprietary consumer data under regulators...,https://finnhub.io/api/news?id=71fdba9784c63eb7ef06db4d96e307f20edbe4213b7cb358a0854f6b562659cc
company,1624448700,Equifax Announces 2021 Developer Challenge and Accelerator Program: Equifax Accelerate,68436265,https://s.yimg.com/uu/api/res/1.2/3J1mh1mQJUkZdpOkmCMZAg--~B/aD03NTt3PTQwMDthcHBpZD15dGFjaHlvbg--/https://media.zenfs.com/en/prnewswire.com/bb4651d6cacbdff7475ec36c4b336df8,EFX,Yahoo,"Equifax (NYSE: EFX) believes that cloud computing technology is essential to expanding access to credit. As the only cloud-native consumer credit reporting agency, Equifax is leveraging the power of its $1.5 billion cloud transformation to introduce a 2021 developer challenge and accelerator program: Equifax Accelerate. Applications are open through July 29 to start-up and early stage software developers looking to create transformative solutions designed to foster financial inclusion with the p",https://finnhub.io/api/news?id=0a28e62bd5008ca7ed4a229e2f1b2d8133611e1f9afaf27c25661ff65a50321a
company,1624434300,Equifax Announces 2021 Developer Challenge and Accelerator Program: Equifax Accelerate,68441974,,EFX,PR Newswire,Looking for stock market analysis and research with proves results? Zacks.com offers in-depth financial research with over 30years of proven results.,https://finnhub.io/api/news?id=6db21820710209ec1e7231f81e46aec7cd2e9ee25878ba91ee6c63fc75e5011c
company,1624380660,Equifax Inc. stock underperforms Tuesday when compared to competitors,68515617,https://images.mktw.net/im-220105/social,EFX,MarketWatch,"Shares of Equifax Inc. slumped 0.26% to $238.11 Tuesday, on what proved to be an all-around great trading session for the stock market, with the S&P 500...",https://finnhub.io/api/news?id=155e9dd5a4cdd4b67ad8c1087a33b357ea8f23116a508fda0ad9c60197ccd04b
company,1624294260,Equifax Inc. stock outperforms market on strong trading day,68417532,https://images.mktw.net/im-220105/social,EFX,MarketWatch,"Shares of Equifax Inc. rose 2.54% to $238.72 Monday, on what proved to be an all-around great trading session for the stock market, with the S&P 500 Index...",https://finnhub.io/api/news?id=89a803f28d621e1c4ed1f3dbe3433506eace7a1d78ef69436427bced234d3524
company,1624278600,Equifax Workforce Solutions Expands ACA Service to Help Employers Meet Their State Reporting Requirements,68398610,https://s.yimg.com/uu/api/res/1.2/3J1mh1mQJUkZdpOkmCMZAg--~B/aD03NTt3PTQwMDthcHBpZD15dGFjaHlvbg--/https://media.zenfs.com/en/prnewswire.com/bb4651d6cacbdff7475ec36c4b336df8,EFX,Yahoo,"Equifax (NYSE: EFX) has expanded its Affordable Care Act (ACA) Management solution to help satisfy state reporting requirements for the states that have recently implemented their own individual mandates. In those states, employers have additional reporting requirements and must file the same information with the state as to the IRS, a potentially manual and time-consuming task for HR and payroll teams. Equifax Workforce Solutions offers employers with employees in those states with individual m",https://finnhub.io/api/news?id=1797fc7a9e8d7055ef7eb9572ba2881c1850a8274169795671c2580c88e1a7f8
company,1624275000,Equifax To Discuss Financial Inclusion and Access to Credit With JPMorgan Chase Institute and Invest America on June 24,68398613,,EFX,Yahoo,"As part of the company's continued efforts to responsibly expand access to credit, Equifax (NYSE: EFX) today announced a special edition of its industry-leading Market Pulse webinar series. The event, ""Accelerating Access to Credit,"" will be held on June 24. During the session, Equifax United States Information Solutions (USIS) President Sid Singh will moderate a discussion between Christopher Wheat, Co-President of the JPMorgan Chase Institute, and Kahlil Byrd, CEO and Co-Founder of Invest Amer",https://finnhub.io/api/news?id=1e4a2d1d4efe7500ed3a34638b9826a5727174fc64a99c12ff52feb60daa7bb4
company,1624264200,Equifax Workforce Solutions Expands ACA Service to Help Employers Meet Their State Reporting Requirements,68398685,,EFX,PR Newswire,Looking for stock market analysis and research with proves results? Zacks.com offers in-depth financial research with over 30years of proven results.,https://finnhub.io/api/news?id=4e07b8c269d4b09e4da36d02dffe42aad25e02d8856b79aa198a0afaab652f8e
company,1624260600,Equifax To Discuss Financial Inclusion and Access to Credit With JPMorgan Chase Institute and Invest America on June 24,68394097,,EFX,PR Newswire,Looking for stock market analysis and research with proves results? Zacks.com offers in-depth financial research with over 30years of proven results.,https://finnhub.io/api/news?id=b4d0691809d5fc1c6a5dada4061c81755416b6fc268564cb5cce1881cc35cf0f
company,1624258402,Is Equifax Inc.'s (NYSE:EFX) 18% ROE Better Than Average?,68398615,https://s.yimg.com/uu/api/res/1.2/94bcc5bcuvrJNKUdDP7UgA--~B/aD00MzI7dz0xMTk0O2FwcGlkPXl0YWNoeW9u/https://media.zenfs.com/en/simply_wall_st__316/58df37cadd48c6619bbe022c72dae85c,EFX,Yahoo,Many investors are still learning about the various metrics that can be useful when analysing a stock. This article is...,https://finnhub.io/api/news?id=83ce7956bd08a88e61d21cf92f7cb004d609f60e06edaf6a8d13d3039f6fa4d3
company,1624162380,Data Is the New Oil and Experian Is a Major Player,68390305,,EFX,GuruFocus,GuruFocus Article or News written by The City Letter and the topic is about: Why Experian is a quality stock,https://finnhub.io/api/news?id=f91eb6680df2845e625552318d7692ba74709acd9064c535448e4b5a5f766db7
company,1624035060,Equifax Inc. stock outperforms market despite losses on the day,68417533,https://images.mktw.net/im-220105/social,EFX,MarketWatch,"Shares of Equifax Inc. shed 0.62% to $232.80 Friday, on what proved to be an all-around poor trading session for the stock market, with the S&P 500 Index...",https://finnhub.io/api/news?id=c23cc2f70b4cd74cc40a1af7c6fc2e790b71624e1763d1c29a7b16ccccb8b81a
company,1623948660,"Equifax Inc. stock rises Thursday, outperforms market",68417534,https://images.mktw.net/im-220105/social,EFX,MarketWatch,"Shares of Equifax Inc. rallied 1.45% to $234.25 Thursday, on what proved to be an all-around rough trading session for the stock market, with the S&P 500...",https://finnhub.io/api/news?id=be6a14d02df87d6865b5af747ed63ffa263c34f6820f4b27d8e5176793de49a4
company,1623862260,"Equifax Inc. stock falls Wednesday, still outperforms market",68417535,https://images.mktw.net/im-220105/social,EFX,MarketWatch,"Shares of Equifax Inc. slumped 0.23% to $230.90 Wednesday, on what proved to be an all-around rough trading session for the stock market, with the S&P 500...",https://finnhub.io/api/news?id=00f3253bbab8e2f3ef0014858151f66080ec517feb848602dcbafd0714f5db35
company,1623813473,Tracking Al Gore's Generation Investment Management Portfolio - Q1 2021 Update,68295685,https://static.seekingalpha.com/cdn/s3/uploads/getty_images/495498540/medium_image_495498540.jpg,EFX,SeekingAlpha,"Generation Investment Management’s 13F portfolio value increased from $22.41B to $23.86B this quarter. The top three positions are Baxter International, Equifax, and Cisco Systems.",https://finnhub.io/api/news?id=042e4843875e1c56fa8d96d06873353b54f81eab1c0f0d58bd7f7e49f9ed657e
company,1623775860,"Equifax Inc. stock rises Tuesday, outperforms market",68417536,https://images.mktw.net/im-220105/social,EFX,MarketWatch,"Shares of Equifax Inc. rose 1.13% to $231.43 Tuesday, on what proved to be an all-around grim trading session for the stock market, with the S&P 500 Index...",https://finnhub.io/api/news?id=60226b04401b92d5e2e2dc46c355de36a00cf27090059c48be0649f8540c8432
company,1623728280,"Equifax Moves Up In Market Cap Rank, Passing Verisk Analytics",68291907,,EFX,The Online Investor,"the online investor,EFX,VRSK,",https://finnhub.io/api/news?id=eb8d55e5045809a76cfb4e93ece71a88d13a181ae452004fbb24b765c34c5c07
company,1623721255,Here's Why I Think Equifax (NYSE:EFX) Is An Interesting Stock,68372431,https://www.nasdaq.com/sites/acquia.prod/files/2019-05/0902-Q19%20Total%20Markets%20photos%20and%20gif_CC8.jpg?725953002,EFX,Nasdaq,"It's only natural that many investors, especially those who are new to the game, prefer to buy shares in 'sexy' stocks with a good story, even if those businesses lose money.  But as Warren Buffett has mused, 'If you've been playing poker for half an hour and you still don't kno",https://finnhub.io/api/news?id=c8b1a3452ee98fcaee6195fa565620793b19ec312baeb97c275815025f848d94
company,1623689460,Equifax Inc. stock underperforms Monday when compared to competitors,68417537,https://images.mktw.net/im-220105/social,EFX,MarketWatch,"Shares of Equifax Inc. slipped 0.91% to $228.85 Monday, on what proved to be an all-around mixed trading session for the stock market, with the S&P 500 Index...",https://finnhub.io/api/news?id=14e1e3c4a0a9578eac93148b31aaea52ea17db6cdc7cb83f98a3f24dbbcb10fc
company,1623558167,The Stocks To Focus On Today,68238718,https://static.seekingalpha.com/cdn/s3/uploads/getty_images/949211586/medium_image_949211586.jpg,EFX,SeekingAlpha,Inflation is here; and that means these groups ought to be on your radar. The best stocks within every sector now.,https://finnhub.io/api/news?id=11851a7d3519b8540b9cab305fd7732f311c2c186dfc9c5beb709ba3c6f53a8c
company,1623430260,"Equifax Inc. stock rises Friday, outperforms market",68230321,https://images.mktw.net/im-220105/social,EFX,MarketWatch,"Shares of Equifax Inc. inched 0.85% higher to $230.96 Friday, on what proved to be an all-around favorable trading session for the stock market, with the S&P...",https://finnhub.io/api/news?id=ca9d9c73bc9e1c68bc652ba1dc233e6ad14b1bef65185cc742ebd69cca4dfd78
company,1623406482,Cyber standards are key in battling ransomware attacks,68224467,https://image.cnbcfm.com/api/v1/image/106114015-1567698570831gettyimages-817486028.jpeg?v=1623347827,EFX,CNBC,"Development of a set of cybersecurity standards, similar to generally accepted accounting principles, could go a long way in helping companies with breaches.",https://finnhub.io/api/news?id=dc16d7213bdac5a1e503677ffd96c2fbb9bbc96d69638df59a845ae7690d1278
company,1623343860,"Equifax Inc. stock rises Thursday, still underperforms market",68230322,https://images.mktw.net/im-220105/social,EFX,MarketWatch,"Shares of Equifax Inc. inched 0.16% higher to $229.01 Thursday, on what proved to be an all-around great trading session for the stock market, with the S&P...",https://finnhub.io/api/news?id=38ca8d699dfd2c3715859397e784d450d0eea68b48630692403bba1ab07d84d0
company,1623337022,H&R Block (HRB) to Report Q4 Earnings: What's in the Offing?,68176903,https://s.yimg.com/uu/api/res/1.2/SCERhZzSpIZuRvXLB.9fxw--~B/aD00MDA7dz02MzU7YXBwaWQ9eXRhY2h5b24-/https://media.zenfs.com/en/zacks.com/ddfa6a8e51d280ee8c044d7b90861bcc,EFX,Yahoo,H&R Block's (HRB) fourth-quarter fiscal 2021 earnings and revenues are expected to have increased year over year.,https://finnhub.io/api/news?id=1f8f9688656950f164118c439f81c1c7046c1d0949a752baaace002641313282
company,1623257460,Equifax Inc. stock underperforms Wednesday when compared to competitors,68169014,https://images.mktw.net/im-220105/social,EFX,MarketWatch,"Shares of Equifax Inc. slid 0.47% to $228.64 Wednesday, on what proved to be an all-around dismal trading session for the stock market, with the S&P 500...",https://finnhub.io/api/news?id=a0aef3924de36e3b63a97aa1814e76927d5f0e9ab625745d0216172f85d67c83
company,1623236118,"RSP, NUE, KSU, EFX: Large Inflows Detected at ETF",68357881,https://www.nasdaq.com/sites/acquia.prod/files/2019-05/0902-Q19%20Total%20Markets%20photos%20and%20gif_CC8.jpg?1377052849,EFX,Nasdaq,"Looking today at week-over-week shares outstanding changes among the universe of ETFs covered at ETF Channel, one standout is the Invesco S&P 500— Equal Weight ETF (Symbol: RSP) where we have detected an approximate $156.7 million dollar inflow -- that's a 0.5% increa",https://finnhub.io/api/news?id=382cb8d19496c8a71b718c53dfa02e6a2fa25e93339397e39d2329e856774abd
company,1623171060,Equifax Inc. stock underperforms Tuesday when compared to competitors despite daily gains,68082765,https://images.mktw.net/im-220105/social,EFX,MarketWatch,"Shares of Equifax Inc. inched 0.44% higher to $229.73 Tuesday, on what proved to be an all-around mixed trading session for the stock market, with the S&P...",https://finnhub.io/api/news?id=4878054a0c31e102d1d0bc85ec854ad97f80653223870af1cbc3961bac015efe
company,1623142800,Mortgage Surge Pushes Canada Consumer Debt to $1.7 Trillion,68105440,https://s.yimg.com/uu/api/res/1.2/uklQ9.aqZoZPDBT1RZQD.w--~B/aD0xMzMyO3c9MjAwMDthcHBpZD15dGFjaHlvbg--/https://media.zenfs.com/en/bloomberg_markets_842/c423cb80ef1cea1add9ecb1f7a0f449b,EFX,Yahoo,"(Bloomberg) -- A surge in mortgage borrowing is pushing consumer debt loads higher in Canada despite falling credit card use, as households plow more money into their homes while spending less on everything else.New mortgage borrowing rose 41% in the first quarter compared to the same period in 2020, when the pandemic began, according to a release Tuesday from consumer credit reporting firm Equifax Inc. The average limit on new mortgages -- the amount for which borrowers were approved -- jumped",https://finnhub.io/api/news?id=3b740420ca83700cba407288e1d46f4a6748ca600adb7a3929f8369a51f9b453
company,1623142800,Hot Housing Market Drives Overall Consumer Debt Higher Ahead of New Mortgage Stress Test,68105439,https://s.yimg.com/uu/api/res/1.2/U8AnOT7cDe7Eq7vG0C_x4A--~B/aD0yMzI7dz04MTY7YXBwaWQ9eXRhY2h5b24-/https://media.zenfs.com/en/globenewswire.com/b727e991feeaf2887fc5b90f23887cd5,EFX,Yahoo,"Credit Card Debt Down to its Lowest Level in 6 YearsTORONTO, June 08, 2021 (GLOBE NEWSWIRE) -- While most consumers are ratcheting back on their credit card debt, homebuyers have pushed new mortgage volumes to unprecedented levels according to Equifax Canada’s most recent report on consumer credit conditions. New mortgages are up 41.2 per cent in Q1 compared to Q1 2020 and the average limit on new mortgages grew by 20.5 per cent to $326,930. Overall consumer debt now stands at $2.08 trillion, up",https://finnhub.io/api/news?id=4ba1a6a90b3205d403d5e4cc7a711fdfa0bb4ab5b11ab7f0d9e08dd6beccf425
company,1623128400,Hot Housing Market Drives Overall Consumer Debt Higher Ahead of New Mortgage Stress Test,68060164,,EFX,GlobeNewswire,Looking for stock market analysis and research with proves results? Zacks.com offers in-depth financial research with over 30years of proven results.,https://finnhub.io/api/news?id=96643f3bbc8e03d351f4303d309cf95c12b61259180b71e26d67be32b57f6a5e
company,1623084660,"Equifax Inc. stock falls Monday, underperforms market",68082766,https://images.mktw.net/im-220105/social,EFX,MarketWatch,"Shares of Equifax Inc. slipped 2.01% to $228.72 Monday, on what proved to be an all-around grim trading session for the stock market, with the S&P 500 Index...",https://finnhub.io/api/news?id=99ca46ade3d027b0bc22546bf2ca0519b9805c1b8141ca774333bb66d53b4e37
company,1623056436,Equifax Reaches Analyst Target Price,68000802,https://www.nasdaq.com/sites/acquia.prod/files/2019-05/0902-Q19%20Total%20Markets%20photos%20and%20gif_CC8.jpg?1515072587,EFX,Nasdaq,"In recent trading, shares of Equifax Inc (Symbol: EFX) have crossed above the average analyst 12-month target price of $232.15, changing hands for $233.40/share.  When a stock reaches the target an analyst has set, the analyst logically has two ways to react: downgrade on valuati",https://finnhub.io/api/news?id=f7337da38a5684153f8bf0180ef3f02746ca14dd3a49fd8776024c01a8cb26db
company,1623052740,Equifax Reaches Analyst Target Price,67998349,,EFX,ETF Channel,"Staff article entitled Equifax Reaches Analyst Target Price, about ETFs, from ETF Channel.",https://finnhub.io/api/news?id=91d296b9e1d43d694826eec5f5e5ab358b6be380ec7c1daf20a215a7b9e4fe97
company,1622798520,7 Best Equal-Weight ETFs To Buy In June,67979185,https://investorplace.com/wp-content/uploads/2019/07/etfs1600july2019.jpg,EFX,InvestorPlace,Financial planners highlight the benefits of ETFs track an equal-weighted index. Here are seven of the leading ETFs to consider in June.,https://finnhub.io/api/news?id=861e9a90a04ba2f5825486117697155bdcaf69abb4303b54bd2ac49d3cb8b4e6
company,1622792700,3 Technology Stocks You Can Buy and Hold for the Next Decade,67991418,https://www.nasdaq.com/sites/acquia.prod/files/2019-05/0902-Q19%20Total%20Markets%20photos%20and%20gif_CC8.jpg?493778865,EFX,Nasdaq,"Let's be honest. A lot of people say their positions in flashy technology companies are meant to be long-term holdings, but they're really just an effort to make a quick buck. And that's OK. Any profitable trade is technically a good trade. If you can get in and out at the right",https://finnhub.io/api/news?id=faf3e068406f93d568789034a387f0bed69579cdddfaaa0b7493ea17a493fac6
company,1622717021,Experian could face the brunt of Biden's credit score overhaul plan - research,67992268,https://www.nasdaq.com/sites/acquia.prod/files/2021-06-03T114419Z_1_CS0_RTRLXPP_2_LYNXPACKAGER.JPG?773334449,EFX,Nasdaq,"Experian, the world's largest credit data firm, faces a potential impact on up to 40% of its revenue if the Biden administration overhauls credit reporting and scoring in the United States, brokerage RBC said on Thursday.",https://finnhub.io/api/news?id=0952199d91ab02101ca1d5e7bc8332445a88547e7d1e8cdfdd4b31a27bc53377
company,1622705749,Experian could face the brunt of Biden's credit score overhaul plan - research,67992270,https://www.nasdaq.com/sites/acquia.prod/files/2021-06-03T114419Z_1_CS0_RTRLXPP_2_LYNXPACKAGER.JPG?1534388256,EFX,Nasdaq,"Experian Plc, the world's largest credit data firm, faces a potential impact on up to 40% of its revenue if the Biden administration overhauls credit reporting and scoring in the United States, brokerage RBC said on Thursday.",https://finnhub.io/api/news?id=a18f607b0d4af6e9d87add73331a89e6cf02a60bc65f4ff4a9f0e19d8cd55329
company,1622635860,JPMorgan fintech analysts to hold an analyst/industry conference call,67988551,,EFX,Thefly.com,JPMorgan fintech analysts to hold an analyst/industry conference call EFX TRU,https://finnhub.io/api/news?id=c19699e86a619d90f7755445a5d43b61a6af77196c133fe5ce69775f175af192
company,1622538960,William Blair to hold a virtual conference,67964393,,EFX,Thefly.com,William Blair to hold a virtual conference ABMD ADPT CERT EXAS MAX PRLB TDOC ZEN WISH TCMD PLMR EVER KRNT PETQ SIEN SDC VRSK EFX DXCM AXON GH,https://finnhub.io/api/news?id=9fb3bd6809f4cb7509bdda6cf690c389980ed2ed5aef50ce0be241588fed61b2
company,1622199237,"Noteworthy ETF Inflows: RSP, NUE, EFX, KSU",67942354,https://www.nasdaq.com/sites/acquia.prod/files/2019-05/0902-Q19%20Total%20Markets%20photos%20and%20gif_CC8.jpg?2111907088,EFX,Nasdaq,"Looking today at week-over-week shares outstanding changes among the universe of ETFs covered at ETF Channel, one standout is the Invesco S&P 500— Equal Weight ETF (Symbol: RSP) where we have detected an approximate $375.6 million dollar inflow -- that's a 1.3% increa",https://finnhub.io/api/news?id=5da04dfcd0d41f8bbb45aec42206fa06ab0be87aca137ef7a7e6e06839522fe1
company,1622139406,The Top Stocks You Can Buy Now,67932458,https://static.seekingalpha.com/cdn/s3/uploads/getty_images/998851206/medium_image_998851206.jpg,EFX,SeekingAlpha,"Market leadership by sector and market cap. Sectors remain tilted toward mid-cycle ideas. However, stock-specific ideas are available in every basket.",https://finnhub.io/api/news?id=21d8a4d0581775f08e6093cd8b20044615ef621e5c9e0cffb0ae45d08406ead3
