category,datetime,headline,id,image,related,source,summary,url
company,1624466940,FCB Network Sets Record With 53 Lions to Date at Cannes Lions 2020/2021,68440507,https://s.yimg.com/uu/api/res/1.2/3TKGIMIOFPzt1YP4a3gZPw--~B/aD03ODt3PTE3MjthcHBpZD15dGFjaHlvbg--/https://media.zenfs.com/en/globenewswire.com/5e20a8b79c9ffe6b960ed837c78b1492,IPG,Yahoo,"FCB Canada notches Gold for “Project Understood” during day three of FestivalNEW YORK, June 23, 2021 (GLOBE NEWSWIRE) -- The FCB Network continues its winning streak during day three of the Cannes Lions International Festival of Creativity, adding five more trophies to its growing collection, including Gold for FCB Canada’s acclaimed “Project Understood” on behalf of Google AI and the Canadian Down Syndrome Society in the category of Digital Craft – Experience Design: Voice. Today’s honors bring",https://finnhub.io/api/news?id=dd68252342607d322463ff0974f3c81918ad6c1321573b2369b5dad4d6ba44b2
company,1624464000,IPG Names Heide Gardner Global Culture Officer,68440508,https://s.yimg.com/ny/api/res/1.2/JNtNnRcV0hNArzgRpuis7g--/YXBwaWQ9aGlnaGxhbmRlcjt3PTIwMDA7aD0xNDk5/https://s.yimg.com/uu/api/res/1.2/ohzCTS1kuQs5qU09reDqHw--~B/aD0yMTI1O3c9NDIwODthcHBpZD15dGFjaHlvbg--/https://media.zenfs.com/en/globenewswire.com/51ade617b2f03298a2c60cc3a65517b2,IPG,Yahoo,"New York, NY, June 23, 2021 (GLOBE NEWSWIRE) -- Interpublic Group (NYSE: IPG) announced today that it has appointed Heide Gardner to the newly-created position of Global Culture Officer. She currently serves as IPG’s Senior Vice President, Chief Diversity and Inclusion Officer. In her new position, Gardner will take a leadership role in shaping the values-based company’s strategic, long-term vision on a broad range of social justice issues and well-being for underserved and under-represented com",https://finnhub.io/api/news?id=4df3a02cba6c52b8c2bcf12bf9917ac368a5f36f347a574f9afc747512ad5975
company,1624452540,FCB Network Sets Record With 53 Lions to Date at Cannes Lions 2020/2021,68444590,,IPG,GlobeNewswire,Looking for stock market analysis and research with proves results? Zacks.com offers in-depth financial research with over 30years of proven results.,https://finnhub.io/api/news?id=f99c4a1a564f99cae66b2eb2e6726a1705429361606cf4b03915df76e4d69358
company,1624449600,IPG Names Heide Gardner Global Culture Officer,68444592,,IPG,GlobeNewswire,Looking for stock market analysis and research with proves results? Zacks.com offers in-depth financial research with over 30years of proven results.,https://finnhub.io/api/news?id=266af981e9ec79c03d8e1ad6fdf1c6fc9b0c39606a71b366e271a793b2069df1
company,1624446480,Interpublic Group appoints Heide Gardner as global culture officer,68444594,,IPG,Thefly.com,Interpublic Group appoints Heide Gardner as global culture officer IPG,https://finnhub.io/api/news?id=3c575a569efd3b122c61b06e31af4e6865a465ebbec9dec8252388df07e20d3e
company,1624437000,Imperial Mining Receives Final Crater Lake Drill Results: Data Sent to Engineers for 43-101 Resource Estimation on TG Zone,68444595,,IPG,GlobeNewswire,Looking for stock market analysis and research with proves results? Zacks.com offers in-depth financial research with over 30years of proven results.,https://finnhub.io/api/news?id=8e658860c76a50390ed5628037487b4a4c286d366be5ee4db71c5d8bddbf6c71
company,1624381260,"Interpublic Group of Cos. stock falls Tuesday, underperforms market",68418885,https://images.mktw.net/im-220105/social,IPG,MarketWatch,"Shares of Interpublic Group of Cos. slipped 1.39% to $31.94 Tuesday, on what proved to be an all-around favorable trading session for the stock market, with...",https://finnhub.io/api/news?id=fa5a7a260119ffee31067313c068dfd0b475ed26ef961dc1961ed07ec9f93fe5
company,1624379700,FCB Celebrates Two More Grand Prix Wins at Cannes,68425091,https://s.yimg.com/uu/api/res/1.2/3TKGIMIOFPzt1YP4a3gZPw--~B/aD03ODt3PTE3MjthcHBpZD15dGFjaHlvbg--/https://media.zenfs.com/en/globenewswire.com/5e20a8b79c9ffe6b960ed837c78b1492,IPG,Yahoo,"Network continues its remarkable showing during second day of FestivalNEW YORK, June 22, 2021 (GLOBE NEWSWIRE) -- The FCB Network continues its winning streak on day two of the Cannes Lions International Festival of Creativity, taking home two more Grand Prix trophies – the first, in the category of Media – Social Behaviour for FCB Chicago’s “Boards of Change,” on behalf of the City of Chicago. The second Grand Prix was awarded in the category of PR – Corporate Image, Communication & Reputation",https://finnhub.io/api/news?id=f1abb38949fe441c4209184f8794a6f99170e8292b6d7b4de6dc182e9cbff250
company,1624377300,McCann Worldgroup Wins PR Cannes Lions Grand Prix for 'The Bread Exam',68425093,https://s.yimg.com/uu/api/res/1.2/f0N9GNqwUGcUbN6YkASy6g--~B/aD0yMjU7dz00MDA7YXBwaWQ9eXRhY2h5b24-/https://media.zenfs.com/en/prnewswire.com/d160a4761b31762d6866f52328317b70,IPG,Yahoo,"McCann Worldgroup has been awarded a Grand Prix in the PR Lions category at the Cannes Lions International Festival of Creativity for 'The Bread Exam', a campaign teaching women to perform self-checks and detect early signs of breast cancer.",https://finnhub.io/api/news?id=de3fedbbb109226de00034e78e404bde5e07a701f911b76153dd420ef880ef55
company,1624365300,FCB Celebrates Two More Grand Prix Wins at Cannes,68418355,,IPG,GlobeNewswire,Looking for stock market analysis and research with proves results? Zacks.com offers in-depth financial research with over 30years of proven results.,https://finnhub.io/api/news?id=a5cd241573cefe82e67ff840fa92863c7ccb4f8bd61b8f0a4e9e06c37ef14724
company,1624307700,Impressive Start for FCB at Cannes Lions 2020/2021,68408139,https://s.yimg.com/uu/api/res/1.2/3TKGIMIOFPzt1YP4a3gZPw--~B/aD03ODt3PTE3MjthcHBpZD15dGFjaHlvbg--/https://media.zenfs.com/en/globenewswire.com/5e20a8b79c9ffe6b960ed837c78b1492,IPG,Yahoo,"Incredible showing for the first day, with 21 trophiesNEW YORK, June 21, 2021 (GLOBE NEWSWIRE) -- FCB is off to its best-ever start during the first day of Cannes Lions International Festival of Creativity, taking home 21 Lions. FCB Health Network was crowned “Healthcare Network of the Year” with its AREA 23 unit receiving the prestigious “Healthcare Agency of the Year” honor and the Grand Prix in the category of Pharma – Regulated for “SICK BEATS.” The Pharma Grand Prix is awarded infrequently",https://finnhub.io/api/news?id=0b2422c63dc8e83ede5b80320e5b3e21869eeb1ce6cd7f3687d6c19af3541454
company,1624294860,Interpublic Group of Cos. stock underperforms Monday when compared to competitors despite daily gains,68415531,https://images.mktw.net/im-220105/social,IPG,MarketWatch,"Shares of Interpublic Group of Cos. rose 2.79% to $32.39 Monday, on what proved to be an all-around favorable trading session for the stock market, with the...",https://finnhub.io/api/news?id=825c8bd833c47ef940d34462e82cd5a071da0179e906b88455a1a5d194973cc2
company,1624293300,Impressive Start for FCB at Cannes Lions 2020/2021,68404772,,IPG,GlobeNewswire,Looking for stock market analysis and research with proves results? Zacks.com offers in-depth financial research with over 30years of proven results.,https://finnhub.io/api/news?id=17066927c13b20eb31c4ade17f7540de3fe05d768bca0167c1450bf9f7e9170e
company,1624094102,"Why big companies like DoorDash, 3M and HP are making films",68373999,https://image.cnbcfm.com/api/v1/image/106899720-1624041916713-nzyunMiQ.jpeg?v=1624041988,IPG,CNBC,Brand films are picking up steam as consumers increasingly are finding ways of avoiding commercials.,https://finnhub.io/api/news?id=ab2bc5eb97cc68d9cf56e48cd552e404e27231207e5947d52c4b050c67e98093
company,1624035660,"Interpublic Group of Cos. stock falls Friday, underperforms market",68415532,https://images.mktw.net/im-220105/social,IPG,MarketWatch,"Shares of Interpublic Group of Cos. slid 2.84% to $31.51 Friday, on what proved to be an all-around rough trading session for the stock market, with the S&P...",https://finnhub.io/api/news?id=b3c65aab32652d6fbf3db086b2dc3be6754d618f5b7ac3724b030f45a83e798d
company,1624031970,Interpublic Group of Companies Named Top Dividend Stock With Insider Buying and 3.33% Yield (IPG),68371711,https://www.nasdaq.com/sites/acquia.prod/files/2019-05/0902-Q19%20Total%20Markets%20photos%20and%20gif_CC8.jpg?210372608,IPG,Nasdaq,"In this series, we look through the most recent Dividend Channel ''DividendRank'' report, and then we cherry pick only those companies that have experienced insider buying within the past six months.  The officers and directors of a company tend to have a unique insider's view",https://finnhub.io/api/news?id=2e9a908966d9ef18a818bf67a96e8f1263a6e7f319acb6396943365bc95effa7
company,1623985140,Interpublic Group of Companies Named Top Dividend Stock With Insider Buying and 3.33% Yield (IPG),68359612,,IPG,Dividend Channel,"dividend channel,IPG,",https://finnhub.io/api/news?id=683068b926d4f3e42c3a94ff897118422fe4a618eb0293ee4365f86a911f35e0
company,1623955860,"IPG Mediabrands’ MAGNA Signs Partnership With Rapidly Growing Airport Network, ReachTV",68343206,https://s.yimg.com/uu/api/res/1.2/6k.fzZCtyzvHlYQGs7Rm4g--~B/aD04MDt3PTQ4MDthcHBpZD15dGFjaHlvbg--/https://media.zenfs.com/en/business-wire.com/a291efee17e6bdd1c36ef5efbd158060,IPG,Yahoo,"NEW YORK, Jun 17, 2021--As air travel is resurging, Mediabrands is joining forces with ReachTV, the rapidly expanding network available on nearly 2,500 screens at some 90 airports across North America and the United Kingdom.",https://finnhub.io/api/news?id=1c3c14188bec3ab3cab3411b6ee1acf671bed21141abe4b1fa62eedce5e31696
company,1623949260,"Interpublic Group of Cos. stock falls Thursday, underperforms market",68415533,https://images.mktw.net/im-220105/social,IPG,MarketWatch,"Shares of Interpublic Group of Cos. shed 3.05% to $32.43 Thursday, on what proved to be an all-around grim trading session for the stock market, with the S&P...",https://finnhub.io/api/news?id=6e733e68e688d9bdcb3821456f4d68a623a24d2733655a8b82a7b8baf2834e27
company,1623941460,"IPG Mediabrands’ MAGNA Signs Partnership With Rapidly Growing Airport Network, ReachTV",68335416,,IPG,Business Wire,Looking for stock market analysis and research with proves results? Zacks.com offers in-depth financial research with over 30years of proven results.,https://finnhub.io/api/news?id=f001d778e3e57b2d7486ac0528e75146c8efe82d9232e9cc6e6366599c12b102
company,1623940560,HOKA ONE ONE Names FCB First-Ever Global Creative AOR,68327381,https://s.yimg.com/ny/api/res/1.2/4HRsnwx0AkNen8pMXlua3A--/YXBwaWQ9aGlnaGxhbmRlcjt3PTIwMDA7aD0xMjcy/https://s.yimg.com/uu/api/res/1.2/zH5CWxGsPkv3iAscwGQVgA--~B/aD0yMDAwO3c9MzAwMDthcHBpZD15dGFjaHlvbg--/https://media.zenfs.com/en/globenewswire.com/4c3edb66eff49e0ad1d3258ea0713077,IPG,Yahoo,"New partnership marks next expansion chapter in company’s incredible success story HOKA ONE ONE HOKA ONE ONE Mach 4 SAN FRANCISCO, June 17, 2021 (GLOBE NEWSWIRE) -- HOKA ONE ONE®, a division of Deckers Brands (NYSE: DECK), has announced the appointment of FCB as its first-ever global creative agency of record following a competitive review. FCB WEST, the network’s nimble creative boutique in San Francisco, will serve as the global lead office and will tap into FCB’s network of offices around the",https://finnhub.io/api/news?id=fbaebb86df27033a76e2644ad58673e804908580142c4eaf25253a6d807888ca
company,1623926160,HOKA ONE ONE Names FCB First-Ever Global Creative AOR,68326968,,IPG,GlobeNewswire,Looking for stock market analysis and research with proves results? Zacks.com offers in-depth financial research with over 30years of proven results.,https://finnhub.io/api/news?id=a41b976fcea208131a174ca7f45954ab66decbca4e716b49779d851012036b59
company,1623862860,"Interpublic Group of Cos. stock falls Wednesday, underperforms market",68415534,https://images.mktw.net/im-220105/social,IPG,MarketWatch,"Shares of Interpublic Group of Cos. sank 0.86% to $33.45 Wednesday, on what proved to be an all-around rough trading session for the stock market, with the...",https://finnhub.io/api/news?id=e6985ca5db4c1c636c94fd0dad4bce6c7bee501d9f89bc826aaa766379b8b5ca
company,1623776460,"Interpublic Group of Cos. stock rises Tuesday, outperforms market",68299910,https://images.mktw.net/im-220105/social,IPG,MarketWatch,"Shares of Interpublic Group of Cos. inched 0.33% higher to $33.74 Tuesday, on what proved to be an all-around grim trading session for the stock market, with...",https://finnhub.io/api/news?id=05ba44936556678d0e405becdf33dc403378a0de6a4cb5671110e88803469a20
company,1623762901,"Interpublic (IPG) Hits 52-Week High, Can the Run Continue?",68290870,https://s.yimg.com/uu/api/res/1.2/YliGu3uiWo7T6YkWQuaEpA--~B/aD02MDE7dz05MDA7YXBwaWQ9eXRhY2h5b24-/https://media.zenfs.com/en/zacks.com/62d8c8e05376a18ba1420a1733ffdda4,IPG,Yahoo,"Interpublic (IPG) is at a 52-week high, but can investors hope for more gains in the future? We take a look at the company's fundamentals for clues.",https://finnhub.io/api/news?id=9ad1cb2269a5208a42d249ccfc1aed41be5c21cbe4f9767fa44d70108c29c95d
company,1623753000,Two-Thirds of People Don't Believe They Will Have The Transportation Flexibility to Meet Future Needs,68279839,https://s.yimg.com/uu/api/res/1.2/KwgGfO2zHAcfLEN74_nceQ--~B/aD0yMDk7dz00MDA7YXBwaWQ9eXRhY2h5b24-/https://media.zenfs.com/en/prnewswire.com/2ecfe73cc088f81966fb3fa23d04cae4,IPG,Yahoo,"The R/GA Future of Mobility Report shows that two-thirds of vehicle owners globally (67%) feel they will not have flexible transportation options in the future, even with the rise of new forms of mobility. This poses new opportunities in addition to new risks for automotive incumbents, who face a threat of losing direct access to customer relationships with the decline of car ownership.",https://finnhub.io/api/news?id=6ff25c441c23cff810b21341617338136f06aaf1b71f25c9fd14121bd006a4bf
company,1623749400,LiveRamp and Carrefour Partner to Deliver Next-Generation Retail Offerings,68281003,,IPG,Business Wire,Looking for stock market analysis and research with proves results? Zacks.com offers in-depth financial research with over 30years of proven results.,https://finnhub.io/api/news?id=7e04842e5f21eac994f3077fb344dc2650f950eb7a48042b2bdf6c0c08398698
company,1623738600,Two-Thirds of People Don't Believe They Will Have The Transportation Flexibility to Meet Future Needs,68279046,,IPG,PR Newswire,Looking for stock market analysis and research with proves results? Zacks.com offers in-depth financial research with over 30years of proven results.,https://finnhub.io/api/news?id=bc44579a25fe8f7e9df7748b50d0bbdb6c1eeb8d955b8697b8ea183f3ed3d104
company,1623690060,"Interpublic Group of Cos. stock falls Monday, underperforms market",68288582,https://images.mktw.net/im-220105/social,IPG,MarketWatch,"Shares of Interpublic Group of Cos. slid 1.55% to $33.63 Monday, on what proved to be an all-around mixed trading session for the stock market, with the S&P...",https://finnhub.io/api/news?id=2dad4fbc7cca93fc9594a54a2d30e62d0b197eaba032c7a74f81087ea05f972d
company,1623558167,The Stocks To Focus On Today,68238718,https://static.seekingalpha.com/cdn/s3/uploads/getty_images/949211586/medium_image_949211586.jpg,IPG,SeekingAlpha,Inflation is here; and that means these groups ought to be on your radar. The best stocks within every sector now.,https://finnhub.io/api/news?id=11851a7d3519b8540b9cab305fd7732f311c2c186dfc9c5beb709ba3c6f53a8c
company,1623494085,Dividend Challenger Highlights: Week Of June 13,68233034,https://static.seekingalpha.com/cdn/s3/uploads/getty_images/1072593728/medium_image_1072593728.jpg,IPG,SeekingAlpha,A weekly summary of dividend activity for Dividend Challengers. Click here to read about the companies with upcoming ex-dividend dates and upcoming pay dates.,https://finnhub.io/api/news?id=489bff359f75a3b72fc0bd2bc9e8fe9c082f37195adee4b2f3ef9f43f9f21d00
company,1623430860,Interpublic Group of Cos. stock outperforms competitors on strong trading day,68288583,https://images.mktw.net/im-220105/social,IPG,MarketWatch,"Shares of Interpublic Group of Cos. rallied 1.79% to $34.16 Friday, on what proved to be an all-around positive trading session for the stock market, with...",https://finnhub.io/api/news?id=a92bc793166950ba308cd2cd550593ca4371fddbe994cd6eb098279cd4cafbbf
company,1623423180,Cox Communications and FCB Connect Immunocompromised Families with “The Hug Project”,68210252,https://s.yimg.com/uu/api/res/1.2/3TKGIMIOFPzt1YP4a3gZPw--~B/aD03ODt3PTE3MjthcHBpZD15dGFjaHlvbg--/https://media.zenfs.com/en/globenewswire.com/5e20a8b79c9ffe6b960ed837c78b1492,IPG,Yahoo,"Latest campaign marks milestone in a nearly decade-long partnership that spans advertising, performance marketing, UX and digital designCHICAGO, June 11, 2021 (GLOBE NEWSWIRE) -- As the world reemerges, people can begin to connect again, but for those who are immunocompromised, social distancing and separation extend past the pandemic. As a technology company — and a human company — Cox Communications aims to be a part of the solution to safely help families that are unable to reunite in person.",https://finnhub.io/api/news?id=410c3a022f6c97bbc6cedce5f6d5624f73106edb39fea5b76068fffe2e614746
company,1623408720,Cox Communications and FCB Connect Immunocompromised Families with “The Hug Project”,68203803,,IPG,GlobeNewswire,Looking for stock market analysis and research with proves results? Zacks.com offers in-depth financial research with over 30years of proven results.,https://finnhub.io/api/news?id=df6c6660daba2ca503b3e5d362d6beab460808282c2308ffc778323a2fb66976
company,1623379552,Interpublic Group: A Good Second-Half Play As U.S. Market Returns To Normal,68191230,https://static.seekingalpha.com/cdn/s3/uploads/getty_images/956813632/medium_image_956813632.jpg,IPG,SeekingAlpha,Interpublic Group's positive organic and net revenue growth in 1Q21 bodes well for revenue prospects for IPG entering the summer months. Read more here...,https://finnhub.io/api/news?id=ed70ed5274f9a5a84c8f0aacb1bd458779b0296bb41a13fad2fd2306269168e2
company,1623344460,"Interpublic Group of Cos. stock rises Thursday, still underperforms market",68188436,https://images.mktw.net/im-220105/social,IPG,MarketWatch,"Shares of Interpublic Group of Cos. inched 0.12% higher to $33.56 Thursday, on what proved to be an all-around favorable trading session for the stock...",https://finnhub.io/api/news?id=ccdf60f83b5ffc78cf1da188df53b166da854ecdb4601183c5c1de8226eabd4b
company,1623342600,Anneka Gupta to Leave LiveRamp to Pursue New Opportunity,68190702,,IPG,Business Wire,Looking for stock market analysis and research with proves results? Zacks.com offers in-depth financial research with over 30years of proven results.,https://finnhub.io/api/news?id=6b8d7fabea106371392af0b53b7b025c9d8c213f091b77ccb25d2a982cbef879
company,1623341100,McCann Worldgroup Promotes Laura Simpson To President Of McCann Worldgroup Truth Central And Global Chief Intelligence Officer,68177118,https://s.yimg.com/uu/api/res/1.2/GQMZWW5t303ApmB1DpwpgQ--~B/aD0xNjt3PTE2O2FwcGlkPXl0YWNoeW9u/https://media.zenfs.com/en/prnewswire.com/8bfc21158d7ae934afa5615d48cfbb00,IPG,Yahoo,"McCann Worldgroup today announced that Laura Simpson has been promoted to President, McCann Worldgroup Truth Central and Global Chief Intelligence Officer, heading up the network's intelligence unit. McCann Worldgroup's expanded intelligence capabilities include the official launch of the agency's Truth Engine, a proprietary tool that provides access across the network to the proprietary insights (aka ""truths"") identified by McCann Worldgroup (MW) Truth Central, the network's global intelligence",https://finnhub.io/api/news?id=d5a2e601322b424e5cbe37afd75e5fdbf358043fede87a4caf9ba77329a4a125
company,1623335400,Weber Shandwick Chief Growth Officer Susan Howe Named President,68177120,https://s.yimg.com/uu/api/res/1.2/.7NiIedc6.toodoLS74ANw--~B/aD0xNjt3PTE2O2FwcGlkPXl0YWNoeW9u/https://media.zenfs.com/en/prnewswire.com/9c46a95a4d7fcc3e19e768cb8534445b,IPG,Yahoo,"Weber Shandwick, one of the world's leading global communications and marketing solutions firms, today has named Susan Howe president, effective immediately. Howe will continue to report to Weber Shandwick CEO Gail Heimann. She will continue to have oversight of all Weber Shandwick regions as she deepens the strategic integration among the specialist brands within the agency's eco-system and drives cross-functional collaboration at global scale.",https://finnhub.io/api/news?id=4bc7330e4b7972d0f0f9dd5bb162a60e47a3fba78af6e976644a244158c9a029
company,1623321000,Weber Shandwick Chief Growth Officer Susan Howe Named President,68190704,,IPG,PR Newswire,Looking for stock market analysis and research with proves results? Zacks.com offers in-depth financial research with over 30years of proven results.,https://finnhub.io/api/news?id=190711a7c93a1f732fbfd2f0ee2ee8d386523ab6064d05df21d8bad44ee1172e
company,1623308460,The Interpublic Group of Stock Shows Every Sign Of Being Significantly Overvalued,68190706,,IPG,GuruFocus,GuruFocus Article or News written by GF Value and the topic is about: ,https://finnhub.io/api/news?id=4b17ce5bfb2c51ab8bfd6c82c572c9b677fc1de1c1ae69d08ef7d14122ca92e6
company,1623258060,Interpublic Group of Cos. stock outperforms competitors despite losses on the day,68181330,https://images.mktw.net/im-220105/social,IPG,MarketWatch,"Shares of Interpublic Group of Cos. dropped 0.15% to $33.52 Wednesday, on what proved to be an all-around rough trading session for the stock market, with...",https://finnhub.io/api/news?id=cd6f0980ed34f36bb77675a2af63105db20056a8dd37eb045fd4cd0fe3c7e511
company,1623247200,IPG Announces Climate Action Plan as Part of an Integrated ESG Program,68106795,https://s.yimg.com/ny/api/res/1.2/hIiq3y7b5w3KZQnMRaQqRg--/YXBwaWQ9aGlnaGxhbmRlcjt3PTIwMDA7aD0xMDEw/https://s.yimg.com/uu/api/res/1.2/ohzCTS1kuQs5qU09reDqHw--~B/aD0yMTI1O3c9NDIwODthcHBpZD15dGFjaHlvbg--/https://media.zenfs.com/en/globenewswire.com/51ade617b2f03298a2c60cc3a65517b2,IPG,Yahoo,"First Company in the Advertising & Marketing Sector to Publish SASB Report Commits to Set a Science Based TargetWill Source 100% Renewable Electricity by 2030Joins The Climate Pledge co-Founded by Amazon and Global Optimism New York, NY, June 09, 2021 (GLOBE NEWSWIRE) -- Interpublic Group (NYSE: IPG) announced today that as part of its growing commitment to addressing ESG (environmental, social and governance) concerns, the company is moving forward on an ambitious climate action plan that consi",https://finnhub.io/api/news?id=efdaa842a1dff83ebe2be82a9f173bf5e1890c6e9d7b1028d5110d725e240516
company,1623241800,"U.S. Nears Halfway Mark On Road To Recovery For Live Experiences, Reports New Index From Jack Morton",68106796,https://s.yimg.com/uu/api/res/1.2/pg2ppoG2IU5GahMnWAEaXg--~B/aD0xNjt3PTE2O2FwcGlkPXl0YWNoeW9u/https://media.zenfs.com/en/prnewswire.com/10d2c88bf76c86c4c39412f8c2ea2a8b,IPG,Yahoo,"With vaccination rates rising, cities around the country reopening, sporting events at almost full capacity and mask mandates lifting, data from global brand experience agency Jack Morton, shows the U.S. making steady progress toward returning to live, in-person brand experiences again.",https://finnhub.io/api/news?id=6408cb14f342c79b91dbba8cf844a35ee737cf9a55b2f9ca97dfff54325c4bc8
company,1623236400,IPG Launches Motor City Marketing and Communications Fellowship Program,68106797,https://s.yimg.com/ny/api/res/1.2/hIiq3y7b5w3KZQnMRaQqRg--/YXBwaWQ9aGlnaGxhbmRlcjt3PTIwMDA7aD0xMDEw/https://s.yimg.com/uu/api/res/1.2/ohzCTS1kuQs5qU09reDqHw--~B/aD0yMTI1O3c9NDIwODthcHBpZD15dGFjaHlvbg--/https://media.zenfs.com/en/globenewswire.com/51ade617b2f03298a2c60cc3a65517b2,IPG,Yahoo,"Opportunities for Local College Grads in PR, Advertising, Experiential, Relationship MarketingDetroit, MI, June 09, 2021 (GLOBE NEWSWIRE) -- Interpublic Group (NYSE: IPG) announced the Motor City Marketing and Communications Fellowship, a jobs program associated exclusively with IPG’s Detroit-based communications and marketing companies that support General Motors, including Weber Shandwick, MRM, McCann, Jack Morton Worldwide and Commonwealth//McCann. The Motor City Marketing and Communications",https://finnhub.io/api/news?id=f630d1cf77d397592f3d1d885365dc3e5915fe97bd758fda3245541725634d89
company,1623235080,Interpublic Group Sets New Climate Action Plan,68181331,https://mw3.wsj.net/mw5/content/logos/mw_logo_social.png,IPG,MarketWatch,By Chris Wack Interpublic Group said it is moving forward on an ambitious climate action plan that consists of three simultaneous goals. The company said it...,https://finnhub.io/api/news?id=c1525e367229bbf8a203994353dd48fae45e1c714638b942a9b528a7a3b5abbb
company,1623232800,IPG Announces Climate Action Plan as Part of an Integrated ESG Program,68133215,,IPG,GlobeNewswire,Looking for stock market analysis and research with proves results? Zacks.com offers in-depth financial research with over 30years of proven results.,https://finnhub.io/api/news?id=8b4ff3daccaca2e52ce6517142907b5e328ef59f1c441f56df0da9b4c0d5b127
company,1623227400,"U.S. Nears Halfway Mark On Road To Recovery For Live Experiences, Reports New Index From Jack Morton",68133885,,IPG,PR Newswire,Looking for stock market analysis and research with proves results? Zacks.com offers in-depth financial research with over 30years of proven results.,https://finnhub.io/api/news?id=6b20806f540b31d8337ea17ffa93972a65c4e2a5bae7acdc4b6bac3b0abd7beb
company,1623227400,Imperial Mining Develops High-Recovery Extraction Process for Scandium and Rare Earth Elements for Crater Lake Mineralization,68133884,,IPG,GlobeNewswire,Looking for stock market analysis and research with proves results? Zacks.com offers in-depth financial research with over 30years of proven results.,https://finnhub.io/api/news?id=69bab22235f973af3ce79b7495c3ec64451f6bf55baee6a24bedea65badae94f
