category,datetime,headline,id,image,related,source,summary,url
company,1619535726,"Interpublic Group of Companies, Inc. (The) -- Moody's affirms Interpublic Group's senior unsecured ratings at Baa2 and revises the outlook to stable",66763373,https://s.yimg.com/cv/apiv2/social/images/yahoo_default_logo-1200x1200.png,IPG,Yahoo,"Rating Action: Moody's affirms Interpublic Group's senior unsecured ratings at Baa2 and revises the outlook to stableGlobal Credit Research - 27 Apr 2021Approximately $3.4 billion of rated debt impactedNew York, April 27, 2021 -- Moody's Investors Service, (""Moody's"") has affirmed The Interpublic Group of Companies, Inc.'s (""IPG"" or the ""company"") Baa2 senior unsecured ratings and Prime-2 commercial paper rating.  The outlook was revised to stable from negative.Affirmations:..Issuer: Interpublic Group of Companies, Inc. (The)....Senior Unsecured Shelf, Affirmed (P)Baa2....Senior Unsecured Commercial Paper, Affirmed P-2....Senior Unsecured Regular Bond/Debenture, Affirmed Baa2Outlook Actions:..Issuer: Interpublic Group of Companies, Inc. (The)....Outlook, Changed To Stable From NegativeRATINGS RATIONALEThe revision of the outlook to stable reflects IPG's strong operating performance execution, focus on cost management and exposure to client verticals that were less impacted by the global ad spending contraction during the COVID-19 health crisis and recession, and Moody's expectation that operating performance will continue to improve over the next year as the economy recovers.",https://finnhub.io/api/news?id=e1e5a7ac334359b7ef58a4dea7ecd1c1ff33f4ba2a36dbed587319e0e634bf19
company,1619528160,Notable companies reporting before tomorrow`s open,66690199,,IPG,Thefly.com,Notable companies reporting before tomorrow's open SHOP BA ADP BSX HUM SPOT GD APH YUM SWK ROK SIRI DISCA IPG SIX EAT,https://finnhub.io/api/news?id=616ae5a559fde96ae80c5611a5226e27a634aaabc24c806a4f1c2ac432516483
company,1619456460,Interpublic Group of Cos. stock outperforms competitors despite losses on the day,66598150,https://images.mktw.net/im-220105/social,IPG,MarketWatch,"Shares of Interpublic Group of Cos. slid 0.00% to $29.72 Monday, on what proved to be an all-around mixed trading session for the stock market, with the S&P...",https://finnhub.io/api/news?id=acc1aa34a19b2fd4aad4e2e8f4f2dd979851db8374a547da158ad0189fa485b6
company,1619434630,Interpublic (IPG) to Report Q1 Earnings: What's in the Cards?,66500808,https://s.yimg.com/uu/api/res/1.2/OLLyh6ovH3rQL6cWNIIzqw--~B/aD00MDA7dz02MzU7YXBwaWQ9eXRhY2h5b24-/https://media.zenfs.com/en/zacks.com/40b3c11ab65693676425f4ab90613967,IPG,Yahoo,Interpublic's (IPG) first-quarter 2021 earnings and revenues are expected to have increased year over year.,https://finnhub.io/api/news?id=412ae24657c370bbb73efe70cc1cc541566248890c4b90ec15add47bba929521
company,1619426100,Investor Presentations Now Available for On-Demand Viewing: Critical & Strategic Minerals Investment Opportunities in Quebec,66446641,,IPG,PR Newswire,Looking for stock market analysis and research with proves results? Zacks.com offers in-depth financial research with over 30years of proven results.,https://finnhub.io/api/news?id=7be51a409df380e146a1e8ddfa83c56ba4d648b5715a6f95d3227e52ce540d56
company,1619323744,One Last Hurrah? The Stocks To Buy Now,66243334,https://static.seekingalpha.com/uploads/2021/4/23/486106-1619222908388881_origin.png,IPG,SeekingAlpha,"Warning signals are flashing, suggesting it could be smart to fade the next move up. The strongest sectors currently include financials, REITs, and consumer goods.",https://finnhub.io/api/news?id=15660c3b80c6ac06438c0199b68804eebace5b9a2854cb0b752c7db9b0506215
company,1619258930,56 Outstanding Dividend Buds Now Show 11 Flowering For May,66220234,https://static.seekingalpha.com/uploads/2021/4/24/748328-1619238911291941_origin.png,IPG,SeekingAlpha,"From May to July 2020, Kiplinger Today listed five sets of dividend stocks sorted as favorites, super-safe, durable, centenarian, and MoPays.",https://finnhub.io/api/news?id=e07896958cbe5df4d6632a5b4d32eb1c845cdf693df6bdce1951121b4b5f9cd4
company,1619197260,"Interpublic Group of Cos. stock rises Friday, still underperforms market",66243249,https://images.mktw.net/im-220105/social,IPG,MarketWatch,"Shares of Interpublic Group of Cos. inched 0.30% higher to $29.72 Friday, on what proved to be an all-around positive trading session for the stock market,...",https://finnhub.io/api/news?id=fe8e1ea22a8f1cf8f2436df278310f4359ae1faf81690855e7cc7b8c9bdd990b
company,1619187600,"Carl Spielvogel, Co-Founder of a Hot Advertising Shop, Dies at 92 ",66202251,https://images.wsj.net/im-329230/social,IPG,DowJones,Executive got his start as a newspaper columnist and found clients through his many public-service roles. ,https://finnhub.io/api/news?id=6660e9dfbe95d8d5864204a909b87e59f578cbdce55813f58f5f893b3f93a73d
company,1619180040,Miller/Howard Investments Q1 2021 Quarterly Report,66201228,https://static.seekingalpha.com/assets/og_image_1200-29b2bfe1a595477db6826bd2126c63ac2091efb7ec76347a8e7f81ba17e3de6c.png,IPG,SeekingAlpha,"Miller/Howard Investments is an employee-owned, research-driven firm managing portfolios for a range of investors, from high-net-worth individuals to large institutions.",https://finnhub.io/api/news?id=4d7a22b43c81c10a810b7e0893ced2dd9d4ef796ac08377632ebd31349f68f81
company,1619110860,"Interpublic Group of Cos. stock falls Thursday, underperforms market",66243251,https://images.mktw.net/im-220105/social,IPG,MarketWatch,"Shares of Interpublic Group of Cos. shed 3.45% to $29.63 Thursday, on what proved to be an all-around poor trading session for the stock market, with the S&P...",https://finnhub.io/api/news?id=2e50eb4ef2d51ff72aca3c73da642e318c0ec8a601f4dc8d50fab15d48c54369
company,1619090940,R/GA Appoints Tania Secor as Global Chief Financial Officer,66500812,https://s.yimg.com/uu/api/res/1.2/gDkVwxFr_jLQK5_Db5p1Sg--~B/aD0xNzk7dz00MDA7YXBwaWQ9eXRhY2h5b24-/https://media.zenfs.com/en/prnewswire.com/6377367df405ebff7c2f9a904eee6cd1,IPG,Yahoo,"R/GA has named Tania Secor as its Global Chief Financial Officer. The former CFO at Reprise Digital will start on May 3 and report to Global Chief Executive Officer Sean Lyons. As Global CFO, Secor will oversee the global finance function for R/GA with a responsibility to support and build out programs that ensure the financial strength as well as drive revenue and profit for the company.",https://finnhub.io/api/news?id=651a2a3ac49f8af53131b6a0337bc7cff950c11f1a4952c68a9b9bc5ac56915c
company,1619080200,Omar Tawakol Joins LiveRamp Board of Directors,66286860,,IPG,Business Wire,Looking for stock market analysis and research with proves results? Zacks.com offers in-depth financial research with over 30years of proven results.,https://finnhub.io/api/news?id=534e8e8f5791d16362f9486e7bfd16791a443f138d0920a1b89f6f7d3464dbb7
company,1619079660,"Top Analyst Upgrades and Downgrades: AutoNation, Coinbase, First Solar, Ford, Okta, Pioneer Natural Resources, Planet Fitness and More",66262780,https://247wallst.com/wp-content/uploads/2018/07/stock-market-financial-data.jpg,IPG,247WallSt,"Thursday's top analyst upgrades and downgrades included AutoNation, Coinbase, Energy Transfer, First Solar, Ford, Okta, Pioneer Natural Resources and Planet Fitness.",https://finnhub.io/api/news?id=d6261f64b790497a4c8de1b606cec9a0b713a2cde29a864fd245e72e226ba2ee
company,1619076540,R/GA Appoints Tania Secor as Global Chief Financial Officer,66492665,,IPG,PR Newswire,Looking for stock market analysis and research with proves results? Zacks.com offers in-depth financial research with over 30years of proven results.,https://finnhub.io/api/news?id=6260ebd994ebc29c7639e9ff5c8e8468e50d71bd984aac0c89795476b1d7fe0b
company,1619068135,Ad group WPP targets net zero emissions by 2025,68825679,https://www.nasdaq.com/sites/acquia.prod/files/2021-04-22T090220Z_1_GR2_RTRLXPP_2_LYNXPACKAGER.JPG?2021847832,IPG,Nasdaq,WPP said on Thursday it planned to make the world's largest advertising company reach net zero carbon emissions by 2025 by incorporating many of the virtual production solutions it has developed during the pandemic.,https://finnhub.io/api/news?id=5a54f144b66d144192ff4db4f32b5cda6452b346197e679b3028f7612cbc49b3
company,1619063940,Interpublic Group downgraded to Market Perform from Outperform at BMO Capital,66492667,,IPG,Thefly.com,Interpublic Group downgraded to Market Perform from Outperform at BMO Capital BMO Capital IPG,https://finnhub.io/api/news?id=907b56e3e33f5cb603d329d0a5f1dfe181dfde048f247b7095552455de3fb44f
company,1619059686,"Is The Interpublic Group of Companies, Inc. (NYSE:IPG) Trading At A 21% Discount?",68825680,https://www.nasdaq.com/sites/acquia.prod/files/2019-05/0902-Q19%20Total%20Markets%20photos%20and%20gif_CC8.jpg?1965346490,IPG,Nasdaq,"How far off is The Interpublic Group of Companies, Inc. (NYSE:IPG) from its intrinsic value? Using the most recent financial data, we'll take a look at whether the stock is fairly priced  by estimating the company's future cash flows and discounting them to their present value.",https://finnhub.io/api/news?id=407389ee5a060e35432867fddc2e2997c9860fc5a7e393b1eec973d428776e75
company,1619024460,Interpublic Group of Cos. stock outperforms competitors on strong trading day,66243253,https://images.mktw.net/im-220105/social,IPG,MarketWatch,"Shares of Interpublic Group of Cos. advanced 2.27% to $30.69 Wednesday, on what proved to be an all-around great trading session for the stock market, with...",https://finnhub.io/api/news?id=04f001d893f6242a3ad06096f83c868248f0225d265059f226080d8db792b916
company,1618938060,"Interpublic Group of Cos. stock falls Tuesday, underperforms market",66183124,https://images.mktw.net/im-220105/social,IPG,MarketWatch,"Shares of Interpublic Group of Cos. slipped 1.41% to $30.01 Tuesday, on what proved to be an all-around rough trading session for the stock market, with the...",https://finnhub.io/api/news?id=d55d9dd64d2f70c13a8c1a26551d67e53e127e1343237fa0233fb8346c360833
company,1618935720,Imperial Mining Group fera une présentation lors de la conférence « Quebec Critical and Strategic Minerals Investment » le jeudi 22 avril à 13h30 NHE,66492670,,IPG,GlobeNewswire,Looking for stock market analysis and research with proves results? Zacks.com offers in-depth financial research with over 30years of proven results.,https://finnhub.io/api/news?id=41614b4220b99d1c9b6172e78d1b3babe180e451c9e7ea87bb170661575779ca
company,1618851660,Interpublic Group of Cos. stock underperforms Monday when compared to competitors,66183125,https://images.mktw.net/im-220105/social,IPG,MarketWatch,"Shares of Interpublic Group of Cos. dropped 0.52% to $30.44 Monday, on what proved to be an all-around dismal trading session for the stock market, with the...",https://finnhub.io/api/news?id=9dbacc5cef0aed1ab17408b6304d242d6a229f3417ec1e8d3e03b6c48c745fc8
company,1618821300,Live Virtual Investor Conference April 22nd: Critical and Strategic Minerals Investment Opportunities in the Province of Quebec,66353298,,IPG,PR Newswire,Looking for stock market analysis and research with proves results? Zacks.com offers in-depth financial research with over 30years of proven results.,https://finnhub.io/api/news?id=9fc6a4d06857ef99037ae564b84667526b4a1fb70ce86a0d1db02effd5e1e947
company,1618641887,The Best Stocks You Can Buy Now,66161851,https://static.seekingalpha.com/cdn/s3/uploads/getty_images/1213370681/medium_image_1213370681.jpg,IPG,SeekingAlpha,The strongest sectors this week. The best stocks within the best sectors to concentrate on.,https://finnhub.io/api/news?id=11e360eddd8822c6d26c528c0ba0aec4a6d906797cdb4f58ee6f7d9cf9a950d5
company,1618593600,Imperial and SOQUEM Close the Transaction to Exchange Quebec Base Metal and Gold Property Interests,66492679,,IPG,GlobeNewswire,Looking for stock market analysis and research with proves results? Zacks.com offers in-depth financial research with over 30years of proven results.,https://finnhub.io/api/news?id=2bea8eb4ec57b5cb932e8a7a5dbc466fd458ab6ad86cf4a1f2299d92787effe3
company,1618592460,Interpublic Group of Cos. stock outperforms competitors on strong trading day,66183126,https://images.mktw.net/im-220105/social,IPG,MarketWatch,"Shares of Interpublic Group of Cos. inched 0.56% higher to $30.60 Friday, on what proved to be an all-around positive trading session for the stock market,...",https://finnhub.io/api/news?id=1b605ffdc93e34713a9f5651afb911a54091b021fe963621bf5adf2c0b606651
company,1618588620,Creative and Content Veteran Alejandro Lopez Appointed U.S. Head of Mediabrands Content Studio,66500817,https://s.yimg.com/uu/api/res/1.2/2bQM1rvVqbhVRl.N2Fk3Bw--~B/aD00ODA7dz0zNDE7YXBwaWQ9eXRhY2h5b24-/https://media.zenfs.com/en/business-wire.com/7a4535c44e2e38c8cc538a95ea4dc0c4,IPG,Yahoo,Mediabrands Content Studio Appoints Creative and Content Veteran Alejandro Lopez as New U.S. Head.,https://finnhub.io/api/news?id=db551fa3953ee72153830204538beda67389fff05015a853fd760bdaa1211231
company,1618574220,Creative and Content Veteran Alejandro Lopez Appointed U.S. Head of Mediabrands Content Studio,66492682,,IPG,Business Wire,Looking for stock market analysis and research with proves results? Zacks.com offers in-depth financial research with over 30years of proven results.,https://finnhub.io/api/news?id=5de7f0107830107879c8ca7e92626d8c05b08d1f9997f7e7a0c212ea6f51b3c1
company,1618566300,Hershey selects Horizon Media as ad agency for U.S. confectionary business,66455401,,IPG,Thefly.com,Hershey selects Horizon Media as ad agency for U.S. confectionary business HSY IPG,https://finnhub.io/api/news?id=1fddc0d2caf2b252979f09dadccdd0b004e686aeddb4ec620af17666e6d12954
company,1618506060,Interpublic Group of Cos. stock outperforms market on strong trading day,66183127,https://images.mktw.net/im-220105/social,IPG,MarketWatch,"Shares of Interpublic Group of Cos. advanced 1.70% to $30.43 Thursday, on what proved to be an all-around positive trading session for the stock market, with...",https://finnhub.io/api/news?id=1ab6e77c28779705a6871cc8fd846979ad71dba237081f654baee7b12455572f
company,1618487821,June 18th Options Now Available For Interpublic Group of Companies (IPG),68825681,https://www.nasdaq.com/sites/acquia.prod/files/2019-05/0902-Q19%20Total%20Markets%20photos%20and%20gif_CC8.jpg?1809803444,IPG,Nasdaq,"Investors in Interpublic Group of Companies Inc. (Symbol: IPG) saw new options become available today, for the June 18th expiration.   At Stock Options Channel, our YieldBoost formula has looked up and down the IPG options chain for the new June 18th contracts and identified on",https://finnhub.io/api/news?id=44bbb12fbbc3d89ec4aa6ed57e4954e3815bef8d436bc365b97d8da416df5791
company,1618484220,June 18th Options Now Available For Interpublic Group of Companies (IPG),66492693,,IPG,Stock Options Channel,"Staff article entitled June 18th Options Now Available For Interpublic Group of Companies (IPG), about stock options, from Stock Options Channel.",https://finnhub.io/api/news?id=494d6b9c6a874bb4b33164ab8e4caab6febf31e8da19a1ba1e4e44d316a0296f
company,1618481400,Stocks That Hit 52-Week Highs On Thursday,66150735,https://cdn.benzinga.com/files/imagecache/og_image_social_share_1200x630/sites/all/themes/bz2/images/bz-icon.png,IPG,Benzinga," 
 
Thursday morning saw 166 companies set new 52-week highs.
Interesting Highlights:

The largest company by market cap to hit a new 52-week high was Microsoft (NASDAQ:...",https://finnhub.io/api/news?id=86ca0d35993029704cfca739b9c7ba2c334a19786fb8fedf741fecfa14194413
company,1618419660,"Interpublic Group of Cos. stock rises Wednesday, outperforms market",66148957,https://images.mktw.net/im-220105/social,IPG,MarketWatch,"Shares of Interpublic Group of Cos. rallied 1.29% to $29.92 Wednesday, on what proved to be an all-around mixed trading session for the stock market, with...",https://finnhub.io/api/news?id=95c0bb7dc1a95bbd4866430c5772251757e6dcb98f09f5da2c4200790c2fbaba
company,1618333260,"Interpublic Group of Cos. stock falls Tuesday, underperforms market",66137307,https://images.mktw.net/im-220105/social,IPG,MarketWatch,"Shares of Interpublic Group of Cos. slipped 1.50% to $29.54 Tuesday, on what proved to be an all-around mixed trading session for the stock market, with the...",https://finnhub.io/api/news?id=06351bead8eee3dd437584ae9b52a387e034bae7c1bd567ef9aa7cb58e659da8
company,1618322100,Primis Earns TAG Anti-Fraud Certification for Fourth Year in a Row,66500820,https://s.yimg.com/uu/api/res/1.2/hDn6cYq1gEvsHJIOoDDVQg--~B/aD00ODt3PTE0MTthcHBpZD15dGFjaHlvbg--/https://media.zenfs.com/en/globenewswire.com/47c4c921fb84d8354b30d69968f6449f,IPG,Yahoo,"Leading Video Discovery Platform Reinforces its Fight Against Criminal Activity in Digital AdvertisingTEL AVIV, Israel, April 13, 2021 (GLOBE NEWSWIRE) -- Primis (a part of Universal McCann and Interpublic Group), today announced it has earned the coveted TAG Certified Against Fraud Seal from the Trustworthy Accountability Group (TAG) for the fourth consecutive year. TAG is an advertising initiative that aims to combat fraudulent and criminal activity in the digital advertising space. “TAG certification fits in with our core values that the advertising industry should be safe, fair, and provide true value to all parties involved, especially our publishers,” Dan Sharon, Compliance Officer of Primis, said. “We are honored to once again achieve the TAG Certified Against Fraud Seal as we continue to support their anti-fraudulent efforts, and we are continually building trusted relationships with our partners to create a brand-safe environment.” Primis is continually enhancing its IVT pre-bid verification tool to meet and address the needs of today’s brand-safe marketers. The company also includes extensive brand safety examinations with the use of MRC-accredited vendor WhiteOps. The platform also integrates ads.txt in all publishers, which enables transparency while granting publishers a significant amount of control over their inventory. “Success in tackling complex supply chain challenges like fraud in digital advertising requires broad collaboration, and we are pleased to recognize Primis for the high standards it continues to set to fight fraud in our industry,” said Mike Zaneis, CEO of TAG. “Year after year, Primis has walked the walk by achieving the TAG Certified Against Fraud Seal, and we look forward to continuing to work with them on these issues going forward.” TAG is recognized as the leading global standards program around criminal activity and brand safety, and an increasing number of companies have opted to certify their global operations. To secure its recertification, Primis underwent a rigorous audit from an independent third-party auditor. About Primis, Video DiscoveryPrimis is a global Video Discovery platform that increases revenue for publishers by helping their users discover high-quality video content. Our video discovery technology is used by 100s of digital publishers, empowering 200M uniques with an engagement-based video experience that recommends video content they love, automatically skipping content they don’t interact with. Primis is owned by Universal McCann and The Interpublic Group of Companies, Inc. (NYSE: IPG) holding itself to the highest standards in digital advertising. Website: www.primis.tech Twitter: @Primisltd LinkedIn: Primis-UMFacebook: Primis-UM Media Contact: Kyle KuhnelBroadsheet Communications for Primiskyle@broadsheetcomms.com",https://finnhub.io/api/news?id=026d33119994141c9cd505b889e7a9509880f8bd0c13d26a34726dacfd24d8ad
company,1618258500,Interpublic Schedules First Quarter 2021 Earnings Release,66500823,https://s.yimg.com/ny/api/res/1.2/hIiq3y7b5w3KZQnMRaQqRg--/YXBwaWQ9aGlnaGxhbmRlcjt3PTIwMDA7aD0xMDEw/https://s.yimg.com/uu/api/res/1.2/ohzCTS1kuQs5qU09reDqHw--~B/aD0yMTI1O3c9NDIwODthcHBpZD15dGFjaHlvbg--/https://media.zenfs.com/en/globenewswire.com/51ade617b2f03298a2c60cc3a65517b2,IPG,Yahoo,"New York, April 12, 2021 (GLOBE NEWSWIRE) -- Interpublic Group (NYSE: IPG) today announced that it will release earnings for the first quarter ended March 31, 2021 on the morning of April 28, 2021. Following the release, the company will hold a conference call for investors at 8:30 a.m. Eastern Time on the same day to review results. To join the conference call, please call (888) 889-1955. Outside the United States, please call (517) 308-9345. The participant passcode is 1473881. The call will be available live on the company’s website, www.interpublic.com. The conference call will be recorded and available for 30 days by calling (800) 285-0609 followed by the passcode 8274. Outside the United States, please call (203) 369-3393 followed by the passcode 8274. The call will also be archived and available in the investor relations section of the company’s website. # # # About InterpublicInterpublic is values-based, data-fueled, and creatively-driven. Major global brands include Acxiom, Craft, FCB (Foote, Cone & Belding), FutureBrand, Golin, Huge, Initiative, Jack Morton, Kinesso, MAGNA, Matterkind, McCann, Mediahub, Momentum, MRM, MullenLowe Group, Octagon, R/GA, UM and Weber Shandwick. Other leading brands include Avrett Free Ginsberg, Campbell Ewald, Carmichael Lynch, Deutsch, Hill Holliday, ID Media and The Martin Agency. For more information, please visit www.interpublic.com. # # # Contact InformationTom Cunningham (Press) (212) 704-1326 Jerry Leshne (Analysts, Investors) (212) 704-1439",https://finnhub.io/api/news?id=fb2faec9c8430126ce8a7ef17b0c9b6e2e93e1707a706c9a0774e5e2216bae46
company,1618251420,Reprise Commerce Lands DeMert Brands as Its First Direct US Client,66500826,https://s.yimg.com/uu/api/res/1.2/fwlt.yCv0URA4fxwFLXkEw--~B/aD0xMzU7dz00ODA7YXBwaWQ9eXRhY2h5b24-/https://media.zenfs.com/en/business-wire.com/13a3b87b110a6304d5f40ba027ea11a0,IPG,Yahoo,"Reprise Commerce Lands Its First Direct Client, Beauty Expert, DeMert Brands",https://finnhub.io/api/news?id=5af067351be88ff5a34e91e9450179cb908f09b87c6c65e2b77c800c1096d9b6
company,1618246860,"Interpublic Group of Cos. stock rises Monday, outperforms market",66130108,https://images.mktw.net/im-220105/social,IPG,MarketWatch,"Shares of Interpublic Group of Cos. rallied 2.01% to $29.99 Monday, on what proved to be an all-around rough trading session for the stock market, with the...",https://finnhub.io/api/news?id=9999782bf41cdbd5da57647a72e5f769c54c50dbad13eb8f2557abc7d86701b9
company,1618244100,Interpublic Schedules First Quarter 2021 Earnings Release,66286864,,IPG,GlobeNewswire,Looking for stock market analysis and research with proves results? Zacks.com offers in-depth financial research with over 30years of proven results.,https://finnhub.io/api/news?id=ae7d75b75289234fd76957651b0f287785f3ff269a8a1f9756a49276cf4d0565
company,1618237020,Reprise Commerce Lands DeMert Brands as Its First Direct US Client,66492704,,IPG,Business Wire,Looking for stock market analysis and research with proves results? Zacks.com offers in-depth financial research with over 30years of proven results.,https://finnhub.io/api/news?id=4ca5e79fd94984c07f2725b38f6cb6c3c7b826ef59bddab68dcc5302b4093255
company,1618218000,"Legion Partners Nominates Seven Highly-Qualified, Independent Candidates for Election to Genesco’s Board",66277791,,IPG,Business Wire,Looking for stock market analysis and research with proves results? Zacks.com offers in-depth financial research with over 30years of proven results.,https://finnhub.io/api/news?id=099f416ff8895274c208ffa71dcdd44c92de6f40fdd518f41caa97718b4c6446
company,1618198740,"Private Capital Group, LLC Buys iShares Core Total USD Bond Market ETF, BTC iShares MSCI EAFE ...",66326296,https://static.gurufocus.com/photos/gurus/guru_logo_square.jpg,IPG,GuruFocus,"Private Capital Group, LLC Buys iShares Core Total USD Bond Market ETF, BTC iShares MSCI EAFE Value ETF, iShares U.S. Energy ETF, Sells S&P 500 ETF TRUST ETF, Vanguard Mid-Cap Growth ETF, Vanguard Growth ETF, Stocks: EFV,DOW,IPG,TIP,IPGP,DECK,IUSB,IYE,MTUM,GBTC,TOTL,, release date:Apr 12, 2021",https://finnhub.io/api/news?id=7386166137d8a4405a40c5bd9c25b8e86461cf1addbc71a62dd40e2f9c3635f9
company,1618003920,"Yum! Brands Inc. stock rises Friday, still underperforms market",66113650,https://images.mktw.net/im-220105/social,IPG,MarketWatch,"Shares of Yum! Brands Inc. inched 0.26% higher to $114.96 Friday, on what proved to be an all-around positive trading session for the stock market, with the...",https://finnhub.io/api/news?id=c244146a82284b3ef1054abdde7246905ce874753f260c77ce6330daa60d89be
company,1617987660,Interpublic Group of Cos. stock underperforms Friday when compared to competitors,66113057,https://images.mktw.net/im-220105/social,IPG,MarketWatch,"Shares of Interpublic Group of Cos. dropped 0.17% to $29.40 Friday, on what proved to be an all-around positive trading session for the stock market, with...",https://finnhub.io/api/news?id=2bf17dc0ee74b18e638bff74025da9623e8454caa28045bac9d309c2a84197fa
company,1617968291,"Zacks Industry Outlook Highlights: Gannett Co, Omnicom Group and The Interpublic Group of Companies",66291632,https://s.yimg.com/uu/api/res/1.2/0btkc66cLJo3jeMt0es0_Q--~B/aD00MDA7dz02MzU7YXBwaWQ9eXRhY2h5b24-/https://media.zenfs.com/en/zacks.com/2915bb18fca236838e2944ec62b5caff,IPG,Yahoo,"Zacks Industry Outlook Highlights: Gannett Co, Omnicom Group and The Interpublic Group of Companies",https://finnhub.io/api/news?id=60afc0d052a433de7661f7c6b200294d4fa29e21dcddcffdd67dcb5e8d2bf6ab
company,1617917520,"Yum! Brands Inc. stock rises Thursday, outperforms market",66103883,https://images.mktw.net/im-220105/social,IPG,MarketWatch,"Shares of Yum! Brands Inc. inched 0.53% higher to $114.66 Thursday, on what proved to be an all-around favorable trading session for the stock market, with...",https://finnhub.io/api/news?id=154611f7479e09d78f7fcb743e3039fbd5faa19ca9122c4f07df778f2a841f38
