category,datetime,headline,id,image,related,source,summary,url
company,1616976000,Wharton Research Data Services Adds Refinitiv Datastream and ESG Data to Its Offerings,65260963,https://mms.businesswire.com/media/20210329005070/en/867571/23/Wharton_WRDS_full_tag_2020.jpg,MSCI,businesswire,"Refinitiv Datastream and ESG data on WRDS—analyze  economic cycles and company performance across environmental, social and governance themes.",https://finnhub.io/api/news?id=15f38ff519770e52a64ebc3497141c1c442d19a56110e5e27dc24f330c33cd1a
company,1616974543,Asia-Pacific stocks mostly rise; Bilibili slumps in Hong Kong debut,65168732,https://image.cnbcfm.com/api/v1/image/106816845-1609213716683-gettyimages-1229866474-JAPAN_JPX.jpeg?v=1616975029,MSCI,CNBC,"Shares of Chinese video platform Bilibili slumped in their debut in Hong Kong on Monday, sitting more than 2% lower than their issue price by the afternoon.",https://finnhub.io/api/news?id=5236df11b13e8a2b4a53a39e4922ddfa6f349c71d7ccaa41b9f4599782a65d8e
company,1616814022,"Haynes and Boone, EnerCom release inaugural report on ESG movement’s impact on Oil and Gas sector - Oil & Gas 360",65988584,https://www.oilandgas360.com/wp-content/uploads/2021/03/ESG-Tracker.jpg,MSCI,https://www.oilandgas360.com,"Haynes and Boone, LLP and EnerCom, Inc. have launched a new research report that tracks how oil and gas companies are responding to growing pressure to support and communicate environmental, social and governance (ESG) policies and report their progress implementing those policies.",https://finnhub.io/api/news?id=1b35e982aa280d49c07df7664a119b3be84b62cf199cc81cab010f94b7eeed88
company,1616778600,"MSCI Inc. stock rises Friday, outperforms market",65327298,https://images.mktw.net/im-220105/social,MSCI,MarketWatch,"Shares of MSCI Inc. rose 3.11% to $424.87 Friday, on what proved to be an all-around positive trading session for the stock market, with the S&P 500 Index...",https://finnhub.io/api/news?id=d9e8221534d9ac8ef03131b6bda02f6a48dd04a591d61b635cf02796d05174e3
company,1616774460,Opinion: This little known investment could double in seven years: GMO,64948888,https://images.mktw.net/im-316251/social,MSCI,MarketWatch,Make it big by going small in Japan,https://finnhub.io/api/news?id=8eb6833e0a437714f62985bfa5791d6a71a27926b031269a7dc8e81d935f80d0
company,1616772060,MSCI Completes Private Offering of $500 Million 3.625% Senior Notes Due 2030,66715240,https://s.yimg.com/cv/apiv2/social/images/yahoo_default_logo-1200x1200.png,MSCI,Yahoo,MSCI Completes Private Offering of $500 Million 3.625% Senior Notes Due 2030,https://finnhub.io/api/news?id=b21eeae3651824b9e72a6a27c57b8f531a612daedb6ca4e3a4b99ffb8bcd6a50
company,1616768751,7 Sector Index Funds To Keep On Your Radar,68909104,https://www.nasdaq.com/sites/acquia.prod/files/2019-05/0902-Q19%20Total%20Markets%20photos%20and%20gif_CC8.jpg?1493703140,MSCI,Nasdaq,"InvestorPlace - Stock Market News, Stock Advice & Trading Tips",https://finnhub.io/api/news?id=0e5f3aac4ffbedcfe2ffdd99c58958b800eb25515f08b21b0bee2c7d6fc672ee
company,1616763600,Don’t Mind the Naysayers. ESG Investing Is Here to Stay.,64898343,https://images.barrons.com/im-316439/social,MSCI,MarketWatch,"Blanket accusations of greenwashing ignore the reality of the industry, say Matt Christensen and Christian McCormick of Allianz Global Investors.",https://finnhub.io/api/news?id=7141c6028a0219cdf3a16027105a94502d285ca76e4257351bd04a87d8dfedbf
company,1616759521,The rise of ESG investing,64925608,https://www.moneyweb.co.za/wp-content/uploads/2017/06/shutterstock_399164620.jpg,MSCI,https://www.moneyweb.co.za,ESG factors are now a mainstay in most valuations and portfolio formations.,https://finnhub.io/api/news?id=aef784abd01d856fc00a57672213b15ab32e84ee463b032af1f11af562d46182
company,1616757660,MSCI Completes Private Offering of $500 Million 3.625% Senior Notes Due 2030,66456408,,MSCI,Business Wire,Looking for stock market analysis and research with proves results? Zacks.com offers in-depth financial research with over 30years of proven results.,https://finnhub.io/api/news?id=ad866ba6f077d6abebc079c62651eac8d5ac6bcb5846b87a725fd5779b3e3ce5
company,1616729100,"AskSlim Market Week - Friday, March 26",66283681,,MSCI,TalkMarkets,Content,https://finnhub.io/api/news?id=9fb8033644c7b3608db89f2356605acb8b78ec288153af581099a7280f21c701
company,1616721960,7 Sector Index Funds To Keep On Your Radar,66311031,https://investorplace.com/wp-content/uploads/2020/06/index-funds-1600.jpg,MSCI,InvestorPlace,Investors who want to allocate their capital into different sectors should consider these seven index funds in Q2,https://finnhub.io/api/news?id=f2b7b5f847354c6c4a65c0b0e1838cd4d181434c31b47deeb84002dca0ac2192
company,1616716800,MSCI Completes Private Offering of $500 Million 3.625% Senior Notes Due 2030,64898011,http://www.businesswire.com/images/bwlogo_square.png,MSCI,businesswire,MSCI Completes Private Offering of $500 Million 3.625% Senior Notes Due 2030,https://finnhub.io/api/news?id=b38d91f654294d0cd66a2aabc7cf3dbabef8e83d03ace62c3b2879d378b5f260
company,1616716800,Teleperformance remporte 11 prix aux European Contact Center & Customer Service Awards (ECCCSA),64895572,https://mms.businesswire.com/media/20210326005263/fr/676465/23/logo_-_new.jpg,MSCI,businesswire,"Regulatory News: Teleperformance (Paris:TEP), un leader mondial des services aux entreprises en solutions digitales intégrées, annonce aujourd’hui que",https://finnhub.io/api/news?id=c9aaab83eb93aacf9685a5f4a444dcb5b090bfccf32ccd2f453edf8cb790b893
company,1616716800,Tenet Forms New Board Committee Focused on ESG,64895315,https://mms.businesswire.com/media/20210326005067/en/754022/23/TenetHealth_rounded.jpg,MSCI,businesswire,Tenet Healthcare Corporation (NYSE: THC) today announced that it has formed a new committee of its Board of Directors focused on matters directly rela,https://finnhub.io/api/news?id=cbf7a0167072c236f1f9df6158e6c9ab1b435705b994997872440d12bd534e3e
company,1616716094,Asia-Pacific stocks rise following Dow's overnight rebound,64859072,https://image.cnbcfm.com/api/v1/image/106814724-1608594276238-gettyimages-1229866197-JAPAN_JPX.jpeg?v=1616715262,MSCI,CNBC,The Dow Jones Industrial Average jumped nearly 200 points overnight stateside.,https://finnhub.io/api/news?id=68137697ce6e3c75a3f80003a3cd47fbbee5f73399d35d1db56421f65535f004
company,1616692200,"MSCI Inc. stock falls Thursday, underperforms market",65327299,https://images.mktw.net/im-220105/social,MSCI,MarketWatch,"Shares of MSCI Inc. shed 2.83% to $412.05 Thursday, on what proved to be an all-around great trading session for the stock market, with the S&P 500 Index...",https://finnhub.io/api/news?id=bded60d0d3f31b745fd066875464ac0dc62110749edf4f7751f613f1e8fb6e89
company,1616677095,RAEX-Europe: First ESG ranking of Russian iron and steel companies,65131415,http://d39raawggeifpx.cloudfront.net/styles/16_9_desktop/s3/articleimages/bneGeneric_ESG_metal_iron_steel_cut_out_.jpg,MSCI,https://www.intellinews.com,"The first ESG ranking of Russian iron and steel companies showcases fairly high results in terms of the quality of corporate governance, while the ...",https://finnhub.io/api/news?id=cdd993b809f307b95e256e9d51a701994f0535df59b42fc2c1a8214d45a0abc2
company,1616630400,ESG Among Forbes’ America’s Best Management Consulting Firms for Six Years Running,64842983,https://mms.businesswire.com/media/20210325005129/en/867276/23/ESG-Logo-Color-RGB-01.jpg,MSCI,businesswire,"Execution Specialists Group (ESG), a strategy execution-focused consultancy, is named to Forbes' list of America’s Best Management Consulting Firms.",https://finnhub.io/api/news?id=edbc24c2d3f4936c994aa728a35328a521ab0a2f3c08c652f7207fdb6722325a
company,1616605800,MSCI Inc. stock underperforms Wednesday when compared to competitors despite daily gains,64835309,https://images.mktw.net/im-220105/social,MSCI,MarketWatch,"Shares of MSCI Inc. inched 0.78% higher to $424.03 Wednesday, on what proved to be an all-around grim trading session for the stock market, with the S&P 500...",https://finnhub.io/api/news?id=6bb49374405a8d4442f47d34026cc97da989b475ab9e89d1a1bbbeb95d8c222e
company,1616544000,Razer Crosses the US$1B Revenue Milestone and Turns Profitable Ahead of All Expectations in FY2020,64821193,https://mms.businesswire.com/media/20210324005217/en/867039/23/THS_black.jpg,MSCI,businesswire,"Razer FY2020 Financial Results, published March 24, 2020 at 12:00PM SGT.",https://finnhub.io/api/news?id=0e5fa8f21dc3c3c768f27c22bb5d52e14e13c7dcfc0611dcdade31a0c7223977
company,1616544000,Razer Crosses the US$1B Revenue Milestone and Turns Profitable Ahead of All Expectations in FY2020,64820146,http://www.businesswire.com/images/bwlogo_square.png,MSCI,businesswire,"Razer™ (“Razer” or the “Company”, together with its subsidiaries, the “Group”, Hong Kong Stock Code: 1337), the leading global lifestyle brand for gam",https://finnhub.io/api/news?id=3d8a2326ad372530a2093d8daf6913d64ed6e8550cb3f15c31afb5ea9ae29e0a
company,1616543270,Hong Kong and Japan lead declines in Asia-Pacific as pandemic recovery doubts weigh on sentiment,64819833,https://image.cnbcfm.com/api/v1/image/106816354-1608883812721-gettyimages-1229336191-JAPAN_TRADING.jpeg?v=1616542389,MSCI,CNBC,The World Health Organization said earlier this week that many regions globally are seeing an increase in new Covid-19 cases.,https://finnhub.io/api/news?id=b084230410b6145b1451e202853ada3abe3541bbbf90e9cef5d93c739e45c0ce
company,1616520763,Here’s Why Baron FinTech is Long MSCI Inc. (MSCI),66715243,,MSCI,Yahoo,"Baron Funds, an investment management firm, published its fourth quarter 2020 “Baron FinTech Fund” investor letter – a copy of which can be downloaded here. A return of 13.61% was recorded by its Retail Shares, and 13.67% by its Institutional Shares in the fourth quarter of 2020, both below its FactSet Global FinTech Benchmark that delivered […]",https://finnhub.io/api/news?id=738daea0b0c688550877e189413dc05259678bdda0916b2f49caf3ced288a975
company,1616519400,"MSCI Inc. stock rises Tuesday, outperforms market",64816792,https://images.mktw.net/im-220105/social,MSCI,MarketWatch,"Shares of MSCI Inc. inched 0.33% higher to $420.76 Tuesday, on what proved to be an all-around dismal trading session for the stock market, with the S&P 500...",https://finnhub.io/api/news?id=2ae40bf6b3d5bbfdd713f9677ecb355cc4ac1ef2c4aac95aef42120788dcc06a
company,1616517723,ESGU: ESG Investing Can Shape The Future Of Our Planet,64811537,https://media.gettyimages.com/photos/group-of-children-holding-planet-earth-over-defocused-nature-picture-id1214243583?b=1&k=6&m=1214243583&s=170667a&w=0&h=oEo5o8161gGMIoOa9aZX4m59FSNlFs4U5bxDdYC0Aus=,MSCI,SeekingAlpha,The COVID-19 pandemic will most likely change our perception of how important the key business sustainability issues are for making our planet a better place.,https://finnhub.io/api/news?id=619e8fcebbc811449a8ce56a63de58bd47c55b2bc642701fdaeecc33642b2756
company,1616517932,D.R. Horton - A Homebuilding Dividend Wildcard,64812766,https://static.seekingalpha.com/cdn/s3/uploads/getty_images/1264362572/medium_image_1264362572.jpg,MSCI,SeekingAlpha,D.R. Horton is not only America's biggest home builder but also the best long-term investment in this industry.,https://finnhub.io/api/news?id=787d8b43b55ec7ee0984190ee9f817f97c979f5ded27bc221e96c2adff336348
company,1616456053,Asia-Pacific stocks mixed; Baidu rises in Hong Kong debut,64801244,https://image.cnbcfm.com/api/v1/image/106816845-1609213716683-gettyimages-1229866474-JAPAN_JPX.jpeg?v=1614901573,MSCI,CNBC,"Chinese search giant Baidu made its debut in Hong Kong on Tuesday, with shares rising more than 1% in morning trade from their issue price.",https://finnhub.io/api/news?id=23fea32abcd6c6f12979eda3b73925ee6003e36e6c8a32e31e9fce4ddacce4e7
company,1616433000,MSCI Inc. stock outperforms competitors on strong trading day,64796482,https://images.mktw.net/im-220105/social,MSCI,MarketWatch,"Shares of MSCI Inc. advanced 2.19% to $419.36 Monday, on what proved to be an all-around positive trading session for the stock market, with the S&P 500...",https://finnhub.io/api/news?id=1d89a9688eed82e8ff54462d121a6b3c7b9043c097e8c53f9e121a1db96cfa89
company,1616371200,"Forward Air Releases First Environmental, Social and Governance Report",64788347,https://mms.businesswire.com/media/20210322005596/en/814129/23/Forward.jpg,MSCI,businesswire,"Forward Air Corporation (NASDAQ: FWRD) (the “Company” or “Forward”) is executing a growth strategy that involves organic infrastructure investments, s",https://finnhub.io/api/news?id=825075065a7603d2cfb306258df347da9471e0873e7d0b156048d3d22a00179f
company,1616370485,Japan leads losses in mixed Asia-Pacific trading; Turkish lira weakens sharply against the dollar,64779421,https://image.cnbcfm.com/api/v1/image/106847484-1614641552617-gettyimages-1231210046-JAPAN_STOCKS.jpeg?v=1616369953,MSCI,CNBC,"China's one-year loan prime rate (LPR) and five-year LPR were left unchanged at 3.85% and 4.65%, respectively, on Monday.",https://finnhub.io/api/news?id=e2103bce00bded3957b7c3d6e420728c311f832729e93429a10375d6e9b21cb7
company,1616246506,Putting the Grift in ESG | National Review,66108614,https://i1.wp.com/www.nationalreview.com/wp-content/uploads/2021/03/larry-fink-2017.jpg?fit=1200%2C675&ssl=1,MSCI,https://www.nationalreview.com,"The week of March 15: ESG’s new clothes, tax troubles ahead, inflation ahead (or not) and much, much more.",https://finnhub.io/api/news?id=68b921241e9999e544620013637597b69114500051a32f83ec643053fc6e9c0d
company,1616173800,MSCI Inc. stock outperforms competitors on strong trading day,64764500,https://images.mktw.net/im-220105/social,MSCI,MarketWatch,"Shares of MSCI Inc. rallied 1.17% to $410.36 Friday, on what proved to be an all-around rough trading session for the stock market, with the S&P 500 Index...",https://finnhub.io/api/news?id=739ae6657b4dc21c3eabb395f70cbca8bf4f610fe980efe54812c85e498c4a39
company,1616158179,Be socially-wise by investing into an ESG Fund,64769415,https://images.livemint.com/img/2021/03/19/600x338/abstract-3d-leaves-forming-esg-text-symbol-white-background-creative-eco-environment-investment-fund-2021-future-green-energy-innovation-business-trend_44651-477_1616157923710_1616157927578.jpeg,MSCI,https://www.livemint.com,"Parking your money in ESG Funds is a trend catching up fast in a world where sustainability is becoming a key virtue. Good ESG practices translate into a better performance for the business in the long term, making it an attractive choice for investors.",https://finnhub.io/api/news?id=629775e0accb83e5989ed621a091a196755914a3d01c2b97b36ac579e9b9e8a4
company,1616120580,MSCI files automatic mixed securities shelf,66456424,,MSCI,Thefly.com,MSCI files automatic mixed securities shelf MSCI,https://finnhub.io/api/news?id=72a272aee041854a2f6fac69dde1164d39593572ab95ab94c049f1ecfc27a180
company,1616112000,"MSCI Earns An Attractive Rating For March, Despite Downward Trend",64761651,https://thumbor.forbes.com/thumbor/fit-in/1200x0/filters%3Aformat%28jpg%29/https%3A%2F%2Fspecials-images.forbesimg.com%2Fimageserve%2F5f8f028820817dd921507240%2F0x0.jpg,MSCI,https://www.forbes.com,Although MSCI stock is slipping – down 5.4% since the start of 2021 – there doesn’t appear to be cause for upset. Here's what Q.ai has to say.,https://finnhub.io/api/news?id=0e552210f71e6af21073e16a30cb5d29627b48cf136c573d2f03ea0fa2c60f46
company,1616087400,MSCI Inc. stock underperforms Thursday when compared to competitors,64740935,https://images.mktw.net/im-220105/social,MSCI,MarketWatch,"Shares of MSCI Inc. slid 1.83% to $405.62 Thursday, on what proved to be an all-around poor trading session for the stock market, with the S&P 500 Index...",https://finnhub.io/api/news?id=542bf5a22f6618b84c7904071e08647dfb88d6188fd7fa840460cbab2e39db26
company,1616080660,"1 in 4 investing dollars are now going into ESG strategies. How to play it, according to Cowen",64741255,https://image.cnbcfm.com/api/v1/image/106851259-1615300899655Parking-Deck-png?v=1615301137,MSCI,CNBC,Sustainable funds attracted record inflows in 2020 and the momentum is showing no signs of slowing down.,https://finnhub.io/api/news?id=ecc1ac12c8ccdde0e0b10a848c5e7e874fde495fd6297c967a2719f867fc32ae
company,1616064550,"The Rule Of 40 For SaaS Companies, Part 6 - Moving Past The Rule Of 40 With The 'SaaS Scorecard' To Beat R40 Stocks",64727872,https://static.seekingalpha.com/cdn/s3/uploads/getty_images/1203544876/medium_image_1203544876.jpg,MSCI,SeekingAlpha,"Over the last few months, I’ve written a series of articles on software as a service (SaaS) firms and their stocks, and especially those that pass the Rule of 40.",https://finnhub.io/api/news?id=73d825f5472fe80d31fbf4f68b247e2722fffe1ddb64f4bfad8d33643eb21286
company,1616025600,Goldman Sachs adopta el conjunto de datos de Moody's ESG Solutions sobre riesgos climáticos soberanos,64737102,https://mms.businesswire.com/media/20210318005910/es/865859/23/MCO_RGB_Blue-jpg.jpg,MSCI,businesswire,Moody's ESG Solutions Group acaba de anunciar que Goldman Sachs Asset Management (Goldman Sachs) ha seleccionado el sistema de puntuación de riesgo cl,https://finnhub.io/api/news?id=92f64d0df4eefaf3c3457672f23f4f1bfdc92d69a3aabd1c6661dcc60d06d6ee
company,1616025600,Goldman Sachs seleciona o conjunto de dados sobre risco climático soberano da Moody’s ESG Solutions,64737100,https://mms.businesswire.com/media/20210318005911/pt/865859/23/MCO_RGB_Blue-jpg.jpg,MSCI,businesswire,O Moody’s ESG Solutions Group anunciou hoje que a Goldman Sachs Asset Management (Goldman Sachs) selecionou a Pontuações de Risco Climático Soberano (,https://finnhub.io/api/news?id=178edffb706700755e9d7a641a8b77ef7581311d69cbeddc76108f36824cbd85
company,1616025600,Goldman Sachs choisit l'ensemble de données de Moody’s ESG Solutions sur les risques climatiques des émetteurs souverains,64735194,https://mms.businesswire.com/media/20210318005870/fr/865859/23/MCO_RGB_Blue-jpg.jpg,MSCI,businesswire,Moody’s ESG Solutions Group a annoncé aujourd’hui que Goldman Sachs Asset Management (Goldman Sachs) a choisi les scores de risque climatique des émet,https://finnhub.io/api/news?id=34ebc4400ed5f0571c758ecb4ddaf6eef10a5c4fcefd1382b070546f225be549
company,1616025600,Goldman Sachs Selects Moody’s ESG Solutions Dataset on Sovereign Climate Hazards,64723889,https://mms.businesswire.com/media/20210318005402/en/865859/23/MCO_RGB_Blue-jpg.jpg,MSCI,businesswire,Moody’s ESG Solutions Group announced today that Goldman Sachs Asset Management (Goldman Sachs) has selected Sovereign Climate Risk Scores powered by,https://finnhub.io/api/news?id=c0fecf1e69d6931495c54b4314919b1cd4a6f6218b70a3b0c35985b3763ccd19
company,1616001894,Should you include sustainable funds?,64723544,https://images.livemint.com/img/2021/03/17/600x338/ESG_1550523620193_1615997770813.jpg,MSCI,https://www.livemint.com,ESG theme-based indices have outperformed traditional peers.ESG funds don’t need to be a part of any portfolio as long as investors pick quality funds from fund houses with a strong track record,https://finnhub.io/api/news?id=22f8f7645305ca5e7259a96608fa700dd199a554ee27979af918c868e41959fd
company,1616001000,MSCI Inc. stock underperforms Wednesday when compared to competitors,64720732,https://images.mktw.net/im-220105/social,MSCI,MarketWatch,"Shares of MSCI Inc. slid 0.82% to $413.17 Wednesday, on what proved to be an all-around favorable trading session for the stock market, with the S&P 500...",https://finnhub.io/api/news?id=625dd4ffdefd432c40fd19a560096eb32243744f6c112070237ce349ef3465f1
company,1615939200,Bank of America Reaches Milestone; Company Has Distributed 25 Million Masks to Underserved Communities Across the U.S.,64714249,https://mms.businesswire.com/media/20210317005704/en/691133/23/BAC_logo_%28standard%29.jpg,MSCI,businesswire,"Bank of America today announced that in partnership with local nonprofits across the country, it has distributed more than 25 million masks since last",https://finnhub.io/api/news?id=aeec80e4b7e85a5185a1dce1da3a0cdb25370120664e32e13410b08ffdee86ed
company,1615939200,NAVEX Global Integrates SASB Standards into NAVEX ESG Solution,64703324,https://mms.businesswire.com/media/20210317005492/en/808689/23/prime-rgb-no-tag.jpg,MSCI,businesswire,"NAVEX Global®, the leader in integrated risk and compliance management software, today announced a licensing agreement with the Sustainability Account",https://finnhub.io/api/news?id=b1127e71dd594054bd0521859f6b0966b575ddcda3a420a38c364162aa895dab
company,1615939200,Inclusion of ESG Metrics in Incentive Plans: Evolution or Revolution?,64700994,https://mms.businesswire.com/media/20210317005234/en/865695/23/Pay_Gov_logo_no_shadow.jpg,MSCI,businesswire,Pay Governance's just-released survey looks at how companies are responding to ESG and  its effect on the design of incentive compensation plans.,https://finnhub.io/api/news?id=5d180f704e16c63d79806381ea37658d456ffb8dc74960bfd63b1bd4cce6bfea
company,1615939200,Gecina lance un Espace en ligne pour ses actionnaires individuels au nominatif pur,64700209,https://mms.businesswire.com/media/20210317005383/fr/694573/23/Gecina_logo-RVB.jpg,MSCI,businesswire,"Regulatory News: Afin d’enrichir dans la durée la relation avec ses actionnaires individuels, Gecina (Paris:GFC) lance en ligne son « Espace actionnai",https://finnhub.io/api/news?id=98e437d3e83f400c34f9569b8ef42ed1bd34f820a7faf14b0d3b1358039795f4
company,1615914720,MSCI Inc. stock outperforms competitors despite losses on the day,64694830,https://images.mktw.net/im-220105/social,MSCI,MarketWatch,"Shares of MSCI Inc. sank 0.71% to $416.58 Tuesday, on what proved to be an all-around grim trading session for the stock market, with the S&P 500 Index...",https://finnhub.io/api/news?id=33bc444b88ab06af47941ed4b18ee5b628ca44589f78d95e37d41961cb52573e
company,1615913516,Should You Buy MSCI (MSCI) Stock Before It’s Too Late?,66715246,,MSCI,Yahoo,"Baron Growth Fund recently published its fourth-quarter commentary – a copy of which can be downloaded here. During the fourth quarter of 2020, the Baron Growth Fund returned 21.1% (institutional shares). In comparison, the benchmark S&P 500 Index was up 12.15%, while the Russell 2000 Growth Index was up 29.61%. You should check out Baron […]",https://finnhub.io/api/news?id=64a9c724d471ee18b213e1e6724409a9638a4687edf87b4e13279af433a71ef4
company,1615852800,A Tale Of Two ESG Investors Since COP 21,64761414,https://thumbor.forbes.com/thumbor/fit-in/1200x0/filters%3Aformat%28jpg%29/https%3A%2F%2Fspecials-images.forbesimg.com%2Fimageserve%2F6050a47ee4f2e63e1efb585c%2F0x0.jpg,MSCI,https://www.forbes.com,"The algorithmic passive investor looked to measure ESG for every stock, the next gen investor bought Tesla.",https://finnhub.io/api/news?id=8e84a2bc2f99100f14d636c0001f4fb5a86b0674d7b9f52fa98788f4fc1ee01d
company,1615852800,Savanna Recognized for Advances in Sustainability and Wellness Across 7 Million SF New York City Property Portfolio,64689524,https://mms.businesswire.com/media/20210316005770/en/865510/23/141_Willoughby_-_Exterior_-_Savanna.jpg,MSCI,businesswire,Savanna has been recognized by two leading industry organizations for portfolio-wide performance in sustainability and wellness. Savanna officially ea,https://finnhub.io/api/news?id=e600403722b05d0c3d94969fc9f1997dc8ab00e54b203ae445eef77d55511702
company,1615852800,KBRA Appoints Stacie Olivares as Independent Board Director,64680044,https://mms.businesswire.com/media/20210316005697/en/1044565/23/KBRA-logo-fullcolor-RGB.jpg,MSCI,businesswire,Kroll Bond Rating Agency (KBRA) is pleased to announce the appointment of Stacie Olivares as its newest independent board director. Stacie Olivares is,https://finnhub.io/api/news?id=3391436ce0f5fe3176c2017708741c36bc13ba7d47a88291dfc3b4938704c1cf
company,1615852800,AM Best Becomes Signatory to the ESG-Related Principles for Sustainable Insurance (PSI); First CRA to Make This Commitment,64678186,https://mms.businesswire.com/media/20210316005650/en/828829/23/AM_Best_Logo.jpg,MSCI,businesswire,AM Best became a signatory of the United Nations Environment Programme’s (UNEP) FI Principles for Sustainable Insurance (PSI). AM Best believes the in,https://finnhub.io/api/news?id=a807aacf7236b7a1494fd6d10a7a7ef7fba093df9211c7a51a968c65be183cb3
company,1615852800,Linedata s’associe avec Arabesque S-Ray pour lancer la première solution de gestion des données ESG du marché dédiée à l’asset management,64675013,https://mms.businesswire.com/media/20210316005351/fr/865318/23/linedata_logo.jpg,MSCI,businesswire,"Linedata (Euronext Paris : LIN), éditeur de solutions globales pour les professionnels de l’asset management, de l’assurance et du crédit, annonce sa",https://finnhub.io/api/news?id=9665521795ca672a9bcdd6af82960d18998dbc158bfa927a681759717c90516f
company,1615766400,Assurant Affirms Long-Standing Commitment to Social Responsibility,64665525,https://mms.businesswire.com/media/20210315005737/en/865200/23/AIZ-09329-Our_Connected_Social_Responsibilities_Infographic_031221_Final.jpg,MSCI,businesswire,Assurant Affirms Long-standing Commitment to Social Responsibility  in 2021 Social Responsibility Report,https://finnhub.io/api/news?id=aca3a05b0706078a18c3b2afe3f1faecbba88fd513c6da86a472e43e6c32e7f3
company,1615750200,Vanguard is beefing up its ESG staffing – are more sustainable-investing funds on the way?,64682091,https://images.mktw.net/im-270702/social,MSCI,MarketWatch,"As data quality improves, Vanguard thinks about its next steps.",https://finnhub.io/api/news?id=0fc732546074c2cf3439aaf0d5242eada231fdd38938997dd82dda350d8fc27a
