category,datetime,headline,id,image,related,source,summary,url
company,1620407400,MSCI Inc. stock outperforms competitors on strong trading day,67727553,https://images.mktw.net/im-220105/social,MSCI,MarketWatch,"Shares of MSCI Inc. rallied 1.34% to $482.31 Friday, on what proved to be an all-around positive trading session for the stock market, with the S&P 500 Index...",https://finnhub.io/api/news?id=6f66d6447d7b2a691d2d09d1c286d1eaeaad9d8cb06e28e5f56f4bfcd463b7d6
company,1620373719,Quality Dividend Growth Stocks For May 2021,67660663,https://static.seekingalpha.com/cdn/s3/uploads/getty_images/1225375936/medium_image_1225375936.jpg,MSCI,SeekingAlpha,I present 30 Quality Dividend Growth Stocks for consideration in May 2021. There are 4 new stocks on this month's watchlist with solid dividend growth histories.,https://finnhub.io/api/news?id=b7290d269660998dbe9ef52ae0b04583c91ff45d282c1464b47f8152e6a2a69d
company,1620331260,MSCI to Participate in the Barclays Americas Select Franchise Conference,67646817,https://s.yimg.com/cv/apiv2/social/images/yahoo_default_logo-1200x1200.png,MSCI,Yahoo,"MSCI Inc. (NYSE: MSCI), a leading provider of critical decision support tools and services for the global investment community, announced today that Andy Wiechmann, Chief Financial Officer, will participate in a virtual fireside chat on Tuesday, May 18, 2021 at 09:00 AM Eastern as part of the Barclays Americas Select Franchise Conference.",https://finnhub.io/api/news?id=1e166479febe5988f004f0eff14767b35cb6e8499fe8d98e6fdd5951f5e35919
company,1620321000,"MSCI Inc. stock falls Thursday, underperforms market",67727555,https://images.mktw.net/im-220105/social,MSCI,MarketWatch,"Shares of MSCI Inc. dropped 0.47% to $475.91 Thursday, on what proved to be an all-around positive trading session for the stock market, with the S&P 500...",https://finnhub.io/api/news?id=b7c49a74990c3012d8e9a9728eafef4ce13cad96cdbe55f6aee51c832070c7bf
company,1620316860,MSCI to Participate in the Barclays Americas Select Franchise Conference,67633578,,MSCI,Business Wire,Looking for stock market analysis and research with proves results? Zacks.com offers in-depth financial research with over 30years of proven results.,https://finnhub.io/api/news?id=568b639e6fb4c0c7519c532a44b07c27834ef03300330efb4cf883d0fcd74d84
company,1620311100,TRADING UPDATES: Superdry optimistic; Virgin Wines toasts demand surge,67630918,,MSCI,Alliance News,Looking for stock market analysis and research with proves results? Zacks.com offers in-depth financial research with over 30years of proven results.,https://finnhub.io/api/news?id=211d08f2fb8eba265558131c974684e1444f838914633f7a337bfaa39e374543
company,1620295560,Intercontinental Exchange: Steady Growth From a Fairly Valued Company,67625400,,MSCI,GuruFocus,GuruFocus Article or News written by Robert Abbott and the topic is about: The owner of the New York Stock Exchange and other assets also offers a growing dividend,https://finnhub.io/api/news?id=03d23fe27f46497a6564ffef11cd88b89e544bd696fd8ac97169defc4be4c554
company,1620294060,Intercontinental Exchange: Steady Growth from a Fairly-Valued Company,67623894,,MSCI,GuruFocus,GuruFocus Article or News written by Robert Abbott and the topic is about: The owner of the New York Stock Exchange and other assets also offers a growing dividend,https://finnhub.io/api/news?id=9331986290d6f87d25dcab443de66b72adafd77ebf860078a3fdb5f352ea2b63
company,1620270900,Msci Inc (MSCI) President & COO Cd Baer Pettit Sold $1.2 million of Shares,67642733,,MSCI,GuruFocus,GuruFocus Article or News written by insider and the topic is about: ,https://finnhub.io/api/news?id=b73f1828f71adeb106d21a6057466c43895468d98e601ba3d3a700691eea52c8
company,1620234600,"MSCI Inc. stock falls Wednesday, underperforms market",67727557,https://images.mktw.net/im-220105/social,MSCI,MarketWatch,"Shares of MSCI Inc. sank 0.90% to $478.18 Wednesday, on what proved to be an all-around positive trading session for the stock market, with the S&P 500 Index...",https://finnhub.io/api/news?id=21800faf44c042fb250ecde11e0ddf620281ea5335ca341c24686525ea0ffd41
company,1620166380,"MSCI May Semi-Annual Index Review Announcement Scheduled for May 11, 2021",67504982,https://s.yimg.com/cv/apiv2/social/images/yahoo_default_logo-1200x1200.png,MSCI,Yahoo,"MSCI Inc. (NYSE:MSCI), a leading provider of research-based indexes and analytics, will announce the results of the May 2021 Semi-Annual Index Review for the MSCI Equity Indexes - including the MSCI Global Standard, MSCI Global Small Cap and MSCI Micro Cap Indexes, the MSCI Global Value and Growth Indexes, the MSCI Frontier Markets, and MSCI Frontier Markets Small Cap Indexes, the MSCI Global Islamic and MSCI Global Islamic Small Cap Indexes, the MSCI Pan-Euro and MSCI Euro Indexes, the MSCI US Equity Indexes, the MSCI US REIT Index, the MSCI China A Onshore Indexes and the MSCI China All Shares Indexes. All changes will be made as of the close of May 27, 2021.",https://finnhub.io/api/news?id=e3897c613815d8bef7a4ef2d9a7a87cb57fdd30171a471af3f345a1f2ab0f37c
company,1620158460,MSCI Published an Investor Presentation,67484793,https://s.yimg.com/cv/apiv2/social/images/yahoo_default_logo-1200x1200.png,MSCI,Yahoo,"MSCI Inc. (""MSCI"" or the ""Company"") (NYSE: MSCI), a leading provider of critical decision support tools and services for the global investment community, published a presentation for investors on its website, ir.msci.com, on Tuesday, May 4, 2021. The Company’s management team may use this presentation during meetings with investors.",https://finnhub.io/api/news?id=a4cbc6eb9c4f1fdb436aa2429e31695e819aa0c80ad31e02f3a3834916a12c2e
company,1620151980,"MSCI May Semi-Annual Index Review Announcement Scheduled for May 11, 2021",67501834,,MSCI,Business Wire,Looking for stock market analysis and research with proves results? Zacks.com offers in-depth financial research with over 30years of proven results.,https://finnhub.io/api/news?id=db86ef5fd1f0c19b305ce23d18317acda4170611bca2afe2f92c72c3c489e36f
company,1620148200,"MSCI Inc. stock falls Tuesday, underperforms market",67507283,https://images.mktw.net/im-220105/social,MSCI,MarketWatch,"Shares of MSCI Inc. slid 0.76% to $482.50 Tuesday, on what proved to be an all-around mixed trading session for the stock market, with the Dow Jones...",https://finnhub.io/api/news?id=8545377ac210764123826d6913fb9c7dc61dac5e9ebee0a445f6949e58b3c9c7
company,1620144060,MSCI Published an Investor Presentation,67488259,,MSCI,Business Wire,Looking for stock market analysis and research with proves results? Zacks.com offers in-depth financial research with over 30years of proven results.,https://finnhub.io/api/news?id=5f32d34cb37a0d0f716656a1c04889e95d47310d4b8369d77da30c1549c25168
company,1620061800,"MSCI Inc. stock rises Monday, still underperforms market",67507286,https://images.mktw.net/im-220105/social,MSCI,MarketWatch,"Shares of MSCI Inc. inched 0.09% higher to $486.20 Monday, on what proved to be an all-around favorable trading session for the stock market, with the S&P...",https://finnhub.io/api/news?id=f0f96123de5938219ecbaa6bc2bb3f88fbd7b3846c12bd899e8e83369b06497d
company,1619983351,"Bad, Worse, Worst: Assets To Avoid",67294223,https://static.seekingalpha.com/cdn/s3/uploads/getty_images/933052786/medium_image_933052786.jpg,MSCI,SeekingAlpha,There are thousands of stocks and other assets one should not buy or hold right now. These range from high-quality businesses that are overvalued to purely speculative plays.,https://finnhub.io/api/news?id=f352503ca26c4e4a05a3c3a407af27f5561c61299ae07fc8470180fd6135900f
company,1619820120,MSCI Prices $600 Million 3.625% Senior Unsecured Notes Due 2031,67189106,https://s.yimg.com/cv/apiv2/social/images/yahoo_default_logo-1200x1200.png,MSCI,Yahoo,"MSCI Inc. (NYSE: MSCI), a leading provider of critical decision support tools and services for the global investment community, announced today that it priced its private offering of $600.0 million aggregate principal amount of 3.625% senior unsecured notes due 2031 (the ""notes"") at an issue price of 100.000% (the ""offering""). Interest on the notes will be 3.625%, and will be payable in cash semi-annually, beginning on November 1, 2021. The size of the offering reflects an increase of $100.0 million from the previously announced offering size. Interest on the notes will begin accruing from May 14, 2021. The offering is expected to settle on May 14, 2021, subject to customary closing conditions. MSCI intends to use the net proceeds from the offering for general corporate purposes, including, without limitation, potential purchases of common stock, investments and acquisitions, and to pay fees and expenses incurred in connection with the offering. The notes will be senior unsecured obligations of MSCI and will be guaranteed by MSCI and certain of its domestic subsidiaries.",https://finnhub.io/api/news?id=72dfdfa7dbad650bb98e48a468b9de1f12d73af73398c86f992cb40f73705aa1
company,1619805720,MSCI Prices $600 Million 3.625% Senior Unsecured Notes Due 2031,67170547,,MSCI,Business Wire,Looking for stock market analysis and research with proves results? Zacks.com offers in-depth financial research with over 30years of proven results.,https://finnhub.io/api/news?id=d2b7c4dc23ff5acc9d737a78a0067d1945a04c7d66402f35e80ebe034456cedb
company,1619802600,MSCI Inc. stock underperforms Friday when compared to competitors,67197669,https://images.mktw.net/im-220105/social,MSCI,MarketWatch,"Shares of MSCI Inc. shed 1.83% to $485.77 Friday, on what proved to be an all-around rough trading session for the stock market, with the S&P 500 Index...",https://finnhub.io/api/news?id=902c2fa226cc9999610bcc7d4154842d23f5c4fdf7c71021b6c4344fbcbd066c
company,1619787480,MSCI Launches Private Offering of $500 Million Senior Unsecured Notes Due 2031,67165402,https://s.yimg.com/cv/apiv2/social/images/yahoo_default_logo-1200x1200.png,MSCI,Yahoo,"MSCI Inc. (NYSE: MSCI), a leading provider of critical decision support tools and services for the global investment community, announced today that it intends to issue $500.0 million aggregate principal amount of senior unsecured notes due 2031 (the ""notes"") in a private offering that is exempt from the registration requirements of the Securities Act of 1933, as amended (the ""Securities Act""). The proposed offering is subject to market and other conditions. If the offering is successfully placed, MSCI intends to use the net proceeds from the offering for general corporate purposes, including, without limitation, potential purchases of common stock, investments and acquisitions, and to pay fees and expenses incurred in connection with the offering.",https://finnhub.io/api/news?id=c7cf058ec966856264b32f20af91dd3e3fc0f1ccf1494d80c0c1bf3c894a4729
company,1619780110,"Zacks Industry Outlook Highlights: SYNNEX Corp, MSCI and Guidewire Software",67148228,https://s.yimg.com/uu/api/res/1.2/7HJtgv5fGfJpj_Tk6WdZNg--~B/aD00MDA7dz02MzU7YXBwaWQ9eXRhY2h5b24-/https://media.zenfs.com/en/zacks.com/ba90e83a09bdb85ceb7164515a5261a1,MSCI,Yahoo,"Zacks Industry Outlook Highlights: SYNNEX Corp, MSCI and Guidewire Software",https://finnhub.io/api/news?id=bee1212468cf01ba43ec94ad120aa8e028f8b6f40465573c27e275ff1a1f2ede
company,1619773080,MSCI Launches Private Offering of $500 Million Senior Unsecured Notes Due 2031,67156990,,MSCI,Business Wire,Looking for stock market analysis and research with proves results? Zacks.com offers in-depth financial research with over 30years of proven results.,https://finnhub.io/api/news?id=0ef166918e864f2b3b3c553573111cec68e05879a1129cc2819e06a1a38974ff
company,1619766780,MSCI Stock Shows Every Sign Of Being Significantly Overvalued,67156991,,MSCI,GuruFocus,GuruFocus Article or News written by GF Value and the topic is about: ,https://finnhub.io/api/news?id=cd994dd1637b42ff161f800bafcc228332c34363b0c55fcf17edfb882eab1ad5
company,1619716200,MSCI Inc. stock outperforms market on strong trading day,67164775,https://images.mktw.net/im-220105/social,MSCI,MarketWatch,"Shares of MSCI Inc. rallied 2.23% to $494.83 Thursday, on what proved to be an all-around great trading session for the stock market, with the S&P 500 Index...",https://finnhub.io/api/news?id=21a8d157989f7b0b593eb2493e015950bb0ffeec5862eed04baade840538ebb1
company,1619712907,"MSCI Inc. -- Moody's upgrades MSCI's CFR, senior unsecured to Ba1 from Ba2; outlook stable",67118675,https://s.yimg.com/cv/apiv2/social/images/yahoo_default_logo-1200x1200.png,MSCI,Yahoo,"Rating Action: Moody's upgrades MSCI's CFR, senior unsecured to Ba1 from Ba2; outlook stableGlobal Credit Research - 29 Apr 2021About $4 billion of debt upgradedNew York, April 29, 2021 -- Moody's Investors Service (""Moody's"") upgraded MSCI Inc.'s (""MSCI"") corporate family rating (""CFR"") to Ba1 from Ba2, probability of default rating (""PDR"") to Ba1-PD from Ba2-PD and senior unsecured rating to Ba1 from Ba2.  The outlook remains stable.RATINGS RATIONALE""Increased revenue size, very high profit rates, Moody's expectations for ongoing institutional investor interest in its custom factor indices, including ESG-focused ones, and predictable although still opportunistic financial strategies lead to the upgrade to Ba1,"" said Edmond DeForest, Moody's Vice President and Senior Credit Officer.The Ba1 CFR is supported by a growing, recurring subscription base of investment risk management and decision support tools and equity index products.",https://finnhub.io/api/news?id=8f51190967a1c339b654b120c278f7c3e6a51c953c8710cc357e93be0364e973
company,1619698452,3 Business-Software Services Stocks to Watch in a Challenging Industry,67116820,https://s.yimg.com/uu/api/res/1.2/_q6iBR_h4vSsD9R0vmzJ9A--~B/aD00MDA7dz02MzU7YXBwaWQ9eXRhY2h5b24-/https://media.zenfs.com/en/zacks.com/f38705761433d43a7bfa416beff9b389,MSCI,Yahoo,3 Business-Software Services Stocks to Watch in a Challenging Industry,https://finnhub.io/api/news?id=2a661d251d79c88b931ca356f200660f5b1e26ef7f60674cd8019def19dc9d7c
company,1619629800,MSCI Inc. stock outperforms competitors despite losses on the day,67025984,https://images.mktw.net/im-220105/social,MSCI,MarketWatch,"Shares of MSCI Inc. sank 0.73% to $484.03 Wednesday, on what proved to be an all-around grim trading session for the stock market, with the S&P 500 Index...",https://finnhub.io/api/news?id=976d0f743a142abc740832c86b6558e66549791cbfefafab4c4dd2e1df133d33
company,1619605210,Is iShares MSCI Emerging Markets Multifactor ETF (EMGF) a Strong ETF Right Now?,67094963,https://s.yimg.com/uu/api/res/1.2/XFzKRSTb2_xUaLSOCP9.Bg--~B/aD02MDI7dz05MDA7YXBwaWQ9eXRhY2h5b24-/https://media.zenfs.com/en/zacks.com/a41b81fe729c761f3f94f42ff348f70c,MSCI,Yahoo,Smart Beta ETF report for EMGF,https://finnhub.io/api/news?id=45a8bb04ca4d6a686033d5f21973b35e28f0abb6ff439d307389b622955b5011
company,1619597340,MSCI price target raised to $533 from $493 at Oppenheimer,67024437,,MSCI,Thefly.com,MSCI price target raised to $533 from $493 at Oppenheimer Oppenheimer MSCI,https://finnhub.io/api/news?id=ed2bb90a42b6cad7098bbaa71afbef2e118b3cd5849c6507200fb22c46178fee
company,1619590380,MSCI price target raised to $525 from $475 at Deutsche Bank,67024439,,MSCI,Thefly.com,MSCI price target raised to $525 from $475 at Deutsche Bank Deutsche Bank MSCI,https://finnhub.io/api/news?id=f90a7a89f1d6f48c92b1b47a0362b857cf733d52deb8d47a423add691c8a6849
company,1619588558,Reflation Trades Look to Revive Amid Global Commodities Fervor,66835497,https://s.yimg.com/uu/api/res/1.2/2R2PHWWxZf99c2VtE88jhQ--~B/aD02NzU7dz0xMjAwO2FwcGlkPXl0YWNoeW9u/https://media.zenfs.com/en/bloomberg_markets_842/1700019e7f1b9cb88df9a31fb18067cf,MSCI,Yahoo,"(Bloomberg) -- The market’s reflationistas are getting a second wind, as a string of solid economic numbers and the prospect of more stimulus raise the chances of a revival in trades linked to rebounding growth and prices.A gauge of U.S. inflation expectations climbed to an eight-year high Tuesday, the Bloomberg Commodity Spot Index reached its highest since 2012 and Treasury yields saw gains across the curve.Reflation believers have warmed to reports showing soaring home prices and consumer confidence. They are also looking ahead to President Joe Biden’s pitch for a large social-spending package to Congress Wednesday and a renewed commitment from the Federal Reserve to allow inflation to run hot.“The inflation question will continually return to investors’ minds this year,” said Andy Wong, senior investment manager of the international multi-asset team at Pictet Asset Management in Hong Kong. “The U.S. household balance sheet is the healthiest it has been for years, and ‘excess savings meets disrupted supply chains’ means dislocation in supply and demand.”The reflation trade had hit a wall this month, with havens such as Treasuries rallying and cyclical shares underperforming as spikes in Covid-19 infection rates around the world forced renewed lockdowns in major economies. But the relentless rise in commodity prices has pushed inflation expectations out of their lull and some strategists expect the rally to continue.Goldman Says Commodities Will Power On as Oil Demand Leaps The sharp increases in the cost of materials are motivating companies such as Procter & Gamble Co. and Chipotle Mexican Grill Inc. to pass on costs to consumers -- moves that raise questions about the Fed’s assurances that any bump in inflation will be short-lived. The 10-year breakeven rate, a proxy for where investors see annual inflation rates over the next decade, topped 2.4% Tuesday -- the highest since April 2013.“There’s some skepticism there as to whether it is transitory, given the delays in supply chains and potentially some productive capacity destruction as a result of lockdowns,” said Anthony Doyle, global cross-asset investment specialist at Fidelity Investment Management in Sydney.Gundlach Says Fed Is Guessing That Inflation Will Be TransitoryStill, not everyone is ready to pile back into the reflation trades that gripped markets earlier this year. An MSCI Inc. gauge of global value shares -- which have high exposure to economic growth -- has lagged its more defensive growth counterpart by nearly 4 percentage points this month and has barely budged this week.BlackRock Inc. has turned neutral from overweight on U.S. inflation-linked bonds after the recent rebound in inflation expectations. The world’s largest asset manager has also cut its short positioning in Treasuries.BlackRock Cuts Inflation-Haven Bond Bet, Stays Bullish on StocksNevertheless, it’s harder to dismiss inflation risks given the positive surprises in recent economic reports.“All of the better data points to a higher-inflation narrative that the market is reflecting,” said Rob Daly, director of fixed income for Glenmede Investment Management in Philadelphia.(Updates throughout.)For more articles like this, please visit us at bloomberg.comSubscribe now to stay ahead with the most trusted business news source.©2021 Bloomberg L.P.",https://finnhub.io/api/news?id=a18a675b390354c9eff5eb5616b5694bce802d50dd3a246c948b864add94db89
company,1619581612,MSCI launches thematic indexes for investors betting on Chinese megatrends,67094971,https://s.yimg.com/cv/apiv2/social/images/yahoo_default_logo-1200x1200.png,MSCI,Yahoo,"Global securities index publisher MSCI Inc on Wednesday said it has launched 20 thematic indexes to help domestic and international investors bet on megatrends in China that are aligned with the Chinese government's strategic policy goals.  MSCI said it designed its first suite of country-specific thematic indexes to better enable investors to capitalise on long-term, structural change in technology, the environment, society and lifestyle in the world's second-biggest economy.  The launch comes after Beijing in March formalised its 14th five-year plan focusing on high-quality, sustainable development, as the economy continues its shift toward reliance on domestic consumption and innovation and away from exports.",https://finnhub.io/api/news?id=206249481c82ee9f5c13ffcf1339739fd48a0247e28f9e6759a04a6c19997e11
company,1619577077,MSCI (MSCI) Q1 2022 Earnings Call Transcript,67094976,,MSCI,Yahoo,"MSCI earnings call for the period ending March 31, 2021.",https://finnhub.io/api/news?id=d5aa568254defc172e505540160efab9d35a3fefd83ad0ef461a3eaaf927425b
company,1619568000,MSCI/thematic indices: Chinese megatrend bets are mega broad,67094978,,MSCI,Yahoo,"Back to front as it sounds, MSCI is following the money.  The global securities index publisher has launched a deck of indices allowing both domestic and international funds to track Chinese megatrends.  Globally there was $170bn of assets under management in passive thematic funds as at end of the first quarter, almost treble the year-ago level, according to Morningstar.",https://finnhub.io/api/news?id=bab65c33575c0e88ecdb20b756b854019957380b7a71f09e221103bb1f3216df
company,1619567212,MSCI launches thematic indexes for investors betting on Chinese megatrends,66821125,https://www.nasdaq.com/sites/acquia.prod/files/2021-04-28T035245Z_1_YN8_RTRLXPP_2_LYNXPACKAGER.JPG?2111334098,MSCI,Nasdaq,Global securities index publisher MSCI Inc on Wednesday said it has launched 20 thematic indexes to help domestic and international investors bet on megatrends in China that are aligned with the Chinese government's strategic policy goals.,https://finnhub.io/api/news?id=b392038fa7326eb52ed87bc6ce6ad3b2ec9288fb5293a3b77fbfa1d5dcd3fc78
company,1619562677,MSCI (MSCI) Q1 2022 Earnings Call Transcript,66821129,https://www.nasdaq.com/sites/acquia.prod/files/2019-05/0902-Q19%20Total%20Markets%20photos%20and%20gif_CC8.jpg?1393584578,MSCI,Nasdaq,Image source: The Motley Fool.,https://finnhub.io/api/news?id=c2d0ce337a148547a46cb9d30e2031b03f512dcd4f2a3deac422e79924d3ab20
company,1619545807,"MSCI, Inc. (MSCI) CEO Henry Fernandez on Q1 2021 Results - Earnings Call Transcript",66730520,https://static.seekingalpha.com/assets/og_image_1200-29b2bfe1a595477db6826bd2126c63ac2091efb7ec76347a8e7f81ba17e3de6c.png,MSCI,SeekingAlpha,"MSCI, Inc. (NYSE:MSCI) Q1 2021 Earnings Conference Call April 27, 2021, 11:00 ET Company Participants Sallilyn Schwartz - Head, IR &amp; Treasurer Henry Fernandez - Chairman &amp; CEO Baer...",https://finnhub.io/api/news?id=a02bf896ab6a3b527f523f249646d82535d41b0d74e1a1492dc8d1ac711d70ab
company,1619543400,MSCI Inc. stock outperforms market on strong trading day,66883410,https://images.mktw.net/im-220105/social,MSCI,MarketWatch,"Shares of MSCI Inc. inched 0.13% higher to $487.61 Tuesday, on what proved to be an all-around mixed trading session for the stock market, with the Dow Jones...",https://finnhub.io/api/news?id=7390c28ba45c5f08329761726a092e0029d612edacf34600fe8518e795f2c0fa
company,1619541904,MSCI (MSCI) is an Incredible Growth Stock: 3 Reasons Why,66715180,https://s.yimg.com/uu/api/res/1.2/xopQugjeNyS1VO21qlHkcQ--~B/aD02NzU7dz05MDA7YXBwaWQ9eXRhY2h5b24-/https://media.zenfs.com/en/zacks.com/3cb5117fc22f5e37890d1860dcd61f9f,MSCI,Yahoo,MSCI (MSCI) could produce exceptional returns because of its solid growth attributes.,https://finnhub.io/api/news?id=c88a067e0ab7ee4cb353e569ccb01d78a573700cf817799ba3c38f21a47d7da9
company,1619540404,"MSCI Q1 Earnings and Revenues Beat Estimates, Shares Up",66715182,https://s.yimg.com/uu/api/res/1.2/MjwyKd_nWoFvVBW.JFLfbw--~B/aD00MDA7dz02MzU7YXBwaWQ9eXRhY2h5b24-/https://media.zenfs.com/en/zacks.com/7e65418edbf7491f843b8e0de38cb899,MSCI,Yahoo,MSCI's first-quarter 2021 results benefit from strong growth in recurring subscription revenues and asset-based fees.,https://finnhub.io/api/news?id=81c83e6ba41fb89d055aaae92233709d8014af8326d3f25acde93e9a9406fb52
company,1619529285,MSCI Inc. 2021 Q1 - Results - Earnings Call Presentation,66676358,https://static.seekingalpha.com/assets/og_image_1200-29b2bfe1a595477db6826bd2126c63ac2091efb7ec76347a8e7f81ba17e3de6c.png,MSCI,SeekingAlpha,The following slide deck was published by MSCI Inc. in conjunction with their 2021 Q1 earnings call.,https://finnhub.io/api/news?id=ab98021fd7d7f46d7546f4f67e0ed963f1dbc9d6597693025071771e910d0d6c
company,1619527500,"MSCI, Inc. to Host Earnings Call",66715187,https://s.yimg.com/cv/apiv2/social/images/yahoo_default_logo-1200x1200.png,MSCI,Yahoo,"NEW YORK, NY / ACCESSWIRE / April 27, 2021 / MSCI, Inc. (NYSE:MSCI) will be discussing their earnings results in their 2021 First Quarter Earnings call to be held on April 27, 2021 at 11:00 AM Eastern Time.",https://finnhub.io/api/news?id=2b713694f8419185816d7c2a556f65c41cb4c764210da023dacfd178d6ee473b
company,1619525112,MSCI (MSCI) Q1 Earnings and Revenues Surpass Estimates,66715192,https://s.yimg.com/uu/api/res/1.2/UPInF06X6fJkTqeimnpZuQ--~B/aD03NDU7dz05MDA7YXBwaWQ9eXRhY2h5b24-/https://media.zenfs.com/en/zacks.com/078b2d95159d12a337f09f2519ff10ba,MSCI,Yahoo,"MSCI (MSCI) delivered earnings and revenue surprises of 7.42% and 1.54%, respectively, for the quarter ended March 2021. Do the numbers hold clues to what lies ahead for the stock?",https://finnhub.io/api/news?id=0c0f37aed86e065461d2af13c821ffbb6559bed377716acfa64ec5b7465e74c9
company,1619520300,MSCI Reports Financial Results for First Quarter 2021,66715194,https://s.yimg.com/cv/apiv2/social/images/yahoo_default_logo-1200x1200.png,MSCI,Yahoo,"MSCI Inc. (""MSCI"" or the ""Company"") (NYSE: MSCI), a leading provider of critical decision support tools and services for the global investment community, today announced its financial results for the three months ended March 31, 2021 (""first quarter 2021"").",https://finnhub.io/api/news?id=62b7a9febe17373a6243aaaa09fdcd553631084146a10ac9180f411ef871787f
