category,datetime,headline,id,image,related,source,summary,url
company,1629227040,Philip Morris International Inc. stock outperforms market on strong trading day,69707975,https://images.mktw.net/im-220105/social,PM,MarketWatch,"Shares of Philip Morris International Inc. inched 0.11% higher to $102.50 Tuesday, on what proved to be an all-around dismal trading session for the stock...",https://finnhub.io/api/news?id=9993cdc9790b591143223b2fb27148f06b31123e1335dfd98aa191784045a659
company,1629208165,Philip Morris Launches Smoke Free Product IQOS ILUMA In Japan,69708278,https://s.yimg.com/uu/api/res/1.2/qaaI9XRRTeijwtWR2Oq1Ew--~B/aD00MDA7dz02MDA7YXBwaWQ9eXRhY2h5b24-/https://media.zenfs.com/en/Benzinga/71284f80f0a22a985701f643929b1d4d,PM,Yahoo,"Philip Morris International Inc (NYSE: PM) has launched IQOS ILUMA to their portfolio of smoke-free products for adults who would otherwise continue to smoke or use nicotine products. The IQOS ILUMA series offers two devices in Japan: IQOS ILUMA PRIME and IQOS ILUMA, available for pre-order on IQOS.com beginning August 17, 2021, and for purchase at stores on August 18, 2021. IQOS ILUMA introduces induction-heating technology, which utilizes no blade and requires no cleaning. The heating technolo",https://finnhub.io/api/news?id=8d99a92c910259220411090554c3dc40a45a8ad4ce7e9bf590356081fa18ed0a
company,1629198360,UK shareholder meetings calendar - next 7 days,69698418,,PM,Alliance News,Looking for stock market analysis and research with proves results? Zacks.com offers in-depth financial research with over 30years of proven results.,https://finnhub.io/api/news?id=6218d07d9be6f8b762b68394ffa1f68d11ccb52eacc31e1c0be9f3c2f139dc03
company,1629195180,Stocks That Hit 52-Week Highs On Tuesday,69696539,https://cdn.benzinga.com/files/imagecache/og_image_social_share_1200x630/sites/all/themes/bz2/images/bz-icon.png,PM,Benzinga," 
 
Before 10 a.m. ET on Tuesday, 55 companies set new 52-week highs.
Points of Interest:

Apple (NASDAQ:AAPL) was the largest company by market cap to set a new 52-week...",https://finnhub.io/api/news?id=89bff3b255cda39ced7d3d82f57abf75db82808a9d92ace05c0fdecc8b10cf14
company,1629193740,Philip Morris Launches Smoke Free Product IQOS ILUMA In Japan,69696492,https://cdn.benzinga.com/files/imagecache/og_image_social_share_1200x630/images/story/2012/aaconsumerv3_536.png,PM,Benzinga,Philip Morris International Inc (NYSE: PM) has launched IQOS ILUMA to their portfolio of smoke-free products for adults who would otherwise continue to smoke or use...,https://finnhub.io/api/news?id=e43767958eb48a0aa52ce3febbb0670d2c17c5ccdd925de91a26a3e0b1841aa0
company,1629183600,IN BRIEF: Philip Morris launches new smoke free product in Japan,69694412,,PM,Alliance News,Looking for stock market analysis and research with proves results? Zacks.com offers in-depth financial research with over 30years of proven results.,https://finnhub.io/api/news?id=e0ee2fe495d3545a4580ab539d15c8353c99a45b85f190dbc90f68f34a0331cc
company,1629181800,Philip Morris International Launches New IQOS ILUMA in Japan to Accelerate the Achievement of a Smoke-Free Future,69699239,https://s.yimg.com/uu/api/res/1.2/8jfzGM1tYTO.UbOhplJSLA--~B/aD04Mzt3PTQ4MDthcHBpZD15dGFjaHlvbg--/https://media.zenfs.com/en/business-wire.com/2f975f7e19465a8c65bfe5bd5f0392bf,PM,Yahoo,"LAUSANNE, Switzerland, August 17, 2021--Philip Morris International Launches New IQOS ILUMA in Japan to Accelerate the Achievement of a Smoke-Free Future",https://finnhub.io/api/news?id=35ac8a5d05479bee49014ee75489611f9410d86d31ccfd3e51de502939137cb0
company,1629177948,Tracking Gardner Russo & Quinn Portfolio - Q2 2021 Update,69691435,https://static.seekingalpha.com/cdn/s3/uploads/getty_images/1019729218/medium_image_1019729218.jpg,PM,SeekingAlpha,Gardner Russo & Quinn’s 13F portfolio value increased from $10.96B to $11.84B. Russo increased Alibaba Group Holding and Cable One while decreasing JPMorgan Chase during the quarter.,https://finnhub.io/api/news?id=d22b3297eeaa40bee82b45b0c09cfc8f66a15d4efac0fa82d242b6d6731d0040
company,1629173460,Philip Morris launches IQOS ILUMA in Japan,69694413,,PM,Thefly.com,Philip Morris announced t... PM,https://finnhub.io/api/news?id=26b1baf8a6e414b276cf8a970a57a831a21dc6c1b691375b29aa0be2c6c3a436
company,1629171540,"Turiya Advisors Asia Ltd Buys Advanced Micro Devices Inc, AGCO Corp, Philip Morris International Inc",69716821,,PM,GuruFocus,,https://finnhub.io/api/news?id=d1737712b94746a3c06c82b0ffae48eaf49c4c81187dfd121344a8464403fce7
company,1629167400,Philip Morris International Launches New IQOS ILUMA in Japan to Accelerate the Achievement of a Smoke-Free Future,69694414,,PM,Business Wire,Looking for stock market analysis and research with proves results? Zacks.com offers in-depth financial research with over 30years of proven results.,https://finnhub.io/api/news?id=c34a3d03eafa9aa316e165cfb14ee7e4aa84a536fd86f1eaff6fa0bd83444b1c
company,1629157146,7 High-Yield Blue-Chips That Can Help You Retire Rich,69687642,,PM,SeekingAlpha,,https://finnhub.io/api/news?id=b7dd918453af06e8f1de0d373c62dd04c98830cd3e59b954a74987a17ce9f9ce
company,1629134160,Philip Morris International Inc. stock outperforms competitors on strong trading day,69685792,https://images.mktw.net/im-220105/social,PM,MarketWatch,"Shares of Philip Morris International Inc. inched 0.79% higher to $102.39 Monday, on what proved to be an all-around positive trading session for the stock...",https://finnhub.io/api/news?id=11360809beca5abad0c004645b2866d02d0adee68dfdac1dbf3719e4caba6389
company,1629133260,Philip Morris International Enters Tender Period with Vectura Shareholders Following Unanimous Recommendation by Vectura Board,69690604,https://s.yimg.com/cv/apiv2/social/images/yahoo_default_logo-1200x1200.png,PM,Yahoo,"LAUSANNE, Switzerland, August 16, 2021--Philip Morris International Enters Tender Period with Vectura Shareholders Following Unanimous Recommendation by Vectura Board",https://finnhub.io/api/news?id=4854392e16702ca4519e2eca8a4510bbeebb6e5c2fc38f5d359fde7130e231b4
company,1629127029,10 Cheap Hemp Stocks Redditors are Buying,69681161,https://s.yimg.com/uu/api/res/1.2/M1DJfwuZGGs56V2GUvSpnQ--~B/aD01MDA7dz03NTA7YXBwaWQ9eXRhY2h5b24-/https://media.zenfs.com/en/insidermonkey.com/05655dd71e6b133a45dbbf1650567ef1,PM,Yahoo,"In this article, we discuss the 10 cheap hemp stocks Redditors are buying. If you want to skip our detailed analysis of these stocks, go directly to the 5 Cheap Hemp Stocks Redditors are Buying. As the lawmakers in the United States grapple with the implications of legalizing marijuana at a federal level, the hemp […]",https://finnhub.io/api/news?id=0f436f587c0d10b1db83c4b98b594ddeb9b8ff3dcdb84eb02c8a7d344fe9f1f5
company,1629118860,Philip Morris International Enters Tender Period with Vectura Shareholders Following Unanimous Recommendation by Vectura Board,69694415,,PM,Business Wire,Looking for stock market analysis and research with proves results? Zacks.com offers in-depth financial research with over 30years of proven results.,https://finnhub.io/api/news?id=48bd6de5d8fa74e9426eba0aae306dc2b76608e8fe9b63ef65d283e4e5948584
company,1629115320,Philip Morris enters tender period with Vectura Group shareholders,69694416,,PM,Thefly.com,"Philip Morris Internation... PM, VEGPF",https://finnhub.io/api/news?id=eba559c9fc9d1ee57c67bfe35546433f6c1d3869011518f45f9c73bbf24390a7
company,1629110340,"Bollard Group LLC Buys Madison Square Garden Sports Corp, AT&T Inc, Chevron Corp, Sells Okta Inc, Royal Dutch Shell PLC, DocuSign Inc",69694417,,PM,GuruFocus,,https://finnhub.io/api/news?id=97965c8e9f221c96e5eff8075c4dfb89bac6ec0457a9f3fe052bddb669eca211
company,1629108720,Stocks That Hit 52-Week Highs On Monday,69681210,https://cdn.benzinga.com/files/imagecache/og_image_social_share_1200x630/sites/all/themes/bz2/images/bz-icon.png,PM,Benzinga," 
 
Before 10 a.m. ET on Monday, 71 companies hit new 52-week highs.
Highlights:

Apple (NASDAQ:AAPL) was the largest firm on a market cap basis to set a new 52-week...",https://finnhub.io/api/news?id=e10fab9752a2b5aa4ad163aaf81bc173c5a834f76fc2b8d34c3840afb6c3f22f
company,1629085140,"Dai-Ichi Life Insurance Company, Ltd Buys iShares iBoxx USD Investment Grade Corporate Bond , Altria Group Inc, Philip Morris International Inc, Sells Vanguard S&P 500 ETF, iShares Russell 2000 ETF, iShares MSCI Emerging Markets ETF",69694420,,PM,GuruFocus,,https://finnhub.io/api/news?id=7dd253105700041ff0339b8440fd16449f47fd0674a288f47057cd4ed21cce62
company,1629085140,"QS Investors, LLC Buys Legg Mason Low Volatility High Dividend ETF, iShares Russell 1000 ETF, Vanguard FTSE All-World ex-US ETF, Sells Primo Water Corp, ISHARES TRUST, Vanguard Total International Bond ETF",69694419,,PM,GuruFocus,,https://finnhub.io/api/news?id=70afbb0b0121b4f5f5e513f4c9970f3192823c3201f654c8f85aaa6118137fcc
company,1629085140,"Howe & Rusling Inc Buys U.S. Bancorp, Texas Instruments Inc, Philip Morris International Inc, Sells Corteva Inc, Allstate Corp, MetLife Inc",69694418,,PM,GuruFocus,,https://finnhub.io/api/news?id=b79bbd7677290c577dba60327569721bb44be0cfd920361e419677919ea78a9a
company,1628979420,Dividend Income Summary: Bert's July 2021 Summary,69672703,,PM,SeekingAlpha,,https://finnhub.io/api/news?id=8edbca8d4e82449616ae5bced5397ff42ed4f86397bf68e44e1f90a70bc37e3e
company,1628874960,"Philip Morris International Inc. stock rises Friday, outperforms market",69685793,https://images.mktw.net/im-220105/social,PM,MarketWatch,"Shares of Philip Morris International Inc. rallied 1.58% to $101.59 Friday, on what proved to be an all-around favorable trading session for the stock...",https://finnhub.io/api/news?id=1a280f77cfc3cfe663822722d85972a5f36c6c080fadbfadd4d4a1f8ca21f8c3
company,1628862228,The Vectura directors who backed Philip Morris takeover,69652751,https://static.independent.co.uk/2021/08/13/14/f9c1a53aba0fa3d849909dfc9776f942Y29udGVudHNlYXJjaGFwaSwxNjI4OTQ1NTg1-2.4762610.jpg?width=1200&auto=webp&quality=75,PM,Yahoo,The cigarette maker made a billion-pound offer for the lung medicines manufacturer.,https://finnhub.io/api/news?id=0a8681dfb675e11fcaa5d643a1d7140d85ad93334b66143b11d088495492f2f4
company,1628845920,"London stocks set to close out week with gains, and Vectura may be at the end of a takeover battle",69661105,https://images.mktw.net/im-385071/social,PM,MarketWatch,Gains were driven by healthcare and insurers while the oil and gas sectors weighed.,https://finnhub.io/api/news?id=8d332fe70e4bde88dafc9060844efc86bfb343cbb95ef10b21c2f14dd8e8449e
company,1628845440,Philip Morris Gives Investors a Nicotine Test ,69657894,https://images.wsj.net/im-384873/social,PM,DowJones,"Now that inhaler-maker Vectura’s board has recommended an offer from the Marlboro cigarette giant, only a new bidder can save shareholders from a tricky ethical decision. ",https://finnhub.io/api/news?id=d57d437f9b540de8354d24547719cc9caf22f6f29f5571be681d18c518928de7
company,1628841143,Markets: FTSE inches to new post-pandemic high as Vectura takeover draws closer,69649427,https://s.yimg.com/ny/api/res/1.2/Vu6jKrGAOF0V94aY4CEjfg--/YXBwaWQ9aGlnaGxhbmRlcjt3PTIwMDA7aD0xMzMz/https://s.yimg.com/os/creatr-uploaded-images/2021-08/7a0332e0-fc08-11eb-9ff8-8286e58cf332,PM,Yahoo,"A modest early rally pushed the FTSE 100 to a fresh 18-month high in early trade, having reached those levels earlier in the week.",https://finnhub.io/api/news?id=8e7b8fdc085565e1b5570075d667419de2e215e8830edd2364fc3aadcbbee082
company,1628814240,GLOBAL BRIEFING: US authorises Covid booster jab for immunocompromised,69652793,,PM,Alliance News,Looking for stock market analysis and research with proves results? Zacks.com offers in-depth financial research with over 30years of proven results.,https://finnhub.io/api/news?id=fefd9651803ab694a3b6c0e5ccbf8f648302039a83115cf3233d1a811b27929f
company,1628787561,Directors of inhaler firm unanimously back £1.1bn takeover by Marlboro owner,69638999,https://static.independent.co.uk/2021/08/12/18/643e5dd6242372f539114c93f1327bfeY29udGVudHNlYXJjaGFwaSwxNjI4ODcyOTQy-2.60968966.jpg?width=1200&auto=webp&quality=75,PM,Yahoo,Vectura has faced heavy criticism over plans to support the deal by Philip Morris but has accepted the offer regardless.,https://finnhub.io/api/news?id=84874db0d523a033dfd84c997e73a6f65e2584ab59e325f8ad3e4ea639c9390b
company,1628788560,"Philip Morris International Inc. stock rises Thursday, still underperforms market",69685795,https://images.mktw.net/im-220105/social,PM,MarketWatch,"Shares of Philip Morris International Inc. inched 0.25% higher to $100.01 Thursday, on what proved to be an all-around favorable trading session for the...",https://finnhub.io/api/news?id=11ea01dc978f2ad4427cbd23a44d80bfcefec597ea3d994e8e5769c6e9560339
company,1628785471,UK's Vectura bows to sweetened 1.1 billion stg Philip Morris offer,69639000,https://s.yimg.com/uu/api/res/1.2/IOC.3vRalq8UI2LRgU7_9w--~B/aD01NTY7dz04MDA7YXBwaWQ9eXRhY2h5b24-/https://media.zenfs.com/en/reuters.com/8d8059beefbe85e6f5ef3af114eb5669,PM,Yahoo,"(Reuters) -Cigarette maker Philip Morris won the support of Vectura for its 1.1 billion pound ($1.5 billion) takeover offer for the inhaled treatments maker after outbidding private equity firm Carlyle, the British company said on Thursday.  Philip Morris International (PMI) on Sunday sweetened its offer for the asthma drugmaker to 165 pence per share, surpassing Carlyle's final 155p proposal.  Vectura said it considered the terms of the Philip Morris offer to be fair and reasonable and its board planned to unanimously recommend the bid to shareholders.",https://finnhub.io/api/news?id=e1f4889714e65c248d50f6f99c6c08ad1d924856943127e04050ec1a05527828
company,1628785260,NEW YORK MARKET CLOSE: Stocks rise despite US producer price jump,69652397,,PM,Alliance News,Looking for stock market analysis and research with proves results? Zacks.com offers in-depth financial research with over 30years of proven results.,https://finnhub.io/api/news?id=f807db795693cc1c9ef158b8398c45e5111a229c942b2f99c3b9248176dc676c
company,1628782085,Inhaler maker backs takeover by tobacco titan behind Marlboro,69639001,https://s.yimg.com/ny/api/res/1.2/DfP_TA2SLXuSuuhoXNt0TQ--/YXBwaWQ9aGlnaGxhbmRlcjt3PTIwMDA7aD0xMzMz/https://s.yimg.com/uu/api/res/1.2/DKIBckUcpz1iKnq27COPpQ--~B/aD0xMjk5O3c9MjA3OTthcHBpZD15dGFjaHlvbg--/https://media.zenfs.com/en/the_telegraph_818/21c7622355952e8e82876a80b443638b,PM,Yahoo,"Vectura, the company that sells medicines to treat smoking-related diseases, has agreed to a takeover by the world's biggest tobacco company, paving the way for a major test of the City investors' ethical credentials.",https://finnhub.io/api/news?id=a3e4c4b772580d1a07d1eab55a07383d1c51d339a7a3dfc7166a4aff61ac6ef8
company,1628772780,TOP NEWS: Philip Morris GBP1 billion bid wins Vectura backing,69638336,,PM,Alliance News,Looking for stock market analysis and research with proves results? Zacks.com offers in-depth financial research with over 30years of proven results.,https://finnhub.io/api/news?id=280b8a7727ec40288a73544fe097fe961686607a223dc13cea53f2a42f7c67d9
company,1628770560,Vectura to recommend Philip Morris takeover bid to shareholders,69685796,https://mw3.wsj.net/mw5/content/logos/mw_logo_social.png,PM,MarketWatch,A bidding war takes a turn.,https://finnhub.io/api/news?id=b719966cff8280b3969001e226889df3d10c3853096ff57acd53c6bc2ab03e1a
company,1628766660,Vectura directors to recommend Philip Morris offer to shareholders,69638337,,PM,Thefly.com,"In a statement to the Lon... PM, VEGPF, CG",https://finnhub.io/api/news?id=670965adea13baa102dec646528b581a92bbe46ce315785bd6165cd217b39b8a
company,1628733060,Philip Morris Further Expands Its Reach Into Health Care,69652488,https://static.gurufocus.com/photos/companies/iStock_philip_morris_2014_02_03.jpg,PM,GuruFocus,Giant tobacco company acquires respiratory developer OtiTopic,https://finnhub.io/api/news?id=847a9bc72f49be5eea899ca23bdf8a1a7a6d8a62a6be65370b2949e1e508d9b4
company,1628702160,"Philip Morris International Inc. stock falls Wednesday, underperforms market",69685797,https://images.mktw.net/im-220105/social,PM,MarketWatch,"Shares of Philip Morris International Inc. dropped 0.20% to $99.76 Wednesday, on what proved to be an all-around favorable trading session for the stock...",https://finnhub.io/api/news?id=dac4c3200a971616a16a2833a84e77d59ecfa9dea6c42c695e6ba52d0bb5df8e
company,1628676360,4 Value Stocks That'll Help You Trounce Inflation,69612661,https://s.yimg.com/uu/api/res/1.2/YQYXiMgGbRwudxcYFGWn.A--~B/aD05MzM7dz0xNDAwO2FwcGlkPXl0YWNoeW9u/https://media.zenfs.com/en/motleyfool.com/8439a10ecd9f37c9bda3c0127f2cc121,PM,Yahoo,One of the best ways to fight back against inflation is to put your cash to work in time-tested companies.,https://finnhub.io/api/news?id=a1e68a5118ab899355f7bc87c63b393106ea3d00d86f624952d4c7460fbf8c98
company,1628668004,Inhaler maker Vectura poised to fall to Big Tobacco as bidding war collapses,69615417,https://s.yimg.com/ny/api/res/1.2/XIxnfmZqqh_I6u17W_e45g--/YXBwaWQ9aGlnaGxhbmRlcjt3PTIwMDA7aD0zMDA2/https://s.yimg.com/os/creatr-uploaded-images/2021-08/317099c0-fa76-11eb-9da7-8bf2991c7c63,PM,Yahoo,"Rival bidder The Carlyle Group said on Tuesday evening it would not increase its bid for the company, poleaxing plans for an auction.",https://finnhub.io/api/news?id=975966f9bbc351b82156e519258a031ae2eb0672672c5430dbcd235fe2f6bbd4
company,1628667180,How Spinoffs Affect Your Stocks,69633837,,PM,TalkMarkets,,https://finnhub.io/api/news?id=c0992ea05ef7365c0e84f415078522c4ab6e558bf13c5929d4e2f226709b13c8
company,1628656380,TOP NEWS: Vectura to decide own fate after Carlyle swerves auction,69615489,,PM,Alliance News,Looking for stock market analysis and research with proves results? Zacks.com offers in-depth financial research with over 30years of proven results.,https://finnhub.io/api/news?id=6fbf7f856a73b510969c4047702fd3c1dc99b86f7adc055c78aee602266e78dc
company,1628651820,LONDON BRIEFING: Avast results strong ahead of NortonLifeLock merger,69614032,,PM,Alliance News,Looking for stock market analysis and research with proves results? Zacks.com offers in-depth financial research with over 30years of proven results.,https://finnhub.io/api/news?id=83c31d1cf8c2747c02e22af4d58ab4f5ac2a93b6462b9fda6528451f4242ccb8
company,1628641320,GLOBAL BRIEFING: US Senate passes USD1.2 trillion infrastructure bill,69614167,,PM,Alliance News,Looking for stock market analysis and research with proves results? Zacks.com offers in-depth financial research with over 30years of proven results.,https://finnhub.io/api/news?id=6da8a1fd4173a41eb4c39c9eeff214f55233658c21883ab6e062be60c3eb0c0c
company,1628615271,"Carlyle Says Vectura Offer Is Final, Short-Circuits Auction",69601023,https://s.yimg.com/cv/apiv2/social/images/yahoo_default_logo-1200x1200.png,PM,Yahoo,"(Bloomberg) -- Carlyle Group Inc. declared its most recent 958 million-pound ($1.33 billion) offer for Vectura Group Plc final, ending a proposed auction with Philip Morris International Inc. for the U.K. asthma drug maker before it began.The U.S. private equity group said Tuesday that it considered the 155 pence-a-share offer made on Friday to be “full and fair.” The announcement came less than an hour before the start of the auction, which was meant to nail down how much both companies were wi",https://finnhub.io/api/news?id=f20aaf279c6c0412bb73ab23f91db3d051954a77c36256b3f63fe1f41149aed9
company,1628634427,Nicholas Ward's Dividend Growth Portfolio: July 2021 Update,69608093,https://static.seekingalpha.com/cdn/s3/uploads/getty_images/1272890161/medium_image_1272890161.jpg,PM,SeekingAlpha,My passive income was up 3.76% y/y in July. My portfolio's total returns were 3.74% in July.,https://finnhub.io/api/news?id=9292b486622e65aef54e6a42c2b3cb2115792462875bba67450d0553822ae847
company,1628616360,Vectura auction called off after Carlyle declines to beat Philip Morris bid,69604575,https://s.yimg.com/ny/api/res/1.2/9oWwDgSRu5uJWAk4IaCz4Q--/YXBwaWQ9aGlnaGxhbmRlcjt3PTIwMDA7aD0xMjQ2/https://s.yimg.com/uu/api/res/1.2/.ZdgQUZIdrMYeqqH8KO8ug--~B/aD0xMjk1O3c9MjA3OTthcHBpZD15dGFjaHlvbg--/https://media.zenfs.com/en/the_telegraph_818/2fcb6488b80c659e1572eec8112bc8df,PM,Yahoo,A takeover auction for Vectura has been scrapped at the 11th hour after one of the drugmaker's suitors declared that it would not increase its bid.,https://finnhub.io/api/news?id=38fe8809c39f37f76c09579031e96f9e672559215fb94874e24e4930341b2d8c
company,1628615760,Philip Morris International Inc. stock underperforms Tuesday when compared to competitors despite daily gains,69685798,https://images.mktw.net/im-220105/social,PM,MarketWatch,"Shares of Philip Morris International Inc. inched 0.77% higher to $99.96 Tuesday, on what proved to be an all-around positive trading session for the stock...",https://finnhub.io/api/news?id=67307841740288999bd1a142e7595d5e24382c28d760b042ccd85956b57c97c7
company,1628611579,No auction for Vectura as Carlyle declares $1.3 billion takeover bid final,69604577,https://s.yimg.com/cv/apiv2/social/images/yahoo_default_logo-1200x1200.png,PM,Yahoo,"(Reuters) -The takeover battle between tobacco giant Philip Morris and private equity firm Carlyle for inhaled treatments maker Vectura will not be heading to the auction ring on Wednesday after Carlyle said it will not raise its bid.  U.S.-based Carlyle on Tuesday declared final its 155 pence per Vectura share offer, which it sweetened last week to value the British company at about 958 million pounds ($1.33 billion).  The proposal is below an increased 165 pence bid from Philip Morris on Sunday.",https://finnhub.io/api/news?id=2595f56b5ffaf19dee3fd1037051f63bbcf347f0ba10afa4b2e8368ab551ffc2
company,1628611375,UPDATE 2-No auction for Vectura as Carlyle declares $1.3 bln takeover bid final,69601384,https://s.yimg.com/cv/apiv2/social/images/yahoo_default_logo-1200x1200.png,PM,Yahoo,"The takeover battle between tobacco giant Philip Morris and private equity firm Carlyle for inhaled treatments maker Vectura will not be heading to the auction ring on Wednesday after Carlyle said it will not raise its bid.  U.S.-based Carlyle on Tuesday declared final its 155 pence per Vectura share offer, which it sweetened last week to value the British company at about 958 million pounds ($1.33 billion).  The proposal is below an increased 165 pence bid from Philip Morris on Sunday.",https://finnhub.io/api/news?id=027c602e166a5af23cb9721db274b37bbef1def367869acf31309c8ebfdcf1ab
company,1628607362,Philip Morris (PM) Boosts Beyond Nicotine Options With OtiTopic,69604579,https://s.yimg.com/uu/api/res/1.2/iaKLFcU.DdVA1BhEHS2daw--~B/aD00MDA7dz02MzU7YXBwaWQ9eXRhY2h5b24-/https://media.zenfs.com/en/zacks.com/578c75a0bdc2572dd0bbdad8c4aeb25c,PM,Yahoo,Philip Morris (PM) acquires OtiTopic to expand offerings in the inhaled therapeutics and respiratory drug delivery platform. The move is part of the company's Beyond Nicotine strategy.,https://finnhub.io/api/news?id=d8bce5ee84bcb6ca7b384d1b54a40bf142ed89991981999c58745da89c730d8a
company,1628597760,UPDATE: No auction for Vectura as Carlyle opts not to raise bid,69615492,,PM,Alliance News,Looking for stock market analysis and research with proves results? Zacks.com offers in-depth financial research with over 30years of proven results.,https://finnhub.io/api/news?id=361e642566b20c5aff072a99721deb039f0aa8371f611f38a21fa78ba41aed3f
company,1628596200,Carlyle Europe Makes 155 Pence a Share Offer for Vectura Final,69605393,https://mw3.wsj.net/mw5/content/logos/mw_logo_social.png,PM,MarketWatch,By Joe Hoppe Carlyle Europe Partners V said Tuesday that it won't increase its offer of 155 pence (215 cents) a share for Vectura Group PLC to match Philip...,https://finnhub.io/api/news?id=a1d4b9503c3c1d6758e0acd25e020e7721a19c5294d91c6f0506475ca5eeb9ce
company,1628589173,Philip Morris Pivots to a Takeover Offer in Vectura Fight,69593224,https://s.yimg.com/uu/api/res/1.2/sPbFzDCjE0HUR7PNMlZpXg--~B/aD0xMTQ1O3c9MTcyMDthcHBpZD15dGFjaHlvbg--/https://media.zenfs.com/en/bloomberg_markets_842/2fdff8cbd68f569bdd47be78b53ca897,PM,Yahoo,"(Bloomberg) -- Philip Morris International Inc. lowered the threshold of shareholder backing needed to succeed with its bid for Vectura Group Plc as it faces off with Carlyle Group Inc. in a rare auction for control of the U.K. asthma drug maker.By switching to what’s known under U.K. rules as a takeover offer from a scheme of arrangement, Philip Morris will need just over 50% of shareholder acceptances, instead of 75%. The Marlboro maker made the move to improve its chances of sealing the acqui",https://finnhub.io/api/news?id=7ea2c73a54ecf4cc1aac7185fe0e5a363658d866af7788bd764ede368ab9825c
company,1628585100,Global E-Vapor & Heat-Not-Burn (HnB) Products Market Expected To Cross $43 Billion By 2023- Financialnewsmedia.com,69594382,,PM,PR Newswire,Looking for stock market analysis and research with proves results? Zacks.com offers in-depth financial research with over 30years of proven results.,https://finnhub.io/api/news?id=ca579fea6bb67b2bdc2ea382590146105cf6ee173238c3dbeff0a5361bee5fc7
company,1628580600,"EXTRA: Philip Morris vies for Vectura as ""crown jewel"" in new strategy",69596216,,PM,Alliance News,Looking for stock market analysis and research with proves results? Zacks.com offers in-depth financial research with over 30years of proven results.,https://finnhub.io/api/news?id=408df04f538bd3da600246d22af6c9924e04e4babdda18852de469c80095235f
company,1628579940,LONDON MARKET MIDDAY: Stocks mixed as investors eye US inflation,69594970,,PM,Alliance News,Looking for stock market analysis and research with proves results? Zacks.com offers in-depth financial research with over 30years of proven results.,https://finnhub.io/api/news?id=e56341ae5e9cd1cbc43acc14897fe49802e8eb6eb7d142ce2c17a89429a3bf2b
