category,datetime,headline,id,image,related,source,summary,url
company,1626765240,Philip Morris: Q2 Earnings Snapshot,69226773,,PM,"Associated Press, The",Looking for stock market analysis and research with proves results? Zacks.com offers in-depth financial research with over 30years of proven results.,https://finnhub.io/api/news?id=34807bc86a329e463b5f54ff4de8a8d37a0603844d5f42b7f5a68064a99c2bf2
company,1626765060,Philip Morris Intl: Q2 Earnings Insights,69225535,https://cdn.benzinga.com/files/imagecache/og_image_social_share_1200x630/sites/all/themes/bz2/images/bz-icon.png,PM,Benzinga," 
Shares of Philip Morris Intl (NYSE:PM) rose 0.6% in pre-market trading after the company reported Q2 results.
Quarterly Results
Earnings per share increased 21.71% year...",https://finnhub.io/api/news?id=0754d1e64f7b40ff96fde082559029f81af2a0d03ce484cdbc6694033a22a160
company,1626764607,US STOCKS-Futures bounce after steep selloff; IBM gains on strong results,69221316,https://www.nasdaq.com/sites/acquia.prod/files/2021-07-19T185427Z_1084261234_RC2UNO93ID0I_RTRMADP_2_USA-STOCKS.JPG?1975841033,PM,Nasdaq,"Futures tracking Wall Street's main indexes rose on Tuesday, as economically sensitive stocks rebounded following a sharp selloff in the previous session, while shares of IBM jumped after posting strong second-quarter results.",https://finnhub.io/api/news?id=3bb16ec2fee0919a7f3ca6566f6e50318c26af4bf8a5e88f82c98c596b0d697c
company,1626764340,"Philip Morris International Inc. Reports 2021 Second-Quarter Reported Diluted EPS of $1.39—Including Charges for Saudi Arabia Customs Assessments and Exit Costs—and Adjusted Diluted EPS of $1.57, Reflecting Organic Growth of 17.8%",69223279,,PM,Business Wire,Looking for stock market analysis and research with proves results? Zacks.com offers in-depth financial research with over 30years of proven results.,https://finnhub.io/api/news?id=6690469b32988b95be1d72426952135794af9268aba411261764be05eee97132
company,1626761700,"4 Top Stock Trades for Wednesday: Ethereum, NFLX, PM, AMC",69245297,https://investorplace.com/wp-content/uploads/2019/07/IP_TopStockTradesWednesday1600.jpg,PM,InvestorPlace,"Ethereum, Netflix, Philip Morris and AMC Entertainment were our top stock trades for Wednesday. Let's look at how the chart are setting up.",https://finnhub.io/api/news?id=dd5606f6b860fc886c62b7afc5934b642a4f90c492cbb9735c86c5128b40c080
company,1626761220,"Markets Steady, Evergrande Woes, IBM and Other Earnings - What's Moving Markets By Investing.com",69224924,https://i-invdn-com.investing.com/news/LYNXNPEC0R108_L.jpg,PM,Investing.com,"Markets Steady, Evergrande Woes, IBM and Other Earnings - What's Moving Markets",https://finnhub.io/api/news?id=8a946e44c7c18fecb1549c64503ac685ac9cf1ceb683f67d8569107edc102f36
company,1626761220,Home - The Fly,69226775,,PM,Thefly.com,The Fly is a leading digital publisher of real-time financial news. The Fly team scours all sources of company news and delivers short-form stories consisting of only market moving content.,https://finnhub.io/api/news?id=a1083c4c4c63eadf2489260b48db83d75bb83c2f7e4166b946d2ff4165028f6f
company,1626761040,"Philip Morris reports Q2 adjusted EPS of $1.57, consensus $1.55",69226777,,PM,Thefly.com,Reports Q2 adjusted net r... PM,https://finnhub.io/api/news?id=3234a48f385e58fe977626178c521c19e3fc6b8e0a78e4a0d0493a7a5d55e369
company,1626760800,A Peek Into The Markets: US Stock Futures Gain Following Monday's Plunge,69225533,https://cdn.benzinga.com/files/imagecache/og_image_social_share_1200x630/images/story/2012/peek_into_the_marketnew_220.png,PM,Benzinga,"Pre-open movers
U.S. stock futures traded higher in early pre-market trade as the Dow Jones tumbled more than 700 points in the previous session amid concerns over the spread of...",https://finnhub.io/api/news?id=b896e561360282473f9a0dbc73bb78b5224123e4f57e9da9d1f2985abd625cf8
company,1626756600,"5 Stocks To Watch For July 20, 2021",69225537,https://cdn.benzinga.com/files/imagecache/og_image_social_share_1200x630/images/story/2012/stocks_to_watch_1983.png,PM,Benzinga,"Some of the stocks that may grab investor focus today are:

Wall Street expects  Philip Morris International Inc. (NYSE: PM) to report quarterly earnings at $1.55 per share on...",https://finnhub.io/api/news?id=f274872c940fad5358983c0c22f140823b9482620aa0ef4afdd3106c0f148ac1
company,1626754560,"Earnings Scheduled For July 20, 2021",69225538,https://cdn.benzinga.com/files/imagecache/og_image_social_share_1200x630/images/story/2012/earnings_scheduled_1904.png,PM,Benzinga," 
Companies Reporting Before The Bell
• Signature Bank (NASDAQ:SBNY) is likely to report quarterly earnings at $3.14 per share on revenue of $466.52 million.
•...",https://finnhub.io/api/news?id=b3645d9eb4091a1072c6ed0d979547377cb635daf9e302d370a339144ca792a9
company,1626753360,U.S. stocks higher at close of trade; Dow Jones Industrial Average up 1.62% By Investing.com,69243049,https://i-invdn-com.investing.com/news/WallStreet_800x533_L_1598959151.jpg,PM,Investing.com,U.S. stocks higher at close of trade; Dow Jones Industrial Average up 1.62%,https://finnhub.io/api/news?id=a71523d1f4a5130ae992a9966e5377e918c25a2eb3e250da2255cc6a13bdfc93
company,1626751740,Wall Street in Fives - Must Read Lists for Tuesday,69243586,https://image.thefly.com/catalog/201904/img_457.jpg,PM,Thefly.com,"Five top five lists with the news and calls moving stocks, powered by The Fly. VIAC, VIACA, IBM, HAL, MCK, CAH, INTC, DBRG, RKT, VLDR, NETA.N, SPG, CMCSA, CMCSK, AAPL, FB, T, SNAP, PLXP, MRNA, TAK, ARDX, SWI, NABL, GKOS, SYF, PPG, PM, HCA, DOV, ABC",https://finnhub.io/api/news?id=e7f7c3e7a54f6a6cc91481aaf4152ab1cfff4a9bee40b7804ce9f0341899fd71
company,1626715854,"GLOBAL MARKETS-Investors flee stocks, pile into bonds as COVID-19 surges; oil plunges",69221347,https://www.nasdaq.com/sites/acquia.prod/files/2021-07-19T180757Z_1_VS7_RTRLXPP_2_LYNXPACKAGER.JPG?571314249,PM,Nasdaq,"Stocks on Wall Street fell as much as 2% on Monday, with the Dow posting its worst day in nine months, as a rise in worldwide coronavirus cases and increasing U.S. deaths drove investors out of risky assets, crushing bond yields and share prices.",https://finnhub.io/api/news?id=97208a310ab88ad274ceae77640f741543c68830a5c998aeb9226978a2469f5c
company,1626714960,Philip Morris International Inc. stock outperforms competitors despite losses on the day,69241026,https://images.mktw.net/im-220105/social,PM,MarketWatch,"Shares of Philip Morris International Inc. slipped 0.98% to $97.93 Monday, on what proved to be an all-around grim trading session for the stock market, with...",https://finnhub.io/api/news?id=f385b2a2ed57d8f1f81112ed4cff3f7163e4f51c4ccb2dc53555d60b67a9c23d
company,1626710402,"Pre-Market Earnings Report for July 20, 2021 :  PM, HCA, TRV, SYF, DOV, KEY, ALLY, CFG, HAL, OMC, SBNY, SNV",69221348,https://www.nasdaq.com/sites/acquia.prod/files/2019-05/0902-Q19%20Total%20Markets%20photos%20and%20gif_CC8.jpg?1166627883,PM,Nasdaq,"The following companies are expected to report earnings prior to market open on 07/20/2021.  Visit our Earnings Calendar for a full list of expected earnings releases.Philip Morris International Inc (PM)is reporting for the quarter ending June 30, 2021. The tobacco company's cons",https://finnhub.io/api/news?id=0a38bd11e10f3544fe9c504a43a85622d7ed3f4bd607b2a58c753b8b0e01af6b
company,1626700140,This Tobacco Giant Wants You to Think It's a Healthcare Company Now,69205499,https://s.yimg.com/uu/api/res/1.2/JLb6CqvxJ7iOdYPBBmAmEA--~B/aD05MzM7dz0xNDAwO2FwcGlkPXl0YWNoeW9u/https://media.zenfs.com/en/motleyfool.com/e98e1b52ea40120be15347e43b21b103,PM,Yahoo,"Philip Morris International (NYSE: PM) really wants consumers to believe it is serious about reducing the harm its cigarettes have caused.  It announced that it's buying U.K.-based Vectura Group, a manufacturer of respiratory therapy and inhaled-drug delivery devices.  Now Philip Morris has made its second acquisition this month, both focusing on oral delivery of nicotine-alternative products.",https://finnhub.io/api/news?id=007f48bb76f8b9fa641a1d4bc45b0902e32ba840c3fd4bfc64eb3c1a0254cf92
company,1626697800,Notable companies reporting before tomorrow's open,69224126,,PM,Thefly.com,"Notable companies reporti... PM, HCA, TRV, SYF, DOV, KEY, CFG, ALLY, HAL, OMC, SNV",https://finnhub.io/api/news?id=2bca12f16c97afa0d8d46fcdbaa42dccfd8ff5590e148464940ab2830dba1808
company,1626696605,"GLOBAL MARKETS-COVID-19 surge sparks bond rally, stocks on worst run in 18 months",69221349,https://www.nasdaq.com/sites/acquia.prod/files/2021-07-19T004159Z_1_IH3_RTRLXPP_2_LYNXPACKAGER.JPG?91583234,PM,Nasdaq,"Investors moved away from risky assets on Monday as a rise in worldwide coronavirus cases crushed bond yields and left stocks facing losing streaks, with Wall Street falling more than 1%.",https://finnhub.io/api/news?id=8bb3b51a440a230a5f859dac975510bb68f0e18dfb3843b9f9c112cbf76828df
company,1626695760,LONDON MARKET CLOSE: Reopening jitters batter stocks on 'freedom day',69208010,,PM,Alliance News,Looking for stock market analysis and research with proves results? Zacks.com offers in-depth financial research with over 30years of proven results.,https://finnhub.io/api/news?id=37d529fd8bd192f7861913d136960b75f2442768195262d70406b6b62a75496e
company,1626690415,Altria Stock: Huge Yield But No Growth,69206393,https://static.seekingalpha.com/cdn/s3/uploads/getty_images/1212925084/medium_image_1212925084.jpg,PM,SeekingAlpha,Altria's stock pays $3.44 in dividends annually which gives it a 7.3% yield at today's price of $47.31. Find out why MO doesn't have much else going for it.,https://finnhub.io/api/news?id=647a4e996015a68d6565b37cbf590b9d8f7d570eef1dda83966bc343555118bd
company,1626689383,"GLOBAL MARKETS-COVID-19 surge sparks bond rally, stocks on worst run in 18 months",69206573,https://www.nasdaq.com/sites/acquia.prod/files/2021-07-19T004159Z_1_IH3_RTRLXPP_2_LYNXPACKAGER.JPG?948161834,PM,Nasdaq,Risk-aversion ruled on Monday as a surge in worldwide coronavirus cases sank bond yields and left stocks facing their longest losing streak since the pandemic first hit global markets 18 months ago.,https://finnhub.io/api/news?id=0da1270971471b969546e979639ffd44497d3e5d53d557deb210665e15399537
company,1626685740,This Tobacco Giant Wants You to Think It's a Healthcare Company Now,69205086,https://www.nasdaq.com/sites/acquia.prod/files/2019-05/0902-Q19%20Total%20Markets%20photos%20and%20gif_CC8.jpg?125019176,PM,Nasdaq,"Philip Morris International (NYSE: PM) really wants consumers to believe it is serious about reducing the harm its cigarettes have caused. It announced that it's buying U.K.-based Vectura Group, a manufacturer of respiratory therapy and inhaled-drug delivery devices.",https://finnhub.io/api/news?id=a6b8ff20ac05e75ecccb5500f608cf44efb6e5c29976d643f812080bdc59f153
company,1626680031,GLOBAL MARKETS-Stocks on worst run in 18-months amid global COVID-19 surge,69205087,https://www.nasdaq.com/sites/acquia.prod/files/2021-07-19T004159Z_1_IH3_RTRLXPP_2_LYNXPACKAGER.JPG?465311037,PM,Nasdaq,Risk-aversion ruled on Monday as a surge in worldwide coronavirus cases drove down bond yields and left stocks facing their longest losing streak since the pandemic first hit global markets 18 months ago.,https://finnhub.io/api/news?id=10afea598061bcd4b36217c987d17bb70eeafe52185bd553bd004f06a037eb58
company,1626671545,GLOBAL MARKETS-Stocks on worst run in 18-months amid global COVID-19 surge,69205088,https://www.nasdaq.com/sites/acquia.prod/files/2021-07-14T133026Z_1_AX0_RTRLXPP_2_LYNXPACKAGER.JPG?1344898312,PM,Nasdaq,Risk-aversion ruled on Monday as a surge in worldwide coronavirus cases pushed down bond yields and left stocks facing their longest losing streak since the pandemic first hit global markets 18 months ago.,https://finnhub.io/api/news?id=e0e6ae4feb285716ac27f893a11b0c4917cff2b0b117a7a987c1a63f02a6c1c3
company,1626661224,"GLOBAL MARKETS-Asian shares slip to 1-week lows on renewed virus scare, inflation worry",69205089,https://www.nasdaq.com/sites/acquia.prod/files/2021-07-14T133026Z_1_AX0_RTRLXPP_2_LYNXPACKAGER.JPG?511264899,PM,Nasdaq,Asian shares stumbled to a one-week low on Monday and perceived safe haven yen edged higher amid a relentless surge in coronavirus cases and fears of rising inflation while oil prices fell on oversupply worries.,https://finnhub.io/api/news?id=62e4403ade64efca8458723e6f9b0d78b7f57558d035ce215519c00421298dd8
company,1626646435,"GLOBAL MARKETS-Asian shares hit 1-wk lows on renewed virus scare, inflation worry",69205090,https://www.nasdaq.com/sites/acquia.prod/files/2021-07-19T004159Z_1_IH3_RTRLXPP_2_LYNXPACKAGER.JPG?85720704,PM,Nasdaq,"Asian shares slipped to a one-week low on Monday and perceived safe haven assets, including the yen and gold, edged higher amid fears of rising inflation and a surge in coronavirus cases, while oil prices fell on oversupply worries.",https://finnhub.io/api/news?id=7f5aef465d83865a5ea056fca49f86ee896d4409c3e2ac4b4aac2a544650a2d2
company,1626641344,"GLOBAL MARKETS-Asian shares extend losses on renewed virus scare, inflation woes",69205091,https://www.nasdaq.com/sites/acquia.prod/files/2021-07-19T001446Z_1_DL1_RTRLXPP_2_LYNXPACKAGER.JPG?1562242244,PM,Nasdaq,"Asian shares slipped again on Monday while perceived safe haven assets, including the yen and gold, edged higher as investor risk appetite was soured by fears of rising inflation and a relentless surge in coronavirus cases.",https://finnhub.io/api/news?id=58ec3ad029596097373922a2a63d46c0c20e0950b3b5d7d68a08c5252135674d
company,1626593535,Wall Street Breakfast: The Week Ahead (Podcast),69194841,https://static3.seekingalpha.com/assets/podcasts/wsb-d57bf915fd82bac19817953c2e226c7610de9fc3a36c166d7c276e18e86311ea.png,PM,SeekingAlpha,"Earnings season heats up in a big way next week with IBM, Netflix, Chipotle, Coca-Cola and Twitter just a few of the major companies due to spill numbers.",https://finnhub.io/api/news?id=3112c0db64b8e6e2c541e94c78a415278a5c1187d8addbc80d7b85187300fc44
company,1626592888,Wall Street Breakfast: The Week Ahead,69194806,https://static.seekingalpha.com/assets/og_image_1200-29b2bfe1a595477db6826bd2126c63ac2091efb7ec76347a8e7f81ba17e3de6c.png,PM,SeekingAlpha,"The earnings season heats up in a big way next week with IBM, Netflix, Chipotle, Coca-Cola and Twitter just a few of the major companies due to spill numbers.",https://finnhub.io/api/news?id=0e74a2ea28ae43c4fbe62a936d4fe3f3ca1c5b1cc3061af8e1ed24242ae98822
company,1626518780,Should Altria Have Infused Its Wines With CBD Instead of Selling Them Off?,69187173,https://www.nasdaq.com/sites/acquia.prod/files/2019-05/0902-Q19%20Total%20Markets%20photos%20and%20gif_CC8.jpg?565972245,PM,Nasdaq,"As Altria Group (NYSE: MO) focuses more narrowly on its core objective of eventually transitioning to cigarette alternatives and smokeless products, the tobacco giant is selling off its wine business for $1.2 billion in an all-cash deal with hedge fund Sycamore Partners.",https://finnhub.io/api/news?id=c56c828a86800a679366b5867f184fcd530af244f57dc930318b218c39e191dc
company,1626455760,"Philip Morris International Inc. stock falls Friday, still outperforms market",69201947,https://images.mktw.net/im-220105/social,PM,MarketWatch,"Shares of Philip Morris International Inc. slumped 0.41% to $98.90 Friday, on what proved to be an all-around dismal trading session for the stock market,...",https://finnhub.io/api/news?id=574026c3eb2e0107c4d6c19b88b91dcf44f28d689b77437f43d3115690c4254d
company,1626439864,My Dividend Growth Portfolio - Q2 2021 Summary,69094290,https://static.seekingalpha.com/cdn/s3/uploads/getty_images/1287156325/medium_image_1287156325.jpg,PM,SeekingAlpha,"In 2015, I started publishing quarterly updates regarding my dividend growth portfolio.",https://finnhub.io/api/news?id=9d5bf49bbba14b475f11ab1e24e9e5777e5132294efe770f248b329d10777591
company,1626439572,Is a Surprise Coming for Philip Morris (PM) This Earnings Season?,69099443,,PM,Yahoo,Philip Morris (PM) is seeing favorable earnings estimate revision activity and has a positive Zacks Earnings ESP heading into earnings season.,https://finnhub.io/api/news?id=d208c5e4174ae2887b31927374032679e7b4d4fb3ecddd71d38691ac8b1f197c
company,1626435120,"Earnings Previews: Halliburton, HCA, Philip Morris, Synchrony",69141053,https://247wallst.com/wp-content/uploads/2018/05/philip-morris.jpg,PM,247WallSt,"Before markets open on Tuesday, these four companies are among those that will be reported June-quarter earnings results.",https://finnhub.io/api/news?id=50d7e9376ce20c176dce86d07a16ad1362ae70f0bdc8efdc5044e65ed6ff2144
company,1626412922,3 High Dividends I'm Buying Hand Over Fist,69062848,https://static.seekingalpha.com/cdn/s3/uploads/getty_images/1032204372/medium_image_1032204372.jpg,PM,SeekingAlpha,"Safe high-yielding stocks can be found in both bull and bear markets alike. Read more to know 3 picks that offer safety, growth and diversification.",https://finnhub.io/api/news?id=4401dd5e2944f33b162ef62b2af486ea4f366bb8fb0ec238fc84d3cf5b6dacd2
company,1626411900,What Does Philip Morris Intl's Debt Look Like?,69197778,https://cdn.benzinga.com/files/imagecache/og_image_social_share_1200x630/sites/all/themes/bz2/images/bz-icon.png,PM,Benzinga," 
Shares of Philip Morris Intl (NYSE:PM) increased by 5.65% in the past three months. Before having a look at the importance of debt, let us look at how much debt Philip...",https://finnhub.io/api/news?id=cfe957e571492b9fe634010694241d52c3403c762726073754fbaba8493d885c
company,1626393600,Big Tobacco struggles to convince critics it can kick the cigarettes,69316193,,PM,Yahoo,"When one of the world’s biggest tobacco groups claims it wants to “unsmoke the world” it is bound to meet scepticism, so it was no surprise that Philip Morris International’s £1bn swoop on a British company that makes asthma inhalers caused something of a stir.  It is one of a string of acquisitions big tobacco companies have made to diversify beyond their traditional business — in products from vapes and e-cigarettes to oral nicotine pouches — but Philip Morris can rightly claim to have taken the lead in broadening its horizons.  “We believe in, and we are going to contribute to, cigarettes being phased out,” he added.",https://finnhub.io/api/news?id=1bc3d86a1ecc282b3a67b4fe4ddd16c88037194a09ca02f8be6f338f3a0961a5
company,1626369360,Philip Morris International Inc. stock underperforms Thursday when compared to competitors,69201948,https://images.mktw.net/im-220105/social,PM,MarketWatch,"Shares of Philip Morris International Inc. slumped 0.25% to $99.31 Thursday, on what proved to be an all-around mixed trading session for the stock market,...",https://finnhub.io/api/news?id=bee65077fbba596fa75e6e1349af218b2b6bd3b3d51bbcf68415f8a9921fa77a
company,1626330437,5 High-Yield Dividend Aristocrats That Could Double In 5 Years,68737668,https://static.seekingalpha.com/cdn/s3/uploads/getty_images/1227306113/medium_image_1227306113.jpg,PM,SeekingAlpha,"The market keeps climbing to new highs, causing investors to worry. Check out 5 best dividend stocks (MO, ENB, PM, IBM, and ED) that could double in 5 years.",https://finnhub.io/api/news?id=f67a1dabd727b1144ac46787b7f6211d50c749f673c39648286316bc01caee7b
company,1626290647,Things Worth Noting Before Philip Morris' (PM) Q2 Earnings,68724603,https://s.yimg.com/uu/api/res/1.2/ShfhwtDyA2WzDBKdAL7M8Q--~B/aD00MDA7dz02MzU7YXBwaWQ9eXRhY2h5b24-/https://media.zenfs.com/en/zacks.com/6f2cab89bf2cbad1966358e04258e202,PM,Yahoo,"Philip Morris' (PM) second-quarter 2021 results are likely to reflect solid pricing power and strength in reduced risk products. However, duty-free business is likely to show weakness.",https://finnhub.io/api/news?id=cd88fae064cf4947e1f34e81c393048fd0557287af44706a162d65219b6c5935
company,1626282960,Philip Morris International Inc. stock outperforms competitors on strong trading day,69201949,https://images.mktw.net/im-220105/social,PM,MarketWatch,"Shares of Philip Morris International Inc. rallied 1.89% to $99.56 Wednesday, on what proved to be an all-around great trading session for the stock market,...",https://finnhub.io/api/news?id=647478ad9708c0da9e88fd2bfed9546a17edfafd647a9e047972ad22565139b9
company,1626268860,"Vectura, Philip Morris $1.45B Deal Under UK Government Scrutiny: Times",68725412,https://cdn.benzinga.com/files/imagecache/og_image_social_share_1200x630/images/story/2012/aapharma_1042.png,PM,Benzinga,Britain's business minister has tasked the government with keeping tabs on Marlboro maker Philip Morris International Inc's (NYSE: PM) proposed takeover of U.K-...,https://finnhub.io/api/news?id=bedadf8236358fd40a4cf6bd3b601744d925b549a8ae0938c7fdb4bd8dc8698b
company,1626259920,3 High-Yield Dividend Stocks to Buy Now,68716336,https://s.yimg.com/uu/api/res/1.2/BwNT_povSTb4LUS6ubQVBQ--~B/aD05MzM7dz0xNDAwO2FwcGlkPXl0YWNoeW9u/https://media.zenfs.com/en/motleyfool.com/e932c4f1a929f23605860d12bcbb4d0f,PM,Yahoo,Growth stocks are lots of fun to watch from a safe distance.  Savvy investors know that dividend-paying stocks tend to outperform shares of companies that don't share their profits.  The steady cash flows that dividend stocks can provide makes them so attractive that high yields like these aren't easy to come by.,https://finnhub.io/api/news?id=5478bb89ef98ba346227b80a0ea2ab8ebdffca819c29fb2fd2515eb886b98155
company,1626250940,XLP: Consumer Staples Dashboard For July,68716256,https://static.seekingalpha.com/cdn/s3/uploads/getty_images/1257382932/medium_image_1257382932.jpg,PM,SeekingAlpha,"Here is a dashboard with metrics in consumer non-cyclical industries, with value and quality scores, and their evolution since last month.",https://finnhub.io/api/news?id=d0302880e5c568e533f264c5adf825c2d2398d625437da04f510ba3c679911b1
company,1626245520,3 High-Yield Dividend Stocks to Buy Now,68736886,https://www.nasdaq.com/sites/acquia.prod/files/2019-05/0902-Q19%20Total%20Markets%20photos%20and%20gif_CC8.jpg?1619234866,PM,Nasdaq,Are the market's ups and downs getting to you? You'll be glad to know there's more than one way to get rich with stocks.Growth stocks are lots of fun to watch from a safe distance. Savvy investors know that dividend-paying stocks tend to outperform shares of companies that don't,https://finnhub.io/api/news?id=abf0ba07f1fb17de5d2cf85719fb37eaea98da4e35d2fc248b7001e86aa90522
company,1626237540,"Heritage Way Advisors, LLC Buys Philip Morris International Inc, iShares MSCI EM ESG Select ETF, Intuitive Surgical Inc",68741710,,PM,GuruFocus,,https://finnhub.io/api/news?id=cf7cb6d2ecfeed46ad933dcdbb551a4f70d3deffabec7248d675238928ab6b04
company,1626223000,British minister asks for monitoring of Vectura's proposed takeover by Philip Morris -The Times,68709095,https://static.reuters.com/resources/r/?m=02&d=20210714&t=2&i=1568784498&r=LYNXMPEH6D00N,PM,Reuters,"British Business Minister Kwasi Kwarteng has asked officials to monitor drugmaker Vectura Group PLC's proposed takeover by U.S. tobacco group Philip Morris International Inc, the Times newspaper reported https://bit.ly/3efO4ag.",https://finnhub.io/api/news?id=b3be8e7771392f516342c4f2c50868861dfaf2fcd0230390ec45f45ea09f5d8d
company,1626207153,British minister asks for monitoring of Vectura's proposed takeover by Philip Morris -The Times,68736887,https://www.nasdaq.com/sites/acquia.prod/files/2021-07-14T001724Z_1_JS3_RTRLXPP_2_LYNXPACKAGER.JPG?208594998,PM,Nasdaq,"British Business Minister Kwasi Kwarteng has asked officials to monitor drugmaker Vectura Group PLC's proposed takeover by U.S. tobacco group Philip Morris International Inc, the Times newspaper reported https://bit.ly/3efO4ag.",https://finnhub.io/api/news?id=4b344f8f297a455728fcadd08046bb4acdbf74caaaaa33141719518f8ffc5f97
company,1626202807,Philip Morris (PM) Earnings Expected to Grow: Should You Buy?,68709719,https://s.yimg.com/uu/api/res/1.2/132juehTNIyEUn7pK7.GPA--~B/aD01MDY7dz05MDA7YXBwaWQ9eXRhY2h5b24-/https://media.zenfs.com/en/zacks.com/3d7c5b2146ac04ffd51752e17ff2a619,PM,Yahoo,Philip Morris (PM) possesses the right combination of the two key ingredients for a likely earnings beat in its upcoming report. Get prepared with the key expectations.,https://finnhub.io/api/news?id=bd2f13c5d6a785da600fe29e1cafe00a6a126b15b5e1c3d82a59915133eda997
company,1626198480,Economic jolt: Red Bull to help build beverage hub in NC,68741712,,PM,"Associated Press, The",Looking for stock market analysis and research with proves results? Zacks.com offers in-depth financial research with over 30years of proven results.,https://finnhub.io/api/news?id=ffe4c012d3b1d7a91e319e634e6fff3f19c71e06db4eff6af9be5e7774b4b0ee
company,1626196560,"Philip Morris International Inc. stock falls Tuesday, underperforms market",69201950,https://images.mktw.net/im-220105/social,PM,MarketWatch,"Shares of Philip Morris International Inc. slipped 0.85% to $97.71 Tuesday, on what proved to be an all-around dismal trading session for the stock market,...",https://finnhub.io/api/news?id=f0cae15ed7edc5184e49b2626867be07fb47abebb39375a98017842e0ef61c8c
company,1626188520,Philip Morris International Inc. to Host Webcast of 2021 Second-Quarter Results,68709720,https://s.yimg.com/uu/api/res/1.2/dMEn0m0c6XVkZq6oW4AE2g--~B/aD0zNjU7dz00ODA7YXBwaWQ9eXRhY2h5b24-/https://media.zenfs.com/en/business-wire.com/791cce5fccbe5b575f83a22d870b9f6a,PM,Yahoo,"NEW YORK, July 13, 2021--Regulatory News: Philip Morris International Inc. (NYSE: PM) will host a live audio webcast on www.pmi.com/2021Q2earnings on Tuesday, July 20, 2021, at 9:00 a.m. ET to discuss its 2021 Second-Quarter results, which will be issued at approximately 7:00 a.m. ET the same day.",https://finnhub.io/api/news?id=d3f3f5ccedf14bd5865c695393d4ff6301c31e61844c7dd28dfca82bc637126a
