category,datetime,headline,id,image,related,source,summary,url
company,1624529258,Is There An Opportunity With Philip Morris International Inc.'s (NYSE:PM) 49% Undervaluation?,68465931,https://s.yimg.com/uu/api/res/1.2/gJy70GPMhPYZ.CPOsrCm5Q--~B/aD00MzI7dz0xMTk0O2FwcGlkPXl0YWNoeW9u/https://media.zenfs.com/en/simply_wall_st__316/a9b40c0d3001089acbbcced97c80196c,PM,Yahoo,Today we'll do a simple run through of a valuation method used to estimate the attractiveness of Philip Morris...,https://finnhub.io/api/news?id=1f97ce8567436058d7412d72bb6447043c6418c0655a92e46197e8e6a084b28c
company,1624521600,Philip Morris International: New Study Shows Near-Doubling in Counterfeit Cigarettes in the European Union Drives Increase of Total Illicit Consumption in 2020,68458447,https://s.yimg.com/cv/apiv2/social/images/yahoo_default_logo-1200x1200.png,PM,Yahoo,"LAUSANNE, Switzerland, June 24, 2021--Philip Morris International Inc. (PMI) (NYSE: PM) is calling for public and private representatives to jointly combat illicit trade as a new report produced by KPMG was released on the consumption and flows of illicit cigarettes in 30 European countries—the 27 European Union (EU) member states, as well as U.K., Norway and Switzerland. The study estimates that, while total cigarette consumption continues to decline, the share of illicit cigarettes increased b",https://finnhub.io/api/news?id=48ffb3702d7980137df15b76e09ab1614624e40f4fa7ac22085f523916a1a465
company,1624509360,Philip Morris calls for representatives to combat illicit cigarettes,68461492,,PM,Thefly.com,Philip Morris calls for representatives to combat illicit cigarettes PM,https://finnhub.io/api/news?id=6c8677115f914eb55f4282f26f1f5b2290ce4bdc94c674af3e1e8e5bf77e6733
company,1624507200,Philip Morris International: New Study Shows Near-Doubling in Counterfeit Cigarettes in the European Union Drives Increase of Total Illicit Consumption in 2020,68456767,,PM,Business Wire,Looking for stock market analysis and research with proves results? Zacks.com offers in-depth financial research with over 30years of proven results.,https://finnhub.io/api/news?id=c24fea24f620137938b74784277963eca666b7b9a7d0c01d3024ed605f875092
company,1624468560,Philip Morris International Inc. stock outperforms market on strong trading day,68502836,https://images.mktw.net/im-220105/social,PM,MarketWatch,"Shares of Philip Morris International Inc. inched 0.05% higher to $100.05 Wednesday, on what proved to be an all-around poor trading session for the stock...",https://finnhub.io/api/news?id=3475b71947671909ae2b915098c9d5b39ca15739665079210843137fa14d9e9b
company,1624465793,"After Hours Most Active for Jun 23, 2021 :  PM, OPENW, ABEV, VCLT, AGTC, V, PCG, NOV, BAC, AAPL, BCRX, PDD",68472132,https://www.nasdaq.com/sites/acquia.prod/files/2019-05/0902-Q19%20Total%20Markets%20photos%20and%20gif_CC8.jpg?711761171,PM,Nasdaq,"The NASDAQ 100 After Hours Indicator is down -.56 to 14,273.68.  The total After hours volume is currently 75,603,566 shares traded.The following are the most active stocks for the after hours session: Philip Morris International Inc (PM) is unchanged at $100.05, with 5,083,253 s",https://finnhub.io/api/news?id=a62358b35b989bfc2699eeae09897225fdc5ee85f25dac645870dbee4223d1cf
company,1624465090,The Retiree's Dividend Portfolio - Jane's May Update: The Fed Announces The Potential For Rate Increases,68442701,https://static.seekingalpha.com/cdn/s3/uploads/getty_images/1225375936/medium_image_1225375936.jpg,PM,SeekingAlpha,"Jane's retirement accounts generated a total of $1,385.68 of dividend income for May 2021 vs. $1,233.71 of dividend income for May 2020.",https://finnhub.io/api/news?id=69e8c61f945b81d7c5a3a1177b0343e454b753daa1a068285882066dfb45c35f
company,1624461740,"Notable Wednesday Option Activity: PM, RL, MSFT",68736905,https://www.nasdaq.com/sites/acquia.prod/files/2019-05/0902-Q19%20Total%20Markets%20photos%20and%20gif_CC8.jpg?1388535763,PM,Nasdaq,"Looking at options trading activity among components of the Russell 3000 index, there is noteworthy activity today in Philip Morris International Inc (Symbol: PM), where a total volume of 51,926 contracts has been traded thus far today, a contract volume which is representative",https://finnhub.io/api/news?id=4bdddf4356e98a7e0151332f624651a31824f81af5906fb9c0006ea22bc61128
company,1624460162,"Philip Morris (PM) Focuses on Transformation, Shifts Headquarters",68439274,https://s.yimg.com/uu/api/res/1.2/7Ss_ahxI1JL8QmgBDBvOrg--~B/aD00MDA7dz02MzU7YXBwaWQ9eXRhY2h5b24-/https://media.zenfs.com/en/zacks.com/b722e658bf812e4a58e158c041871ac6,PM,Yahoo,"Philip Morris (PM) unveils shifting of its corporate headquarters to Connecticut, which is likely to speed up its transformation toward a smoke-free future.",https://finnhub.io/api/news?id=18fc274209e9e167e00db90b6d909ecfffad938f1bafcbec44cf7168a265bb75
company,1624443503,Seeking Alpha Quants Reveal 60 Top Rated Dividend Possibilities,68435396,https://static.seekingalpha.com/cdn/s3/uploads/getty_images/1223392811/medium_image_1223392811.jpg,PM,SeekingAlpha,Seeking Alpha listed 60 stocks yielding over 2% with bullish-ratings-or-better across three-factors. Here are my top ten from these stocks.,https://finnhub.io/api/news?id=5f692b45bae4fea7a954004c41c791a80ab2a7d72ec046e0fa304a9db546735a
company,1624415667,Tracking Bruce Berkowitz's Fairholme Portfolio - Q1 2021 Update,68428743,https://static.seekingalpha.com/cdn/s3/uploads/getty_images/1013942720/medium_image_1013942720.jpg,PM,SeekingAlpha,Bruce Berkowitz’s 13F stock portfolio value decreased this quarter from $1.24B to $1.21B. The Fairholme Portfolio is mostly invested in St. Joe Company.,https://finnhub.io/api/news?id=4e834a8d0b3d21daa6fa34af8daa4c775b99c5ca4330e7631de8857062208ff4
company,1624414920,"Notable Wednesday Option Activity: PM, RL, MSFT",68445044,,PM,Stock Options Channel,"Staff article entitled Notable Wednesday Option Activity: PM, RL, MSFT, about stock options, from Stock Options Channel.",https://finnhub.io/api/news?id=0e416d6f50dd643404cee04bd6054bc153f378c5edb99f7e7cde37796d7fcbfe
company,1624382160,"Philip Morris International Inc. stock falls Tuesday, underperforms market",68422096,https://images.mktw.net/im-220105/social,PM,MarketWatch,"Shares of Philip Morris International Inc. slid 0.16% to $100.00 Tuesday, on what proved to be an all-around favorable trading session for the stock market,...",https://finnhub.io/api/news?id=c8ee5335e9a63cbe6e84824ebf21b5afc515ef84424ac1454d676a369ee84afb
company,1624381900,13 Stocks to Buy Amid Rising Inflation,68421942,https://s.yimg.com/uu/api/res/1.2/HquTTC_7FiIlNuPtHWr1Mg--~B/aD00OTg7dz03NTA7YXBwaWQ9eXRhY2h5b24-/https://media.zenfs.com/en/insidermonkey.com/eea1708525904e0ae3c3b4e2e9a75b0b,PM,Yahoo,"In this article, we discuss the 13 stocks to buy amid rising inflation. If you want to skip our detailed analysis of these stocks, go directly to the 5 Stocks to Buy Amid Rising Inflation. The increase in prices of items because of supply chain problems and rising demand have led to fears of inflation […]",https://finnhub.io/api/news?id=76e0078302a22e93228ba9c35bbca97a689feed2d20d4f4a4eccd981819366a5
company,1624368360,Philip Morris International to Relocate Headquarters to Connecticut From New York City ,68417305,https://images.wsj.net/im-357872/social,PM,DowJones,The tobacco company plans to move 200 jobs to a not-yet-named location in the southwestern part of the state from New York City.,https://finnhub.io/api/news?id=4cd23474535304b12117540aab10f3181e5aef096fe411416e7d1012b73c9b0f
company,1624362000,Philip Morris Moves Headquarters To Connecticut,68746189,https://cdn.benzinga.com/files/imagecache/og_image_social_share_1200x630/images/story/2012/aaconsumerv3_36.png,PM,Benzinga,Cigarette and tobacco manufacturer Philip Morris International Inc (NYSE: PM) said it is relocating its corporate headquarters to Connecticut from New...,https://finnhub.io/api/news?id=0e6ccff69eca72826c704f196a3ec5d660d22680b2c47bec3b3cf3108523ee94
company,1624361948,Philip Morris to relocate corporate HQ to Connecticut from New York,68414392,https://s.yimg.com/uu/api/res/1.2/S8SCotpO9m2XQyQUIGU5dw--~B/aD02MzA7dz0xMjAwO2FwcGlkPXl0YWNoeW9u/https://media.zenfs.com/en/marketwatch.com/96d076434b2a015a3010bd2787b8c856,PM,Yahoo,Tobacco company Philip Morris International said Tuesday it is relocating its corporate headquarters to Connecticut from New York. The move is expected to create about 200 jobs in the state and was facilitated by the office of Gov. Ned Lamont. The new headquarters is expected to be operational by the summer of 2022. Philip Morris is working to shift away from combustible smoking products to smoke-free alternatives and expects to be a majority smoke-free company by net revenue by the end of 2025.,https://finnhub.io/api/news?id=36ac3745eb3afbbfd6cfae069233a532fc1745eee4b273c11260409811857df3
company,1624361400,Philip Morris International Relocates Corporate Headquarters to Connecticut,68414393,https://s.yimg.com/cv/apiv2/social/images/yahoo_default_logo-1200x1200.png,PM,Yahoo,"NEW YORK, Jun 22, 2021--Philip Morris International Relocates Corporate Headquarters to Connecticut",https://finnhub.io/api/news?id=1667635f024244c627a9aa20bb3a081286375a90c0228bca410b5e1b796257d7
company,1624356900,Philip Morris moving corporate headquarters to Connecticut,68417163,,PM,"Associated Press, The",Looking for stock market analysis and research with proves results? Zacks.com offers in-depth financial research with over 30years of proven results.,https://finnhub.io/api/news?id=fbd0e0eb55be9dd543bca78decc618c5a20f27b56fe7ae69ab051374217b69b3
company,1624355340,Philip Morris to move headquarters from NY to Connecticut,68419814,,PM,"Associated Press, The",Looking for stock market analysis and research with proves results? Zacks.com offers in-depth financial research with over 30years of proven results.,https://finnhub.io/api/news?id=38a7d12fc8fbce58650be0e27af2ff2ff9ea2d61a4686032d758ecb79c62ac03
company,1624355340,Philip Morris to move headquarters from NY to Connecticut,68417164,,PM,"Associated Press, The",Looking for stock market analysis and research with proves results? Zacks.com offers in-depth financial research with over 30years of proven results.,https://finnhub.io/api/news?id=20d112a4fbfbfdca1dac650ab37128126aa0396a4b2294efc55dc098bf461451
company,1624347840,Philip Morris to Move Headquarters to Connecticut,68422100,https://mw3.wsj.net/mw5/content/logos/mw_logo_social.png,PM,MarketWatch,"By Matt Grossman Philip Morris International Inc. will move its headquarters to Connecticut from New York by next summer, the tobacco company said Tuesday....",https://finnhub.io/api/news?id=51a217ee85fc7372ce16dab14867f8f4a3db974e927f902808ff1cec9b979264
company,1624347548,Philip Morris to relocate corporate HQ to Connecticut from New York ,68422102,https://s.wsj.net/public/resources/MWimages/MW-GP644_MicroS_ZG_20180906154215.jpg,PM,MarketWatch,Tobacco company Philip Morris International undefined said Tuesday it is relocating its corporate headquarters to Connecticut from New York. The move is...,https://finnhub.io/api/news?id=8f069bb81c555f330bf263baf3da201f658cf6b948985576efeb7f8b8c4a62cb
company,1624347000,Philip Morris International Relocates Corporate Headquarters to Connecticut,68417166,,PM,Business Wire,Looking for stock market analysis and research with proves results? Zacks.com offers in-depth financial research with over 30years of proven results.,https://finnhub.io/api/news?id=ba890a874a35e703940b00fabf1ebfe4ecc33098a81069570cee778fc925175e
company,1624343580,Philip Morris relocates headquarters to Connecticut from New York,68417167,,PM,Thefly.com,Philip Morris relocates headquarters to Connecticut from New York PM,https://finnhub.io/api/news?id=5618d3c90a5a2b579c3fb9c0b1a716eb2839518c460099f4241c6114160f2a27
company,1624341600,Rates Are Still Low. Here Are 8 Large-Cap Stocks That Offer Income.,68418294,https://images.barrons.com/im-357331/social,PM,MarketWatch,"High-yielders include Altria, AT&T , Exxon Mobil , Chevron, and Valero Energy.",https://finnhub.io/api/news?id=ca8f3fa6d99110ef47d306c5d527744575bde128c0aaab9c3522f49f5f97c38b
company,1624301620,Philip Morris: A Different Kind Of Play In The Tobacco Sector With An Interesting Long-Term Horizon,68407302,https://static.seekingalpha.com/cdn/s3/uploads/getty_images/1133345196/medium_image_1133345196.jpg,PM,SeekingAlpha,Philip Morris is a different kind of play in the tobacco sector with an interesting long-term horizon. Find out why this tobacco sector stock may actually grow.,https://finnhub.io/api/news?id=4617ae04752fb8d21508a93cec0c867b661603eb97dd818dd330661993a34c28
company,1624295760,"Philip Morris International Inc. stock rises Monday, still underperforms market",68422103,https://images.mktw.net/im-220105/social,PM,MarketWatch,"Shares of Philip Morris International Inc. inched 0.66% higher to $100.16 Monday, on what proved to be an all-around great trading session for the stock...",https://finnhub.io/api/news?id=da4ff13224e8e7aae099cea3194fb3b6b970fbfb222e3f30a74167cc1272f9bc
company,1624294700,Here is What Hedge Funds Think About Philip Morris International Inc. (PM),68408183,https://s.yimg.com/uu/api/res/1.2/0MzYEjpvpuQQZExsmHGvMw--~B/aD02MDA7dz00NzM7YXBwaWQ9eXRhY2h5b24-/https://media.zenfs.com/en/insidermonkey.com/17f123c9bb51f7d1d1615994b341be87,PM,Yahoo,"The latest 13F reporting period has come and gone, and Insider Monkey is again at the forefront when it comes to making use of this gold mine of data. We at Insider Monkey have plowed through 866 13F filings that hedge funds and well-known value investors are required to file by the SEC. The 13F […]",https://finnhub.io/api/news?id=12569a574c8a6d7caa32fca1d690d84df95e4c984cab72451a4b42182ff27df3
company,1624279812,How Investors Can Grab Better Returns for Consumer Staples Using the Zacks ESP Screener,68397471,https://s.yimg.com/uu/api/res/1.2/7h8ntzJXcDOdVmDKQ08gRg--~B/aD02MDA7dz05MDA7YXBwaWQ9eXRhY2h5b24-/https://media.zenfs.com/en/zacks.com/e8e4b0344809eaac6d73c9fd25fd180a,PM,Yahoo,Finding stocks expected to beat quarterly earnings estimates becomes an easier task with our Zacks Earnings ESP.,https://finnhub.io/api/news?id=e85cf7e4d9d9e6947e8d61664d204c968eb929db6cd72f8c05d4def6f8eff473
company,1624264860,8 Blue-Chip Stocks to Buy to Fortify Your Portfolio,68396506,https://investorplace.com/wp-content/uploads/2019/07/blue-chip-money.jpg,PM,InvestorPlace,"As the market gets more volatile, it's a good time to stick with the stocks that have proven track records like the blue-chip stocks here.",https://finnhub.io/api/news?id=248061f4150ab029abba20b9518986e76143ff1274948be5fb7d4fdd8d6d8eb5
company,1624142767,Dividend Champion And Contender Highlights: Week Of June 20,68381952,https://static.seekingalpha.com/cdn/s3/uploads/getty_images/1072593728/medium_image_1072593728.jpg,PM,SeekingAlpha,A weekly summary of dividend activity for Dividend Champions and Contenders. Click here to see the companies with upcoming ex-dividend and pay dates.,https://finnhub.io/api/news?id=dd787f48c804d98662d3c65699f529794214b8b946fb584db28c9d4fc09b27fa
company,1624069860,"36 Firms Going Ex-Dividend Next Week, Including Philip Morris, Medtronic And Total Energies",68373427,,PM,TalkMarkets,Content,https://finnhub.io/api/news?id=5207043ca900a025c9811cab2ffbe8a2298ba741f2fb5b022ce89e0fc4100915
company,1624040535,Philip Morris International (PM) Presents At Deutsche Bank Global Consumer Conference - Slideshow,68363197,https://static.seekingalpha.com/assets/og_image_1200-29b2bfe1a595477db6826bd2126c63ac2091efb7ec76347a8e7f81ba17e3de6c.png,PM,SeekingAlpha,The following slide deck was published by Philip Morris International Inc.,https://finnhub.io/api/news?id=68fc8efc76bea6cc9b9726ba4dc7ff910774ba39cc0748635ea78fc7b12af7f0
company,1624036560,"Philip Morris International Inc. stock falls Friday, still outperforms market",68422105,https://images.mktw.net/im-220105/social,PM,MarketWatch,"Shares of Philip Morris International Inc. slumped 0.50% to $99.50 Friday, on what proved to be an all-around dismal trading session for the stock market,...",https://finnhub.io/api/news?id=34f477ddc9cc0379dfd56532086b8dcd049f3ad718a02fac517ccfe3aae55de3
company,1624032983,FSTA: Consumer Staples Dashboard For June,68359315,https://static.seekingalpha.com/cdn/s3/uploads/getty_images/663898456/medium_image_663898456.jpg,PM,SeekingAlpha,"A dashboard with metrics in consumer non-cyclical industries. Value and quality scores, and their evolution since last month. Focus on FSTA.",https://finnhub.io/api/news?id=bda8ee1a85f8014f799b89df161b5c72ee20048baf795ad624edde81eb0d3e17
company,1623950160,Philip Morris International Inc. stock outperforms competitors on strong trading day,68422107,https://images.mktw.net/im-220105/social,PM,MarketWatch,"Shares of Philip Morris International Inc. inched 0.08% higher to $100.00 Thursday, on what proved to be an all-around rough trading session for the stock...",https://finnhub.io/api/news?id=e9e869b1b1a62068cabfcba9aa4cfbb6dab6d44a567a0dbe845fbe88c92b8987
company,1623945418,"Consumer Sector Update for 06/17/2021: PM,TDUP,RVLV,KR",68370092,https://www.nasdaq.com/sites/acquia.prod/files/2019-05/0902-Q19%20Total%20Markets%20photos%20and%20gif_CC8.jpg?94424459,PM,Nasdaq,"Consumer stocks added to modest gains Thursday afternoon, with the SPDR Consumer Staples Select Sector ETF climbing 0.5% while the SPDR Consumer Discretionary Select Sector ETF also was ahead 0.5%.",https://finnhub.io/api/news?id=b5b0548154a59978c5810a1c5e3c383b6e7427dc5a43ca8a1ede30a8df4f47a2
company,1623939962,Nicotine Gum Maker Fertin Draws Philip Morris Interest,68332343,https://s.yimg.com/cv/apiv2/social/images/yahoo_default_logo-1200x1200.png,PM,Yahoo,"(Bloomberg) -- Fertin Pharma, a maker of nicotine chewing gum, is attracting takeover interest from suitors including cigarette giant Philip Morris International Inc., people with knowledge of the matter said.The Danish company’s private equity owner, EQT AB, has been working with an adviser to gauge interest in the business, according to the people, who asked not to be identified because the information is private. Fertin could be valued at about 600 million euros ($716 million) including debt",https://finnhub.io/api/news?id=4cbad6b853920ce53b815c9eda0d0273342106a89e54f36595f04e071f3dbc81
company,1623928372,Philip Morris unveils new structure for the Americas as it works toward smoke-free future,68325257,https://s.yimg.com/uu/api/res/1.2/S8SCotpO9m2XQyQUIGU5dw--~B/aD02MzA7dz0xMjAwO2FwcGlkPXl0YWNoeW9u/https://media.zenfs.com/en/marketwatch.com/96d076434b2a015a3010bd2787b8c856,PM,Yahoo,"Philip Morris International Inc. unveiled a new structure for the Americas on Thursday and named Deepak Mishra president of the region, replacing Martin King, who is retiring after 30 years. Mishra, who has been with the company for three years, is a former managing director at private-equity firm Centerbridge Partners LP, and has also done stints at McKinsey & Co., Procter & Gamble and Accenture . He will take up his new role on July 1. The new Americas structure will focus on building out Phil",https://finnhub.io/api/news?id=484c1baafb2bf01b300546d7cb6876f5d453d3c5ab17553b8eee9d482a7a342f
company,1623927600,"Philip Morris International Organizes for Continued Innovation: Deepak Mishra Named President, Americas Region, Martin King to Retire After 30 Years of Service",68325258,https://s.yimg.com/cv/apiv2/social/images/yahoo_default_logo-1200x1200.png,PM,Yahoo,"NEW YORK, Jun 17, 2021--Philip Morris International Organizes for Continued Innovation: Deepak Mishra Named President, Americas Region",https://finnhub.io/api/news?id=19da06ecb7a2ab09c194cf3719ba489f84adfc7386ded999e991c9ce44d747c7
company,1623922200,Smoke Sometimes Got in Our Eyes: Barron’s and Tobacco Through the Years,68325259,,PM,Yahoo,"In our 100 years, we’ve had a long and complicated relationship with tobacco purveyors. Consider our original take on the 1970 ban on TV and radio advertising. Or some of the ads we ran in the 1930s and ’40s.",https://finnhub.io/api/news?id=d576a9570d733b29c2493b8cb364579bd0046dcefcf480edf427dc2f6753dc09
company,1623913972,Philip Morris unveils new structure for the Americas as it works toward smoke-free future,68325773,https://s.wsj.net/public/resources/MWimages/MW-GP644_MicroS_ZG_20180906154215.jpg,PM,MarketWatch,"Philip Morris International Inc. undefined unveiled a new structure for the Americas on Thursday and named Deepak Mishra president of the region, replacing...",https://finnhub.io/api/news?id=4f744684194ae51a9d783f8205abd4c5c8ea2486bcaa32ef17c3155cf00add3f
company,1623913200,"Philip Morris International Organizes for Continued Innovation: Deepak Mishra Named President, Americas Region, Martin King to Retire After 30 Years of Service",68325377,,PM,Business Wire,Looking for stock market analysis and research with proves results? Zacks.com offers in-depth financial research with over 30years of proven results.,https://finnhub.io/api/news?id=d15568a0fc68b697c926102e4fad7de352a3399900efcd6a772ce0c6c7494cfc
company,1623863760,Philip Morris International Inc. stock outperforms market despite losses on the day,68325774,https://images.mktw.net/im-220105/social,PM,MarketWatch,"Shares of Philip Morris International Inc. slid 0.54% to $99.92 Wednesday, on what proved to be an all-around dismal trading session for the stock market,...",https://finnhub.io/api/news?id=125a90129f3ef1f89588ed51a7b5d27dd126b938d8bf13db81a81a46ffcd1e1d
company,1623777360,Philip Morris International Inc. stock outperforms market despite losses on the day,68325775,https://images.mktw.net/im-220105/social,PM,MarketWatch,"Shares of Philip Morris International Inc. slipped 0.04% to $100.46 Tuesday, on what proved to be an all-around poor trading session for the stock market,...",https://finnhub.io/api/news?id=be8c7cb1edf87aba417e838d5af73e663b1ef71db5d55733269e58fb23c943d0
company,1623774918,Top Tobacco Stocks for Q3 2021,68285293,,PM,Yahoo,"The tobacco industry includes companies that grow, produce, and sell tobacco and related products such as cigarettes and e-cigarettes.  The biggest tobacco companies include Philip Morris International Inc. (PM) and Altria Group Inc. (MO), both of which sell products with dominant brand names.  Tobacco stocks as a group have significantly lagged the broader market.",https://finnhub.io/api/news?id=ccc9ba6c31092afcbf8bc22d9e428d791c3bbbb1e3f29fb17f83f3f67bfced68
company,1623753910,"Zacks Industry Outlook Highlights: Vector Group, Philip Morris International and Altria Group",68281092,https://s.yimg.com/uu/api/res/1.2/iA0pEpik6fVUsCBAoxgiUg--~B/aD00MDA7dz02MzU7YXBwaWQ9eXRhY2h5b24-/https://media.zenfs.com/en/zacks.com/8a61c7cb9a22ca41cfb9605a78d42897,PM,Yahoo,"Zacks Industry Outlook Highlights: Vector Group, Philip Morris International and Altria Group",https://finnhub.io/api/news?id=44307770633396e9d29b9deb590f321f0ea995f27d4ee68a8d758084ba2a9aa6
company,1623742707,"My Dividend Portfolio: May 2021 Update - 101 Holdings, 28 Buys, Dividend Record",68278995,https://static.seekingalpha.com/cdn/s3/uploads/getty_images/1248262649/medium_image_1248262649.jpg,PM,SeekingAlpha,Stocks moved another leg higher in May. I am continuing my monthly investment plans while awaiting a market correction or possibly a real crash once market euphoria has come down.,https://finnhub.io/api/news?id=2c30a579c4cfd64cebe1da91d6aa4da8d4755c8c701e1ea590c91785b0d50ff7
company,1623690960,Philip Morris International Inc. stock outperforms competitors on strong trading day,68325776,https://images.mktw.net/im-220105/social,PM,MarketWatch,"Shares of Philip Morris International Inc. advanced 1.68% to $100.50 Monday, on what proved to be an all-around mixed trading session for the stock market,...",https://finnhub.io/api/news?id=0f479c45a7f99ab9a42705b15c50ca505fa70c3ad1f7f66cdff816cedaf956a3
company,1623687861,"After Hours Most Active for Jun 14, 2021 :  ELY, GRUB, AAPL, HBAN, PM, GFI, GPS, ZTS, WOOF, CHNG, MSFT, QQQ",68357293,https://www.nasdaq.com/sites/acquia.prod/files/2019-05/0902-Q19%20Total%20Markets%20photos%20and%20gif_CC8.jpg?1251013512,PM,Nasdaq,"The NASDAQ 100 After Hours Indicator is down -6.6 to 14,121.6.  The total After hours volume is currently 97,083,427 shares traded.The following are the most active stocks for the after hours session: Callaway Golf Company (ELY) is unchanged at $34.51, with 9,913,662 shares trade",https://finnhub.io/api/news?id=94e9c214fd42b7833984c255d080bf3d8ec3f51d98de0beda82c36171a5ada65
company,1623687561,British American Tobacco: Don't Just Focus On Its Yield,68266760,,PM,SeekingAlpha,,https://finnhub.io/api/news?id=e71173aed2bb031985cc9468e9dc4e8fac0ecf306b8d08d8dd353d82ca3be5c8
company,1623681122,"Philip Morris (PM) Rewards Shareholders, Unveils New Buyback Plan",68263246,https://s.yimg.com/uu/api/res/1.2/G.ujydpBYSAt7lyXaW_8Ug--~B/aD00MDA7dz02MzU7YXBwaWQ9eXRhY2h5b24-/https://media.zenfs.com/en/zacks.com/5f18056afe0160963629647d3f1ac31f,PM,Yahoo,Philip Morris (PM) approves a new share buyback plan of up to $7 billion and announces a quarterly dividend. Solid pricing power and strength in RRPs are key growth drivers for the company.,https://finnhub.io/api/news?id=10d4a6554d5718f6cd10d653a8287a94126d2b63809899e22fd5dd240d73417d
company,1623680746,3 Top Stock Trades for the Week,68371447,https://www.nasdaq.com/sites/acquia.prod/files/2019-05/0902-Q19%20Total%20Markets%20photos%20and%20gif_CC8.jpg?2044016365,PM,Nasdaq,"InvestorPlace - Stock Market News, Stock Advice & Trading Tips",https://finnhub.io/api/news?id=3bb8540da1a8929e70c5315997be5c3163adc019e426bdddd71b08f0504e0e75
