category,datetime,headline,id,image,related,source,summary,url
company,1628231888,Is MJ A Buy: Evaluating The Oldest Cannabis ETF,69539198,https://static.seekingalpha.com/cdn/s3/uploads/getty_images/921946128/medium_image_921946128.jpg,PM,SeekingAlpha,"MJ is officially the oldest cannabis ETF. However, without exposure to actual US cannabis operators, it will be difficult for MJ to fully capture the growth potential of the cannabis sector.",https://finnhub.io/api/news?id=194f3092fc616d75f07558c083a5af64e53c90737049cdf00f9a45eb504c7ce2
company,1628183760,"Philip Morris International Inc. stock rises Thursday, still underperforms market",69539765,https://images.mktw.net/im-220105/social,PM,MarketWatch,"Shares of Philip Morris International Inc. inched 0.10% higher to $99.59 Thursday, on what proved to be an all-around great trading session for the stock...",https://finnhub.io/api/news?id=485ec14138fa1e4cbaebe26727005b7458b19e297a5090a1581fa8edef436051
company,1628128430,"My Dividend Portfolio: July 2021 Update - 99 Holdings, 35 Buys, Dividend Record",69509162,https://static.seekingalpha.com/cdn/s3/uploads/getty_images/1155610132/medium_image_1155610132.jpg,PM,SeekingAlpha,The stock market continued to perform well with the S&P 500 up another 2.27% bringing its YTD gains to almost exactly 17%.,https://finnhub.io/api/news?id=7f8c9de29285f3837096139d3c8d984e923259045c0773187fdcecc79464b16f
company,1628097360,"Philip Morris International Inc. stock falls Wednesday, underperforms market",69506086,https://images.mktw.net/im-220105/social,PM,MarketWatch,"Shares of Philip Morris International Inc. shed 0.95% to $99.49 Wednesday, on what proved to be an all-around grim trading session for the stock market, with...",https://finnhub.io/api/news?id=693c1e621e8e88aa9677f4e23a6873a4dc51feeb5cc0d14e87cb2d8cb6590cb6
company,1628089200,Altria Halts IQOS Expansion After British American Tobacco Wins Patent Infringement Ruling,69492067,,PM,Yahoo,The ruling before International Trade Commission will halt imports of the electronic cigarette into the U.S.,https://finnhub.io/api/news?id=e615e8f7e471327bb17f5d854fb9d9dad3b2ca190da7a0ada295c0cf84a5e9b4
company,1628064780,High Yield Dividend Stocks For August 2021,69487741,https://static.seekingalpha.com/cdn/s3/uploads/getty_images/480761398/medium_image_480761398.jpg,PM,SeekingAlpha,There are 24 High-Yield Dividend Stocks on the August 2021 watchlist. The watchlist gained 1.54% in July and is up over 37% since November 2020. Read more here.,https://finnhub.io/api/news?id=63ad8ee834ddc461b2dc0f6c7cbab405bb0555987b8c489a2b1afa73b9d6c9c1
company,1628059140,"Charles Schwab Trust Co Buys Schwab 5-10 Year Corporate Bond ETF, Schwab Fundamental International Small Company Ind, Xtrackers International Real Estate ETF, Sells Emerson Electric Co, SPDR Portfolio TIPS ETF, iShares Gold Trust",69490232,,PM,GuruFocus,,https://finnhub.io/api/news?id=afd6400c4b70ef033d51598e624b66de1f42f8e7795234d028ccece2b446e908
company,1628051940,"Amica Mutual Insurance Co Buys Vanguard S&P 500 ETF, iShares Core MSCI Total International Stock ETF, Charter Communications Inc, Sells Heico Corp, JPMorgan Chase, Comcast Corp",69515267,,PM,GuruFocus,,https://finnhub.io/api/news?id=fa1fa575a35b89d027fdbf4e669184b8258bcb4e0868a5c1b161c51bc0473383
company,1628044500,3 Tobacco Stocks to Buy for High Dividend Yields You Can Depend On,69520645,https://investorplace.com/wp-content/uploads/2021/04/tobacco-stocks.jpg,PM,InvestorPlace,"These tobacco stocks offer strong dividend growth histories, and given their ability to generate free cash flow, that should continue.",https://finnhub.io/api/news?id=7ff90d4edab0419ce174030919bba5aa92337987ab0fc503534288b314246233
company,1628010960,"Philip Morris International Inc. stock rises Tuesday, still underperforms market",69506087,https://images.mktw.net/im-220105/social,PM,MarketWatch,"Shares of Philip Morris International Inc. inched 0.41% higher to $100.44 Tuesday, on what proved to be an all-around favorable trading session for the stock...",https://finnhub.io/api/news?id=9736837fadde3d26b354afabcb72ab37bb2f762a32ead9056abc38c35db069e0
company,1627983720,First Week of PM March 2022 Options Trading,69471764,,PM,Stock Options Channel,"Staff article entitled First Week of PM March 2022 Options Trading, about stock options, from Stock Options Channel.",https://finnhub.io/api/news?id=d227effc171ff19a16158ead20975636e21a6426b6ff9d7b0931f60fa78b7838
company,1627976970,Wall Street Breakfast: Ready For Takeoff (Podcast),69462518,https://static3.seekingalpha.com/assets/podcasts/wsb-d57bf915fd82bac19817953c2e226c7610de9fc3a36c166d7c276e18e86311ea.png,PM,SeekingAlpha,Our top stories today: Ready for takeoff; ‘spiritual opium’; and delta shadows.,https://finnhub.io/api/news?id=9768ce1312eac1dce1588ef7de02b8d8df7e431da8089403b62b7800e5cd4491
company,1627974076,Wall Street Breakfast: Ready For Takeoff,69461955,https://static.seekingalpha.com/assets/og_image_1200-29b2bfe1a595477db6826bd2126c63ac2091efb7ec76347a8e7f81ba17e3de6c.png,PM,SeekingAlpha,"Listen on the go! A daily podcast of Wall Street Breakfast will be available by 8:00 a.m. on Seeking Alpha, iTunes, Stitcher and Spotify.",https://finnhub.io/api/news?id=4d6e29c4f75806e56b0a2d5a4d55072a6eb2133b5129e8ea16b10975b97a5919
company,1627924573,"British American Tobacco: Mixed H1, But Attractive At 8.0% Dividend Yield",69454291,https://static.seekingalpha.com/cdn/s3/uploads/getty_images/1057964346/medium_image_1057964346.jpg,PM,SeekingAlpha,"H1 results showed strong headlines but a mixed underlying performance, in line with the low expectations in our investment case.",https://finnhub.io/api/news?id=7808ea539afe48bcc4cd36f71c03134b6194e9a3d7ec40c45305c38d29de5729
company,1627924560,Philip Morris International Inc. stock outperforms market despite losses on the day,69506089,https://images.mktw.net/im-220105/social,PM,MarketWatch,"Shares of Philip Morris International Inc. sank 0.06% to $100.03 Monday, on what proved to be an all-around poor trading session for the stock market, with...",https://finnhub.io/api/news?id=10b4d4c9c57db21542648f03852e9de5984d71e0828105161c7b0d0800352370
company,1627902060,Wall Street in Fives - Must Read Lists at Midday,69464113,https://image.thefly.com/catalog/201810/img_66.png,PM,Thefly.com,"Five top five lists with the news and calls moving stocks, powered by The Fly. SQ, AFTPF, PH, MEGGF, FL, GE, TGT, ATCX, ZM, ALG, WLTW, JNJ, AMZN, AUTL, MRNA, VXRT, CAN, IMVT, TGTX, ON, GPN, TSEM, MRIN, GPRE, PM, MO, EL, LEVI, FSLR, INFI",https://finnhub.io/api/news?id=839d2ffa333a7e7d9da2433a9ca91f3014df7e479ea6150dac2ce1ac0894429c
company,1627892657,July 2021 Portfolio Update - $1.25M And Growing,69446041,https://static.seekingalpha.com/cdn/s3/uploads/getty_images/1257805716/medium_image_1257805716.jpg,PM,SeekingAlpha,"A major milestone was reached when my portfolio crossed over into $1.25M in total, less than 5 months after reaching my first million. Know my plans for the remainder of 2021.",https://finnhub.io/api/news?id=63c0078e5cb7aa91624655edb39755e03f2ccab4b21e6c6a5a6d24837d47bc69
company,1627891560,"Philip Morris, Altria could possibly revisit combining, says Morgan Stanley",69447816,,PM,Thefly.com,"Morgan Stanley analyst Pa... PM, MO",https://finnhub.io/api/news?id=5c29e6b3faa194bac17265c517ec6b52726e6c77bd61306496e9d99187be6aac
company,1627875180,Wall Street in Fives - Must Read Lists for Monday,69464117,https://image.thefly.com/catalog/201904/img_457.jpg,PM,Thefly.com,"Five top five lists with the news and calls moving stocks, powered by The Fly. SQ, PH, MEGGF, TGT, HD, GE, FL, PM, MO, LEVI, FSLR, INFI, ATCX, ZM, ALG, WLTW, JNJ, AMZN, F, AUTL, VXRT, CAN, IMVT, RKT, ON, GPN, TSEM, MRIN, GPRE, AFTPF",https://finnhub.io/api/news?id=2083c79a3b22ccc40ad72401557a7a01480695a8b547702b9bf49bdf3ded02c4
company,1627871940,"Clark Capital Management Group, Inc. Buys SPDR Portfolio S&P 500 Growth ETF, iShares S&P Small-Cap 600 Value ETF, Danaher Corp, Sells iShares Core S&P Small-Cap ETF, iShares Core S&P Mid-Cap ETF, Bristol-Myers Squibb Company",69464538,,PM,GuruFocus,,https://finnhub.io/api/news?id=08235c708d077b55f571c0d31251e4e9005711b797ad17e887b802c673c5ec05
company,1627871940,"San Francisco Sentry Investment Group (ca) Buys Invesco DWA Momentum ETF, JPMorgan Diversified Return U.S. Equity ETF, SPDR S&P Kensho Clean Power ETF, Sells Apple Inc, Visa Inc, Microsoft Corp",69464675,,PM,GuruFocus,,https://finnhub.io/api/news?id=22f62d9b95b9bd176798ef355ff6b173aad3ad38051500e87d2f3ef064a5a344
company,1627829496,The Retiree's Dividend Portfolio - Jane's June Update: Targeting Double-Digit Dividend Income Growth,69435178,https://static.seekingalpha.com/cdn/s3/uploads/getty_images/1126636461/medium_image_1126636461.jpg,PM,SeekingAlpha,We have continued to take advantage of selling select positions when share price reaches certain levels. Click here to read more about John and Jane's portfolio.,https://finnhub.io/api/news?id=d267b65adbc4684c23b38f817bb04ae016e008ea15d307f62b34b21706523644
company,1627667640,"Opinion | My Father, the Cigarette Salesman",69419111,https://images.wsj.net/im-377684/social,PM,DowJones,He gave out free samples as a gesture of goodwill. It was a different world.,https://finnhub.io/api/news?id=b536bf325e7e911bc817bbbe09ce9a92463f5e5e5f4afd0dc7b2e9f4256d6d2a
company,1627665360,Philip Morris International Inc. stock outperforms competitors despite losses on the day,69453621,https://images.mktw.net/im-220105/social,PM,MarketWatch,"Shares of Philip Morris International Inc. slid 0.20% to $100.09 Friday, on what proved to be an all-around rough trading session for the stock market, with...",https://finnhub.io/api/news?id=dc87e6ddf5efb046b9ea2cbe91b42c4cac56c029058332e7032abc58bb1088e4
company,1627649220,What Is Philip Morris International Smoking? CEO Calls for Banning Cigarettes Within a Decade,69414550,https://s.yimg.com/uu/api/res/1.2/VynF04IUZ7iSZyjnRHDFhA--~B/aD05MzM7dz0xNDAwO2FwcGlkPXl0YWNoeW9u/https://media.zenfs.com/en/motleyfool.com/1b102ab3794c5c48804c0fa96fe5be87,PM,Yahoo,"The answer is, they probably won't -- and Philip Morris International (NYSE: PM) may regret calling on the U.K.'s government to ban cigarettes in 10 years.  Philip Morris International chairman André Calantzopoulos and CEO Jacek Olczak told The Telegraph it's time for the government to treat cigarettes like gasoline-powered cars and ban them.  The U.K. has said it will ban all vehicles with internal combustion engines by 2030.",https://finnhub.io/api/news?id=d1a61e39b5b9dfb94f0e25e5b4e4b3ab7ac32691825753f1d626f540f3f95948
company,1627645237,Update: Philip Morris International (NYSE:PM) Stock Gained 29% In The Last Year,69414551,https://s.yimg.com/uu/api/res/1.2/gJy70GPMhPYZ.CPOsrCm5Q--~B/aD00MzI7dz0xMTk0O2FwcGlkPXl0YWNoeW9u/https://media.zenfs.com/en/simply_wall_st__316/a9b40c0d3001089acbbcced97c80196c,PM,Yahoo,There's no doubt that investing in the stock market is a truly brilliant way to build wealth. But not every stock you...,https://finnhub.io/api/news?id=15e03fcb17d0fa90009938a24361d2828cf638547dd5a6e888ff91e531542946
company,1627645237,British American Tobacco: Batting For A Lucky Strike,69408217,https://static.seekingalpha.com/cdn/s3/uploads/getty_images/841379944/medium_image_841379944.jpg,PM,SeekingAlpha,British American Tobacco sells at a low multiple of earnings. Click here to read why BAT's earnings multiples will expand as it grows next-gen products.,https://finnhub.io/api/news?id=bad91291708067230b6955b303ac8639d86367d92995792f729e9ef226038285
company,1627627140,"Heartland Bank & Trust Co Buys Philip Morris International Inc, Caterpillar Inc, Pfizer Inc, Sells The Home Depot Inc, Procter & Gamble Co, The Walt Disney Co",69420261,,PM,GuruFocus,,https://finnhub.io/api/news?id=0d5ad31947a3663b671a67dd97b0745b188dcd1ed375c226b0ff0138a8824a35
company,1627627140,"Value Partner Investments Inc. Buys Lockheed Martin Corp, Bentley Systems Inc, Enbridge Inc, Sells FedEx Corp, Johnson & Johnson, The Home Depot Inc",69406048,,PM,GuruFocus,,https://finnhub.io/api/news?id=6567614dbc450a11340ab71f78a50673b68ab268d7aceb76740ac58212486cd6
company,1627601337,5 Blue-Chip Bargains That Create The World's Safest 6% Yielding Retirement Portfolio,69399832,https://static.seekingalpha.com/cdn/s3/uploads/getty_images/172267398/medium_image_172267398.jpg,PM,SeekingAlpha,"We live in a yield-starved world where 2.8% is considered high yield. Fortunately, building a custom portfolio allows you to achieve nearly double that, with far superior safety and quality.",https://finnhub.io/api/news?id=a42665a4b4d6a7fa78373a4efaec04b69a025b6941f28dde7e3ba06d2b59e20e
company,1627556098,Altria: Q2 Strong Cigarette Trends More Than Offset Other Setbacks,69378728,https://static.seekingalpha.com/cdn/s3/uploads/getty_images/1755033/medium_image_1755033.jpg,PM,SeekingAlpha,"Altria reported strong Q2 earnings and raised its 2021 EPS outlook. Read more about Altria’s dividend yield and valuation, and see if MO Stock is a Buy or Sell.",https://finnhub.io/api/news?id=a81a3972d422d522d5ba5568f0a8cec2a3a485cc64300434cb4309ef1ba10d9a
company,1627552140,4 Stocks Insiders Are Selling,69377809,https://cdn.benzinga.com/files/imagecache/og_image_social_share_1200x630/sites/all/themes/bz2/images/bz-icon.png,PM,Benzinga,"When insiders sell shares, it indicates their concern in the company’s prospects or that they view the stock as being overpriced. Either way, this signals an opportunity to...",https://finnhub.io/api/news?id=c395e816584234c5afe33db71b36febdf95af6a6afa1da7c1ee6b830b449294b
company,1627550160,"Philip Morris International Inc (PM) CEO, PMI America Martin G. King Sold $2.2 million of Shares",69380634,,PM,GuruFocus,,https://finnhub.io/api/news?id=d003f2be03576c64d8f15c0701395122d01deb38e5be73206bc1d50b255e4794
company,1627543860,Altria: Q2 Earnings Snapshot,69378964,,PM,"Associated Press, The",Looking for stock market analysis and research with proves results? Zacks.com offers in-depth financial research with over 30years of proven results.,https://finnhub.io/api/news?id=56264d3e6915e9d289d56af41352fbf578c357176bc8617e689e161fa5b04b85
company,1627439940,"Riverstone Advisors, LLC Buys Apple Inc, Philip Morris International Inc, The Home Depot Inc, Sells Vanguard Health Care ETF, S&P 500 ETF TRUST ETF, Vanguard S&P 500 ETF",69376295,,PM,GuruFocus,,https://finnhub.io/api/news?id=ff7acde6feafef25e2339db96b6bab025738048d2ea9c2842bfc4940b7aa23f6
company,1627405059,Young lured to tobacco addiction via e-cigarettes - WHO,69344446,,PM,Yahoo,"The tobacco industry's sleek marketing is attracting youngsters to e-cigarettes which can lead to tobacco addiction, despite claims by some executives that they aim to solve the smoking epidemic, the World Health Organization (WHO) said on Tuesday.  Over eight million people die annually from tobacco use and exposure to tobacco smoke, making the habit a leading cause of preventable diseases, the WHO said in a report calling for greater regulation of smoke-free devices containing nicotine.  In a weekend interview with Britain's Mail on Sunday newspaper, Philip Morris International CEO Jacek Olczak was quoted as saying he wanted the tobacco group to be able ""to leave smoking behind"".",https://finnhub.io/api/news?id=5c091345de63a54d3c64f0718305b4a1b40c6c7cd329630e2674b788366d0288
company,1627395300,2 Top Value Stocks to Buy Right Now,69337863,https://s.yimg.com/uu/api/res/1.2/CJGxa.nLk6rTTv.OiY0Wrg--~B/aD03ODc7dz0xNDAwO2FwcGlkPXl0YWNoeW9u/https://media.zenfs.com/en/motleyfool.com/2d9ec13623192c5c11d69a194514b256,PM,Yahoo,"Savvy investors want more for less, and value stocks like General Motors (NYSE: GM) and Philip Morris International (NYSE: PM) offer just that.  Tesla (NASDAQ: TSLA) is probably the first name that comes to mind when you think of electric vehicles (EVs), but that could change over the coming decades as GM's EV strategy takes shape.  General Motors has committed $35 billion to develop EV and autonomous driving technology, and it plans to release 30 new EVs globally by 2025.",https://finnhub.io/api/news?id=09696b9afc100ab22616403f48234b3d798c2b9c518a632b725e6c9f08fdb349
company,1627390031,"The More They Fall, The More I Buy: 3 Rich Retirement Blue Chips Set To Fly",69338495,https://static.seekingalpha.com/cdn/s3/uploads/getty_images/160142915/medium_image_160142915.jpg,PM,SeekingAlpha,The market recently dipped on fears of surging Delta cases and is now roaring higher once again. Prudent investors know to ignore the noise and focus on fundamentals.,https://finnhub.io/api/news?id=667274a15f0a4430c77589d76e492964ce30dc0ad3d65f2ed0d5aa4342aa71d8
company,1627382340,"Argyle Capital Management Inc. Buys Organon, Philip Morris International Inc, Sells Perspecta Inc, SunPower Corp, Altria Group Inc",69338226,,PM,GuruFocus,,https://finnhub.io/api/news?id=d21775e5138475bd5f7bef74d0fc5f36849924c9a18967cbc0edb535f7274c05
company,1627367880,S&P 500 Dividend Yield Lowest in 20 Years: 5 Blue Chips to Buy Now With Huge Dividends,69331888,https://247wallst.com/wp-content/uploads/2021/03/imageForEntry14-hQk.jpg,PM,247WallSt,"With bond yields remaining at generational lows, and the prospect of them going meaningfully higher in the near term seemingly off the table, it makes sense for growth and income investors to consider top dividend-paying stocks. None of these five is as crowded and as overbought as most of the market is.",https://finnhub.io/api/news?id=55f12d564d6432132ba0396d963b7a3b64e7cd0d7a45c51b61c0b2a78198840b
company,1627362360,7 Stocks To Buy if the Economy Rolls Over on Recessionary Worries,69332372,https://investorplace.com/wp-content/uploads/2020/03/istock-959185324.jpg,PM,InvestorPlace,Here are seven stocks to buy based on arguments and signals indicating that the economy may not be as strong as it appears at first blush.,https://finnhub.io/api/news?id=4bd032b7d4850b78a85b527bdfdf6217b5be77f2756c0c5aacd75df21888143e
company,1627308729,Philip Morris International Vows To End UK Cigarette Sales Within 10 Years,69344448,,PM,Yahoo,"Tobacco company Philip Morris International (NYSE: PM) has announced a goal to cease cigarette sales in the U.K. within the next 10 years. What Happened: In an interview with the Daily Mail, CEO Jacek Olczak stated the company will replace its traditional cigarette product line with “modern alternatives” including e-cigarettes and heated tobacco devices. “I want to allow this company to leave smoking behind,” Olczak said. “I think in the U.K., 10 years from now maximum, you can completely solve",https://finnhub.io/api/news?id=2a6ef7fe2748c3b7ff96d572d39e7795bfc4975b2e49b269ea110a6cd89e0d3e
company,1627302840,Tobacco CEO sees end to cigarettes in Britain in 10 years,69334727,,PM,"Associated Press, The",Looking for stock market analysis and research with proves results? Zacks.com offers in-depth financial research with over 30years of proven results.,https://finnhub.io/api/news?id=05affe67ffc5e020d36d263b34600ea6096b00feca943f5aeb52cecf8d68c308
company,1627302240,Philip Morris Wants to Quit Cigarettes in the U.K. It Has a Plan.,69344449,,PM,Yahoo,"Philip Morris International will stop selling cigarettes in the U.K. 10 years from now. That might be a problem for a cigarette maker, but it has a plan.",https://finnhub.io/api/news?id=ce42e86483d7d6a0f3ad16397b48149226dd9de8030d06ea63405cc930ed82ed
company,1627299460,Philip Morris to end Marlboro cigarette sales in UK within a decade,69344450,,PM,Yahoo,"""I think in the UK, ten years from now maximum, you can completely solve the problem of smoking,"" Chief Executive Officer Jacek Olczak said in the report, adding that it would require the help of governments and regulators.  Doing its part, Olczak said the Marlboro brand ""will disappear"" from British store shelves along with its other brands, ending a more than 100-year association with the country.  Olczak, who has embarked on a more aggressive strategy to diversify the world's largest tobacco company away from cigarettes, has previously https://www.telegraph.co.uk/business/2021/07/24/marlboro-maker-calls-cigarette-ban-britain called on Britain to treat cigarettes like petrol cars and ban them in 10 years time.",https://finnhub.io/api/news?id=dc1621362602f592292af5cff1c6a0dc32914da955f9704b9397e45c425ec4e0
company,1627297440,Wall Street in Fives - Must Read Lists at Midday,69331106,https://image.thefly.com/catalog/201810/img_66.png,PM,Thefly.com,"Five top five lists with the news and calls moving stocks, powered by The Fly. AON, WLTW, MDLA, AMZN, BITCOIN, $BTC, TAL, EDU, GOTU, ZME, COE, DAO, ONE, PM, HOOD, GM, F, OTLY, RIDE, SWN, ATIP, DNLI, BILI, PKI, HAS, LMT, CHKP, PHG, MOR, SIX, DISH, GPS, LOW, TCEHY, TME, KTOS, BTC",https://finnhub.io/api/news?id=bfc95089795c31c02cae091554e9fa18ebd656c5e86ad791a3104a2dca3116f0
company,1627287778,What to watch today: Dow futures cut sharp overnight losses after Friday's records,69327683,https://image.cnbcfm.com/api/v1/image/106880759-1620673987322-gettyimages-1232810219-AFP_99P42Y.jpeg?v=1620674060,PM,CNBC,"Dow futures dropped Monday, cutting losses of nearly 300 points overnight, as stocks in Hong Kong and China plunged.",https://finnhub.io/api/news?id=e01fd9c593a5541ccabf57bc80e1cc8d57afe79a462a343f58029bb024425122
company,1627285760,Marlboro maker Philip Morris says it may stop selling cigarettes in Britain within 10 years,69370594,https://image.cnbcfm.com/api/v1/image/106916617-1627298195416-gettyimages-1124898468-G2149494.jpeg?v=1627298244,PM,CNBC,"""I want to allow this company to leave smoking behind,"" Philip Morris CEO Jacek Olczak said in an interview with the Mail on Sunday.",https://finnhub.io/api/news?id=f61c1db24a41e81bbd9429013659519b99864002b7475f5bfea2b9e108def9e1
company,1627284600,Philip Morris International CEO Vows to Stop Selling Cigarettes in the U.K.,69344451,,PM,Yahoo,Philip Morris International CEO pledges to stop selling cigarettes in the U.K. within a decade as the company moves toward becoming a 'healthcare and wellness company.',https://finnhub.io/api/news?id=6061f1117b300157525fd432b3a2012c9ae380bd8beace25d09fd1e5bfe64dd4
company,1627275960,"Philip Morris to stop selling cigarettes in UK within 10 years, Daily Mail says",69323058,,PM,Thefly.com,Philip Morris will stop s... PM,https://finnhub.io/api/news?id=b5a0bf3b9d612bcedde63995c9b36097b54040a53af8ef7aa6dd801120e2a3d2
company,1627270380,Wall Street in Fives - Must Read Lists for Monday,69331110,https://image.thefly.com/catalog/201904/img_457.jpg,PM,Thefly.com,"Five top five lists with the news and calls moving stocks, powered by The Fly. JNJ, AON, WLTW, PFE, BNTX, MRNA, MDLA, AMZN, TCEHY, TME, BITCOIN, BTC, $BTC, PKI, TAL, EDU, GOTU, ZME, COE, DAO, ONE, SIX, DISH, LOW, GPS, KTOS, PM, NFLX, NTDOY, SWN, ATIP, ITRM, DNLI, HAS, LMT, CHKP, PHG, MOR, GM, F",https://finnhub.io/api/news?id=2f342ffd29f1c8f8c824445a169da46a07dfa3bad0b217884356bdd9a54c10ac
company,1627267980,Philip Morris to Curb Cigarette Sales in the UK,69334730,https://static.gurufocus.com/logos/0C00000ZNN.png,PM,GuruFocus,Company seeks to revolutionize tobacco consumption,https://finnhub.io/api/news?id=22d16e54f59e308ff48e613dc39c636bed612e0ee80cd57921fa9c5e9c88daa6
company,1627171200,Philip Morris to stop selling Marlboro cigarettes in UK within 10 years,69316437,,PM,Yahoo,"The iconic Marlboro cigarette brand will disappear from UK shelves within 10 years, the chief executive of tobacco group Philip Morris International has said.  Jacek Olczak, who has committed Philip Morris to a diversification strategy more radical than most of its global peers, said the “problem of smoking” could be solved in the UK within “10 years maximum”, though he and others have stressed that this can only happen as part of a broader effort supported by regulation.  The Marlboro brand, once marketed as a women’s cigarette but made famous by “Marlboro man” advertising campaigns featuring rugged outdoorsy types, “will disappear”.",https://finnhub.io/api/news?id=6c891ac85ad1fac455e4ff23c76a31607a8005a5d700cdc288dc431b3b009479
company,1627121160,5 High-Yield Dividend Stocks to Buy Right Now That'll Help You Crush Inflation,69305797,https://s.yimg.com/uu/api/res/1.2/CwUtvMcmbHlc.v..ByKGsA--~B/aD05MzM7dz0xNDAwO2FwcGlkPXl0YWNoeW9u/https://media.zenfs.com/en/motleyfool.com/b8acb60bfa5bdf03ae10f7e8f91d35ca,PM,Yahoo,"At the moment, none seems to be stirring more of a buzz than inflation.  Earlier this month, the Bureau of Labor Statistics reported that 12-month inflation, as measured by the Consumer Price Index for All Urban Consumers (CPI-U) was 5.4% in June 2021.",https://finnhub.io/api/news?id=b26417250a45f9433785083683cf43cb1d23c470eb43b2ead29091658de5b2e2
company,1627111084,Here's Why 8.6%-Yielding Imperial Brands Is A Strong Buy,69305808,,PM,SeekingAlpha,,https://finnhub.io/api/news?id=d7638f692fc564644db5d592d9a79faffdcfbf53cc166d6406897bad725037a0
company,1627110000,Philip Morris: A 'Sin Stock' That's Hard Not To Love,69305724,https://static.seekingalpha.com/cdn/s3/uploads/getty_images/459009137/medium_image_459009137.jpg,PM,SeekingAlpha,"In today’s market, it’s incredibly difficult to find very high quality companies that have safe and growing dividends that also trade with fair (or better) valuations.",https://finnhub.io/api/news?id=a97dd5d0bab4a9434088b31534844aee24cfff05fa3a413096982f456f866dfc
company,1627051500,Altria Reports Next Week. Here’s What to Expect.,69292449,,PM,Yahoo,The tobacco maker has seen its shares move largely sideways since late April on worries about additional regulation on nicotine in the U.S.,https://finnhub.io/api/news?id=961306707e84cc4e3ef79b1d3fb4b122d18c146938876da729089b0f1695e00d
