category,datetime,headline,id,image,related,source,summary,url
company,1621793580,"RNP: Attractive Long-Term Winner, But Looking Expensive",67910421,https://static.seekingalpha.com/cdn/s3/uploads/getty_images/513232938/medium_image_513232938.jpg,SBAC,SeekingAlpha,"Cohen & Steers REIT & Preferred Income Fund has been moving higher in 2021. The market overall seems relatively expensive, and this fund even more so looking at its historical discount.",https://finnhub.io/api/news?id=eadf4cede5031b8767acff4975564c8fb380243663a2c62e2b3388870cca5deb
company,1621688400,Crypto Crackdown Drives Bid For Real Assets,67904095,https://static.seekingalpha.com/cdn/s3/uploads/getty_images/1224823838/medium_image_1224823838.jpg,SBAC,SeekingAlpha,U.S. equity markets retreated on another turbulent week. Click here to read the housing data for last week and three REITs that boosted their dividends.,https://finnhub.io/api/news?id=5af77bae3ff230210c910f56abeca650486d6826148129cf18c770a59058b9d1
company,1621594503,iShares U.S. Real Estate ETF Experiences Big Outflow,67914194,https://www.nasdaq.com/sites/acquia.prod/files/2019-05/0902-Q19%20Total%20Markets%20photos%20and%20gif_CC8.jpg?1735515131,SBAC,Nasdaq,"Looking today at week-over-week shares outstanding changes among the universe of ETFs covered at ETF Channel, one standout is the iShares U.S. Real Estate ETF (Symbol: IYR) where we have detected an approximate $226.5 million dollar outflow -- that's a 4.3% decrease week over w",https://finnhub.io/api/news?id=2837cb9469407e576572e910c2ee01cc076d8dad8870bf6e6a93b79160d11a6d
company,1621328403,"SBA Communications Corporation (SBAC) Ex-Dividend Date Scheduled for May 19, 2021",67923483,https://www.nasdaq.com/sites/acquia.prod/files/2019-05/0902-Q19%20Total%20Markets%20photos%20and%20gif_CC8.jpg?1539122842,SBAC,Nasdaq,"SBA Communications Corporation (SBAC) will begin trading ex-dividend on May 19, 2021. A cash dividend payment of $0.58 per share is scheduled to be paid on June 15, 2021.  Shareholders who purchased SBAC prior to the ex-dividend date are eligible for the cash dividend payment.  T",https://finnhub.io/api/news?id=b0f77c47ecd14f015c96b0b0807e36bad9f4aa07d00e04b35aab2560b7682469
company,1621248785,"Ex-Dividend Reminder: Cognizant Technology Solutions, SBA Communications and Microsoft",67876459,https://www.nasdaq.com/sites/acquia.prod/files/2019-05/0902-Q19%20Total%20Markets%20photos%20and%20gif_CC8.jpg?491167571,SBAC,Nasdaq,"Looking at the universe of stocks we cover at Dividend Channel, on 5/19/21, Cognizant Technology Solutions Corp. (Symbol: CTSH), SBA Communications Corp  (Symbol: SBAC), and Microsoft Corporation (Symbol: MSFT) will all trade ex-dividend for their respective upcoming dividends.",https://finnhub.io/api/news?id=624783c3459a33b8840cc8f231cf5d64277fe6260cfea9b402a3ac424e3d0709
company,1621055516,Tracking Akre Capital Management Portfolio - Q1 2021 Update,67851754,https://static.seekingalpha.com/cdn/s3/uploads/getty_images/1275708831/medium_image_1275708831.jpg,SBAC,SeekingAlpha,Akre Capital Management portfolio value decreased marginally from $14.80B to $14.72B this quarter. Read more to know the new stakes and disposals in the portfolio.,https://finnhub.io/api/news?id=fd1974e82da819ae4659f45c3113f653b55e8065992b5b4f70a86b5fa5d4a4f2
company,1621012800,SBA Communications Corp. stock outperforms competitors on strong trading day,67863851,https://images.mktw.net/im-220105/social,SBAC,MarketWatch,"Shares of SBA Communications Corp. advanced 1.92% to $288.62 Friday, on what proved to be an all-around favorable trading session for the stock market, with...",https://finnhub.io/api/news?id=181fdd8ac7d25951c27d48631cbe8a7d5c3f12e7b90d9e265c9801a27fc8e061
company,1620990000,REIT Earnings Recap: Inflation Overshadows Strong Quarter,67838074,https://static.seekingalpha.com/cdn/s3/uploads/getty_images/1220350688/medium_image_1220350688.jpg,SBAC,SeekingAlpha,"Overshadowed by concerns about rising inflation, a frenzy of real estate earnings reports over the last month has provided critical information on the state of the real estate industry.",https://finnhub.io/api/news?id=18c72a1dd731f1699ef1991d7bd32e0211a3c7d42b6e4e8b5c18819b6f507bd5
company,1620975600,"Masks Off, Dividends Up",67834930,https://static.seekingalpha.com/cdn/s3/uploads/getty_images/1253967686/medium_image_1253967686.jpg,SBAC,SeekingAlpha,In celebration of the continued signs of recovery – and my much-anticipated trip to West Palm Beach next week – I decided to put together a “high-flyer” list.,https://finnhub.io/api/news?id=cfa5283f62e6339a212383409266ffaa263869d944e49b75cceadd0d8d6b0572
company,1620926400,SBA Communications Corp. stock underperforms Thursday when compared to competitors,67863852,https://images.mktw.net/im-220105/social,SBAC,MarketWatch,"Shares of SBA Communications Corp. shed 0.38% to $283.17 Thursday, on what proved to be an all-around positive trading session for the stock market, with the...",https://finnhub.io/api/news?id=f58d553f94e21c0c03c6cd5f382e1417482fd56ee6577d1aea24e8e14fa6e669
company,1620840000,SBA Communications Corp. stock underperforms Wednesday when compared to competitors,67808989,https://images.mktw.net/im-220105/social,SBAC,MarketWatch,"Shares of SBA Communications Corp. shed 2.47% to $284.25 Wednesday, on what proved to be an all-around rough trading session for the stock market, with the...",https://finnhub.io/api/news?id=ad0301f6b1402eab0108b0dac04d711fcab4b689398b1c963ade79c4a4d6e3ac
company,1620805182,Look Under The Hood: IVW Has 13% Upside,67770962,https://www.nasdaq.com/sites/acquia.prod/files/2019-05/0902-Q19%20Total%20Markets%20photos%20and%20gif_CC8.jpg?2079047022,SBAC,Nasdaq,"Looking at the underlying holdings of the ETFs in our coverage universe at ETF Channel, we have compared the trading price of each holding against the average analyst 12-month forward target price, and computed the weighted average implied analyst target price for the ETF itsel",https://finnhub.io/api/news?id=bc456b857d2c48e79dfea37ebbbbaa4dd0af3472395fd6a00cd7ef9559c79878
company,1620753600,SBA Communications Corp. stock outperforms competitors despite losses on the day,67764044,https://images.mktw.net/im-220105/social,SBAC,MarketWatch,"Shares of SBA Communications Corp. slumped 0.21% to $291.45 Tuesday, on what proved to be an all-around grim trading session for the stock market, with the...",https://finnhub.io/api/news?id=0bb8199958c0a2900fff29ad91ef85f011bad313af990171df27e23daf81a9cb
company,1620745620,"SBA Communications Corporation to Speak at the J.P. Morgan Technology, Media and Communications Conference",67748309,https://s.yimg.com/cv/apiv2/social/images/yahoo_default_logo-1200x1200.png,SBAC,Yahoo,"SBA Communications Corporation (NASDAQ: SBAC) (""SBA"") announces that Jeffrey A. Stoops, President and Chief Executive Officer, is scheduled to speak at the J.P. Morgan Technology, Media and Communications Conference on Tuesday, May 25, 2021 at 11:45am ET. This will be a virtual conference. The audio presentation for SBA can be accessed by visiting www.sbasite.com.",https://finnhub.io/api/news?id=8e6479b7f11cca25685e3ffad22d7c1ac4c656ffe5c8626e938a1dc1c8d1b61d
company,1620706746,"Introducing SBA Communications (NASDAQ:SBAC), The Stock That Zoomed 192% In The Last Five Years",67754719,https://www.nasdaq.com/sites/acquia.prod/files/2019-05/0902-Q19%20Total%20Markets%20photos%20and%20gif_CC8.jpg?653709624,SBAC,Nasdaq,"When you buy a stock there is always a possibility that it could drop 100%.  But on a lighter note, a good company can see its share price rise well over 100%.  One great example is SBA Communications Corporation (NASDAQ:SBAC) which saw its share price drive 192% higher over fiv",https://finnhub.io/api/news?id=a6d2444db95ae1a9b458d3d709007e95fe2283cf56e3d9a7caa2edce2bf80b06
company,1620681234,Was The Smart Money Right About SBA Communications (SBAC)?,67725626,https://s.yimg.com/uu/api/res/1.2/iyZi_FVUxy28x5e1e6ucvA--~B/aD02MDA7dz00NzM7YXBwaWQ9eXRhY2h5b24-/https://media.zenfs.com/en/insidermonkey.com/c208ca9290f49ee5e98eba7204827e4f,SBAC,Yahoo,"In this article we will take a look at whether hedge funds think SBA Communications Corporation (NASDAQ:SBAC) is a good investment right now. We check hedge fund and billionaire investor sentiment before delving into hours of research. Hedge funds spend millions of dollars on Ivy League graduates, unconventional data sources, expert networks, and get tips […]",https://finnhub.io/api/news?id=8fc39a53b8fef1de7b71158221d4aca477aa6879e0d308e7adefa7ae375336cf
company,1620667200,"SBA Communications Corp. stock rises Monday, outperforms market",67764045,https://images.mktw.net/im-220105/social,SBAC,MarketWatch,"Shares of SBA Communications Corp. inched 0.40% higher to $292.06 Monday, on what proved to be an all-around dismal trading session for the stock market,...",https://finnhub.io/api/news?id=e3434fc0bb09736800798325c5f2dde471581c33a8b48df4583c2d27db204299
company,1620408000,SBA Communications Corp. stock underperforms Friday when compared to competitors,67696780,https://images.mktw.net/im-220105/social,SBAC,MarketWatch,"Shares of SBA Communications Corp. slumped 0.22% to $290.91 Friday, on what proved to be an all-around favorable trading session for the stock market, with...",https://finnhub.io/api/news?id=ea45155c9caf807f059902a21bba0184ad369dde0d9f4cd45c228fc7ac734c68
company,1620321600,"SBA Communications Corp. stock falls Thursday, underperforms market",67653562,https://images.mktw.net/im-220105/social,SBAC,MarketWatch,"Shares of SBA Communications Corp. shed 0.90% to $291.55 Thursday, on what proved to be an all-around favorable trading session for the stock market, with...",https://finnhub.io/api/news?id=45796ac560f021f2bf791eba7aad97b741ef28d7d71f6c19706765f97e1b32ac
company,1620235200,"SBA Communications Corp. stock falls Wednesday, underperforms market",67653564,https://images.mktw.net/im-220105/social,SBAC,MarketWatch,"Shares of SBA Communications Corp. slumped 0.91% to $294.21 Wednesday, on what proved to be an all-around favorable trading session for the stock market,...",https://finnhub.io/api/news?id=c91525781d6a3d94afd49b12345cff760f4b68fba088f8735a2f95554df35e3f
company,1620148800,"SBA Communications Corp. stock falls Tuesday, still outperforms market",67519530,https://images.mktw.net/im-220105/social,SBAC,MarketWatch,"Shares of SBA Communications Corp. shed 0.59% to $296.90 Tuesday, on what proved to be an all-around mixed trading session for the stock market, with the Dow...",https://finnhub.io/api/news?id=e737938c116ebca467636386d7b583c4c9668e3919178b11afe1b50e23652d64
company,1620127800,Beat And Boost: REIT Earnings Halftime Report,67459367,https://static.seekingalpha.com/cdn/s3/uploads/getty_images/1215119911/medium_image_1215119911.jpg,SBAC,SeekingAlpha,We're now at the halfway point of another newsworthy REIT earnings season. The major themes this quarter have been Beat and Boost and the revival of long-dormant Animal Spirits.,https://finnhub.io/api/news?id=535f147aa32854402e6db0567dfe14a52446abdd6b914006bc61d2ee7eecf583
company,1620062400,SBA Communications Corp. stock outperforms competitors despite losses on the day,67519532,https://images.mktw.net/im-220105/social,SBAC,MarketWatch,"Shares of SBA Communications Corp. slumped 0.35% to $298.66 Monday, on what proved to be an all-around favorable trading session for the stock market, with...",https://finnhub.io/api/news?id=a25e2dfcbdeb31078d17ad2596da48fb682ea3440272e840c801b0e7abcdd7a6
company,1620052648,Shareholders Are Thrilled That The SBA Communications (NASDAQ:SBAC) Share Price Increased 197%,67382672,https://s.yimg.com/uu/api/res/1.2/0jRv83_m03r05H0SZtBfAw--~B/aD00MzI7dz0xMTk0O2FwcGlkPXl0YWNoeW9u/https://media.zenfs.com/en/simply_wall_st__316/003f2dec604a7fb434c6feb185af4674,SBAC,Yahoo,"When you buy a stock there is always a possibility that it could drop 100%. But on the bright side, you can make far...",https://finnhub.io/api/news?id=62033c4dc453a8a4f64b7e35e177b24f8fc81af1aad07b10b70d8d78801a2a5d
company,1619877600,Mergers And Earnings Lift REITs,67213387,https://static.seekingalpha.com/cdn/s3/uploads/getty_images/1225158464/medium_image_1225158464.jpg,SBAC,SeekingAlpha,The U.S. equity market rally stalled this past week as intensifying COVID issues in India and domestic inflationary concerns offset a stellar slate of corporate earnings reports and...,https://finnhub.io/api/news?id=cb7dcf5e7fb0b194dc410338af6d188ce098ebc09cd59fdba5d4ff726609395d
company,1619803200,"SBA Communications Corp. stock rises Friday, outperforms market",67258173,https://images.mktw.net/im-220105/social,SBAC,MarketWatch,"Shares of SBA Communications Corp. inched 0.55% higher to $299.72 Friday, on what proved to be an all-around dismal trading session for the stock market,...",https://finnhub.io/api/news?id=2a0a48b741a10767e242b7299e9c09103eb6b30b4ea373989ad79ba4b0d968db
company,1619716800,"SBA Communications Corp. stock rises Thursday, still underperforms market",67132068,https://images.mktw.net/im-220105/social,SBAC,MarketWatch,"Shares of SBA Communications Corp. inched 0.07% higher to $298.08 Thursday, on what proved to be an all-around favorable trading session for the stock...",https://finnhub.io/api/news?id=649c92111ca048174070d561ffac412731e5ee271a09b181b3d84ca28ba8cbe0
company,1619678460,3 Stocks to Supplement Your Social Security Income,67109502,https://www.nasdaq.com/sites/acquia.prod/files/2019-05/0902-Q19%20Total%20Markets%20photos%20and%20gif_CC8.jpg?472360816,SBAC,Nasdaq,"Social Security income can be a welcome arrival every month, but investors may want a little more to supplement it. If you're looking for additional income that's steady without sacrificing the possibility of gains, you might want to try the real estate investment trust (REIT) se",https://finnhub.io/api/news?id=be9fe330c050dd39488ff18657ec4261078fe57c88595706537813d94f9eaa1b
company,1619630460,"SBA Communications Corp. stock rises Wednesday, outperforms market",67132069,https://images.mktw.net/im-220105/social,SBAC,MarketWatch,"Shares of SBA Communications Corp. rose 1.05% to $297.88 Wednesday, on what proved to be an all-around dismal trading session for the stock market, with the...",https://finnhub.io/api/news?id=bf3a13f12123358c79791f6d12c6fad35e18a6116bceebfeab0d8f935e4d8b73
company,1619624760,SBA Communications Corporation to Speak at the Eighth Annual MoffettNathanson Media and Communications Summit,67112984,https://s.yimg.com/cv/apiv2/social/images/yahoo_default_logo-1200x1200.png,SBAC,Yahoo,"SBA Communications Corporation (NASDAQ: SBAC) (""SBA"") announces that Brendan Cavanagh, Chief Financial Officer, is scheduled to speak at the Eighth Annual MoffettNathanson Media and Communications Summit on Wednesday, May 12, 2021 at 10:00am ET. This will be a virtual conference. The audio presentation for SBA can be accessed by visiting www.sbasite.com.",https://finnhub.io/api/news?id=1a56a4e5c5635ed39c7274201061e0487828cf8055e49351e3462390a3d54dcf
company,1619607461,"Notable ETF Inflow Detected - XLRE, SBAC, WY, CBRE",66970738,https://www.nasdaq.com/sites/acquia.prod/files/2019-05/0902-Q19%20Total%20Markets%20photos%20and%20gif_CC8.jpg?961793360,SBAC,Nasdaq,"Looking today at week-over-week shares outstanding changes among the universe of ETFs covered at ETF Channel, one standout is the The Real Estate Select Sector SPDR— Fund (Symbol: XLRE) where we have detected an approximate $114.3 million dollar inflow -- that's a 4.1% in",https://finnhub.io/api/news?id=38943a11df192298ce99748c3f36507d128793be859f45fdb8cc8d331a16dd6a
company,1619544060,"SBA Communications Corp. stock falls Tuesday, underperforms market",66858223,https://images.mktw.net/im-220105/social,SBAC,MarketWatch,"Shares of SBA Communications Corp. shed 0.67% to $294.78 Tuesday, on what proved to be an all-around mixed trading session for the stock market, with the Dow...",https://finnhub.io/api/news?id=c5cbd06b31807b49188a5aa71efb7128af0a4ec9e9e265ee51db29e8a9964e1d
company,1619539746,SBA Tower Trust -- Moody's assigns (P)A2 (sf) rating to SBA Communication's wireless tower-backed securities,66910449,https://s.yimg.com/cv/apiv2/social/images/yahoo_default_logo-1200x1200.png,SBAC,Yahoo,"Rating Action: Moody's assigns (P)A2 (sf) rating to SBA Communication's wireless tower-backed securitiesGlobal Credit Research - 27 Apr 2021New York, April 27, 2021 -- Moody's Investors Service (Moody's) has assigned a provisional rating to the Series 2021-1 secured tower revenue securities, subclass 2021-1C (the 2021 securities) to be issued by SBA Tower Trust, a New York Common Law Trust (the issuer).  The collateral backing the securitization will be a mortgage loan made by the issuer to the borrowers.",https://finnhub.io/api/news?id=412f201644ca7198c94627fad80f1d3006935156cde2d919d74a9ef2600d833c
company,1619539680,Dividend Increases: 15 Stocks Announcing Massive Hikes,66731362,https://www.nasdaq.com/sites/acquia.prod/files/2019-05/0902-Q19%20Total%20Markets%20photos%20and%20gif_CC8.jpg?1108133447,SBAC,Nasdaq,"While sometimes not the highest yielders, dividend growth stocks, known for steady dividend increases over time, can be valuable additions to your income portfolio.",https://finnhub.io/api/news?id=fe22903656abb51e74bc41818cb61a876ce6345713916378cb4f95244b4b6615
company,1619531101,"SBA Communications (SBAC) Tops on Q1 AFFO, Ups '21 Guidance",66910455,https://s.yimg.com/uu/api/res/1.2/ShfhwtDyA2WzDBKdAL7M8Q--~B/aD00MDA7dz02MzU7YXBwaWQ9eXRhY2h5b24-/https://media.zenfs.com/en/zacks.com/6f2cab89bf2cbad1966358e04258e202,SBAC,Yahoo,Substantial growth in both services and leasing businesses aid SBA Communications' (SBAC) strong Q1 results. Robust leasing activity level enables it to increase the 2021 outlook.,https://finnhub.io/api/news?id=cc81d9d057c11c084d5e99d8873e4d08d32d8ae301f309e8ca897c32cd48c70b
company,1619490646,SBA Communications Corp (SBAC) Q1 2021 Earnings Call Transcript,66631817,,SBAC,Yahoo,"SBAC earnings call for the period ending March 31, 2021.",https://finnhub.io/api/news?id=ff55dbb77f8187b7189720072d9cded2d87abf6c3774979a76df614e7e77cbc8
company,1619482446,SBA Communications Corporation (SBAC) CEO Jeff Stoops on Q1 2021 Results - Earnings Call Transcript,66528481,https://static.seekingalpha.com/assets/og_image_1200-29b2bfe1a595477db6826bd2126c63ac2091efb7ec76347a8e7f81ba17e3de6c.png,SBAC,SeekingAlpha,"SBA Communications Corporation (NASDAQ:SBAC) Q1 2021 Results Earnings Conference Call April 26, 2021, 5:00 pm ET Company Participants Mark DeRussy - Vice President of Finance Brendan...",https://finnhub.io/api/news?id=8be262826d7d43bc57ef93e08fbe0f9fe6d9dd67d731eb5dfe793c70142f9aed
company,1619476246,SBA Communications Corp (SBAC) Q1 2021 Earnings Call Transcript,66602045,https://www.nasdaq.com/sites/acquia.prod/files/2019-05/0902-Q19%20Total%20Markets%20photos%20and%20gif_CC8.jpg?1464759555,SBAC,Nasdaq,Image source: The Motley Fool.,https://finnhub.io/api/news?id=e0512ececdbf96366444967218698dfe6bf20982e2086feeebd2e1d973aa12a8
company,1619471709,SBA Communications (SBAC) Tops Q1 FFO and Revenue Estimates,66631821,https://s.yimg.com/uu/api/res/1.2/132juehTNIyEUn7pK7.GPA--~B/aD01MDY7dz05MDA7YXBwaWQ9eXRhY2h5b24-/https://media.zenfs.com/en/zacks.com/3d7c5b2146ac04ffd51752e17ff2a619,SBAC,Yahoo,"SBA Communications (SBAC) delivered FFO and revenue surprises of 5.31% and 2.42%, respectively, for the quarter ended March 2021. Do the numbers hold clues to what lies ahead for the stock?",https://finnhub.io/api/news?id=0caf856160a0d6d7be4738646fadc986790e75e26681cccaa03903ae145a7ac6
company,1619467260,SBA Communications Corporation Reports First Quarter 2021 Results; Updates Full Year 2021 Outlook; and Declares Quarterly Cash Dividend,66631824,https://s.yimg.com/cv/apiv2/social/images/yahoo_default_logo-1200x1200.png,SBAC,Yahoo,"SBA Communications Corporation (Nasdaq: SBAC) (""SBA"" or the ""Company"") today reported results for the quarter ended March 31, 2021.",https://finnhub.io/api/news?id=ca688a08ff21d4895786f49f784bb1a1033f2d785bb1096e0cfe8c846edacced
company,1619464500,SBA Communications Corp. to Host Earnings Call,66631828,https://s.yimg.com/cv/apiv2/social/images/yahoo_default_logo-1200x1200.png,SBAC,Yahoo,"NEW YORK, NY / ACCESSWIRE / April 26, 2021 / SBA Communications Corp. (NASDAQ:SBAC) will be discussing their earnings results in their 2021 First Quarter Earnings call to be held on April 26, 2021 at 5:00 PM Eastern Time.",https://finnhub.io/api/news?id=defd4ee4413a3135f01ec9d7205b1d4af7770fbd417ce878922334442ef60c9c
company,1619457600,"SBA Communications Corp. stock rises Monday, still underperforms market",66506733,https://images.mktw.net/im-220105/social,SBAC,MarketWatch,"Shares of SBA Communications Corp. inched 0.10% higher to $296.78 Monday, on what proved to be an all-around mixed trading session for the stock market, with...",https://finnhub.io/api/news?id=636a00ca22010486e16dd9b5b1103cc113975f828fb30bac66b29dc2848a3899
company,1619453997,EARNINGS SUMMARY: Details of SBA Communications Corporation Q1 Earnings Report,66494871,https://www.nasdaq.com/sites/acquia.prod/files/2019-05/0902-Q19%20Total%20Markets%20photos%20and%20gif_CC8.jpg?1022457159,SBAC,Nasdaq,"(RTTNews) - Below are the earnings highlights for SBA Communications Corporation (SBAC):-Earnings: -$11.75 million in Q1 vs. -$127.06 million in the same period last year. 
-EPS: -$0.11 in Q1 vs. -$1.14 in the same period last year. 
-Analysts projected $0.34 per share 
-Revenue:",https://finnhub.io/api/news?id=f90d3b7f6dae4f2d518e3f7ad92d0711a1ac181fe256039ca132cc15e546a231
company,1619445607,"After-Hours Earnings Report for April 26, 2021 :  TSLA, CNI, NXPI, CDNS, SBAC, AMP, ARE, SSNC, SUI, BRO, MASI, PKG",66432148,https://www.nasdaq.com/sites/acquia.prod/files/2019-05/0902-Q19%20Total%20Markets%20photos%20and%20gif_CC8.jpg?203523320,SBAC,Nasdaq,"The following companies are expected to report earnings after hours on 04/26/2021.  Visit our Earnings Calendar for a full list of expected earnings releases.Tesla, Inc.  (TSLA) is reporting for the quarter ending March 31, 2021. The auto (domestic) company's consensus earnings p",https://finnhub.io/api/news?id=95a6816463551f541471483cd819ce9ae3bac7bcd6e223fa07299825f43ac8f7
company,1619420400,Who's Buying Into America's Largest Landlords,66357589,https://static.seekingalpha.com/cdn/s3/uploads/getty_images/1214224199/medium_image_1214224199.jpg,SBAC,SeekingAlpha,"I don’t frown on VNQ, because many investors are just way to busy to carefully analyze every stock they’re buying.",https://finnhub.io/api/news?id=c23f4a9e38156ea7700cf94820e9b73171f787508e5fcef174d017a31cfbc080
company,1619416921,SBA Communications Q1 21 Earnings Conference Call At 5:00 PM ET,66359592,https://www.nasdaq.com/sites/acquia.prod/files/2019-05/0902-Q19%20Total%20Markets%20photos%20and%20gif_CC8.jpg?484302531,SBAC,Nasdaq,"(RTTNews) - SBA Communications Corporation (SBAC) will host a conference call at 5:00 PM ET on April 26, 2021, to discuss Q1 21 earnings results.To access the live webcast, log on to https://ir.sbasite.com/news-and-events/default.aspx",https://finnhub.io/api/news?id=ec71606aa631e54c31cbdb188e8fbbad0e80c1ad2391e9d3a1ff94010c488a70
company,1619411040,"Earnings Scheduled For April 26, 2021",66798213,https://cdn.benzinga.com/files/imagecache/og_image_social_share_1200x630/images/story/2012/earnings_scheduled_1848.png,SBAC,Benzinga," 
Companies Reporting Before The Bell
• Albertsons Companies (NYSE:ACI) is projected to report quarterly earnings at $0.51 per share on revenue of $15.63 billion....",https://finnhub.io/api/news?id=06d181ef038201c710302b6f5d474b5051e419469ad059ea7fe2e91a4070f04f
company,1619272800,REITs Rally Despite Tax Hike Fears,66236040,https://static.seekingalpha.com/cdn/s3/uploads/getty_images/1267010934/medium_image_1267010934.jpg,SBAC,SeekingAlpha,U.S. equity markets closed on the cusp of record-highs as a strong slate of housing data and corporate earnings reports offset concerns over President Biden's proposed capital gains tax...,https://finnhub.io/api/news?id=876270dcce4e674b4d7e510cd262a117f130224b6aed9b1d9091847025e00a56
company,1619198460,"SBA Communications Corp. stock rises Friday, still underperforms market",66202776,https://images.mktw.net/im-220105/social,SBAC,MarketWatch,"Shares of SBA Communications Corp. inched 0.65% higher to $296.49 Friday, on what proved to be an all-around positive trading session for the stock market,...",https://finnhub.io/api/news?id=34cb227ee41173b1ce8b9795310c845ac79bc199518bd29be9fb7aceece249be
company,1619186642,"REITs Queued for Q1 Earnings on April 26: SBAC, ARE and More",66256021,https://s.yimg.com/uu/api/res/1.2/enpO1L15BvRY6mpAhoKIXw--~B/aD00MDA7dz02MzU7YXBwaWQ9eXRhY2h5b24-/https://media.zenfs.com/en/zacks.com/44dafb54d965d1f7a00017a0cd2e1b76,SBAC,Yahoo,"The pandemic-induced economic disruption and its impact have widely varied across different property types and hence, delving deeper into the asset fundamentals and markets of each REIT becomes all the more important.",https://finnhub.io/api/news?id=23578cfb8d9c6c882047f22a23f28b2bced8d7c931423eb2e844b6cea31d4ef8
company,1619112000,SBA Communications Corp. stock outperforms market on strong trading day,66202777,https://images.mktw.net/im-220105/social,SBAC,MarketWatch,"Shares of SBA Communications Corp. rallied 1.11% to $294.57 Thursday, on what proved to be an all-around dismal trading session for the stock market, with...",https://finnhub.io/api/news?id=31f0009b6cf5c15393a417c52d32bc85b30083a2b1dcced451b32a3be80de19f
