category,datetime,headline,id,image,related,source,summary,url
company,1619094732,Should You Buy SBA Communications (SBAC) Ahead of Earnings?,66321253,https://s.yimg.com/uu/api/res/1.2/PHAQWn.zDysu9O2JdCx9fg--~B/aD00MDA7dz02MzU7YXBwaWQ9eXRhY2h5b24-/https://media.zenfs.com/en/zacks.com/c04fa10cfb24515e5fe8fc912bd81a3a,SBAC,Yahoo,SBA Communications (SBAC) is seeing favorable earnings estimate revision activity and has a positive Zacks Earnings ESP heading into earnings season.,https://finnhub.io/api/news?id=b891994fde4e690dd4a987493347b71de8ed5fb3b8bda5c1bc45f79c8d9d5b93
company,1619093700,REIT Dividend Revival: Earnings Preview,66194304,https://static.seekingalpha.com/cdn/s3/uploads/getty_images/1225158464/medium_image_1225158464.jpg,SBAC,SeekingAlpha,"Real estate earnings season kicks off this week. We'll see results from more than 175 equity REITs, 40 mortgage REITs, and dozens of housing industry companies over the next month.",https://finnhub.io/api/news?id=191f4401432b596f99820ad66683e7b251e1cb9ec763baa77b14d7231bab7b64
company,1619025600,SBA Communications Corp. stock underperforms Wednesday when compared to competitors,66202778,https://images.mktw.net/im-220105/social,SBAC,MarketWatch,"Shares of SBA Communications Corp. slipped 0.23% to $291.35 Wednesday, on what proved to be an all-around great trading session for the stock market, with...",https://finnhub.io/api/news?id=c7bf8883ff7d32fd3ecc1cc4913953e0237b9b5a18d37c2a305b0a69f1485821
company,1618939260,SBA Communications Corp. stock outperforms market on strong trading day,66202779,https://images.mktw.net/im-220105/social,SBAC,MarketWatch,"Shares of SBA Communications Corp. rose 1.36% to $292.02 Tuesday, on what proved to be an all-around rough trading session for the stock market, with the S&P...",https://finnhub.io/api/news?id=1d877534a14a940d846c38cfd54abe89392e84f8f280bd145a86e23d762b91e4
company,1618934283,How Will SBA Communications (SBAC) Fare in Q1 Earnings?,66321256,https://s.yimg.com/uu/api/res/1.2/LTdDqDt0KRpM0BrGzmBOcw--~B/aD00MDA7dz02MzU7YXBwaWQ9eXRhY2h5b24-/https://media.zenfs.com/en/zacks.com/416f88622c8713f3a64381edc3bde96e,SBAC,Yahoo,"Strength in site leasing, backed by aggressive network deployments by wireless carriers, is likely to have been a growth driver for SBA Communications (SBAC) in Q1.",https://finnhub.io/api/news?id=205ebc8a33d5deed3f721a2a6020e75698d320a8df8a6635652d1710668316af
company,1618921260,Mid-Day Market Update: Crude Oil Down 1.8%; Futu Holdings Shares Plunge,66181964,https://cdn.benzinga.com/files/imagecache/og_image_social_share_1200x630/sites/all/themes/bz2/images/bz-icon.png,SBAC,Benzinga,"Midway through trading Tuesday, the Dow traded down 0.68% to 33,846.89 while the NASDAQ fell 0.91% to 13,788.71. The S&P also fell, dropping 0.65% to 4,136.13.
The U.S. has...",https://finnhub.io/api/news?id=936ad7455f2e9722000819c1a42e1799bd988a38deafb864d1eeb4700d946f69
company,1618920734,"Tuesday's ETF Movers: ICF, OIH",68961228,https://www.nasdaq.com/sites/acquia.prod/files/2019-05/0902-Q19%20Total%20Markets%20photos%20and%20gif_CC8.jpg?738175177,SBAC,Nasdaq,"In trading on Tuesday, the iShares Cohen & Steers REIT ETF is outperforming other ETFs, up about 1.2% on the day.  Components of that ETF showing particular strength include shares of Prologis, up about 2.7% and shares of SBA Communications, up about 2.4% on the day.",https://finnhub.io/api/news?id=5f83f80ccd4e15de7f9f18999b4cebd407e64a6e9a5e23b7a493b6eeb04afbbb
company,1618852860,SBA Communications Corp. stock underperforms Monday when compared to competitors,66202780,https://images.mktw.net/im-220105/social,SBAC,MarketWatch,"Shares of SBA Communications Corp. slumped 0.08% to $288.09 Monday, on what proved to be an all-around poor trading session for the stock market, with the...",https://finnhub.io/api/news?id=9a6465d18b7f1c850bc29c9d6ab9f2004181755c388a98a67e290a6a8bcbf0f3
company,1618748820,Real Estate Remains Red-Hot,66168144,https://static.seekingalpha.com/cdn/s3/uploads/getty_images/1204331594/medium_image_1204331594.jpg,SBAC,SeekingAlpha,U.S. equity markets rallied to fresh record-highs past week as long-term interest rates and inflation expectations pulled back despite stellar slate of economic data and earnings reports,https://finnhub.io/api/news?id=4d848bea2d325bc36ff8c062adb69cd7db0ad5f120df1cc4d712e34857e5b04a
company,1618729200,"Alaska Sold Berkshire Hathaway, Oracle Stock; Bought Wireless-Tower Shares",66168607,https://images.barrons.com/im-326483/social,SBAC,MarketWatch,"Alaska’s Department of Revenue, which invests public funds, reduced investments in Berkshire Hathaway and Oracle stock, and bought American Tower, Crown...",https://finnhub.io/api/news?id=47dae8ef9b8c736a8752fa270e9c219828ef351d950dcc08e24ceb1148d42f72
company,1618593600,"SBA Communications Corp. stock falls Friday, underperforms market",66159622,https://images.mktw.net/im-220105/social,SBAC,MarketWatch,"Shares of SBA Communications Corp. sank 0.04% to $288.33 Friday, on what proved to be an all-around favorable trading session for the stock market, with the...",https://finnhub.io/api/news?id=7d9d7a13324931a077c96b324ebc9b91f0f8c536672c71a1bba0a61482f1b012
company,1618563600,Healthcare REITs: Vaccines Avert Dark Decade,66155076,https://static.seekingalpha.com/cdn/s3/uploads/getty_images/1291182090/medium_image_1291182090.jpg,SBAC,SeekingAlpha,"Healthcare REITs have been revived by the early vaccination success. Risks remain, but long-term fundamentals remain more compelling than other troubled property sectors.",https://finnhub.io/api/news?id=e4ff5584e2a4d1c41ce81264a2def00c401b53e199258236c6a02bb2e5fb0a98
company,1618507200,SBA Communications Corp. stock outperforms competitors on strong trading day,66159623,https://images.mktw.net/im-220105/social,SBAC,MarketWatch,"Shares of SBA Communications Corp. advanced 2.64% to $288.44 Thursday, on what proved to be an all-around great trading session for the stock market, with...",https://finnhub.io/api/news?id=598bb6bbf9704a01eaf685cb6104250abe55659b72ad3ab10f3611db562c7f00
company,1618504434,SBA Communications Breaks Above 200-Day Moving Average - Bullish for SBAC,69163665,https://www.nasdaq.com/sites/acquia.prod/files/2019-05/0902-Q19%20Total%20Markets%20photos%20and%20gif_CC8.jpg?964832604,SBAC,Nasdaq,"In trading on Thursday, shares of SBA Communications Corp  (Symbol: SBAC) crossed above their 200 day moving average of $288.15, changing hands as high as $288.95 per share.  SBA Communications Corp  shares are currently trading up about 2.6% on the day.  The chart below shows",https://finnhub.io/api/news?id=0f43b6aef7a5a079b1fba1d011a7cc74d936f015e05386e6f323ce351b32a0a8
company,1618495916,10 Best Telecom Dividend Stocks to Buy Now,66321260,https://s.yimg.com/uu/api/res/1.2/CipA1_oxwg7sksPbPma55g--~B/aD02MDA7dz0zOTk7YXBwaWQ9eXRhY2h5b24-/https://media.zenfs.com/en/insidermonkey.com/e63af2f1b06b30f670c8058a8b6cdd6d,SBAC,Yahoo,"In this article we will take a look at the 10 best telecom dividend stocks to buy now. You can skip our detailed analysis of these stocks and go directly to 5 Best Telecom Dividend Stocks to Buy Now. The telecommunications sector plays a key role in running governments, businesses, and keeping people connected across […]",https://finnhub.io/api/news?id=1473bb9bd7d12de97b465fd095fb4a0df8d947737dc8608ece21e1ccb91aab30
company,1618493091,S&P 500 Analyst Moves: SBAC,69163666,https://www.nasdaq.com/sites/acquia.prod/files/2019-05/0902-Q19%20Total%20Markets%20photos%20and%20gif_CC8.jpg?96048587,SBAC,Nasdaq,"The latest tally of analyst opinions from the major brokerage houses shows that among the components of the S&P 500 index, SBA Communications is now the #88 analyst pick, moving up by 16 spots.",https://finnhub.io/api/news?id=43830e01470f1856e07d1a3775b7b78233729db0f55bfca3731feaa95d0fb16f
company,1618436647,SBA Communications Corporation -- Moody's announces completion of a periodic review of ratings of SBA Communications Corporation,66321263,https://s.yimg.com/cv/apiv2/social/images/yahoo_default_logo-1200x1200.png,SBAC,Yahoo,"Announcement of Periodic Review: Moody's announces completion of a periodic review of ratings of SBA Communications CorporationGlobal Credit Research - 14 Apr 2021New York, April 14, 2021 -- Moody's Investors Service (""Moody's"") has completed a periodic review of the ratings of SBA Communications Corporation and other ratings that are associated with the same analytical unit.  The review was conducted through a portfolio review discussion held on 7 April 2021 in which Moody's reassessed the appropriateness of the ratings in the context of the relevant principal methodology(ies), recent developments, and a comparison of the financial and operating profile to similarly rated peers.  Since 1 January 2019, Moody's practice has been to issue a press release following each periodic review to announce its completion.This publication does not announce a credit rating action and is not an indication of whether or not a credit rating action is likely in the near future.",https://finnhub.io/api/news?id=244b808dce35828f34dc512853e89c83c5a26ead9d7c67d251de2188d9152daf
company,1618420800,SBA Communications Corp. stock outperforms competitors despite losses on the day,66146908,https://images.mktw.net/im-220105/social,SBAC,MarketWatch,"Shares of SBA Communications Corp. slumped 0.39% to $281.03 Wednesday, on what proved to be an all-around mixed trading session for the stock market, with...",https://finnhub.io/api/news?id=ecd17d1bf5a657fe9f0299cd50074db4f45bd628edbb14b25a757a34eeae8e12
company,1618334460,SBA Communications Corp. stock outperforms market on strong trading day,66146909,https://images.mktw.net/im-220105/social,SBAC,MarketWatch,"Shares of SBA Communications Corp. inched 0.58% higher to $282.13 Tuesday, on what proved to be an all-around mixed trading session for the stock market,...",https://finnhub.io/api/news?id=03ff12d7ee6e9e9c96cd366e9ff18f82fcdc3e0ddae8278f297cb640e8a5ab24
company,1618297200,"Brookfield Infrastructure Partners: Undeniably Good, But At What Price?",66132510,https://static.seekingalpha.com/cdn/s3/uploads/getty_images/1179510266/medium_image_1179510266.jpg,SBAC,SeekingAlpha,"During the past five years, Brookfield Infrastructure Partners is up 127% vs. the S&P's 98%. BIP’s distribution yield and distribution growth rate are twice that of the U.S.",https://finnhub.io/api/news?id=c2b21d111e53f79e9cf91eaacb8af3943346e34622a6fe074e451e3043ccee9d
company,1618248000,SBA Communications Corp. stock outperforms competitors on strong trading day,66146910,https://images.mktw.net/im-220105/social,SBAC,MarketWatch,"Shares of SBA Communications Corp. rallied 1.74% to $280.49 Monday, on what proved to be an all-around rough trading session for the stock market, with the...",https://finnhub.io/api/news?id=8b9925bd01069c44c100502d4855a575e94d745afe66e0b6f7c118ac8feb821d
company,1618245359,"Verizon Forged Deals With Crown Castle, SBA Communications To Fast-Track C-Band Equipment Deployment",66321267,https://s.yimg.com/uu/api/res/1.2/yqVZiKxDNPjHNY8uh8wLcw--~B/aD00MDA7dz02MDA7YXBwaWQ9eXRhY2h5b24-/https://media.zenfs.com/en/Benzinga/bab3d78be63732220c2aa070197dd92d,SBAC,Yahoo,"Verizon Communications Inc (NYSE: VZ) has inked deals with Crown Castle International Corp (NYSE: CCI) and SBA Communications Corp (NASDAQ: SBAC) to accelerate the deployment of C-band equipment for the launch of 5G Ultra-Wideband and fixed wireless broadband service on the newly acquired spectrum. Castle and SBA already hosted Verizon infrastructure equipment. Verizon won an average of 161 MHz of C-band nationwide spectrum in the recent FCC auction. The C-band offered greater speeds and coverage for both mobility, home broadband, and business internet solutions. The 5G Ultra-Wideband deployment on the spectrum required new network equipment, including basebands and antennas on existing towers. The deals with both Crown Castle and SBA Communications offered process improvements leading to Verizon's faster deployment of C-band equipment. Both the agreements established terms for leasing space on existing towers for C-band equipment. The addition of the C-band spectrum will enable Verizon to offer the differentiated 5G Ultra-Wideband mobility service to an additional 250 million customers offering the internet provider choice to 50 million additional customers, stated Verizon SVP Heidi Hemmer. Price action: VZ shares traded higher by 0.10% at $57.55 on the last check Monday. See more from BenzingaClick here for options trades from BenzingaVerizon Extends 5G Home Internet In More CitiesStrikeforce Stock Is Trading Higher On Acquiring Cybersecurity Risk Solutions For Undisclosed Sum© 2021 Benzinga.com. Benzinga does not provide investment advice. All rights reserved.",https://finnhub.io/api/news?id=2a88b6ca6457d3297b076ca29302c2d98a51ec9c7d22c82cb4bd6fafe659c502
company,1618230900,"Verizon Forged Deals With Crown Castle, SBA Communications To Fast-Track C-Band Equipment Deployment",66130521,https://cdn.benzinga.com/files/imagecache/og_image_social_share_1200x630/images/story/2012/abtech_22.png,SBAC,Benzinga,Verizon Communications Inc (NYSE: VZ) has inked deals with Crown Castle International Corp (NYSE: CCI) and SBA Communications Corp (NASDAQ: ...,https://finnhub.io/api/news?id=42995961dcde0180dd778168d48c1a4f1a08c9aeb15c6b202e6dbd2cfd559b33
company,1618144200,REITs Jump Into SPAC Mania,66121731,https://static.seekingalpha.com/uploads/2020/12/4/1723581-16071441553918107_origin.png,SBAC,SeekingAlpha,"Joining a wave of other real estate SPACs this year, including Simon Property and Alexandria, billboard REIT Lamar Advertising announced the formation of yet another.",https://finnhub.io/api/news?id=3963972a33435366d4841bfd0f363cb5b2137062272b756225d9d45bb19fc5dc
company,1617988800,"SBA Communications Corp. stock falls Friday, underperforms market",66119236,https://images.mktw.net/im-220105/social,SBAC,MarketWatch,"Shares of SBA Communications Corp. shed 1.41% to $275.69 Friday, on what proved to be an all-around favorable trading session for the stock market, with the...",https://finnhub.io/api/news?id=3c809be672157899b5520c539027bad720b5dc4bc04a945bdaa40e90df8de72d
company,1617965597,Interesting SBAC Put And Call Options For May 21st,69163667,https://www.nasdaq.com/sites/acquia.prod/files/2019-05/0902-Q19%20Total%20Markets%20photos%20and%20gif_CC8.jpg?1960056768,SBAC,Nasdaq,"Investors in SBA Communications Corp  (Symbol: SBAC) saw new options begin trading this week, for the May 21st expiration.   At Stock Options Channel, our YieldBoost formula has looked up and down the SBAC options chain for the new May 21st contracts and identified one put and",https://finnhub.io/api/news?id=b688a714cffe2cfd17b01f046abcd1ea082db1a7e3c5b966672fbb2d79ca48d3
company,1617902400,SBA Communications Corp. stock underperforms Thursday when compared to competitors,66119237,https://images.mktw.net/im-220105/social,SBAC,MarketWatch,"Shares of SBA Communications Corp. shed 1.60% to $279.64 Thursday, on what proved to be an all-around positive trading session for the stock market, with the...",https://finnhub.io/api/news?id=8d915b9f4c82e9942a92ec4f805c469e66444eeec2f4e2999076746d1bf96695
company,1617816060,"SBA Communications Corp. stock falls Wednesday, underperforms market",66100787,https://images.mktw.net/im-220105/social,SBAC,MarketWatch,"Shares of SBA Communications Corp. shed 0.44% to $284.19 Wednesday, on what proved to be an all-around positive trading session for the stock market, with...",https://finnhub.io/api/news?id=98ac28f3d8b9893ed8538cdf9fa2f35313f8074f1341c25450f2a868a20924f6
company,1617729660,SBA Communications Corp. stock outperforms competitors on strong trading day,66100788,https://images.mktw.net/im-220105/social,SBAC,MarketWatch,"Shares of SBA Communications Corp. inched 0.12% higher to $285.46 Tuesday, on what proved to be an all-around dismal trading session for the stock market,...",https://finnhub.io/api/news?id=84d7caabd20c40aa690976253fc00c9702790e6588488ea8fa58de133f0fdf00
company,1617643200,"SBA Communications Corp. stock rises Monday, still underperforms market",66077059,https://images.mktw.net/im-220105/social,SBAC,MarketWatch,"Shares of SBA Communications Corp. rallied 1.40% to $285.11 Monday, on what proved to be an all-around great trading session for the stock market, with the...",https://finnhub.io/api/news?id=aed51d8709d3a354cd48aa93fa2c35e61455cf4801854bf5a4bd1561251891bb
company,1617636420,SBA Communications Corporation Sets Date for First Quarter 2021 Earnings Release,66321269,https://s.yimg.com/cv/apiv2/social/images/yahoo_default_logo-1200x1200.png,SBAC,Yahoo,"SBA Communications Corporation (NASDAQ: SBAC) (""SBA"" and ""Company"") announced it will release its first quarter results on Monday, April 26, 2021 after market close.",https://finnhub.io/api/news?id=5af3639ff2c18c21610accd539574736c92608cafd1560dca34e781e0f85e179
company,1617620513,Interesting SBAC Put And Call Options For September 17th,69163668,https://www.nasdaq.com/sites/acquia.prod/files/2019-05/0902-Q19%20Total%20Markets%20photos%20and%20gif_CC8.jpg?1850263587,SBAC,Nasdaq,"Investors in SBA Communications Corp  (Symbol: SBAC) saw new options begin trading this week, for the September 17th expiration.  One of the key data points that goes into the price an option buyer is willing to pay, is the time value, so with 165 days until expiration the newl",https://finnhub.io/api/news?id=185372a3fbfaafde55d31dfb9bcdef5287ca083b5f27b65dfe86b43114304df6
company,1617573104,Green's Portfolio - March 2021,66056933,https://static.seekingalpha.com/uploads/2021/4/3/7112581-16174229776803253.png,SBAC,SeekingAlpha,"In March, I continued to use a strategy of holding income funds and swing trading S&P 500 stocks to realize profits.",https://finnhub.io/api/news?id=b130780734f69dde2e97379b3a0836591da6aac4f795baf9dc91e0697621363e
company,1617447600,REITs Reignite Animal Spirits,66048636,https://static.seekingalpha.com/uploads/2020/12/4/1723581-16071441553918107_origin.png,SBAC,SeekingAlpha,Brookfield Asset Management reached an agreement with Brookfield Property to acquire the remainder of its outstanding shares. Animal spirits reignited?,https://finnhub.io/api/news?id=4deff5e63eac0f16470b6105519c13fc38b9e61813eaf59ae1763b806dc00af8
company,1617297660,"SBA Communications Corp. stock rises Thursday, outperforms market",66029103,https://images.mktw.net/im-220105/social,SBAC,MarketWatch,"Shares of SBA Communications Corp. rallied 1.31% to $281.18 Thursday, on what proved to be an all-around great trading session for the stock market, with the...",https://finnhub.io/api/news?id=773996e28c6edd3c59b68904578cd46d86409b3d2dfbca8b4117faa847934d5c
company,1617211260,"SBA Communications Corp. stock rises Wednesday, outperforms market",66009493,https://images.mktw.net/im-220105/social,SBAC,MarketWatch,"Shares of SBA Communications Corp. inched 0.47% higher to $277.55 Wednesday, on what proved to be an all-around mixed trading session for the stock market,...",https://finnhub.io/api/news?id=0291d446fd218cde324f30f9e2be9f663312bda9dc52f7095365d7e3628c0644
company,1617184396,It's Infrastructure Week (For Real This Time): How Investors Can Capitalize,68919302,https://www.nasdaq.com/sites/acquia.prod/files/2019-05/car-roads-adobe.jpg?516846632,SBAC,Nasdaq,"The Trump administration’s attempts to focus on infrastructure were seen as a way of deflecting the unfavorable news coverage that dogged them so often, and became a running joke. This time is different.",https://finnhub.io/api/news?id=a3a62f94b7ddbd76a73788ae2899d2075826f63f5d03f46139cc21801ece06d3
company,1617130851,Is SBAC Stock A Buy or Sell?,66321272,https://s.yimg.com/uu/api/res/1.2/RPsox7lYN41CqfbHEJpoaA--~B/aD0yMDQ4O3c9MTYxMzthcHBpZD15dGFjaHlvbg--/https://media.zenfs.com/en/insidermonkey.com/3363f68474eb4cb36908d3c15c39bead,SBAC,Yahoo,"How do you pick the next stock to invest in? One way would be to spend days of research browsing through thousands of publicly traded companies. However, an easier way is to look at the stocks that smart money investors are collectively bullish on. Hedge funds and other institutional investors usually invest large amounts of […]",https://finnhub.io/api/news?id=22dde52778b01e96101e589e135295fe825d979c209d64b04eb9cb9ac7003740
company,1617127682,FREL: A Net Beneficiary Of Re-Opening Trade,65986448,https://static.seekingalpha.com/cdn/s3/uploads/getty_images/1220422950/medium_image_1220422950.jpg,SBAC,SeekingAlpha,"There is growing debate around the growth-value paradigm possibly resulting in a market correction. This is already impacting Fidelity's FREL REIT ETF, which encapsulates many growth names.",https://finnhub.io/api/news?id=f25458d31647a085c5268997b471496e3ffd04de1ccbb3455162b9d8f3deee3b
company,1617124860,"SBA Communications Corp. stock falls Tuesday, underperforms market",65992636,https://images.mktw.net/im-220105/social,SBAC,MarketWatch,"Shares of SBA Communications Corp. shed 1.83% to $276.24 Tuesday, on what proved to be an all-around grim trading session for the stock market, with the S&P...",https://finnhub.io/api/news?id=885a3cd6245ad2b892abe801ec57d8aa7eeeedf7829e99b26d3b4db1582bff51
company,1617111000,Cell Tower REITs: 5G Dominance,65980591,https://static.seekingalpha.com/uploads/2021/1/11/1723581-1610374940794855_origin.png,SBAC,SeekingAlpha,"Emerging from relative obscurity early last decade, Cell Tower REITs have developed into dominant players of both the telecommunications and real estate sectors through relentless growth.",https://finnhub.io/api/news?id=5adcf5c537f66c78fa077033c9a7b45425c736ba065669318a999ac29a0ef131
company,1617038460,SBA Communications Corp. stock underperforms Monday when compared to competitors,65453971,https://images.mktw.net/im-220105/social,SBAC,MarketWatch,"Shares of SBA Communications Corp. slipped 0.41% to $281.40 Monday, on what proved to be an all-around mixed trading session for the stock market, with the...",https://finnhub.io/api/news?id=870429470fcac629613bc2b513c70cc761c3d54650622482424b6bad7fe361ee
company,1616857200,REITs Rally As Rates Retreat,64982867,https://static.seekingalpha.com/uploads/2020/12/4/1723581-16071441553918107_origin.png,SBAC,SeekingAlpha,Real estate equities - both REITs and homebuilders - delivered strong gains as interest rates pulled back. 3 more REITs increased their dividend this week - all in the mortgage REIT sector.,https://finnhub.io/api/news?id=76b7282821f81f5465d60309f40c8d05f7192136b0864ae5b224fce67a634a5c
company,1616779200,SBA Communications Corp. stock underperforms Friday when compared to competitors despite daily gains,65453972,https://images.mktw.net/im-220105/social,SBAC,MarketWatch,"Shares of SBA Communications Corp. rose 3.75% to $282.57 Friday, on what proved to be an all-around great trading session for the stock market, with the S&P...",https://finnhub.io/api/news?id=321f2c74ec6347101d9afce6d4f69b2adfd6662d5f38062b0e62f5d2a59953e9
company,1616692860,"SBA Communications Corp. stock falls Thursday, underperforms market",65453973,https://images.mktw.net/im-220105/social,SBAC,MarketWatch,"Shares of SBA Communications Corp. slid 0.04% to $272.36 Thursday, on what proved to be an all-around positive trading session for the stock market, with the...",https://finnhub.io/api/news?id=0c719fb29d05777e0c7ac6f65dae67aea0af0cbcfbc78d30ad80260c32f360e1
company,1616691832,Here’s Why SBA Communications (SBAC) Landed in Carillon’s Worst Securities List,66321275,https://s.yimg.com/uu/api/res/1.2/HKwO4vwvhmsXXObhyJ4j.A--~B/aD01MDA7dz03NTA7YXBwaWQ9eXRhY2h5b24-/https://media.zenfs.com/en/insidermonkey.com/7ae52a437043553ae86fe80018186a90,SBAC,Yahoo,"Carillon Tower Advisers, an investment management firm, published its fourth quarter 2020 “Carillon Eagle Mid Cap Growth Fund” investor letter – a copy of which can be downloaded here. In the letter, the fund talked about their best and worst securities, together with their outlook for this year from an investment perspective. You can view […]",https://finnhub.io/api/news?id=508f854d05e5c3a4413642cce1a70ec2e82a5454170d2316650cdb1e8e47c880
company,1616606460,"SBA Communications Corp. stock falls Wednesday, underperforms market",64835882,https://images.mktw.net/im-220105/social,SBAC,MarketWatch,"Shares of SBA Communications Corp. dropped 0.61% to $272.46 Wednesday, on what proved to be an all-around grim trading session for the stock market, with the...",https://finnhub.io/api/news?id=b5aa9433ac405f125345b89ca279a0203b53695ad4ab1356700ee6afa4e69cda
company,1616599803,SBA Communications (SBAC) Up 10.2% Since Last Earnings Report: Can It Continue?,66321278,https://s.yimg.com/uu/api/res/1.2/7h8ntzJXcDOdVmDKQ08gRg--~B/aD02MDA7dz05MDA7YXBwaWQ9eXRhY2h5b24-/https://media.zenfs.com/en/zacks.com/e8e4b0344809eaac6d73c9fd25fd180a,SBAC,Yahoo,SBA Communications (SBAC) reported earnings 30 days ago. What's next for the stock? We take a look at earnings estimates for some clues.,https://finnhub.io/api/news?id=56004b4391419b6e41387da461bc10d377e45ec13b4db382be97e319cb59a309
company,1616520000,SBA Communications Corp. stock underperforms Tuesday when compared to competitors despite daily gains,64816110,https://images.mktw.net/im-220105/social,SBAC,MarketWatch,"Shares of SBA Communications Corp. inched 0.01% higher to $274.14 Tuesday, on what proved to be an all-around dismal trading session for the stock market,...",https://finnhub.io/api/news?id=617a543666901bcdfc682914047706bc7d4078108d2e7e5f6477e4515cb2f3de
