category,datetime,headline,id,image,related,source,summary,url
company,1616519979,Baron Asset Remains Optimistic in SBA Communications (SBAC) Despite Poor Returns,66321281,https://s.yimg.com/uu/api/res/1.2/iNK29ElwPbx1FDhZkl8f2w--~B/aD00OTQ7dz03NTA7YXBwaWQ9eXRhY2h5b24-/https://media.zenfs.com/en/insidermonkey.com/516f776e74cebbc6fc39baf44293e017,SBAC,Yahoo,"Baron Funds, an investment management firm, published its fourth quarter 2020 “Baron Asset Fund” investor letter – a copy of which can be downloaded here. A return of 15.14% was recorded by its Retail Shares, and 15.21% by its Institutional Shares in the fourth quarter of 2020, both below its Russell Midcap Growth Benchmark that […]",https://finnhub.io/api/news?id=f482bc80e471429ef9e3d48c50731d94c81135c6ca5dec8e3affc5e770e71105
company,1616433600,SBA Communications Corp. stock outperforms market on strong trading day,64798684,https://images.mktw.net/im-220105/social,SBAC,MarketWatch,"Shares of SBA Communications Corp. rallied 3.02% to $274.10 Monday, on what proved to be an all-around favorable trading session for the stock market, with...",https://finnhub.io/api/news?id=d610759eb4841a1b07bc7739b15411b2502920f8fb8ce041cf91874472312b18
company,1616418012,Is SBA Communications a Buy?,66321284,https://s.yimg.com/cv/apiv2/social/images/yahoo_default_logo-1200x1200.png,SBAC,Yahoo,"SBA Communications (NASDAQ: SBAC) has a long history of creating shareholder value.  Over the last decade, the communications infrastructure company has generated a more than 565% total return.  While the REIT has produced a nearly 13% total return, that's roughly half the performance of the S&P 500.",https://finnhub.io/api/news?id=90672ed43aadc1783a0baceb19493d72a50f70914cf7156fdb30e196bdb7e063
company,1616252400,REITs Eye Uneven Recovery,64770135,https://media.gettyimages.com/photos/los-angeles-skyline-sunset-picture-id1192564733?b=1&k=6&m=1192564733&s=170667a&w=0&h=yoQRNpKa6XUgD63oBjud8JKPAsl9vJ0qEX8YsKZig-M=,SBAC,SeekingAlpha,U.S. equity markets finished modestly lower on choppy week as assurances from the Fed of a lower-for-longer policy regime didn't slow the continued march higher in long-term interest rates.,https://finnhub.io/api/news?id=d3038332c8378e47b813f74309b64021572a14853da8fbd0a82a4ab92201fc55
company,1616174400,"SBA Communications Corp. stock falls Friday, underperforms market",64762953,https://images.mktw.net/im-220105/social,SBAC,MarketWatch,"Shares of SBA Communications Corp. slid 0.60% to $266.07 Friday, on what proved to be an all-around poor trading session for the stock market, with the S&P...",https://finnhub.io/api/news?id=341da023b03b8e6863abbdab47e537fb8665d8e1f64cc55f245f24ea6c522c59
company,1616088060,SBA Communications Corp. stock outperforms competitors despite losses on the day,64743040,https://images.mktw.net/im-220105/social,SBAC,MarketWatch,"Shares of SBA Communications Corp. slumped 0.02% to $267.67 Thursday, on what proved to be an all-around dismal trading session for the stock market, with...",https://finnhub.io/api/news?id=9729e0c6f2bc5d5aee6f65933bcd3a1d27e2efa01d506b9b14ed615ab755df3d
company,1616001660,"SBA Communications Corp. stock falls Wednesday, underperforms market",64718384,https://images.mktw.net/im-220105/social,SBAC,MarketWatch,"Shares of SBA Communications Corp. slid 0.82% to $267.72 Wednesday, on what proved to be an all-around positive trading session for the stock market, with...",https://finnhub.io/api/news?id=96eed2c30bdbf007672021c895d6ece6f0ba34dad6265899865786b0f950831f
company,1615915380,SBA Communications Corp. stock outperforms market on strong trading day,64696594,https://images.mktw.net/im-220105/social,SBAC,MarketWatch,"Shares of SBA Communications Corp. rose 1.68% to $269.93 Tuesday, on what proved to be an all-around rough trading session for the stock market, with the S&P...",https://finnhub.io/api/news?id=df75b2d49c55334e4e50df2fbcea7e9a2124be4e87bcff9ccba06458cda5396a
company,1615568400,SBA Communications Corp. stock outperforms competitors on strong trading day,64640681,https://images.mktw.net/im-220105/social,SBAC,MarketWatch,"Shares of SBA Communications Corp. inched 0.92% higher to $261.02 Friday, on what proved to be an all-around great trading session for the stock market, with...",https://finnhub.io/api/news?id=8efdafca5c3746af73de44ea18556ba036d51a0c0184a21655ce7f23696a4f51
company,1615482000,SBA Communications Corp. stock outperforms market on strong trading day,64617671,https://images.mktw.net/im-220105/social,SBAC,MarketWatch,"Shares of SBA Communications Corp. advanced 3.52% to $258.63 Thursday, on what proved to be an all-around positive trading session for the stock market, with...",https://finnhub.io/api/news?id=833536076bac1182495890415fbf08deed3f449d7abf7b010f064d9c423a062c
company,1615462717,5 Reasons I'm Buying Towers,64606367,https://static.seekingalpha.com/uploads/2020/12/18/14527192-16083259624298809_origin.png,SBAC,SeekingAlpha,It is rare to be bullish on all the stocks within any given subsector. The fundamentals and valuation make it reasonable here.,https://finnhub.io/api/news?id=a42b282ab89f33f1875789906d9baab9c4b5ab989041f1da2f9ca8178f5779ef
company,1615395600,SBA Communications Corp. stock underperforms Wednesday when compared to competitors despite daily gains,64589574,https://images.mktw.net/im-220105/social,SBAC,MarketWatch,"Shares of SBA Communications Corp. inched 0.75% higher to $249.84 Wednesday, on what proved to be an all-around positive trading session for the stock...",https://finnhub.io/api/news?id=7d842bdd9bd20b52adc6f154f16916519af9581b2c0e4395d7d042614f66a0b4
company,1615359600,The Retirees' Dividend Portfolio: John And Jane's February Taxable Account Update,64562393,https://static.seekingalpha.com/uploads/2021/3/9/saupload_43cf4d7111a09422af3bcb0cfe9fda39.png,SBAC,SeekingAlpha,"The Taxable account generated $1,470.14 of dividends in February of 2021 compared with $1,641.99 of dividends in February of 2020.",https://finnhub.io/api/news?id=39c393f2f016f1d25fa046222db489f3577de3297f962876fb8d564fc4feddc5
company,1615309200,SBA Communications Corp. stock outperforms market on strong trading day,64556025,https://images.mktw.net/im-220105/social,SBAC,MarketWatch,"Shares of SBA Communications Corp. rose 2.37% to $247.97 Tuesday, on what proved to be an all-around positive trading session for the stock market, with the...",https://finnhub.io/api/news?id=81d26a03bf7de9e0f5ab7db8fcc670add10fda2f57d27d2993789349e6fb2ede
company,1615278300,2 REITs That Will Soar,64545337,https://static.seekingalpha.com/uploads/2021/2/25/47644028-16142689271413853.png,SBAC,SeekingAlpha,"Most REITs have strongly recovered over the past months, and as a result, our portfolio is now hitting new all-time highs. STAR stock and CCI stock; two attractive opportunities.",https://finnhub.io/api/news?id=930af5416946964fdec037ac601831e611046f22ebbeb7ba0380a3fe688928be
company,1615222860,SBA Communications Corp. stock outperforms competitors on strong trading day,64536907,https://images.mktw.net/im-220105/social,SBAC,MarketWatch,"Shares of SBA Communications Corp. inched 0.26% higher to $242.82 Monday, on what proved to be an all-around mixed trading session for the stock market, with...",https://finnhub.io/api/news?id=9b036ffe42639a8bf411ee2f427b960afc70be77fd92e24fc0cc011902a9b949
company,1615216288,Ex-Dividend Date Insight: SBA Communications,66321287,https://s.yimg.com/cv/apiv2/social/images/yahoo_default_logo-1200x1200.png,SBAC,Yahoo,"SBA Communications (NASDAQ:SBAC) declared a dividend payable on March 26, 2021 to its shareholders as of February 22, 2021. It was also announced that shareholders of SBA Communications's stock as of March 10, 2021 are entitled to the dividend. The stock is expected to become ex-dividend 1 business day(s) before the record date. SBA Communications has an ex-dividend date set for for March 9, 2021. The company's current dividend payout is $0.58, which equates to a dividend yield of 0.89% at current price levels. What Is An Ex-Dividend Date? An ex-dividend date is when a company's shares stop trading with its current dividend payout in preparation for the company to announce a new one. Usually, a company's ex-dividend date falls one business day before its record date. Investors should keep this in mind when purchasing stocks because buying them on or after ex-dividend dates does not qualify them to receive the declared payment. Newly declared dividends go to shareholders who have owned that stock before the ex-dividend date. Typically, companies will announce and implement new dividend yields on a quarterly basis. SBA Communications's Dividend Performance Over the past year, SBA Communications has seen its dividend payouts and yields climb upward overall. Last year (March 9, 2020), the company's payout sat at $0.47, which has since increased by $0.11. SBA Communications's dividend yield last year was 0.64%, which has since grown by 0.25%. Companies use dividend yields in different strategic ways. Some companies may opt to not give yields altogether to reinvest in themselves. Other companies may opt to increase or decrease their yield amounts to control how their shares circulate throughout the stock market. To read more about SBA Communications click here. See more from BenzingaClick here for options trades from BenzingaBenzinga's Top Ratings Upgrades, Downgrades For March 5, 2021Recap: SBA Communications Q4 Earnings© 2021 Benzinga.com. Benzinga does not provide investment advice. All rights reserved.",https://finnhub.io/api/news?id=bb752f303d8c92767ddc9efa0b7e474389cd26ed313c4a4af8f91362474d0632
company,1615212035,"Dividends Raised, Rents Paid: REIT Earnings Recap",64533152,https://static.seekingalpha.com/uploads/2021/3/6/1723581-1615055855279221.png,SBAC,SeekingAlpha,"Overshadowed by concerns about rising interest rates, a frenzy of real estate earnings reports over last month have provided critical information on the state of the real estate industry.",https://finnhub.io/api/news?id=66e3611bafa6faa921da84440659faf6f975537795376c98a4457aed3c8a1e4a
company,1615046397,Best REITs On Sale,64506526,https://static.seekingalpha.com/uploads/2021/2/24/14527192-16141897721094077_origin.png,SBAC,SeekingAlpha,Investors have been so excited by the reopening that they are dumping the best growth REITs. We view this as another great contrarian opportunity to focus on high-quality REITs.,https://finnhub.io/api/news?id=145cf02bee827735d94f1b459011ae80f13fde52cd64c67ed9948f8de7827d76
company,1614969092,Raymond James Upgrades SBA Communications: Valuation More Attractive Versus Historical Levels,66321289,https://s.yimg.com/uu/api/res/1.2/B4EW_SvKJePYY1LydkCd0Q--~B/aD00MDA7dz02MDA7YXBwaWQ9eXRhY2h5b24-/https://media.zenfs.com/en/Benzinga/a01c603935baa85ac6312d6667114007,SBAC,Yahoo,"Wireless communications infrastructure owner SBA Communications Corporation (NASDAQ: SBAC) offers a more attractive risk despite a shift in sentiment away from ""safer names"" like tower stocks, according to Raymond James. The SBA Communications Analyst: Ric Prentiss upgraded SBA communications' stock rating from Outperform to Strong Buy with an unchanged $309 price target. The SBA Communications Thesis: SBA's stock has lost more than 20% over the past six months amid expectations for higher interest rates and investors flocking towards ""re-opening"" stocks, Prentiss wrote in the upgrade note. However, SBA has two catalysts ahead that would translate to upside potential for the stock. First, REIT-focused funds are likely to seek out exposure to infrastructure stocks like SBA. Second, upcoming analyst day presentations at major cell phone carriers could emphasize the bullish case for tower stocks. Related Link: Benzinga's Top Ratings Upgrades, Downgrades For March 5, 2021 SBA stands out among its peers given: 1) Superior exposure to U.S. towers. 2) Higher quality-adjusted funds from operations (AFFO) to funds available for distribution (FAD) conversion. 3) Expectations for superior dividend growth. 4) A reputation for buying back stock ""opportunistically."" ""All in all, we like all three tower stocks, but think the FAD valuation and AFFO/share and Dividend/share growth profiles are most attractive at SBAC, and we see significant upside,"" the analyst wrote. SBAC Price Action: Shares of SBA Communications were trading higher by nearly 2% Friday afternoon at $240.11. (Photo: SBA Communications) Latest Ratings for SBAC DateFirmActionFromTo Mar 2021Raymond JamesUpgradesOutperformStrong Buy Feb 2021BarclaysMaintainsOverweight Feb 2021Deutsche BankMaintainsBuy View More Analyst Ratings for SBAC View the Latest Analyst Ratings See more from BenzingaClick here for options trades from BenzingaKroger CEO Talks 2021 Outlook: Consumers Are Loving Family Dinner TimeRed Robin To Focus On Donatos Pizza, Digital Upgrades In 2021© 2021 Benzinga.com. Benzinga does not provide investment advice. All rights reserved.",https://finnhub.io/api/news?id=45076ffa3ffed8bb8127ccb2563f2f83a8c48b0ca05f05cbd53ab88251646126
company,1614963600,SBA Communications Corp. stock outperforms competitors on strong trading day,64492211,https://images.mktw.net/im-220105/social,SBAC,MarketWatch,"Shares of SBA Communications Corp. rallied 2.66% to $242.19 Friday, on what proved to be an all-around favorable trading session for the stock market, with...",https://finnhub.io/api/news?id=b0e984cc04ce2533da8570fe1753fafbb81f6af0d7ffec38e298fc15b8b7fb23
company,1614958156,"Benzinga's Top Ratings Upgrades, Downgrades For March 5, 2021",66263419,https://s.yimg.com/cv/apiv2/social/images/yahoo_default_logo-1200x1200.png,SBAC,Yahoo,"Upgrades For Boeing Co (NYSE:BA), Canaccord Genuity upgraded the previous rating of Hold to Buy. In the fourth quarter, Boeing showed an EPS of $4.21, compared to $2.33 from the year-ago quarter. At the moment, the stock has a 52-week-high of $285.91 and a 52-week-low of $89.00. Boeing closed at $224.95 at the end of the last trading period. For Seres Therapeutics Inc (NASDAQ:MCRB), Chardan Capital upgraded the previous rating of Neutral to Buy. For the fourth quarter, Seres Therapeutics had an EPS of $0.19, compared to year-ago quarter EPS of $0.25. The stock has a 52-week-high of $38.50 and a 52-week-low of $2.52. At the end of the last trading period, Seres Therapeutics closed at $18.11. Truist Securities upgraded the previous rating for NextCure Inc (NASDAQ:NXTC) from Hold to Buy. NextCure earned $0.56 in the fourth quarter, compared to $0.34 in the year-ago quarter. The stock has a 52-week-high of $44.71 and a 52-week-low of $7.91. At the end of the last trading period, NextCure closed at $11.39. Barclays upgraded the previous rating for Oracle Corp (NYSE:ORCL) from Equal-Weight to Overweight. For the second quarter, Oracle had an EPS of $1.06, compared to year-ago quarter EPS of $0.90. The stock has a 52-week-high of $67.54 and a 52-week-low of $39.71. At the end of the last trading period, Oracle closed at $65.60. For Limoneira Co (NASDAQ:LMNR), Stephens & Co. upgraded the previous rating of Equal-Weight to Overweight. In the fourth quarter, Limoneira showed an EPS of $0.42, compared to $0.24 from the year-ago quarter. The stock has a 52-week-high of $17.84 and a 52-week-low of $10.60. At the end of the last trading period, Limoneira closed at $15.84. According to B of A Securities, the prior rating for Cardlytics Inc (NASDAQ:CDLX) was changed from Underperform to Neutral. Cardlytics earned $0.05 in the fourth quarter, compared to $0.18 in the year-ago quarter. The stock has a 52-week-high of $161.47 and a 52-week-low of $27.33. At the end of the last trading period, Cardlytics closed at $126.02. For Azul SA (NYSE:AZUL), Deutsche Bank upgraded the previous rating of Hold to Buy. In the fourth quarter, Azul showed an EPS of $0.28, compared to $0.23 from the year-ago quarter. The stock has a 52-week-high of $30.41 and a 52-week-low of $5.30. At the end of the last trading period, Azul closed at $20.34. For SBA Communications Corp (NASDAQ:SBAC), Raymond James upgraded the previous rating of Outperform to Strong Buy. In the fourth quarter, SBA Communications showed an EPS of $0.94, compared to $0.59 from the year-ago quarter. At the moment, the stock has a 52-week-high of $328.37 and a 52-week-low of $205.20. SBA Communications closed at $235.92 at the end of the last trading period. For Ballys Corp (NYSE:BALY), Stifel upgraded the previous rating of Hold to Buy. For the fourth quarter, Ballys had an EPS of $0.39, compared to year-ago quarter EPS of $0.42. At the moment, the stock has a 52-week-high of $66.97 and a 52-week-low of $29.30. Ballys closed at $52.29 at the end of the last trading period. DZ Bank upgraded the previous rating for Exxon Mobil Corp (NYSE:XOM) from Sell to Hold. In the fourth quarter, Exxon Mobil showed an EPS of $0.03, compared to $0.41 from the year-ago quarter. The current stock performance of Exxon Mobil shows a 52-week-high of $59.47 and a 52-week-low of $30.11. Moreover, at the end of the last trading period, the closing price was at $58.67. For Provident Financial Services Inc (NYSE:PFS), RBC Capital upgraded the previous rating of Sector Perform to Outperform. Provident Financial earned $0.56 in the fourth quarter, compared to $0.43 in the year-ago quarter. At the moment, the stock has a 52-week-high of $21.30 and a 52-week-low of $9.05. Provident Financial closed at $20.76 at the end of the last trading period. JP Morgan upgraded the previous rating for Cisco Systems Inc (NASDAQ:CSCO) from Neutral to Overweight. For the second quarter, Cisco Systems had an EPS of $0.79, compared to year-ago quarter EPS of $0.77. At the moment, the stock has a 52-week-high of $49.34 and a 52-week-low of $32.40. Cisco Systems closed at $44.56 at the end of the last trading period. According to JP Morgan, the prior rating for Darling Ingredients Inc (NYSE:DAR) was changed from Neutral to Overweight. For the fourth quarter, Darling Ingredients had an EPS of $0.45, compared to year-ago quarter EPS of $0.92. The current stock performance of Darling Ingredients shows a 52-week-high of $72.85 and a 52-week-low of $10.25. Moreover, at the end of the last trading period, the closing price was at $67.95. According to Jefferies, the prior rating for Paycom Software Inc (NYSE:PAYC) was changed from Hold to Buy. In the fourth quarter, Paycom Software showed an EPS of $0.84, compared to $0.86 from the year-ago quarter. The current stock performance of Paycom Software shows a 52-week-high of $471.08 and a 52-week-low of $163.42. Moreover, at the end of the last trading period, the closing price was at $349.44. According to Morgan Stanley, the prior rating for The Michaels Companies Inc (NASDAQ:MIK) was changed from Underweight to Equal-Weight. Michaels Companies earned $1.69 in the fourth quarter, compared to $1.26 in the year-ago quarter. The current stock performance of Michaels Companies shows a 52-week-high of $22.30 and a 52-week-low of $1.00. Moreover, at the end of the last trading period, the closing price was at $21.83. See all analyst ratings upgrades. Downgrades Craig-Hallum downgraded the previous rating for Smith & Wesson Brands Inc (NASDAQ:SWBI) from Buy to Hold. Smith & Wesson Brands earned $0.93 in the second quarter, compared to $0.09 in the year-ago quarter. The current stock performance of Smith & Wesson Brands shows a 52-week-high of $27.79 and a 52-week-low of $12.87. Moreover, at the end of the last trading period, the closing price was at $15.79. For Transocean Ltd (NYSE:RIG), Barclays downgraded the previous rating of Equal-Weight to Underweight. In the fourth quarter, Transocean showed an EPS of $0.34, compared to $0.43 from the year-ago quarter. The current stock performance of Transocean shows a 52-week-high of $4.24 and a 52-week-low of $0.65. Moreover, at the end of the last trading period, the closing price was at $4.11. Barclays downgraded the previous rating for Frank's International NV (NYSE:FI) from Equal-Weight to Underweight. In the fourth quarter, Frank's International showed an EPS of $0.02, compared to $0.06 from the year-ago quarter. The current stock performance of Frank's International shows a 52-week-high of $5.44 and a 52-week-low of $1.49. Moreover, at the end of the last trading period, the closing price was at $4.88. According to Barclays, the prior rating for Dril-Quip Inc (NYSE:DRQ) was changed from Equal-Weight to Underweight. Dril-Quip earned $0.12 in the fourth quarter, compared to $0.23 in the year-ago quarter. The stock has a 52-week-high of $38.72 and a 52-week-low of $22.25. At the end of the last trading period, Dril-Quip closed at $37.13. Loop Capital downgraded the previous rating for The Michaels Companies Inc (NASDAQ:MIK) from Buy to Hold. For the fourth quarter, Michaels Companies had an EPS of $1.69, compared to year-ago quarter EPS of $1.26. The stock has a 52-week-high of $22.30 and a 52-week-low of $1.00. At the end of the last trading period, Michaels Companies closed at $21.83. For Senseonics Holdings Inc (AMEX:SENS), Raymond James downgraded the previous rating of Market Perform to Underperform. In the fourth quarter, Senseonics Holdings showed an EPS of $0.44, compared to $0.18 from the year-ago quarter. The current stock performance of Senseonics Holdings shows a 52-week-high of $5.56 and a 52-week-low of $0.35. Moreover, at the end of the last trading period, the closing price was at $2.69. For Nikola Corp (NASDAQ:NKLA), JP Morgan downgraded the previous rating of Overweight to Neutral. For the fourth quarter, Nikola had an EPS of $0.17, compared to year-ago quarter EPS of $0.09. The current stock performance of Nikola shows a 52-week-high of $93.99 and a 52-week-low of $13.51. Moreover, at the end of the last trading period, the closing price was at $16.03. According to Jefferies, the prior rating for Five Prime Therapeutics Inc (NASDAQ:FPRX) was changed from Buy to Hold. Five Prime Therapeutics earned $0.74 in the third quarter, compared to $1.03 in the year-ago quarter. The current stock performance of Five Prime Therapeutics shows a 52-week-high of $38.18 and a 52-week-low of $1.75. Moreover, at the end of the last trading period, the closing price was at $38.00. See all analyst ratings downgrades. Initiations With a Buy rating, Stifel initiated coverage on DZS Inc (NASDAQ:DZSI). The price target seems to have been set at $22.00 for DZS. The stock has a 52-week-high of $18.90 and a 52-week-low of $2.90. At the end of the last trading period, DZS closed at $15.78. With an Outperform rating, RBC Capital initiated coverage on Viemed Healthcare Inc (NASDAQ:VMD). The price target seems to have been set at $13.00 for Viemed Healthcare. In the fourth quarter, Viemed Healthcare showed an EPS of $0.12, compared to $0.06 from the year-ago quarter. The current stock performance of Viemed Healthcare shows a 52-week-high of $11.98 and a 52-week-low of $2.44. Moreover, at the end of the last trading period, the closing price was at $9.70. With an Outperform rating, Evercore ISI Group initiated coverage on Cognyte Software Ltd (NASDAQ:CGNT). The price target seems to have been set at $40.00 for Cognyte Software. The stock has a 52-week-high of $33.50 and a 52-week-low of $23.75. At the end of the last trading period, Cognyte Software closed at $27.32. With an Outperform rating, CICC initiated coverage on UP Fintech Holding Ltd (NASDAQ:TIGR). The price target seems to have been set at $30.60 for UP Fintech Holding. In the first quarter, UP Fintech Holding showed an EPS of $0.04, compared to $0.01 from the year-ago quarter. The current stock performance of UP Fintech Holding shows a 52-week-high of $38.50 and a 52-week-low of $2.03. Moreover, at the end of the last trading period, the closing price was at $20.33. Baird initiated coverage on Asana Inc (NYSE:ASAN) with an Outperform rating. The price target for Asana is set to $40.00. Interestingly, in the third quarter, Asana's EPS was $0.34. At the moment, the stock has a 52-week-high of $43.72 and a 52-week-low of $20.57. Asana closed at $30.64 at the end of the last trading period. With a Buy rating, HC Wainwright & Co. initiated coverage on Milestone Pharmaceuticals Inc (NASDAQ:MIST). The price target seems to have been set at $20.00 for Milestone Pharmaceuticals. Milestone Pharmaceuticals earned $0.40 in the third quarter, compared to $0.52 in the year-ago quarter. The stock has a 52-week-high of $20.75 and a 52-week-low of $1.69. At the end of the last trading period, Milestone Pharmaceuticals closed at $6.52. With a Buy rating, HC Wainwright & Co. initiated coverage on Aqua Metals Inc (NASDAQ:AQMS). The price target seems to have been set at $8.00 for Aqua Metals. Aqua Metals earned $0.05 in the fourth quarter, compared to $0.13 in the year-ago quarter. The stock has a 52-week-high of $8.06 and a 52-week-low of $0.33. At the end of the last trading period, Aqua Metals closed at $3.54. See all analyst ratings initiations. Latest Ratings for BA DateFirmActionFromTo Mar 2021Canaccord GenuityUpgradesHoldBuy Mar 2021Morgan StanleyMaintainsOverweight Jan 2021Morgan StanleyUpgradesUnderweightOverweight View More Analyst Ratings for BA View the Latest Analyst Ratings See more from BenzingaClick here for options trades from BenzingaWhy Seres Therapeutics's Stock is Trading Lower TodayUnderstanding Oracle's Unusual Options Activity© 2021 Benzinga.com. Benzinga does not provide investment advice. All rights reserved.",https://finnhub.io/api/news?id=aff4384ddfed89dd2a2c673fc1d4aedb14f93b422a98dca2a653fee5531ca7ba
