category,datetime,headline,id,image,related,source,summary,url
company,1623942000,"Union Pacific Announces DEI Giving Goals and ""We Are One"" Tour",68336749,,UNP,PR Newswire,Looking for stock market analysis and research with proves results? Zacks.com offers in-depth financial research with over 30years of proven results.,https://finnhub.io/api/news?id=e0d9cf3d17a66bf61ca1f1987d40e0dcb733a92b59e12a51c76408251ee14f56
company,1623926410,"Zacks Market Edge Highlights: Google, Facebook, NVIDIA, Union Pacific and VOO",68323348,https://s.yimg.com/uu/api/res/1.2/N3yjUM6B9pFSWD49KkBavg--~B/aD00MDA7dz02MzU7YXBwaWQ9eXRhY2h5b24-/https://media.zenfs.com/en/zacks.com/2a0920e070c747ba4972bba58670f2d7,UNP,Yahoo,"Zacks Market Edge Highlights: Google, Facebook, NVIDIA, Union Pacific and VOO",https://finnhub.io/api/news?id=65ff023d851151fe6eb44c54576ca386ac909b1e0a371f88b1e714b43d1cd35f
company,1623914400,"Looking for hedges against inflation? Try Apple, Nike, Verizon and stocks with this in common, strategists say",68325703,https://images.mktw.net/im-355408/social,UNP,MarketWatch,"Stocks are set for a poor performance on Thursday, as markets absorb the Federal Reserve’s indication that interest rate increases are coming sooner than...",https://finnhub.io/api/news?id=500f2260d986c2bf43e898f8f983ce6df332afd3be752775ad991ec4e8501d35
company,1623864420,Union Pacific Corp. stock outperforms competitors despite losses on the day,68479401,https://images.mktw.net/im-220105/social,UNP,MarketWatch,"Shares of Union Pacific Corp. shed 0.35% to $222.06 Wednesday, on what proved to be an all-around grim trading session for the stock market, with the S&P 500...",https://finnhub.io/api/news?id=720ce74b3873a5d1420c05a25d613e570c5b26e221fcbda64707368028a506d7
company,1623846360,"North American rail traffic rose 15.3% in week ended June 12, AAR says",68307583,,UNP,Thefly.com,"North American rail traffic rose 15.3% in week ended June 12, AAR says CNI CP CSX KSU NSC UNP GWR",https://finnhub.io/api/news?id=531851e63958707b43031b70607eece0203d883af36305c9c8433a79727fab53
company,1623826800,TuSimple Stock: The Driverless Truck Stock That Counts NVIDIA and Cathie Wood as Investors,68351007,https://www.nasdaq.com/sites/acquia.prod/files/2019-05/0902-Q19%20Total%20Markets%20photos%20and%20gif_CC8.jpg?955854761,UNP,Nasdaq,"We're going to take a look at TuSimple (NASDAQ: TSP), which develops self-driving technology for long-haul trucks. This is probably a new name for many investors, as it just held its initial public offering (IPO) on April 15.",https://finnhub.io/api/news?id=c0c3195aec560e25ea2bae9b9d137943161c0cf884df7750b645f932cd5e5f78
company,1623826440,Stocks are at New Highs: Should You Buy?,68315254,,UNP,TalkMarkets,Content,https://finnhub.io/api/news?id=ce56e54f732a95d74fe09404b10cdea8107da61ef1fcf5eed346033ce9a8a287
company,1623793809,Union Pacific (UNP) Gains As Market Dips: What You Should Know,68302707,https://s.yimg.com/uu/api/res/1.2/eeFsK50..hTdRBoBNDEyoA--~B/aD03MTE7dz05MDA7YXBwaWQ9eXRhY2h5b24-/https://media.zenfs.com/en/zacks.com/d2f7ed3d1940141716bfd200f5c94c6b,UNP,Yahoo,"Union Pacific (UNP) closed at $222.84 in the latest trading session, marking a +0.1% move from the prior day.",https://finnhub.io/api/news?id=c0ebd55fbf035df4eb59c8d16dc484528b4dc3066cd6b101db627b8252b71b86
company,1623778020,"Union Pacific Corp. stock rises Tuesday, outperforms market",68479403,https://images.mktw.net/im-220105/social,UNP,MarketWatch,"Shares of Union Pacific Corp. inched 0.10% higher to $222.84 Tuesday, on what proved to be an all-around poor trading session for the stock market, with the...",https://finnhub.io/api/news?id=62d235367a29124064a8fe18d53db8dd60ea3820ff4e7bfd6459182462fc9846
company,1623771180,Is Union Pacific Stock a Buy?,68290953,https://s.yimg.com/uu/api/res/1.2/ng1l0rltrIUtmPTFOEVuRA--~B/aD05MjY7dz0xNDAwO2FwcGlkPXl0YWNoeW9u/https://media.zenfs.com/en/motleyfool.com/b9ff2afc4622937372ffa8f591e93fd8,UNP,Yahoo,"Over the last five years, the railroad sector's stellar performance has largely come about due to the wide-scale adoption of precision scheduled railroading (PSR) management techniques. However, the question now is whether the outperformance versus the stock market can continue for stocks like Union Pacific (NYSE: UNP).",https://finnhub.io/api/news?id=8619d7a1114adcccc12bd077d8a470cef10aab7a466e98fa0c23c162f768451b
company,1623756780,Is Union Pacific Stock a Buy?,68360547,https://www.nasdaq.com/sites/acquia.prod/files/2019-05/0902-Q19%20Total%20Markets%20photos%20and%20gif_CC8.jpg?1173189162,UNP,Nasdaq,"Over the last five years, the railroad sector's stellar performance has largely come about due to the wide-scale adoption of precision scheduled railroading (PSR) management techniques. However, the question now is whether the outperformance versus the stock market can continue f",https://finnhub.io/api/news?id=e17223fbd9ebcdca6f1592fd77f0004d03f6d870da2f5804229e6d9f4bdf786c
company,1623735000,Union Pacific price target raised to $256 from $252 at Deutsche Bank,68284227,,UNP,Thefly.com,Union Pacific price target raised to $256 from $252 at Deutsche Bank Deutsche Bank UNP,https://finnhub.io/api/news?id=58f6f148413d21c3c9bd9890a8e13f9c5b64d2f9236c2c429ec0fe3e70c76a2a
company,1623700800,Full Steam Ahead: World's Largest Steam Locomotive Returns with 'The Big Boy 2021 Tour',68268711,https://s.yimg.com/uu/api/res/1.2/WykJ6vIwlGoHS_nW8NSdxQ--~B/aD00MDA7dz0yNzg7YXBwaWQ9eXRhY2h5b24-/https://media.zenfs.com/en/prnewswire.com/4aa373e937d4d361cac9677f8452dfbd,UNP,Yahoo,"Union Pacific's Big Boy No. 4014, will embark on ""The Big Boy 2021 Tour"" Aug. 5 to celebrate railroad heritage and the communities Union Pacific serves. This is the first tour since the locomotive was restored for 2019's ""Great Race"" tours celebrating the 150th anniversary of the transcontinental railroad's completion. The multi-year restoration took place at Union Pacific's steam shop in Cheyenne, Wyoming, following a retirement that spanned six decades.",https://finnhub.io/api/news?id=155f1737576cda090ac46340eec1d1e35c352d56e8e39699b64ebe5c9a3e9fd9
company,1623695150,Where Do Hedge Funds Stand On Union Pacific Corporation (UNP)?,68268714,https://s.yimg.com/uu/api/res/1.2/dRDTRaoIoGyVm3SadGiqxQ--~B/aD04MDA7dz02MDA7YXBwaWQ9eXRhY2h5b24-/https://media.zenfs.com/en/insidermonkey.com/989647763aec39ae7a183db6cb39d960,UNP,Yahoo,"Before we spend countless hours researching a company, we like to analyze what insiders, hedge funds and billionaire investors think of the stock first. This is a necessary first step in our investment process because our research has shown that the elite investors’ consensus returns have been exceptional. In the following paragraphs, we find out […]",https://finnhub.io/api/news?id=8adeab820abd7b88277b1062055ef9b73e050a804f7fe525f85ccc57d418ab38
company,1623691620,Union Pacific Corp. stock underperforms Monday when compared to competitors despite daily gains,68479405,https://images.mktw.net/im-220105/social,UNP,MarketWatch,"Shares of Union Pacific Corp. inched 0.58% higher to $222.62 Monday, on what proved to be an all-around mixed trading session for the stock market, with the...",https://finnhub.io/api/news?id=4a52b5540968c79dbc293eb366a670fdd342c9e47d17a4a3a6e9020801b4d97c
company,1623687694,TSP Stock Blasts Off After TuSimple Sends Self-Driving Truck Across the U.S.,68358576,https://www.nasdaq.com/sites/acquia.prod/files/2019-05/0902-Q19%20Total%20Markets%20photos%20and%20gif_CC8.jpg?1116298853,UNP,Nasdaq,"InvestorPlace - Stock Market News, Stock Advice & Trading Tips",https://finnhub.io/api/news?id=bc0ea7c6ba082fcb6d91589fe403d2df50264062b94c0a5c848ab235ff7afcd8
company,1623686400,Full Steam Ahead: World's Largest Steam Locomotive Returns with 'The Big Boy 2021 Tour',68266172,,UNP,PR Newswire,Looking for stock market analysis and research with proves results? Zacks.com offers in-depth financial research with over 30years of proven results.,https://finnhub.io/api/news?id=4f468231ff033e212afdbb2c61e3c404d64ae1f8899c3925cc422fcabf02726b
company,1623667930,"Notable ETF Outflow Detected - XLI, HON, UPS, UNP",68351009,https://www.nasdaq.com/sites/acquia.prod/files/2019-05/0902-Q19%20Total%20Markets%20photos%20and%20gif_CC8.jpg?21643777,UNP,Nasdaq,"Looking today at week-over-week shares outstanding changes among the universe of ETFs covered at ETF Channel, one standout is the The Industrial Select Sector SPDR— Fund (Symbol: XLI) where we have detected an approximate $108.7 million dollar outflow -- that's a 0.5% dec",https://finnhub.io/api/news?id=13c738f3aedbd8a625e104691bc31c98a776f6112645d03b2b069d45e4c9b17b
company,1623640860,TSP Stock Up After TuSimple Sends Self-Driving Truck Across the US,68268525,https://investorplace.com/wp-content/uploads/2020/10/autonomous-driving-self-driving-av-stocks-1600-1024x576.jpg,UNP,InvestorPlace,"Self-driving trucks will be here long before self-driving cars, making TSP stock an ideal pick for long-term AV gains.",https://finnhub.io/api/news?id=145577c2271f8b095223690fa3dd31fb86e63fd13f1a586e77b99a2319a442a4
company,1623633637,Did UPS Stock Really Warrant A Decline Following Its 2023 Guidance?,68351011,https://www.nasdaq.com/sites/acquia.prod/files/2019-05/0902-Q19%20Total%20Markets%20photos%20and%20gif_CC8.jpg?206105582,UNP,Nasdaq,[Updated: 6/10/2021] UPS Stock Decline,https://finnhub.io/api/news?id=a882b5844e884e9e1f925dbb2011dcf25a33cb1f5993cfa932d3e9792e307543
company,1623468058,Tracking Larry Robbins' Glenview Capital Management Portfolio - Q1 2021 Update,68224667,https://static.seekingalpha.com/cdn/s3/uploads/getty_images/1203342966/medium_image_1203342966.jpg,UNP,SeekingAlpha,Glenview Capital Management’s 13F portfolio value increased from $4.36B to $5.90B this quarter. The number of positions increased from 54 to 63. Click to read more...,https://finnhub.io/api/news?id=92fb5cee3a42a14bc2b45cca72db442b09cab099c586dc716b354a8abb8209b3
company,1623432420,"Union Pacific Corp. stock rises Friday, outperforms market",68225926,https://images.mktw.net/im-220105/social,UNP,MarketWatch,"Shares of Union Pacific Corp. inched 0.79% higher to $221.33 Friday, on what proved to be an all-around positive trading session for the stock market, with...",https://finnhub.io/api/news?id=bc5689b78c17ad96f0d0151ac309f51a29ea03cc384638715fbe827e98d13f8b
company,1623374785,What's Happening With Norfolk Southern Stock?,68360551,https://www.nasdaq.com/sites/acquia.prod/files/2019-05/0902-Q19%20Total%20Markets%20photos%20and%20gif_CC8.jpg?62168820,UNP,Nasdaq,[Updated: 6/9/2021] NSC Stock Update,https://finnhub.io/api/news?id=7037e7ec8b4847bdcc4f9e871cbdaadb402c13d7297b95853beec15273dc6790
company,1623303248,Is Now The Time To Look At Buying Union Pacific Corporation (NYSE:UNP)?,68371369,https://www.nasdaq.com/sites/acquia.prod/files/2019-05/0902-Q19%20Total%20Markets%20photos%20and%20gif_CC8.jpg?88030468,UNP,Nasdaq,"Today we're going to take a look at the well-established Union Pacific Corporation (NYSE:UNP). The company's stock    saw a double-digit share price rise of over 10% in the past couple of months on the NYSE.    As a large-cap stock with high coverage by analysts, you could assum",https://finnhub.io/api/news?id=225b11262897e86b3fc5f9f212955fca7799ecf5837936a25f8e221877e2911a
company,1623275409,Union Pacific (UNP) Stock Moves -0.15%: What You Should Know,68143837,https://s.yimg.com/uu/api/res/1.2/kz0ozt3ejWMPXKci2JxOBw--~B/aD03NTQ7dz0xMDAwO2FwcGlkPXl0YWNoeW9u/https://media.zenfs.com/en/zacks.com/d7dcbe11345e3f8e5e71e6827fe3c4c9,UNP,Yahoo,"Union Pacific (UNP) closed at $221.50 in the latest trading session, marking a -0.15% move from the prior day.",https://finnhub.io/api/news?id=70fe199bdf504cd8b4c4b857d41a111a642cc241695aac52973e81d1a4e5adf7
company,1623256024,Union Pacific's (UNP) Guidance for 2021 Volumes Upbeat,68143840,https://s.yimg.com/uu/api/res/1.2/PxOsKZ7mUiZUC0_3631rDw--~B/aD00MDA7dz02MzU7YXBwaWQ9eXRhY2h5b24-/https://media.zenfs.com/en/zacks.com/6532783c7cf070d2adbe0a4c88dc4b19,UNP,Yahoo,Union Pacific (UNP) expects a dividend payout ratio of nearly 45% (of earnings) for 2021.,https://finnhub.io/api/news?id=b8a8c9df1627f90cba77ef2189e18c74a7af264f2ac66d15ddd7b9f5735188ab
company,1623241080,"North American rail traffic rose 12.2% in week ended June 5, AAR says",68120752,,UNP,Thefly.com,"North American rail traffic rose 12.2% in week ended June 5, AAR says CNI CP CSX KSU NSC UNP GWR",https://finnhub.io/api/news?id=ba719d8c78d347edcf744905328322a92d447638eb2112fc1e3cc013188f8f9a
company,1623217035,What's Next For FedEx Stock After A 4% Drop Last Week?,68351032,https://www.nasdaq.com/sites/acquia.prod/files/2019-05/0902-Q19%20Total%20Markets%20photos%20and%20gif_CC8.jpg?1166243340,UNP,Nasdaq,[Updated: 6/7/2021] FDX Stock Update,https://finnhub.io/api/news?id=e27315f2cf2c9e0a6aca856349eef20a39bc7a89e6a6d87b3aace0d03bf1ba8a
company,1623217015,Forecast Of The Day: CSX Total Carloads of Merchandise Commodities,68371371,https://www.nasdaq.com/sites/acquia.prod/files/2019-05/0902-Q19%20Total%20Markets%20photos%20and%20gif_CC8.jpg?1055227055,UNP,Nasdaq,What?,https://finnhub.io/api/news?id=e5050e309c9ade8004d728a5325ca38ee5452094cd9c34b7bda7845b888168fe
company,1623173220,Union Pacific Corp. stock underperforms Tuesday when compared to competitors,68082644,https://images.mktw.net/im-220105/social,UNP,MarketWatch,"Shares of Union Pacific Corp. shed 0.50% to $221.83 Tuesday, on what proved to be an all-around mixed trading session for the stock market, with the S&P 500...",https://finnhub.io/api/news?id=6b60bfb52559753862f9ac0f9def1fc5ad060207a0cafe3d043cc737345386ea
company,1623166445,Union Pacific Corporation (UNP) Management Presents at UBS Global Industrials and Transportation Virtual Conference Call Transcript,68070112,https://static.seekingalpha.com/assets/og_image_1200-29b2bfe1a595477db6826bd2126c63ac2091efb7ec76347a8e7f81ba17e3de6c.png,UNP,SeekingAlpha,"Union Pacific Corporation (NYSE:UNP) UBS Global Industrials and Transportation Virtual Conference Call June 08, 2021, 9:00 AM ET Company Participants Jennifer Hamann - Executive Vice...",https://finnhub.io/api/news?id=4c5748bb0d3c7945734cd2fdacc5ac1332949a5a351335bef40c4a52f371916e
company,1623155456,Estimating The Fair Value Of Union Pacific Corporation (NYSE:UNP),68083141,https://s.yimg.com/uu/api/res/1.2/_KkR4ZxZVSjnRvR.gPCKtQ--~B/aD00MzI7dz0xMTk0O2FwcGlkPXl0YWNoeW9u/https://media.zenfs.com/en/simply_wall_st__316/840be99550b4c752e2b0eff73b48c1eb,UNP,Yahoo,How far off is Union Pacific Corporation ( NYSE:UNP ) from its intrinsic value? Using the most recent financial data...,https://finnhub.io/api/news?id=5631f2e72eefe93771f2c7f5b70fe98b4f026f82f7e91707592e9fe7f0f9cfa0
company,1623151642,Union Pacific (UNP) Presents At UBS Global Industrials and Transportation Virtual Conference,68068034,https://static.seekingalpha.com/assets/og_image_1200-29b2bfe1a595477db6826bd2126c63ac2091efb7ec76347a8e7f81ba17e3de6c.png,UNP,SeekingAlpha,The following slide deck was published by Union Pacific Corporation in conjunction with this event.,https://finnhub.io/api/news?id=5338c833d6e5f1b67d61b0a0253ddf446efeefa2863a9e02565032334df6790d
company,1623086820,"Union Pacific Corp. stock falls Monday, underperforms market",68082646,https://images.mktw.net/im-220105/social,UNP,MarketWatch,"Shares of Union Pacific Corp. slipped 1.42% to $222.95 Monday, on what proved to be an all-around grim trading session for the stock market, with the S&P 500...",https://finnhub.io/api/news?id=ba1c99f3c51d9a9a69bede7f77bcd541395c050e348dc3cb963b8af88a5b1cef
company,1623063120,Q&A: New Conrail President Sees Ample Intermodal Opportunities In Northeast,68002361,https://cdn.benzinga.com/files/imagecache/og_image_social_share_1200x630/images/story/2012/train-821500_1920_40.jpg,UNP,Benzinga,"Brain E. Gorton, Conrail's president and chief operating officer since April, recently chatted with FreightWaves about his vision for Conrail, a U.S. Northeast terminal railroad...",https://finnhub.io/api/news?id=798b2ade3d28d47281480934faaad9cc7a4e4453854b0528bff2d1a8c984f0e9
company,1622962860,Union Pacific Stock Gives Every Indication Of Being Significantly Overvalued,68002238,,UNP,GuruFocus,GuruFocus Article or News written by GF Value and the topic is about: ,https://finnhub.io/api/news?id=36ceb1007a4f0b307c26b9c7f0fc4f8e4a4eb21d947f8ebe30696df90b09f27d
company,1622822400,3 Attractive Dividends That Are Going Up in June,68019134,https://s.yimg.com/uu/api/res/1.2/mj9i1_QtkMYUKn2OhmxVew--~B/aD05MzM7dz0xNDAwO2FwcGlkPXl0YWNoeW9u/https://media.zenfs.com/en/motleyfool.com/3afabe2eb8f273541bcf3105fe7ae183,UNP,Yahoo,"Investors have good reasons to love dividend stocks.  With that in mind, let's look at a few attractive dividend stocks whose payouts are creeping up in June.  It's not obvious from its stock price chart, but PepsiCo just wrapped up a fantastic fiscal year.",https://finnhub.io/api/news?id=17a7d1497b85d2423a13988f8b6ee0a5f6c3637b596c03092c416a70039ecc85
company,1622808000,3 Attractive Dividends That Are Going Up in June,67995145,https://www.nasdaq.com/sites/acquia.prod/files/2019-05/0902-Q19%20Total%20Markets%20photos%20and%20gif_CC8.jpg?102422271,UNP,Nasdaq,"Investors have good reasons to love dividend stocks. Not only do they offer instant income potential, but these companies also tend to boast stable business models that can generate rising earnings through a wide range of selling environments.",https://finnhub.io/api/news?id=d82a791200a358ecb991aec42052503e63e16d86822a0d0bda76abcfa5ca84fa
company,1622803690,"Zacks Industry Outlook Highlights: Union Pacific Corp, Norfolk Southern Corp, Kansas City Southern, CSX Corp and Canadian Pacific Railway",68011717,https://s.yimg.com/uu/api/res/1.2/v3us456cBrGMIFwfkWRxyQ--~B/aD00MDA7dz02MzU7YXBwaWQ9eXRhY2h5b24-/https://media.zenfs.com/en/zacks.com/e333085514f6bab9a57eba455d7432a6,UNP,Yahoo,"Zacks Industry Outlook Highlights: Union Pacific Corp, Norfolk Southern Corp, Kansas City Southern, CSX Corp and Canadian Pacific Railway",https://finnhub.io/api/news?id=be1eccb9de253768f4df29c51b495076281bc4f310bc3513452e7a26260f8cdb
company,1622791800,American Airlines: New Highs Despite A Lack Of Bulls,67973683,,UNP,SeekingAlpha,,https://finnhub.io/api/news?id=5dc0a20c3cf615831ad5c5c7908f54ba1471edfa45158be8e4bd9c383f73d1c4
company,1622776914,What’s Happening With Union Pacific Stock?,67993526,https://www.nasdaq.com/sites/acquia.prod/files/2019-05/0902-Q19%20Total%20Markets%20photos%20and%20gif_CC8.jpg?1245663898,UNP,Nasdaq,[Updated: 6/2/2021] Union Pacific Update,https://finnhub.io/api/news?id=d95fe9359aae2dae9c006515ddcdd3d374c87b16fd57a8986b8de67a1a443a89
company,1622757009,Union Pacific (UNP) Gains As Market Dips: What You Should Know,68083144,https://s.yimg.com/uu/api/res/1.2/132juehTNIyEUn7pK7.GPA--~B/aD01MDY7dz05MDA7YXBwaWQ9eXRhY2h5b24-/https://media.zenfs.com/en/zacks.com/3d7c5b2146ac04ffd51752e17ff2a619,UNP,Yahoo,"Union Pacific (UNP) closed the most recent trading day at $224.95, moving +0.22% from the previous trading session.",https://finnhub.io/api/news?id=2946f2020e0972e36af994deacd759d67715c84d68bcc789e154266578e7be66
company,1622737984,Railroads Ride on Multiple Tailwinds: 3 Stocks in Focus,68027487,https://s.yimg.com/uu/api/res/1.2/PxOsKZ7mUiZUC0_3631rDw--~B/aD00MDA7dz02MzU7YXBwaWQ9eXRhY2h5b24-/https://media.zenfs.com/en/zacks.com/6532783c7cf070d2adbe0a4c88dc4b19,UNP,Yahoo,"Bullish freight scenario may turn the tide in favor of the railroad stocks like Union Pacific (UNP), Norfolk Southern (NSC) and Canadian Pacific (CP).",https://finnhub.io/api/news?id=ad8f09b1397d5782c0f6b98403becc8a51c65f5909f82d4b1657b854c6729412
company,1622703600,INSIGHT-New blood at Wall Street's old guard rattles Corporate America,67991159,https://www.nasdaq.com/sites/acquia.prod/files/2021-06-03T110232Z_1_YC8_RTRLXPP_2_LYNXPACKAGER.JPG?1404277656,UNP,Nasdaq,A new generation of executives at the world's biggest asset managers is helping drive an uprising against Corporate America that environmental and social justice activists have long campaigned for.,https://finnhub.io/api/news?id=c1b6d125c32f5b972fe46ee58a0fd4c43d42f448203fe82d83c80118b8e74e12
company,1622611323,Dividend Champions For June 2021,67963183,https://static.seekingalpha.com/cdn/s3/uploads/getty_images/1072593728/medium_image_1072593728.jpg,UNP,SeekingAlpha,"Monthly update of the Dividend Champions List. 63 companies declared higher dividends in the past month, with an average increase of 10.12% over their previous payouts.",https://finnhub.io/api/news?id=3ddbb406eb6d053be4ac08c440f2b01931194df2233d0768e814e8d828e3cca9
company,1622548800,Union Pacific Corporation Executives to Address the UBS Global Industrials and Transportation Virtual Conference,68083146,https://s.yimg.com/uu/api/res/1.2/RHZ1WUdAfksn70mIsM2xjg--~B/aD0xMDY7dz00MDA7YXBwaWQ9eXRhY2h5b24-/https://media.zenfs.com/en/prnewswire.com/3f12207c840986b23a813c6c9fd416b1,UNP,Yahoo,"Jennifer Hamann, executive vice president and chief financial officer, and Kenny Rocker, executive vice president marketing and sales, of Union Pacific Corporation (NYSE: UNP), will address the UBS Global Industrials and Transportation Virtual Conference on Tuesday, June 8, 2021, at 9:00 a.m. ET.",https://finnhub.io/api/news?id=3f3008ef40f291403d44c67880af8ccf7eb94da5431b8a0d857183b920392e27
company,1622534400,Union Pacific Corporation Executives to Address the UBS Global Industrials and Transportation Virtual Conference,68002241,,UNP,PR Newswire,Looking for stock market analysis and research with proves results? Zacks.com offers in-depth financial research with over 30years of proven results.,https://finnhub.io/api/news?id=063f3b643c407f2be71705b8b84ca4a41d66758ac53c17f104ada64ce34b4c84
company,1622238609,Union Pacific (UNP) Outpaces Stock Market Gains: What You Should Know,68083147,https://s.yimg.com/uu/api/res/1.2/QOfludHza1dTKV8R6Coeiw--~B/aD02MDE7dz05MDA7YXBwaWQ9eXRhY2h5b24-/https://media.zenfs.com/en/zacks.com/48ad4265c55e3ba7a1fb9148d6e717d9,UNP,Yahoo,"Union Pacific (UNP) closed at $224.73 in the latest trading session, marking a +0.37% move from the prior day.",https://finnhub.io/api/news?id=6f2dda2f54beee11f2e74773162448dfb77aa54b2a1dca2abd27ec9591a30c42
company,1622219464,Union Pacific (UNP) Strong on Dividends and Share Buybacks,68083148,https://s.yimg.com/uu/api/res/1.2/PxOsKZ7mUiZUC0_3631rDw--~B/aD00MDA7dz02MzU7YXBwaWQ9eXRhY2h5b24-/https://media.zenfs.com/en/zacks.com/6532783c7cf070d2adbe0a4c88dc4b19,UNP,Yahoo,Betterment of the freight scenario in the United States is a positive/bodes well for Union Pacific (UNP).,https://finnhub.io/api/news?id=f45b82bc841a6029280c442fbe9d13fb381cfb60014d0f0da0553e2b7ea76fbb
company,1622189820,The highest-paid CEOs by state,67937354,,UNP,"Associated Press, The",Looking for stock market analysis and research with proves results? Zacks.com offers in-depth financial research with over 30years of proven results.,https://finnhub.io/api/news?id=c01a0355c4ad8951439d7b377d87260b07d65ec19d147c9d477bf8154ee58e32
company,1622183400,UNP Named `Top Dividend Stock of the Dow Transports` at Dividend Channel With 1.9% Yield,67954357,,UNP,Dividend Channel,"dividend channel,UNP,",https://finnhub.io/api/news?id=12eb413a406beb999bf376579879cbaa7535a4a4a2e176508ccdae5b30a88bbd
company,1622181780,Union Pacific price target raised to $240 from $230 at Barclays,67954358,,UNP,Thefly.com,Union Pacific price target raised to $240 from $230 at Barclays Barclays UNP,https://finnhub.io/api/news?id=aebe09327fad9f9ddcf67fa2acd64f570908e824207e3a96a8096c6d9d3e9efc
company,1622153588,What's Next For FedEx Stock After A Large 2.5x Rally Over The Last Year?,67934892,https://www.nasdaq.com/sites/acquia.prod/files/2019-05/0902-Q19%20Total%20Markets%20photos%20and%20gif_CC8.jpg?1857204978,UNP,Nasdaq,[Updated: 5/26/2021] FedEx Rates Update,https://finnhub.io/api/news?id=24a11b84bd16af68103e7f34b4538675fc64a84de251b70808bb78ff4d4e1e4f
company,1622113006,"Notable ETF Inflow Detected - XLI, UPS, UNP, BA",67934893,https://www.nasdaq.com/sites/acquia.prod/files/2019-05/0902-Q19%20Total%20Markets%20photos%20and%20gif_CC8.jpg?18699753,UNP,Nasdaq,"Looking today at week-over-week shares outstanding changes among the universe of ETFs covered at ETF Channel, one standout is the The Industrial Select Sector SPDR— Fund (Symbol: XLI) where we have detected an approximate $212.6 million dollar inflow -- that's a 1.0% incr",https://finnhub.io/api/news?id=1276189d02ff6af5ff8a22b3f20aa9aa2e4077586d05dce3afc0e91d7a485749
company,1622109840,Interesting UNP Put And Call Options For October 15th,67954359,,UNP,Stock Options Channel,"Staff article entitled Interesting UNP Put And Call Options For October 15th, about stock options, from Stock Options Channel.",https://finnhub.io/api/news?id=2b0754a79d4cf63f8392afeaeb3692a3d4bda7a79ebbd0d2784fb12f54932ad5
company,1622051667,"Noteworthy Wednesday Option Activity: EXPR, RS, UNP",67944758,https://www.nasdaq.com/sites/acquia.prod/files/2019-05/0902-Q19%20Total%20Markets%20photos%20and%20gif_CC8.jpg?1396787127,UNP,Nasdaq,"Looking at options trading activity among components of the Russell 3000 index, there is noteworthy activity today in Express Inc (Symbol: EXPR), where a total volume of 94,612 contracts has been traded thus far today, a contract volume which is representative of approximately",https://finnhub.io/api/news?id=d1ef53185d75010a007501a79581ac068e103813d37c99918f43c515cca84fc3
company,1622040180,CN And KCS Seek To Divest 70 Miles Of Track In Louisiana,68745911,https://cdn.benzinga.com/files/imagecache/og_image_social_share_1200x630/images/story/2012/train-821500_1920_36.jpg,UNP,Benzinga,Canadian railway CN (NYSE: CNI) and Kansas City Southern (NYSE: KSU) plan to divest of about 70 miles of Kansas City Southern (KCS) track in Louisiana as part of the effort to...,https://finnhub.io/api/news?id=8099549753ebfd2ac755ee43ebb2a475a84830e26d58821cdaf712d084a5a3a3
