category,datetime,headline,id,image,related,source,summary,url
company,1620787140,"Nelson, Van Denburg & Campbell Wealth Management G Buys iShares Core S&P 500 ETF, ...",67770179,,UNP,GuruFocus,GuruFocus Article or News written by insider and the topic is about: ,https://finnhub.io/api/news?id=01132cf8f48910df6b9307badc0294be034378f26cdcc4c35fda1932841ec7ff
company,1620754020,Union Pacific Corp. stock outperforms market despite losses on the day,67768403,https://images.mktw.net/im-220105/social,UNP,MarketWatch,"Shares of Union Pacific Corp. slumped 0.80% to $226.61 Tuesday, on what proved to be an all-around dismal trading session for the stock market, with the S&P...",https://finnhub.io/api/news?id=86aa14d97d46371faec6083327be9a8935966c42b2cba93f7acb245f7f9603d1
company,1620745145,What Type Of Shareholders Own The Most Number of Union Pacific Corporation (NYSE:UNP) Shares?,67750917,https://s.yimg.com/uu/api/res/1.2/_KkR4ZxZVSjnRvR.gPCKtQ--~B/aD00MzI7dz0xMTk0O2FwcGlkPXl0YWNoeW9u/https://media.zenfs.com/en/simply_wall_st__316/840be99550b4c752e2b0eff73b48c1eb,UNP,Yahoo,The big shareholder groups in Union Pacific Corporation ( NYSE:UNP ) have power over the company. Generally speaking...,https://finnhub.io/api/news?id=58bc1cfe15aab1bf64f905607c47d910b898e9da6016788bf36c0b6fcf44e876
company,1620736860,This Is the Best-Performing Sector Since Last March (and It's Not Tech),67741446,,UNP,Yahoo,"There's no denying that familiar stocks like Facebook and Apple have helped set the bullish tone on Wall Street for the past year.  Rather, it's the transportation sector that has booked the biggest overall gains since the market hit its low point in mid-March 2020.  With a great deal of commerce that was previously conducted in stores is now taking place online, Shippers like UPS (NYSE: UPS) and FedEx (NYSE: FDX) have about all the business they can handle.",https://finnhub.io/api/news?id=64d5da9dfaa665fd193f841c241ab501319d7d3c01b3455c9f340c92f5aee972
company,1620722460,This Is the Best-Performing Sector Since Last March (and It's Not Tech),67740493,https://www.nasdaq.com/sites/acquia.prod/files/2019-05/0902-Q19%20Total%20Markets%20photos%20and%20gif_CC8.jpg?663640563,UNP,Nasdaq,"There's no denying that familiar stocks like Facebook and Apple have helped set the bullish tone on Wall Street for the past year. However, the technology sector wasn't actually the market's best performer over that time frame. Neither was healthcare, despite the players in that",https://finnhub.io/api/news?id=0d1cce9100e8d6d64d77e3b489f3f09dd3694838fd920fb900a39668fdd829e2
company,1620707940,"Bank Of The West Buys Goldman Sachs Group Inc, Zoetis Inc, First Republic Bank, Sells ...",67737074,,UNP,GuruFocus,GuruFocus Article or News written by insider and the topic is about: ,https://finnhub.io/api/news?id=a46ad2aad3d159f1762e8055d8746e0053f2877cd09dd641f7985f6644d6ef43
company,1620673200,Union Pacific Honors Safe Chemical Transporters with Pinnacle Award,67720414,https://s.yimg.com/uu/api/res/1.2/RHZ1WUdAfksn70mIsM2xjg--~B/aD0xMDY7dz00MDA7YXBwaWQ9eXRhY2h5b24-/https://media.zenfs.com/en/prnewswire.com/3f12207c840986b23a813c6c9fd416b1,UNP,Yahoo,"Union Pacific Railroad today announced that 63 companies won the 2020 Pinnacle Award for their dedication and commitment to safely transporting chemicals by rail. The annual award honors customers who implement release prevention protocols, corrective action plans and have zero non-accident releases (NARs) of regulated hazardous materials shipments.",https://finnhub.io/api/news?id=804aff827573097e04e66a9df84746d70fe131b421627aa66dcab9dee089bfe4
company,1620667620,Union Pacific Corp. stock outperforms market despite losses on the day,67768405,https://images.mktw.net/im-220105/social,UNP,MarketWatch,"Shares of Union Pacific Corp. slid 0.45% to $228.44 Monday, on what proved to be an all-around poor trading session for the stock market, with the S&P 500...",https://finnhub.io/api/news?id=bc5b396c07c14ba3f457671fbebd91ed60506a58c1fbfe7beed99595ed5312ea
company,1620658800,Union Pacific Honors Safe Chemical Transporters with Pinnacle Award,67724011,,UNP,PR Newswire,Looking for stock market analysis and research with proves results? Zacks.com offers in-depth financial research with over 30years of proven results.,https://finnhub.io/api/news?id=34f22f990eba89cff99f7d90de393366a5da8e1322802b930bfb3fcbaa9889b7
company,1620652751,"Notable Monday Option Activity: GS, LYV, UNP",67717064,https://www.nasdaq.com/sites/acquia.prod/files/2019-05/0902-Q19%20Total%20Markets%20photos%20and%20gif_CC8.jpg?1391080436,UNP,Nasdaq,"Looking at options trading activity among components of the S&P 500 index, there is noteworthy activity today in Goldman Sachs Group Inc (the (Symbol: GS), where a total volume of 34,614 contracts has been traded thus far today, a contract volume which is representative of",https://finnhub.io/api/news?id=66bb0bc4b8c30f607c87d95bbca15ea2391c5b45c131fc46745bd7025489d7da
company,1620650340,"Brasada Capital Management, Lp Buys Union Pacific Corp, National Instruments Corp, Canadian ...",67705017,,UNP,GuruFocus,GuruFocus Article or News written by insider and the topic is about: ,https://finnhub.io/api/news?id=8b50f8015347490d560eef7a82834a282c43831a7fc1fc90893116f4f4201c81
company,1620645960,Stocks That Hit 52-Week Highs On Monday,67716697,https://cdn.benzinga.com/files/imagecache/og_image_social_share_1200x630/sites/all/themes/bz2/images/bz-icon.png,UNP,Benzinga," 
This morning 792 companies reached new 52-week highs.
Points of Interest:

JPMorgan Chase (NYSE: JPM) was the largest company by market cap to set a new 52-week high.
The...",https://finnhub.io/api/news?id=fca861f1f6bbd5058326cfd7bbf53e1df73d052654baf2ea28deb00f6dfecdaf
company,1620643140,"Dillon & Associates Inc Buys Regeneron Pharmaceuticals Inc, American Tower Corp, U.S. ...",67729792,,UNP,GuruFocus,GuruFocus Article or News written by insider and the topic is about: ,https://finnhub.io/api/news?id=4be5685b906cc5606b95ec47204f7baf7ca2e2c89d2f26a6872369ddc91dd9f5
company,1620643140,"Sepio Capital, LLC Buys Boeing Co, Alibaba Group Holding, Novartis AG, Sells iShares 20+ Year ...",67713798,,UNP,GuruFocus,GuruFocus Article or News written by insider and the topic is about: ,https://finnhub.io/api/news?id=71bf5faef475a7184c4f45d746420a66626fca652594727a395335387ce36c91
company,1620628740,"Obermeyer Asset Management Co Buys The Estee Lauder Inc, Bio-Techne Corp, Danimer Scientific ...",67725078,,UNP,GuruFocus,GuruFocus Article or News written by insider and the topic is about: ,https://finnhub.io/api/news?id=90c8258bf99482446185821d025502939140afdf80d9ae88be37c97bb26ac8c6
company,1620604800,US investors revolt against executive pay in record numbers,67704591,https://s.yimg.com/cv/apiv2/social/images/yahoo_default_logo-1200x1200.png,UNP,Yahoo,"Executive bonuses in the US have received record low support from investors this year after boardroom moves to loosen performance targets during the pandemic backfired.  Six S&P 500 companies this year — including General Electric, AT&T, IBM and Starbucks — have failed to win a majority of shareholder support for pay packages.",https://finnhub.io/api/news?id=78e6e09d4aa3e5fef259a48d748fb4d055481182c4e476fd4bf00b313ae1488c
company,1620408420,Union Pacific Corp. stock outperforms market on strong trading day,67768406,https://images.mktw.net/im-220105/social,UNP,MarketWatch,"Shares of Union Pacific Corp. inched 1.00% higher to $229.48 Friday, on what proved to be an all-around great trading session for the stock market, with the...",https://finnhub.io/api/news?id=7da4453f1955ae13ede12317202bc19efaee05659a7bcfd4f83a817eac56fadd
company,1620391920,Regulators Approve CP's And KCS' Request To Form Pre-Merger Voting Trust,68745922,https://cdn.benzinga.com/files/imagecache/og_image_social_share_1200x630/images/story/2012/train-821500_1920_30.jpg,UNP,Benzinga,The Surface Transportation Board (STB) has determined that Canadian Pacific (NYSE: CP) and Kansas City Southern (NYSE: KSU) can proceed with establishing a voting trust as a way...,https://finnhub.io/api/news?id=020a7a7097cae7c8ed23e686a1a8f3039394dedbad4eea32a3ed35441b0eb764
company,1620383940,"ERTS Wealth Advisors, LLC Buys SPDR Portfolio S&P 500 Growth ETF, BTC iShares U.S. ...",67666146,,UNP,GuruFocus,GuruFocus Article or News written by insider and the topic is about: ,https://finnhub.io/api/news?id=e89cce5931978fe02593d1081b21c7a23e7f52deea8b881096421e6752776557
company,1620322020,"Union Pacific Corp. stock rises Thursday, outperforms market",67768408,https://images.mktw.net/im-220105/social,UNP,MarketWatch,"Shares of Union Pacific Corp. rose 1.63% to $227.21 Thursday, on what proved to be an all-around positive trading session for the stock market, with the S&P...",https://finnhub.io/api/news?id=36dfb3d2e1322653637db4dd2f0e2c696f791097021ca2628c57ea58980da50d
company,1620290340,"Edgestream Partners, L.P. Buys iShares 20+ Year Treasury Bond ETF, CSX Corp, Procter & ...",67647763,,UNP,GuruFocus,GuruFocus Article or News written by insider and the topic is about: ,https://finnhub.io/api/news?id=225c090b8cf70261127e0adcb644205bd83435bf9ffcc351ed624026411ed539
company,1620235620,Union Pacific Corp. stock underperforms Wednesday when compared to competitors,67768410,https://images.mktw.net/im-220105/social,UNP,MarketWatch,"Shares of Union Pacific Corp. slipped 0.93% to $223.56 Wednesday, on what proved to be an all-around favorable trading session for the stock market, with the...",https://finnhub.io/api/news?id=e97a6ed300aabd9bc82a1c9a1a82fd6d51a3b5d5ca130fa39b2bea5825c91cc5
company,1620217860,"North American rail traffic rose 25.8% in week ended May 1, AAR says",67599800,,UNP,Thefly.com,"North American rail traffic rose 25.8% in week ended May 1, AAR says CNI CP CSX KSU NSC UNP GWR",https://finnhub.io/api/news?id=eeafa2004248a58dc9e7996d9a90450b0b46b0bc772c0edbc49bb70f603e62b1
company,1620202680,Union Pacific sees low double digit EPS growth CAGR from 2022-2024,67586605,,UNP,Thefly.com,Union Pacific sees low double digit EPS growth CAGR from 2022-2024 UNP,https://finnhub.io/api/news?id=57dcd24300ce6a5c402f027af412834137039ca80b75ed0bb061ae7a49cac9b9
company,1620156600,Union Pacific Opening New Southern California Terminal in Major Import Distribution Region,67483699,https://s.yimg.com/uu/api/res/1.2/RHZ1WUdAfksn70mIsM2xjg--~B/aD0xMDY7dz00MDA7YXBwaWQ9eXRhY2h5b24-/https://media.zenfs.com/en/prnewswire.com/3f12207c840986b23a813c6c9fd416b1,UNP,Yahoo,"Union Pacific today announced plans to open a new intermodal terminal in the heart of Southern California's import distribution region. It is the fastest growing region of industrial warehousing and continues to be a leader throughout the United States. Located near the Ports of Los Angeles and Long Beach, the new terminal will open in the second quarter of 2021, providing customers' expanded access to Chicago and other key markets.",https://finnhub.io/api/news?id=bbd419c538b2c3b3ad65a98030f99cee973b758fb3596f6793a8431a9e473a90
company,1620149220,"Union Pacific Corp. stock rises Tuesday, outperforms market",67768411,https://images.mktw.net/im-220105/social,UNP,MarketWatch,"Shares of Union Pacific Corp. inched 0.86% higher to $225.67 Tuesday, on what proved to be an all-around mixed trading session for the stock market, with the...",https://finnhub.io/api/news?id=0991aa6d81b053acf91e17c7de5bf342013c4f57c454aa3a43c44c0079425fa8
company,1620142200,Union Pacific Opening New Southern California Terminal in Major Import Distribution Region,67499924,,UNP,PR Newswire,Looking for stock market analysis and research with proves results? Zacks.com offers in-depth financial research with over 30years of proven results.,https://finnhub.io/api/news?id=d4deb9f783471031a3c71d1cd22f85aba656738b07f786dfa4f9711eb8c6da11
company,1620141303,Mixed Q1 Earnings Put Transport ETFs in Focus,67474301,https://s.yimg.com/uu/api/res/1.2/loHw3G0IcJAt27p04bSuyQ--~B/aD00MDA7dz02MzU7YXBwaWQ9eXRhY2h5b24-/https://media.zenfs.com/en/zacks.com/b8246b0e2f2abf1f53d4a1a968013a09,UNP,Yahoo,Total earnings for the sector that have been reported so far are down 181.3% on 7.8% lower revenues.,https://finnhub.io/api/news?id=38da6ec85865b81ca45fe34a727601313001376c366234a69d7eb73f93c2b9fd
company,1620131940,"GYL Financial Synergies, LLC Buys JPMorgan Chase, Cisco Systems Inc, Qualcomm Inc, Sells ...",67474578,,UNP,GuruFocus,GuruFocus Article or News written by insider and the topic is about: ,https://finnhub.io/api/news?id=af93fb5bc988787ed4c3e1f990a6378cb64f4683776505ec865586ed82fa4d71
company,1620131940,"Measured Wealth Private Client Group, LLC Buys Plug Power Inc, Magellan Midstream Partners LP, ...",67474636,,UNP,GuruFocus,GuruFocus Article or News written by insider and the topic is about: ,https://finnhub.io/api/news?id=04a06126aa968ec303239616713e894eb22c555e37dca7d2c4003aa0374ff33e
company,1620117540,"Seatown Holdings Pte. Ltd. Buys Amazon.com Inc, Alphabet Inc, Facebook Inc, Sells Palantir ...",67456991,,UNP,GuruFocus,GuruFocus Article or News written by insider and the topic is about: ,https://finnhub.io/api/news?id=26dca07d0d2921241fad564646a971b3f9e11212033bfdd07c1a51fc27ffabb1
company,1620108025,Union Pacific 2021 Virtual Investor Day Webcast At 2:00 PM ET,67446334,https://www.nasdaq.com/sites/acquia.prod/files/2019-05/0902-Q19%20Total%20Markets%20photos%20and%20gif_CC8.jpg?42116557,UNP,Nasdaq,"(RTTNews) - Union Pacific Corporation (UNP) will host its 2021 Virtual Investor Day at 2:00 PM ET on May 4, 2021.To access the live webcast, log on at https://www.up.com/investor/index.htm",https://finnhub.io/api/news?id=6578a18faae84c01a019c4f8921b6534e62c0842eabd92a1a41b2d00539b519e
company,1620095520,Union Pacific announces plans for new Southern California intermodal terminal,67499938,,UNP,Thefly.com,Union Pacific announces plans for new Southern California intermodal terminal UNP,https://finnhub.io/api/news?id=d2ca38998913831604d8d28ca21569b1f5ac5ab912ccdcfd76689207e40990ac
company,1620091440,Union Pacific sees 55% full-year operating ratio in 2022,67499939,,UNP,Thefly.com,Union Pacific sees 55% full-year operating ratio in 2022 UNP,https://finnhub.io/api/news?id=65ed5c0d22d2963abdf8a6203c3f2d292728c2922207b58767b9c93d37fd486a
company,1620072000,Union Pacific Champions Environmental Stewardship and Sustainability Goals in New Building America Report,67387304,https://s.yimg.com/uu/api/res/1.2/RHZ1WUdAfksn70mIsM2xjg--~B/aD0xMDY7dz00MDA7YXBwaWQ9eXRhY2h5b24-/https://media.zenfs.com/en/prnewswire.com/3f12207c840986b23a813c6c9fd416b1,UNP,Yahoo,"Union Pacific today published its 2020 Building America Report, the railroad's annual report on its progress toward environmental, social and governance (ESG) initiatives. The report unveils Union Pacific's new cumulative ESG strategy called Building a Sustainable Future 2030, which includes four areas of concentration: Investing in our Workforce, Driving Sustainable Solutions, Championing Environmental Stewardship and Strengthening our Communities.",https://finnhub.io/api/news?id=f8aab974085bba98152aafe8d0a8e201f6e80f2ba3d3623e92515ca3ed4e7f90
company,1620062820,Union Pacific Corp. stock underperforms Monday when compared to competitors despite daily gains,67768413,https://images.mktw.net/im-220105/social,UNP,MarketWatch,"Shares of Union Pacific Corp. inched 0.74% higher to $223.74 Monday, on what proved to be an all-around great trading session for the stock market, with the...",https://finnhub.io/api/news?id=65fd1ffd1fb06c527144fe872ec0cb1e9cc43df04af5cb2268d1452fbd8403a1
company,1620057600,Union Pacific Champions Environmental Stewardship and Sustainability Goals in New Building America Report,67374750,,UNP,PR Newswire,Looking for stock market analysis and research with proves results? Zacks.com offers in-depth financial research with over 30years of proven results.,https://finnhub.io/api/news?id=a92b08bccab7353a27db77d1fee2e7f70c9b12928733c0e4c204e7b9f69b9151
company,1620031140,"Qvr Llc Buys iShares Russell 2000 ETF, Amazon. ...",67400526,,UNP,GuruFocus,GuruFocus Article or News written by insider and the topic is about: ,https://finnhub.io/api/news?id=5a9abf93d18a2369e3fbe814f68f96491fc581ca9169acc05ad2bc0706f5e0a0
company,1620009540,"CWM Advisors, LLC Buys Vanguard Intermediate-Term Government Bond ETF, NVIDIA Corp, Caterpillar ...",67325803,,UNP,GuruFocus,GuruFocus Article or News written by insider and the topic is about: ,https://finnhub.io/api/news?id=2e5759ad437b04d7127c5e854b4c909930b9b961529b93e8889331390c95d713
company,1619970995,How To Differentiate 'Highly Valued' From 'Overvalued' Stocks To Beat The Market - Part 2,67282112,https://media.gettyimages.com/vectors/stock-market-bubble-stock-share-price-rising-up-from-speculation-from-vector-id1279127288?b=1&k=6&m=1279127288&s=170667a&w=0&h=FoQWo3-lKO7V2YG-oM8WH6jLuClPGGrm6p7kAgYwu9k=,UNP,SeekingAlpha,"In this piece, I share a new strategy, the 'A_Score', that exploits market 'anomalies' to find outperforming stocks with high valuations. I list some high and low scoring names by A_Score.",https://finnhub.io/api/news?id=bcdd5e6f78290f57f6531daf5b021240e7228149e15507dc2b54a6ff9482f68d
company,1619939651,Wall Street Breakfast: The Week Ahead,67259520,https://static3.seekingalpha.com/assets/podcasts/wsb-d57bf915fd82bac19817953c2e226c7610de9fc3a36c166d7c276e18e86311ea.png,UNP,SeekingAlpha,"Our weekend preview of earnings reports, conference presentations, investor days, IPOs, FDA decisions, Barron's mentions and other key events that could impact stocks.",https://finnhub.io/api/news?id=05e4fbe6b91fc536892e2cab694f96446224ef28a5ed2fd9e38443722354e440
company,1619856000,"Stocks To Watch: Eyes On Vaxart, Union Pacific, Honest IPO And Merck Spinoff",67202230,https://static.seekingalpha.com/assets/og_image_1200-29b2bfe1a595477db6826bd2126c63ac2091efb7ec76347a8e7f81ba17e3de6c.png,UNP,SeekingAlpha,Welcome to Seeking Alpha's Stocks to Watch - a preview of key events scheduled for the next week,https://finnhub.io/api/news?id=c05796f02d5e57493853c05b8c42c62eb3777b7df17c96a35601d709414e82c3
company,1619835720,Union Pacific to host virtual investor day,67225949,,UNP,Thefly.com,Union Pacific to host virtual investor day UNP,https://finnhub.io/api/news?id=29002b7a6665ba4620d013cc3927df51a59c7e919afc0a7dcdf9e3428c0a3170
company,1619808423,Jim Cramer's week ahead: 'This earnings season has very high standards',67174259,https://image.cnbcfm.com/api/v1/image/106789960-1605036627852-106789960-1605017978931NYSE-Election-Day-Photo-20201103-320-jpg.jpg?v=1605036666,UNP,CNBC,"""Keep your eyes peeled for more stocks that could get crushed in the wake of great quarters, and then do some buying,"" ""Mad Money"" host Jim Cramer said.",https://finnhub.io/api/news?id=13319a7e1ee5e1895c2190f09abf5412af01f532bf75180e04cc32eb38e0b383
company,1619803620,"Union Pacific Corp. stock falls Friday, underperforms market",67768415,https://images.mktw.net/im-220105/social,UNP,MarketWatch,"Shares of Union Pacific Corp. slipped 1.06% to $222.09 Friday, on what proved to be an all-around poor trading session for the stock market, with the S&P 500...",https://finnhub.io/api/news?id=065d57ab0896690dc7d0a6d4510cd95f1f243b6f9096871a2a4e5cdaea139f7b
company,1619790060,"Rail Roundup: UP's Grain Transload Project, Senators' Grade Crossing Bill",68834683,https://cdn.benzinga.com/files/imagecache/og_image_social_share_1200x630/images/story/2012/train-1728537_1920_61.jpg,UNP,Benzinga,"Union Pacific Constructing Chicago-Area Transload Facility For Agricultural Producers

Union Pacific (NYSE: UNP) is constructing a grain transload facility near Chicago to benefit...",https://finnhub.io/api/news?id=11a4709ab21855e5d716731932ec63026518083c9a3b023ce329e514c312d3f3
company,1619746740,"AAFMAA Wealth Management & Trust LLC Buys Union Pacific Corp, Marvell Technology Inc, ...",67142578,,UNP,GuruFocus,GuruFocus Article or News written by insider and the topic is about: ,https://finnhub.io/api/news?id=cfb31448cb9ad785f237cfa353f66c291e5f17fa0159f547d3a87fc3add8d395
company,1619730038,Tracking Ken Fisher's Fisher Asset Management Portfolio - Q1 2021 Update,67129373,https://static.seekingalpha.com/cdn/s3/uploads/getty_images/186805810/medium_image_186805810.jpg,UNP,SeekingAlpha,"Fisher’s 13F portfolio value increased from ~$133.5B to ~$142B in Q1 2021. They increased Walt Disney and Eli Lilly while trimming Taiwan Semi, JD.com, and Pinduoduo.",https://finnhub.io/api/news?id=6a1e1df96eb3fa49b12cb3aa622dde23bda296ba7d1d58537e3c92f771aac442
company,1619717220,Union Pacific Corp. stock underperforms Thursday when compared to competitors,67153093,https://images.mktw.net/im-220105/social,UNP,MarketWatch,"Shares of Union Pacific Corp. slipped 0.76% to $224.48 Thursday, on what proved to be an all-around positive trading session for the stock market, with the...",https://finnhub.io/api/news?id=9d5475c777f628f1b33416eea53fde22b9de950d2550825c5d5c413d78c73686
company,1619713140,Union Pacific Builds State-of-the-Art Transload Terminal in Chicago,67141877,https://s.yimg.com/uu/api/res/1.2/RHZ1WUdAfksn70mIsM2xjg--~B/aD0xMDY7dz00MDA7YXBwaWQ9eXRhY2h5b24-/https://media.zenfs.com/en/prnewswire.com/3f12207c840986b23a813c6c9fd416b1,UNP,Yahoo,"Union Pacific today announced that it is building a state-of-the-art grain transload facility within its Global IV intermodal terminal in Joliet, Illinois that will reduce supply-chain costs for agricultural producers and processors. The Union Pacific Global IV Transload facility will be managed by JCT, which is a 50/50 joint venture between Consolidated Grain and Barge Co. and Gavilon Grain, LLC.",https://finnhub.io/api/news?id=022260beceb1f6b024228eab7ddca9d407fc0381d202edd822dfb1a5e9f678e9
company,1619698800,Union Pacific Builds State-of-the-Art Transload Terminal in Chicago,67130258,,UNP,PR Newswire,Looking for stock market analysis and research with proves results? Zacks.com offers in-depth financial research with over 30years of proven results.,https://finnhub.io/api/news?id=61f086db5dc094a0274f39d49310bf1b701e5de35910040e8dd3eba7fd12c64e
company,1619696340,"Chatham Capital Group, Inc. Buys Vanguard FTSE All-World ex-US ETF, Procter & Gamble Co, ...",67116759,,UNP,GuruFocus,GuruFocus Article or News written by insider and the topic is about: ,https://finnhub.io/api/news?id=8c13834b2ee7e77461b08dc5ac52ee4b17ef5651f47eedb05f760bdc0f06c2fa
company,1619630880,Union Pacific Corp. stock outperforms market on strong trading day,67108326,https://images.mktw.net/im-220105/social,UNP,MarketWatch,"Shares of Union Pacific Corp. inched 0.20% higher to $226.19 Wednesday, on what proved to be an all-around dismal trading session for the stock market, with...",https://finnhub.io/api/news?id=5c94f729f95bcf6a5c3543c0f21e7a0bb8a6d4d50bee222ce9bfe2d45581bcab
company,1619624699,"Noteworthy Wednesday Option Activity: AON, UNP, VSTO",67022254,https://www.nasdaq.com/sites/acquia.prod/files/2019-05/0902-Q19%20Total%20Markets%20photos%20and%20gif_CC8.jpg?573415614,UNP,Nasdaq,"Among the underlying components of the Russell 3000 index, we saw noteworthy options trading volume today in Aon plc  (Symbol: AON), where a total of 5,979 contracts have traded so far, representing approximately 597,900 underlying shares.  That amounts to about 42.8% of AON's",https://finnhub.io/api/news?id=ea79457a210c4d10f2caea68d9bc337b42bb0cd9b61d651f4104af880105717f
company,1619611920,"North American rail traffic rose 24.8% in week ended April 24, AAR says",66979034,,UNP,Thefly.com,"North American rail traffic rose 24.8% in week ended April 24, AAR says CNI CP CSX KSU NSC UNP GWR",https://finnhub.io/api/news?id=4a129933b5ab75fcad32995594f618fe2c3df654ca78414ebe8755890b71674b
company,1619609940,"Duncker Streett & Co Inc Buys Costco Wholesale Corp, NVIDIA Corp, Union Pacific Corp, Sells ...",66962088,,UNP,GuruFocus,GuruFocus Article or News written by insider and the topic is about: ,https://finnhub.io/api/news?id=b544396a133f0a4f2420387e7fdade51ba1a26cb04d2615f1960269be7875c04
company,1619544420,Union Pacific Corp. stock outperforms market on strong trading day,67108327,https://images.mktw.net/im-220105/social,UNP,MarketWatch,"Shares of Union Pacific Corp. inched 0.51% higher to $225.73 Tuesday, on what proved to be an all-around mixed trading session for the stock market, with the...",https://finnhub.io/api/news?id=55135f40110763a2ca4b41638a98042093da6ecb50ba76d00372d0f6d5a1a2a9
company,1619521451,"The Zacks Analyst Blog Highlights: Visa, Exxon Mobil, SAP, Union Pacific and Gilead Sciences",66636140,https://s.yimg.com/uu/api/res/1.2/rSxxRHy.t0lnoAxhN64mAA--~B/aD00MDA7dz02MzU7YXBwaWQ9eXRhY2h5b24-/https://media.zenfs.com/en/zacks.com/205c27b0a16041ae63dae2a312814e6f,UNP,Yahoo,"The Zacks Analyst Blog Highlights: Visa, Exxon Mobil, SAP, Union Pacific and Gilead Sciences",https://finnhub.io/api/news?id=16ae092d03f21d14d61efef20a2aea337da04ce53e11ac488ef5d17279ffbf32
company,1619501940,"Steigerwald, Gordon & Koch Inc. Buys Ventas Inc, Palantir Technologies Inc, BorgWarner Inc, ...",66748507,,UNP,GuruFocus,GuruFocus Article or News written by insider and the topic is about: ,https://finnhub.io/api/news?id=b1c2eeca925e0a402ccdbefde906a41209945d71f1b4880c2db48fb73e8cecb0
company,1619486490,Can UPS Stock See Higher Levels Post Q1?,66602061,https://www.nasdaq.com/sites/acquia.prod/files/2019-05/0902-Q19%20Total%20Markets%20photos%20and%20gif_CC8.jpg?499312980,UNP,Nasdaq,"United Parcel Service (NYSE:UPS) is scheduled to report its Q1 2021 results on Tuesday, April 27. We expect UPS to likely post revenue and earnings above the street expectations, due to higher demand for residential deliveries. That said, given that several offices remain shut",https://finnhub.io/api/news?id=1b657a2a163ba3b5532e040d47b1d8ce455e84cfdd840e73aad995aa02eb5729
