category,datetime,headline,id,image,related,source,summary,url
company,1629210062,"Moderna (MRNA) Begins Rare Disease Study, Inks Supply Agreement",69702537,https://s.yimg.com/uu/api/res/1.2/GmfbEz4tnrsvK9N__tbc6g--~B/aD00MDA7dz02MzU7YXBwaWQ9eXRhY2h5b24-/https://media.zenfs.com/en/zacks.com/e57c38ef2cab6e9081bde6f59c7a4095,VRTX,Yahoo,Moderna (MRNA) doses first patient in phase I/II study with mRNA-3705 for the treatment of a rare multi-organ disorder. The company also revises the supply agreement with the Canadian Government for its COVID vaccine.,https://finnhub.io/api/news?id=8d32099a61847d095851a87f7580c75144acc49ea44e11cb85892c261d5bffcc
company,1629208200,Wall Street Journal Creates A Pitch In Favor Of Royalty Pharma,69704915,https://cdn.benzinga.com/files/imagecache/og_image_social_share_1200x630/images/story/2012/aapharma_1515.png,VRTX,Benzinga,"Drug development, both a lucrative and a risky segment. Royalty Pharma plc (NASDAQ: RPRX) offers a middle ground for its investors.
The Company was founded in 1996 and...",https://finnhub.io/api/news?id=39af8641d00b11643bad1e1c86f68285532f30d02b7db4033e93b7dd87c101c4
company,1629172680,U.S. stocks lower at close of trade; Dow Jones Industrial Average down 0.79% By Investing.com,69716411,https://i-invdn-com.investing.com/news/LYNXMPEA6E0OG_L.jpg,VRTX,Investing.com,U.S. stocks lower at close of trade; Dow Jones Industrial Average down 0.79%,https://finnhub.io/api/news?id=9aec9ffb6c5cb04f56f4b17332e983a666ccbfa4525fa50c5368400fe656c639
company,1629134940,"Vertex Pharmaceuticals Inc. stock falls Monday, underperforms market",69685741,https://images.mktw.net/im-220105/social,VRTX,MarketWatch,"Shares of Vertex Pharmaceuticals Inc. shed 1.74% to $190.97 Monday, on what proved to be an all-around favorable trading session for the stock market, with...",https://finnhub.io/api/news?id=0b25cd31686fe2e81b589b3edc6aeac43978b24cc21e038143338af02077692f
company,1629117540,"Rhenman & Partners Asset Management AB Buys Biogen Inc, Veeva Systems Inc, Pfizer Inc, Sells Johnson & Johnson, Bristol-Myers Squibb Company, LivaNova PLC",69694645,,VRTX,GuruFocus,,https://finnhub.io/api/news?id=e3413dafe137a733b1098eac765d10e04a530d27798d04c6b7134cc3e56c4159
company,1629108180,Large Cap Biopharma Stocks provide Growth and Value,69681531,,VRTX,TalkMarkets,,https://finnhub.io/api/news?id=3b7f5e8c01a281dc2bb9d1b59a8a0c160feccdd7d5e8e9aacee1d01c840c2f53
company,1629107700,Buying Vertex Pharmaceuticals Stock Now Could Double Your Money Within 5 Years: Here's How,69683098,https://s.yimg.com/uu/api/res/1.2/uGtA88apVovsYGB269pbWg--~B/aD0xMDUwO3c9MTQwMDthcHBpZD15dGFjaHlvbg--/https://media.zenfs.com/en/motleyfool.com/87b637a88c2166eb5ea4cbca814c1ee4,VRTX,Yahoo,"If you bought shares of Vertex Pharmaceuticals (NASDAQ: VRTX) in August 2016 and held them, you'd have a gain of 92% right now.  The company was successful in the past in winning approvals for Kalydeco and Orkambi.",https://finnhub.io/api/news?id=a85f4fe0e9a4f61f97e97ecf51380256c06854f597e8dbeb67edb7966d3662f6
company,1629107460,5 No-Brainer Stocks to Invest $500 In Right Now,69678938,https://s.yimg.com/uu/api/res/1.2/Kgc7Y4rJfnyGz27xQWTYTg--~B/aD0xMDUwO3c9MTQwMDthcHBpZD15dGFjaHlvbg--/https://media.zenfs.com/en/motleyfool.com/019bc7c78b20d4f2f27d256767c0e7e6,VRTX,Yahoo,"The first no-brainer buy that could make long-term investors richer is specialty biotech stock Vertex Pharmaceuticals (NASDAQ: VRTX).  Vertex has lagged the broader market badly after two clinical treatments for alpha-1 antitrypsin deficiency were discontinued following mid-stage trials.  CF has no cure, but Vertex's four generations of therapies have helped to improve lung function for those who have CF.",https://finnhub.io/api/news?id=4845b61a2f00b8f82d9efa77a6a955d7b3fb3c37c403e6aa191a3e5e5897cad0
company,1629106740,"Bellevue Group AG Buys Vertex Pharmaceuticals Inc, Generation Bio Co, Tandem Diabetes Care Inc, Sells , Cigna Corp, Bristol-Myers Squibb Company",69697992,,VRTX,GuruFocus,,https://finnhub.io/api/news?id=ae810eaf6e292da497cc91092b75ba062feae11fea00700b69fbb30b892c63d4
company,1629099540,"Mayo Investment Advisers Llc Buys Vertex Pharmaceuticals Inc, Vistra Corp, Berkshire Hathaway Inc, Sells The Mosaic Co, Apple Inc, Alphabet Inc",69695182,,VRTX,GuruFocus,,https://finnhub.io/api/news?id=537804cb6b0b85ba8cb7805646926262eafef055c2c0751add40467a72981eaa
company,1629081540,"Loomis Sayles & Co L P Buys Vertex Pharmaceuticals Inc, Airbnb Inc, Alnylam Pharmaceuticals Inc, Sells Bristol-Myers Squibb Company, Parker Hannifin Corp, Becton, Dickinson and Co",69698905,,VRTX,GuruFocus,,https://finnhub.io/api/news?id=1bbe4094b1f9c539f7202d1fcdb5b217e60441038b640299779549d7bae139e1
company,1629025380,4 Pharma Stocks You Can Buy and Hold for 20 Years,69675228,https://s.yimg.com/cv/apiv2/social/images/yahoo_default_logo-1200x1200.png,VRTX,Yahoo,"A buy-and-hold strategy can work really well -- if you pick the right stocks.  In this Motley Fool Live video recorded on Aug. 4, 2021, Motley Fool contributors Keith Speights and Brian Orelli discuss their top pharma stocks to buy and hold for 20 years.  Keith Speights: We had another question on Monday.",https://finnhub.io/api/news?id=0f6effb53da855b0f32079a256ddc3ecca3138a06f317d5cd35112d993b79614
company,1629021300,"No, a Stock Market Crash Probably Isn't Imminent: Here's How to Prepare Anyway",69675823,,VRTX,Yahoo,Remember the story of Chicken Little? The aptly named little chicken went around proclaiming that the sky was falling. But it wasn't. I think about that story sometimes when I see gloomy predictions about a stock market crash.,https://finnhub.io/api/news?id=dd1aa3ba00631c065d81b2a913612fa19f018c625083ae74f895833de5ad7f70
company,1628875680,Vertex Pharmaceuticals Inc. stock underperforms Friday when compared to competitors,69663623,https://images.mktw.net/im-220105/social,VRTX,MarketWatch,"Shares of Vertex Pharmaceuticals Inc. slipped 0.23% to $194.36 Friday, on what proved to be an all-around favorable trading session for the stock market,...",https://finnhub.io/api/news?id=c0e368bd6a1269286365268bbb1574d6c89f606b49074443accddbdc8e5bc098
company,1628866382,Pfizer (PFE) Gets Fast Track Tag for Wilson Disease Candidate,69658178,https://s.yimg.com/uu/api/res/1.2/IW5EhxEFuSd4V4nUFOhT_A--~B/aD00MDA7dz02MzU7YXBwaWQ9eXRhY2h5b24-/https://media.zenfs.com/en/zacks.com/1e2f63f10f05b0390ba8b63bd4ef031c,VRTX,Yahoo,"The FDA bestows a Fast Track designation to Pfizer (PFE) and partner Vivet Therapeutics' clinical-stage gene therapy, VTX-801, for the treatment of Wilson disease.",https://finnhub.io/api/news?id=ff28295d67eb446b1790f2d18ea278bacc6157e9b19e23f18672b4b925384c28
company,1628789280,"Vertex Pharmaceuticals Inc. stock falls Thursday, underperforms market",69643597,https://images.mktw.net/im-220105/social,VRTX,MarketWatch,"Shares of Vertex Pharmaceuticals Inc. slid 0.23% to $194.81 Thursday, on what proved to be an all-around favorable trading session for the stock market, with...",https://finnhub.io/api/news?id=7a008fa1c4cb946ef244bd73164e82df98326f45bfd36f32d5b6c9ea5aa521f8
company,1628770920,Interesting VRTX Put And Call Options For October 1st,69652297,,VRTX,Stock Options Channel,"Staff article entitled Interesting VRTX Put And Call Options For October 1st, about stock options, from Stock Options Channel.",https://finnhub.io/api/news?id=c6810d14b0ea34a1afc9becbe732e2f3b2f176403273e9920601eda20d396b75
company,1628747040,7 Falling Knife Stocks To Sell Before Your Portfolio Bleeds Out,69633820,https://investorplace.com/wp-content/uploads/2019/12/fallingstocks1600.jpg,VRTX,InvestorPlace,These seven falling knife stocks have been losing their values of-late and likely have a bumpy road ahead.,https://finnhub.io/api/news?id=530e2aa7b204d155804fae821b6272c9d41149e5f6fc580c61c8787e20605398
company,1628702880,"Vertex Pharmaceuticals Inc. stock falls Wednesday, underperforms market",69643599,https://images.mktw.net/im-220105/social,VRTX,MarketWatch,"Shares of Vertex Pharmaceuticals Inc. slid 0.62% to $195.25 Wednesday, on what proved to be an all-around positive trading session for the stock market, with...",https://finnhub.io/api/news?id=7486eb7c2b952d612143811b5a97334550dc2a19377ff1cb5df883096f764882
company,1628696721,3 of the Best Stocks You Can Buy With $200 or Less,69617700,,VRTX,Yahoo,These three giants of the healthcare sector aren't too big to buy with just a couple hundred bucks.,https://finnhub.io/api/news?id=291b43992185568e00f1b118d15f4e47f58005bf9fe96d33bc4918275babbe40
company,1628688301,"Perrigo (PRGO) Q2 Earnings Lag, Sales Hurt by Weak Cold Season",69615497,,VRTX,Yahoo,Perrigo (PRGO) reports dismal second-quarter 2021 results. Stock down.,https://finnhub.io/api/news?id=f5204397c4cfd53b426e95f00d74cc0cc2f21e020c8899650ffd9345015046ab
company,1628616480,Vertex Pharmaceuticals Inc. stock underperforms Tuesday when compared to competitors,69643600,https://images.mktw.net/im-220105/social,VRTX,MarketWatch,"Shares of Vertex Pharmaceuticals Inc. shed 1.97% to $196.46 Tuesday, on what proved to be an all-around positive trading session for the stock market, with...",https://finnhub.io/api/news?id=4b2692b730154caeeec7918e2d7ca25e20fcaffc193a9dc63c0f65b98cf3c72b
company,1628607387,Here's Why Fulcrum Therapeutics Stock Is Shooting Higher Today,69598360,,VRTX,Yahoo,A positive trial readout suggests the company's new drug discovery engine has more potential than expected.,https://finnhub.io/api/news?id=a50d28ddac8d6ebe06d210d6c7f0e106fddf929644ca02ee123bdb99c06de73b
company,1628607242,"ChemoCentryx (CCXI) Q2 Loss Wider Than Expected, Sales Down",69601494,https://s.yimg.com/uu/api/res/1.2/ShfhwtDyA2WzDBKdAL7M8Q--~B/aD00MDA7dz02MzU7YXBwaWQ9eXRhY2h5b24-/https://media.zenfs.com/en/zacks.com/6f2cab89bf2cbad1966358e04258e202,VRTX,Yahoo,ChemoCentryx Inc. (CCXI) reports a wider-than-expected loss in the second quarter and misses on sales.,https://finnhub.io/api/news?id=b5fb2efcb3bec892952ccdcfddbf73b6bf8abcdd6765d509a2eeb4cbc94c02ac
company,1628530080,Vertex Pharmaceuticals Inc. stock underperforms Monday when compared to competitors,69643602,https://images.mktw.net/im-220105/social,VRTX,MarketWatch,"Shares of Vertex Pharmaceuticals Inc. shed 0.13% to $200.40 Monday, on what proved to be an all-around grim trading session for the stock market, with the...",https://finnhub.io/api/news?id=fef5c5abb88f2cb7de212ed63d2edb0d1a1960847dd52f02a11d0022b7d8fbd9
company,1628519213,Were Hedge Funds Right About Piling Into Vertex Pharmaceuticals Incorporated (VRTX)?,69583133,https://s.yimg.com/uu/api/res/1.2/VFIvepRv_dTLck0n.Amj_g--~B/aD02MDA7dz00NzM7YXBwaWQ9eXRhY2h5b24-/https://media.zenfs.com/en/insidermonkey.com/33ede3b2a4dafa7bc9d5d35b0755b9e1,VRTX,Yahoo,"After several tireless days we have finished crunching the numbers from nearly 900 13F filings issued by the elite hedge funds and other investment firms that we track at Insider Monkey, which disclosed those firms’ equity portfolios as of March 31st. The results of that effort will be put on display in this article, as […]",https://finnhub.io/api/news?id=1846199ffbd55c7780c41a54059840c3b1e6f71c59175cc9daf6ed4881dc243d
company,1628484587,Insider Weekends: A Week Of Repeats With Purchases Of Vertex And B. Riley,69576192,https://static.seekingalpha.com/cdn/s3/uploads/getty_images/1221735326/medium_image_1221735326.jpg,VRTX,SeekingAlpha,Insider buying increased significantly last week. Vertex Pharmaceuticals and American Assets Trust both made the top 5 list.,https://finnhub.io/api/news?id=a350a997405baeb04e027e306cd995ad7cc9571a13aff036ea5a69e144685107
company,1628417160,5 Supercharged Stocks to Buy if the Stock Market Crashes 10%,69569814,https://s.yimg.com/uu/api/res/1.2/vhNNZmfVQDMjT3Y3z1YH5g--~B/aD05NzM7dz0xNDAwO2FwcGlkPXl0YWNoeW9u/https://media.zenfs.com/en/motleyfool.com/3a7a9fc43095fd7bc9ff46055501008d,VRTX,Yahoo,"For many investors, there are no scarier words than ""stock market crash."" But the data doesn't lie: stock market crashes are commonplace, and can arguably be considered the price of admission for taking part in one of the greatest wealth creators on the planet.",https://finnhub.io/api/news?id=3abf43c51053bedcf161271028428f44496e3bd2a48d35e5a059e2699bee5e29
company,1628274556,Why CRISPR Therapeutics Stock Fell 25.2% in July,69550819,,VRTX,Yahoo,"Shares of CRISPR Therapeutics (NASDAQ: CRSP) lost 25.2% of their value in July, according to data from S&P Global Intelligence.  There really wasn't any huge breaking news that hurt the stock, but it was at the tip of a trend away from high-valuation stocks with growth potential into value stocks throughout the month.  The company, which works on gene-editing therapies, doesn't have any consistent revenue yet.",https://finnhub.io/api/news?id=db73552c62184abde400fc82fd36253b25a2d18cc39ced0019292c64a0092448
company,1628270880,"Vertex Pharmaceuticals Inc. stock falls Friday, underperforms market",69643603,https://images.mktw.net/im-220105/social,VRTX,MarketWatch,"Shares of Vertex Pharmaceuticals Inc. slid 1.14% to $200.67 Friday, on what proved to be an all-around favorable trading session for the stock market, with...",https://finnhub.io/api/news?id=f7dbebfb1feb7a189cf912f1985aef28edce8d71c2b13d03139174c82a5a2cba
company,1628254801,How to Find Strong Buy Medical Stocks Using the Zacks Rank,69545591,https://s.yimg.com/uu/api/res/1.2/F3nzpi36wi9juoO_v9PrEA--~B/aD02MDA7dz05MDA7YXBwaWQ9eXRhY2h5b24-/https://media.zenfs.com/en/zacks.com/2a50596f066181e48e4ae0ad6be00462,VRTX,Yahoo,The Zacks Rank offers investors a way to easily find top-rated stocks and build a winning investment portfolio. Here's why you should take advantage.,https://finnhub.io/api/news?id=4d8765d3185b0faf95363ed87f148d85117faca453fa755fe83a26907d42522e
company,1628241609,Bull of the Day: Vertex Pharmaceuticals (VRTX),69545593,https://s.yimg.com/uu/api/res/1.2/UgiI07ytew_hNcL7MgLFiA--~B/aD00MDA7dz02MzU7YXBwaWQ9eXRhY2h5b24-/https://media.zenfs.com/en/zacks.com/5c26ab1f8b890434759145296588998c,VRTX,Yahoo,Scientific innovation in the treatment of cystic fibrosis bolsters success and pipeline confidence,https://finnhub.io/api/news?id=bbd8042e9116ba977b4023456b88796f5f3095d3c6dfbfc1926d8f97bfc6aeb0
company,1628238060,"Friday’s Top Analyst Upgrades and Downgrades: BP, Cloudflare, Expedia, FireEye, Marathon Oil, Moderna, ViacomCBS and More",69542467,https://247wallst.com/wp-content/uploads/2018/07/bull-vs-bear.jpg,VRTX,247WallSt,"Friday’s top analyst upgrades and downgrades included BP, Cloudflare, Expedia, FireEye, Marathon Oil, Moderna, Pinduoduo, Vertex Pharmaceuticals and ViacomCBS.",https://finnhub.io/api/news?id=bd224142062803257b959dd884a02be668ef3cc6c8e3137a18de4eae8d5005f9
company,1628185445,"Horizon's (HZNP) Q2 Earnings and Revenues Beat, Stock Up",69529379,https://s.yimg.com/uu/api/res/1.2/i3fIqgr2ZurQ_myw3ly0.Q--~B/aD00MDA7dz02MzU7YXBwaWQ9eXRhY2h5b24-/https://media.zenfs.com/en/zacks.com/a85eb7319e956e8beb6c9c5b0aadb1b7,VRTX,Yahoo,"Horizon (HZNP) beats on both earnings and revenues in Q2. Sales soared on account of the relaunch of the thyroid eye disease drug Tepezza. As a result, stock rises.",https://finnhub.io/api/news?id=7a89546b53dc6e0417816301778bd8d79aff504c0b4c661d09139a3bf91e80b5
company,1628184480,"Vertex Pharmaceuticals Inc. stock rises Thursday, outperforms market",69643605,https://images.mktw.net/im-220105/social,VRTX,MarketWatch,"Shares of Vertex Pharmaceuticals Inc. rallied 1.70% to $202.99 Thursday, on what proved to be an all-around positive trading session for the stock market,...",https://finnhub.io/api/news?id=7b0694e4ae8e77c2a91ad8502e88b7f3cad4bad6836083f0343c79ec59a553f6
company,1628175057,10 Best Biotech Stocks to Buy According to Alan Frazier’s Frazier Healthcare Partners,69518282,https://s.yimg.com/uu/api/res/1.2/efe0KuhwJ8wv3ZRrCTw_jA--~B/aD01MDA7dz03NTA7YXBwaWQ9eXRhY2h5b24-/https://media.zenfs.com/en/insidermonkey.com/a51a73d785a4f168894010ef445e008b,VRTX,Yahoo,"In this article, we discuss the 10 best biotech stocks to buy according to Alan Frazier. If you want to skip our detailed analysis of Frazier’s history and hedge fund performance, go directly to the 5 Best Biotech Stocks to Buy According to Alan Frazier. Alan Frazier established Frazier Healthcare Partners in 1991. During his […]",https://finnhub.io/api/news?id=5bea7b910908845567198fbc0b9f1522cf37c79ca6df645f559fb6def177afb1
company,1628173622,"Moderna (MRNA) Q2 Earnings Top, COVID-19 Vaccine Brings $4.2B",69523482,https://s.yimg.com/uu/api/res/1.2/OcLKRvy7N6mVxmoeElXmzg--~B/aD00MDA7dz02MzU7YXBwaWQ9eXRhY2h5b24-/https://media.zenfs.com/en/zacks.com/9e8d93e17a792e7de990e3344e61fa6a,VRTX,Yahoo,Moderna's (MRNA) COVID-19 vaccine continues to enjoy robust demand. The company delivered 199 million doses of its COVID-19 vaccine during the second quarter.,https://finnhub.io/api/news?id=4f5c1888613848444cd7a5b12939183aef45d70d43d736ad4b041061ece23980
company,1628155980,4 Stocks Insiders Are Buying,69521448,https://cdn.benzinga.com/files/imagecache/og_image_social_share_1200x630/images/story/2012/insider-buying_0.jpg,VRTX,Benzinga,"When insiders purchase shares, it indicates their confidence in the company's prospects or that they view the stock as a bargain. Either way, this signals an opportunity to go...",https://finnhub.io/api/news?id=22eaba1daac06742ec1cb790299bc3da18c1f99cf1827b09f31a02b51c1cf5ee
company,1628127480,"Video: Thursday 8/5 Insider Buying Report: VRTX, COOK",69545089,,VRTX,Market News Video,"Bargain hunters are wise to pay careful attention to insider buying, because although there are many various reasons for an insider to sell a stock, presumably the only reason they would use their hard-earned cash to make a purchase, is that they expect to make money - Today we look at two noteworthy recent insider buys - VRTX,COOK.",https://finnhub.io/api/news?id=7cd5618cdac21f0f601af2c9b3394a3bc529dfd89bc862e2133ff4803b9b3b1d
company,1628127360,September 24th Options Now Available For Vertex Pharmaceuticals,69545090,,VRTX,Stock Options Channel,"Staff article entitled September 24th Options Now Available For Vertex Pharmaceuticals, about stock options, from Stock Options Channel.",https://finnhub.io/api/news?id=37e7f73f874596bf350ea4d364766b4d51f02e90555d5c215dd6695a606f754a
company,1628098080,"Vertex Pharmaceuticals Inc. stock falls Wednesday, still outperforms market",69506262,https://images.mktw.net/im-220105/social,VRTX,MarketWatch,"Shares of Vertex Pharmaceuticals Inc. dropped 0.23% to $199.59 Wednesday, on what proved to be an all-around grim trading session for the stock market, with...",https://finnhub.io/api/news?id=077bb0d4795ea766c7efb113fbf4f064649872e41f133d1e79790c291b813b66
company,1628095504,Here is Why Growth Investors Should Buy Vertex (VRTX) Now,69500535,https://s.yimg.com/uu/api/res/1.2/nxwFIPS2ImeTQYZMYlnAgg--~B/aD02MDA7dz05MDA7YXBwaWQ9eXRhY2h5b24-/https://media.zenfs.com/en/zacks.com/1a018a29aef5adbf5b4319f32058e209,VRTX,Yahoo,"Vertex (VRTX) possesses solid growth attributes, which could help it handily outperform the market.",https://finnhub.io/api/news?id=90bdaf6e85b0f88a64d2d490314b06e47758471d9aa6c86650ca59ab367f1629
company,1628080200,Vertex Appoints Stuart A. Arbuckle as Chief Operating Officer,69500537,https://s.yimg.com/uu/api/res/1.2/gN4Vvn1hAwVTL5IfJ2TBkg--~B/aD0yNTI7dz00ODA7YXBwaWQ9eXRhY2h5b24-/https://media.zenfs.com/en/business-wire.com/58262403e3f00a6115f710f14c91e616,VRTX,Yahoo,"BOSTON, August 04, 2021--Vertex today announced that Stuart A. Arbuckle has been appointed as Executive Vice President, Chief Operating Officer (COO), effective immediately.",https://finnhub.io/api/news?id=57167028acc101f8b3cdf8d68926cd9a358acd2f260aba3cdf1181a87db7992f
company,1628078100,Vertex Pharmaceuticals appoints Stuart Arbuckle COO,69519098,,VRTX,Thefly.com,Vertex Pharmaceuticals an... VRTX,https://finnhub.io/api/news?id=121f58967a2f7cb5e0d098e2401aa0d1803bf723f925b76829bd575849f4368a
company,1628066280,Vertex Names Stuart Arbuckle as Operating Chief,69504062,https://mw3.wsj.net/mw5/content/logos/mw_logo_social.png,VRTX,MarketWatch,"By Matt Grossman Vertex Pharmaceuticals Inc. has named Stuart A. Arbuckle its chief operating officer, the company said Wednesday. Mr. Arbuckle previously...",https://finnhub.io/api/news?id=67ba4252622587e3b73f8991f1fb00166ddbd1dc41a371df31e4bc03beebe7c1
company,1628065800,Vertex Appoints Stuart A. Arbuckle as Chief Operating Officer,69492029,,VRTX,Business Wire,Looking for stock market analysis and research with proves results? Zacks.com offers in-depth financial research with over 30years of proven results.,https://finnhub.io/api/news?id=9eb8dbc68fab67fc6dc8db02e5bcba555057a930deef68af122b8e852c976d2c
company,1628062440,Vertex Pharmaceuticals appoints Stuart Arbuckle COO,69492030,,VRTX,Thefly.com,Vertex Pharmaceuticals an... VRTX,https://finnhub.io/api/news?id=bd7cf6eb5f326a4d06a0c3ccf3954225afc34365c8ab3e3b426b6237edff2d9c
company,1628044740,"Illinois Municipal Retirement Fund Buys Public Storage, Agilent Technologies Inc, Capital One Financial Corp, Sells PNC Financial Services Group Inc, Digital Realty Trust Inc, S&P Global Inc",69516929,,VRTX,GuruFocus,,https://finnhub.io/api/news?id=20df9ba8631c88d6d559522f436a1dae4e073ce51cb8be9d9cc8733bb6d7d85e
company,1628011680,Vertex Pharmaceuticals Inc. stock underperforms Tuesday when compared to competitors despite daily gains,69506264,https://images.mktw.net/im-220105/social,VRTX,MarketWatch,"Shares of Vertex Pharmaceuticals Inc. inched 0.87% higher to $200.05 Tuesday, on what proved to be an all-around great trading session for the stock market,...",https://finnhub.io/api/news?id=f9209c3eafa6fa429ad1d4a1b75d60692f443509c3beaa6995b3ef6f42c75fac
company,1627986610,Rising P/E: A Trick to Land on 5 Winning Stocks,69462968,https://s.yimg.com/uu/api/res/1.2/7vArMPCbtotNMvTEjU_NLg--~B/aD05MDA7dz05MDA7YXBwaWQ9eXRhY2h5b24-/https://media.zenfs.com/en/zacks.com/35d0a170c3f659cdaa3062e4b0dce45d,VRTX,Yahoo,Want to try a different approach? Tap five stocks with increasing P/E ratios.,https://finnhub.io/api/news?id=f699df46228ae0f8da8d383ce7205eb04ace327ef59d7c4f3c2dc080ab817fae
company,1627972740,"Reliant Investment Management, LLC Buys Amazon.com Inc, Palo Alto Networks Inc, ConocoPhillips, Sells Nike Inc, Walmart Inc, NextEra Energy Inc",69464413,,VRTX,GuruFocus,,https://finnhub.io/api/news?id=29b531226e5929dbf419ae7c3c1529b3982f3ca4b4f1ee52c8cdf09ab0214e32
company,1627956325,The Upcoming Calithera Cystic Fibrosis Data Could Be Significant,69459188,https://static.seekingalpha.com/cdn/s3/uploads/getty_images/1297117985/medium_image_1297117985.jpg,VRTX,SeekingAlpha,Calithera Biosciences is guiding for the market to expect what we believe will be a key data read-out from its ongoing CB-280 study involving Cystic Fibrosis. Read more here...,https://finnhub.io/api/news?id=29bcc2f84b0892443a610ccc2747dc97a10b876b1bde3874ea2c0245efb33e1f
company,1627925280,Vertex Pharmaceuticals Inc. stock underperforms Monday when compared to competitors,69506265,https://images.mktw.net/im-220105/social,VRTX,MarketWatch,"Shares of Vertex Pharmaceuticals Inc. slipped 1.62% to $198.32 Monday, on what proved to be an all-around rough trading session for the stock market, with...",https://finnhub.io/api/news?id=11cf436cdb781f1937d3debd22f134ddc5db0c8026d45e965aaf5e0dfb014b1b
company,1627902000,15 Words From Vertex's CEO That Signal Major Growth Ahead,69445870,,VRTX,Yahoo,"Here's the one big worry a lot of investors have about Vertex Pharmaceuticals (NASDAQ: VRTX) these days: revenue prospects beyond its main cystic fibrosis (CF) business.  Vertex is moving candidates through the pipeline in other areas such as blood disorders, pain, and a rare lung and liver disorder called alpha-1 antitrypsin deficiency.  Of course, as a shareholder I'd like to see Vertex bring one or more of those potential products to market.",https://finnhub.io/api/news?id=5d6ed3a23ab36ae1040b5dee884c1095fb0938f8608f4ff88880a04f648365da
company,1627897920,3 Beaten-Down Growth Stocks to Buy Right Now,69445872,https://s.yimg.com/uu/api/res/1.2/aqx3pSOufA_kydUCwd1Fug--~B/aD05MzM7dz0xNDAwO2FwcGlkPXl0YWNoeW9u/https://media.zenfs.com/en/motleyfool.com/d0c7d296102d6588e1c4953887e66005,VRTX,Yahoo,"Growth stocks are supposed to...grow. It's right there in the name. The problem is that growth can come in fits and starts. And sometimes, it comes with downturns in share prices. Those downturns can provide opportunities for investors who have a long-term perspective.",https://finnhub.io/api/news?id=910724608a06d587d77e4dff72ed92f4e49c2c673723796aa74164b2f0997610
company,1627891140,A Perspective On The Upcoming Calithera Cystic Fibrosis Read-Out,69467819,,VRTX,TalkMarkets,,https://finnhub.io/api/news?id=bf1d3af4b146e266fb7efc63bdc173f78ccff2f80a593e4973c1fa415376934d
company,1627889700,"Allogene Therapeutics appoints Barrett, Sato to board of directors",69446793,,VRTX,Thefly.com,"Allogene Therapeutics (AL... ALLO, URGN, VRTX",https://finnhub.io/api/news?id=9892b4d6feab0110aa5b6a8b0619e30ea6ea04177f8f0bbfccb4cd536102eaee
company,1627735020,Better Buy: Vertex vs. CRISPR,69421699,https://s.yimg.com/uu/api/res/1.2/7cWB3BK6ILLNQOrFplYPdg--~B/aD04OTI7dz0xNDAwO2FwcGlkPXl0YWNoeW9u/https://media.zenfs.com/en/motleyfool.com/0b00b8e252c9d40a4c8b272fb5d41966,VRTX,Yahoo,"Vertex might be undervalued, CRISPR Therapeutics might be overvalued, but both are looking for a home run.",https://finnhub.io/api/news?id=110b27380ec874983bbada38a29be4409b727933795812fc5774daa8e90488ff
company,1627666080,Vertex Pharmaceuticals Inc. stock outperforms market on strong trading day,69415535,https://images.mktw.net/im-220105/social,VRTX,MarketWatch,"Shares of Vertex Pharmaceuticals Inc. inched 0.60% higher to $201.58 Friday, on what proved to be an all-around grim trading session for the stock market,...",https://finnhub.io/api/news?id=e397349f8a8e7579e39bbf7e717a7c29e6aeef4939480cc129373793e342007a
